article_url,article_title,meta_description,section,authors,publish_date,modified_date,canonical_link,top_image,is_opinion
https://www.msn.com/en-us/money/topstocks/swissborg-price-predictions-how-high-can-a-bitfinex-listing-take-the-chsb-crypto/ar-AANvE8T?ocid=BingNews,SwissBorg Price Predictions: How High Can a Bitfinex Listing Take the CHSB Crypto?,"Today, SwissBorg and CHSB are gaining, and gathering a lot of attention with respect to expert SwissBorg price predictions.",,"['Luke Lango', 'Louis Navellier', 'William White']",2021-08-19 17:00:07+00:00,2021-08-19T17:02:55+00:00,https://investorplace.com/2021/08/swissborg-price-predictions-how-high-can-a-bitfinex-listing-take-the-chsb-crypto/,https://investorplace.com/wp-content/uploads/2021/05/crypto-world.jpg,
https://www.msn.com/en-us/music/news/foo-fighters-to-receive-first-ever-vmas-global-icon-award/ar-AANvF6w?ocid=BingNews,Foo Fighters to Receive First-Ever VMAs Global Icon Award,"Music, Film, TV and Political News Coverage",,"['Claire Shaffer', 'Staff Writer', ""Claire Shaffer'S Most Recent Stories"", 'Foo Fighters To Receive First-Ever Vmas Global Icon Award', 'Nine Inch Nails Cancel All Shows For Due To', 'California To Require Proof Of Vaccination For More Indoor Events', 'View All']",2021-08-19 18:00:22+00:00,2021-08-19T17:02:51+00:00,https://www.rollingstone.com/music/music-news/foo-fighters-vmas-global-icon-award-1214326/,https://www.rollingstone.com/wp-content/uploads/2021/08/foo-fighters.jpg,
https://www.msn.com/en-us/movies/reviews/e2-80-98reminiscence-e2-80-99-review-hugh-jackman-and-thandiwe-newton-can-e2-80-99t-save-this-empty-trip-into-the-past-e2-80-94-by-way-of-a-flooded-miami/ar-AANvhE9?ocid=BingNews,‘Reminiscence’ review: Hugh Jackman and Thandiwe Newton can’t save this empty trip into the past — by way of a flooded Miami,"In the waterlogged Miami of the near future, tough times call for a tough hero who isn’t afraid of a ridiculous amount of voiceover narration.",", Michael Phillips, Movies, Entertainment, What to watch",['Michael Phillips'],2021-08-19 00:00:00,,https://www.chicagotribune.com/entertainment/movies/michael-phillips/sc-mov-reminiscence-review-0818-20210819-mkegdzliwvfd3b3d6xltyewu24-story.html,https://www.chicagotribune.com/resizer/i-tKGzUkrV6FZI5rApmPJYoimWc=/1200x0/top/cloudfront-us-east-1.images.arcpublishing.com/tronc/BOILEPGDVPII7NFBLOFDOBGICI.jpg,false
https://www.msn.com/en-us/music/news/selena-gomez-feels-stronger-after-years-of-struggle-scrutiny-it-felt-gross-for-a-long-time/ar-AANvGgg?ocid=BingNews,Selena Gomez Feels Stronger After Years of Struggle & Scrutiny: 'It Felt Gross For a Long Time',Selena Gomez opens up in a new interview about emerging from years of mental health and physical struggles stronger and more determined.,,['Gil Kaufman'],,,https://www.billboard.com/articles/news/9617068/selena-gomez-talks-mental-health-struggles-scrutiny/,https://static.billboard.com/files/2021/08/Selena-Gomez-2020-billboard-1548-1629389624-compressed.jpg,
https://www.msn.com/en-us/music/news/hear-iron-maiden-s-thunderous-new-song-stratego/ar-AANvC2m?ocid=BingNews,Hear Iron Maiden’s Thunderous New Song ‘Stratego’,"Music, Film, TV and Political News Coverage",,"['Daniel Kreps', ""Daniel Kreps'S Most Recent Stories"", 'Stone Temple Pilots Announce Fall U.S. Tour', 'See Common', 'Black Thought Perform New Song', 'When We Move', 'On', 'Fallon', 'Earth', 'Wind']",2021-08-19 17:40:39+00:00,2021-08-19T17:40:39+00:00,https://www.rollingstone.com/music/music-news/iron-maiden-stratego-1214382/,https://www.rollingstone.com/wp-content/uploads/2021/08/iron-maiden.jpeg,
https://www.msn.com/en-us/news/us/miranda-kerr-says-ex-orlando-bloom-is-like-her-brother-and-shes-also-close-with-his-fiancee-katy-perry/ar-AANvcC9?ocid=BingNews,"Miranda Kerr says ex Orlando Bloom is like her brother, and she's also close with his fiancee, Katy Perry","Exes Miranda Kerr and Orlando Bloom get along swimmingly, according to the supermodel.",entertainment,['Chloe Melas'],2021-08-19 00:00:00,2021-08-19T20:32:19Z,https://www.cnn.com/2021/08/19/entertainment/miranda-kerr-orlando-bloom-katy-perry-trnd/index.html,https://cdn.cnn.com/cnnnext/dam/assets/160909173145-miranda-kerr-dion-lee-super-tease.jpg,false
https://www.msn.com/en-us/music/news/garth-brooks-cancels-tour-dates-because-of-covid-delta-surge/ar-AANvpfw?ocid=BingNews,Garth Brooks cancels upcoming tour dates because of COVID-19 Delta surge,"""Now, watching this new wave, I realize we are still in the fight and I must do my part,"" Brooks said.",,"['Christopher Brito', 'Christopher Brito Is A Social Media Producer', 'Trending Writer For Cbs News', 'Focusing On Sports', 'Stories That Involve Issues Of Race']",,,https://www.cbsnews.com/news/garth-brooks-cancels-tour-covid-19-delta-variant/,https://cbsnews2.cbsistatic.com/hub/i/r/2021/08/19/3a2f3098-90ac-46c0-93ce-2c7a24e0d0c2/thumbnail/1200x630/f24e29a63423f203c97bca1ee359e207/gettyimages-1319319780.jpg,false
https://www.msn.com/en-us/movies/news/water-baby-hugh-jackman-get-soaking-in-sci-fi-thriller-reminiscence/ar-AANvpXB?ocid=BingNews,Water baby Hugh Jackman get soaking in sci-fi thriller 'Reminiscence',"Hugh Jackman calls himself a water baby, but he's never spent as much time getting wet as in his latest movie, ""Reminiscence.""",Lifestyle,[],2021-08-20 06:23:50+00:00,2021-08-20T06:24:18.127Z,https://www.reuters.com/lifestyle/water-baby-hugh-jackman-get-soaking-sci-fi-thriller-reminiscence-2021-08-19/,https://www.reuters.com/resizer/pYB9NupM5s0iINjjRvPYoGHJAv8=/1200x628/smart/filters:quality(80)/cloudfront-us-east-2.images.arcpublishing.com/reuters/NE4DHOUIZVIIDCPYZM45DO4FIU.jpg,
https://www.msn.com/en-us/entertainment/entertainment-celebrity/leave-britney-alone-viral-star-announces-that-she-s-transitioning-i-am-doing-this-for-myself/ar-AANvEIv?ocid=BingNews,'Leave Britney Alone' Viral Star Announces That She's Transitioning: 'I Am Doing This for Myself',Cara Cunningham — who went viral following a 4-minute rant defending Britney Spears in 2007 — wrote in an Instagram statement that she would be starting hormone replacement therapy,,['Tomás Mier'],,,https://people.com/music/cara-cunningham-announces-shes-transitioning/,https://imagesvc.meredithcorp.io/v3/mm/image?q=85&c=sc&rect=0%2C200%2C1080%2C740&poi=face&w=1080&h=540&url=https%3A%2F%2Fstatic.onecms.io%2Fwp-content%2Fuploads%2Fsites%2F20%2F2021%2F08%2F19%2Fcara-cunningham.jpg,false
https://www.msn.com/en-us/entertainment/news/crafting-the-traumatic-sitcom-universe-of-wandavision/ar-AANvGvn?ocid=BingNews,Crafting the Traumatic Sitcom Universe of ‘WandaVision’,"Craft Considerations: Watch director Matt Shakman, production designer Mark Worthington, and the songwriters break down ""WandaVision.""",,"[""Sarah Shachat Chris O'Falt"", 'Sarah Shachat', ""Chris O'Falt""]",2021-08-19 18:00:22+00:00,2021-08-19T16:48:33+00:00,https://www.indiewire.com/craft-considerations/wandavision-behind-the-scenes-production-1234658601/,https://www.indiewire.com/wp-content/uploads/2021/08/WV-Featured-2.jpg?w=780,
https://www.msn.com/en-us/music/news/neil-young-bows-out-of-farm-aid-2021-i-worry-about-audiences-coming-together/ar-AANvJdj?ocid=BingNews,Neil Young bows out of Farm Aid 2021: ‘I worry about audiences coming together’,Rocker Neil Young 'can't shake the feeling' that Farm Aid 2021 might not be safe for all —  especially kids —  as COVID-19's Delta variant surges.,Music,"['Staff Writer', 'Nardine Saad Covers Breaking Entertainment News', 'Trending Culture Topics', 'Celebrities', 'Their Kin For The Los Angeles Times. She Joined The Times In As A Metpro Trainee', 'Has Reported Homicide Scenes', 'Flooded Canyons', 'Red Carpet Premieres', 'Award Shows.']",2021-08-19 00:00:00,,https://www.latimes.com/entertainment-arts/music/story/2021-08-19/neil-young-farm-aid-2021-covid-19-pandemic,https://ca-times.brightspotcdn.com/dims4/default/528c5b2/2147483647/strip/true/crop/3479x1826+0+0/resize/1200x630!/quality/90/?url=https%3A%2F%2Fcalifornia-times-brightspot.s3.amazonaws.com%2Fff%2F9d%2Fd73b05d94ed18a16439e52502ea9%2Ffilm-neil-young.JPEG,false
https://www.msn.com/en-us/entertainment/news/emmy-predictions-lead-actress-in-a-drama-series-can-anyone-divide-and-conquer-a-vote-split-with-emma-corrin-and-olivia-colman/ar-AAKdfMO?ocid=BingNews,Emmy Predictions: Lead Actress in a Drama Series – Can Anyone Divide and Conquer a Vote Split With Emma Corrin and Olivia Colman?,"2021 Emmy predictions for lead actress drama include Uzo Aduba, Emma Corrin, Olivia Colman, Elisabeth Moss, Mj Rodriguez and Jurnee Smollett",,['Clayton Davis'],2021-08-19 17:48:07+00:00,2021-08-20T02:12:32+00:00,https://variety.com/feature/2021-emmy-predictions-lead-actress-drama-series-1234977663/,https://variety.com/wp-content/uploads/2021/05/Emma-Corrin-The-Crown.jpg?w=1000,
https://www.msn.com/en-us/music/news/zoomers-rejoice-willow-smith-and-billie-eilish-are-coming-to-los-angeles-next-spring/ar-AANvH1r?ocid=BingNews,Zoomers rejoice: Willow Smith and Billie Eilish are coming to Los Angeles next spring,"After completing her own tour this fall, rising pop-punk star Willow Smith will open for multiple-Grammy winner Billie Eilish, including at the Forum.",Music,"['Staff Writer', 'Christi Carras Is An Entertainment Reporter At The Los Angeles Times. She Was Previously A Times Intern After Graduating Ucla', 'Has Also Worked At Variety', 'The Hollywood Reporter']",2021-08-19 00:00:00,,https://www.latimes.com/entertainment-arts/music/story/2021-08-19/willow-smith-billie-eilish-tour-dates-tickets,https://ca-times.brightspotcdn.com/dims4/default/6961983/2147483647/strip/true/crop/1800x945+0+0/resize/1200x630!/quality/90/?url=https%3A%2F%2Fcalifornia-times-brightspot.s3.amazonaws.com%2F5d%2Fe0%2F96d2760f4e5488d3de4f459caf6a%2Fipiccy-image.jpg,false
https://www.msn.com/en-us/news/politics/will-voter-turnout-sink-or-save-newsom/ar-AANv9je?ocid=BingNews,Will voter turnout sink or save Newsom in recall election?,,,"['Brooke Staggs', 'Journalism Has Led Brooke Staggs To A Manhunt In Las Vegas', 'A Zero Gravity Flight Over Queens', 'A Fishing Village In Ghana. The Big Bear Native Is Addicted To Education. She Earned Her Bachelors Degree In English California Baptist University', ""Then Got Her Master'S In Education As She Taught High School English In The Inland Empire. After Four Years In The Classroom"", 'She Left In To Be A Student Again Herself', 'Earning A Masters Degree In Journalism New York University While Interning', 'Freelancing For A Variety Of Publications. She Sees Journalism As Another Form Of Teaching', 'Helping Readers Make Informed Decisions', 'Better Understand The World Around Them. Brooke Spent Five Years As A Staff Writer Then City Editor At The Daily Press In Victorville. She Joined The Orange County Register In January']",2021-08-19 00:00:00,2021-08-20T05:31:00+00:00,https://www.ocregister.com/2021/08/19/will-voter-turnout-sink-or-save-newsom,https://www.dailynews.com/wp-content/uploads/2021/08/OCR-L-TURNOUT-0819.JA_.01.jpg?w=1024&h=705,
https://www.msn.com/en-us/news/us/judge-blocks-us-effort-to-curtail-ice-arrests-and-deportations/ar-AANvKdt?ocid=BingNews,Judge blocks Biden administration effort to curtail ICE arrests and deportations,"The Biden administration rules instructed ICE agents to focus on arresting recent border-crossers, as well as immigrants deemed to threaten public safety or national security.",,"['Camilo Montoya-Galvez', 'Camilo Montoya-Galvez Is The Immigration Reporter At Cbs News. Based In Washington', 'He Covers Immigration Policy']",,,https://www.cbsnews.com/news/immigration-ice-arrests-deportations-judge-blocks-biden-administration/,https://cbsnews3.cbsistatic.com/hub/i/r/2020/12/23/7d844ad8-5461-44d3-9e5d-d92dc12f5d97/thumbnail/1200x630/9ef0e53a28d65352533f24a452c86763/gettyimages-945288792.jpg,false
https://www.msn.com/en-us/news/politics/republican-senator-from-mississippi-tests-positive-for-coronavirus/ar-AANvl8W?ocid=BingNews,Three U.S. senators test positive for coronavirus,"Sen. Roger Wicker, R-Miss., who opposes mask mandates on planes and trains, has tested positive. So have Sens. Angus King, I-Maine, and John Hickenlooper, D-Colo.",,"['Dareh Gregorian Is A Politics Reporter For Nbc News.', 'Julie Tsirkin', 'Julie Tsirkin Is A Producer', ""Reporter For Nbc News' Capitol Hill Team.""]",2021-08-19 17:47:00+00:00,Thu Aug 19 2021 23:56:14 GMT+0000 (UTC),https://www.nbcnews.com/politics/congress/mississippi-senator-who-s-opposed-mask-mandates-tests-positive-coronavirus-n1277177,"https://media-cldnry.s-nbcnews.com/image/upload/t_nbcnews-fp-1200-630,f_auto,q_auto:best/newscms/2021_33/3500215/210819-roger-wicker-jm-1231.jpg",false
https://www.msn.com/en-us/news/politics/rep-sara-walshs-husband-dies-after-contracting-covid-19/ar-AANvf1e?ocid=BingNews,Rep. Sara Walsh’s husband dies after contracting COVID-19,"ASHLAND, Mo. (AP) — A Missouri state lawmaker who is running for Congress has announced that her husband has died after the couple was diagnosed with COVID-19.  Republican State Rep. Sara Walsh, of Ashland, thanked everyone who had prayed for her husband, Steve Walsh, in announcing Thursday in a tweet that he had died .",Health,[],2021-08-19 14:32:08+00:00,2021-08-19T16:04:56Z,https://apnews.com/9b71c2ff743f8e05eaccfeadbc59a1b1,https://apnews.com/images/ShareLogo2.png,
https://www.msn.com/en-us/news/us/charlie-baker-orders-over-40000-state-workers-to-get-the-covid-19-vaccine-or-potentially-get-fired/ar-AANvkUh?ocid=BingNews,Massachusetts orders state workers to get the COVID-19 vaccine,Get the COVID-19 vaccine or potentially lose your job. That's the choice Massachusetts Gov. Charlie Baker is giving to state workers.,,[],2021-08-19 00:00:00,2021-08-19T21:08:03+00:00,https://www.boston.com/news/coronavirus/2021/08/19/charlie-baker-massachusetts-vaccine-mandate-state-workers/,https://bdc2020.o0bc.com/wp-content/uploads/2021/08/EENKJY2Q2RAMADYSYVDRLSKH2Q-611e826815fed-scaled.jpg,false
https://www.msn.com/en-us/news/us/arizona-school-board-imposes-gag-rule-for-vaccines-masks/ar-AANvyRi?ocid=BingNews,"Arizona school board imposes gag rule for vaccines, masks","BULLHEAD CITY, Ariz. (AP) — Employees in a northwestern Arizona school district cannot discuss vaccination status or mask-wearing with students under a motion approved unanimously by the local school board.",Bullhead City,[],2021-08-19 17:09:50+00:00,2021-08-20T00:12:22Z,https://apnews.com/3173e6e49e74d08a04fdcde59c4fbef0,https://apnews.com/images/ShareLogo2.png,
https://www.msn.com/en-us/news/us/active-bomb-threat-near-us-capitol-cannon-and-jefferson-office-buildings-evacuated/ar-AANv9xL?ocid=BingNews,"Man claiming to have bomb near U.S. Capitol is in custody after standoff, police say",U.S. Capitol Police said a man drove a truck onto the sidewalk outside the Library of Congress. Police identified the man now in custody as Floyd Ray Roseberry.,"D.C., Md. & Va.",[],2021-08-19 00:00:00,2021-08-19T23:31:52.058Z,https://www.washingtonpost.com/dc-md-va/2021/08/19/suspicious-vehicle-library-of-congress/,https://www.washingtonpost.com/wp-apps/imrs.php?src=https://d1i4t8bqe7zgj6.cloudfront.net/08-19-2021/t_3d27660d407d4bc0a594da26ef8053bb_name_20210819_policechiefAP.jpg&w=1440,false
https://www.msn.com/en-us/news/politics/connecticut-state-senate-seat-flip-shows-good-signs-for-gop-ahead-of-midterm-elections/ar-AANvzwt?ocid=BingNews,Connecticut state Senate seat flip shows good signs for GOP ahead of midterm elections,A Republican special election win in a Connecticut state Senate district that broke for President Joe Biden by double digits is an encouraging sign for Republicans looking to repeat the success in this year’s state-level elections and in the 2022 midterm elections.,News,[],2021-08-19 18:43:36.968000,2021-08-19T18:43:36.968,https://www.washingtonexaminer.com/news/connecticut-state-senate-seat-flip-good-signs-gop-ahead-midterm-elections,https://mediadc.brightspotcdn.com/dims4/default/b381fc3/2147483647/strip/true/crop/2290x1202+0+60/resize/1200x630!/quality/90/?url=http%3A%2F%2Fmediadc-brightspot.s3.amazonaws.com%2F1b%2F49%2Ffd8a0c824f21b1e0f0ab9455b69e%2Fvoting-sticker.jpg,
https://www.msn.com/en-us/news/politics/parson-wont-call-lawmakers-back-early-for-redistricting/ar-AANvraM?ocid=BingNews,Missouri governor won’t call session for redistricting,"SEDALIA, Mo. (AP) — Missouri Gov. Mike Parson on Thursday said he won’t call lawmakers back to work this year to redraw the state’s congressional districts,  setting up a compressed timeline for candidates running for the U.S.",Missouri Tigers men's basketball,[],2021-08-19 15:57:50+00:00,2021-08-19T22:20:40Z,https://apnews.com/e0de270235900af0bcb5d6cdb5924285,https://apnews.com/images/ShareLogo2.png,
https://www.msn.com/en-us/news/politics/sen-bernie-sanders-to-tout-democrats-dollar35-trillion-budget-plan-in-red-indiana-iowa/ar-AANvqHH?ocid=BingNews,"Sen. Bernie Sanders to tout Democrats' $3.5 trillion budget plan in red Indiana, Iowa",Sanders will push for the massive Democratic budget plan in areas of Indiana and Iowa represented by Republicans.,Politics,['Jacob Pramuk'],2021-08-19 00:00:00,2021-08-19T18:27:19+0000,https://www.cnbc.com/2021/08/19/bernie-sanders-to-tout-democrats-3point5-trillion-budget-plan-in-red-indiana-iowa.html,https://image.cnbcfm.com/api/v1/image/106872517-1619113324855-gettyimages-1232293943-reynolds127.jpeg?v=1619113369,false
https://www.msn.com/en-us/money/markets/sandp-500-trades-higher-and-nasdaq-rises-as-tech-shares-rebound/ar-AANvgk7?ocid=BingNews,"Stocks End Mixed, Dow Lower as Fed Taper Talk Too Much for Wall Street",Stocks end mixed Thursday on concerns the Fed could begin tapering stimulus this year.,MARKETS,['Joseph Woelfel'],2021-08-19 20:18:37+00:00,,https://www.thestreet.com/markets/stock-market-today-dow-jones-nvidia-federal-reserve-copper-081921,https://www.thestreet.com/.image/t_share/MTY4NjUwODE1NTUyMzAwNjc5/wall-streets-fearless-girl-will-face-down-the-bull-for-another-year.jpg,
https://www.msn.com/en-us/news/politics/biden-administration-calls-on-states-to-use-stimulus-funds-for-unemployment-aid-after-expiration/ar-AANvLUk?ocid=BingNews,Biden administration calls on states to use stimulus funds for unemployment aid after expiration,The Biden administration is calling for states to use leftover stimulus funds to extend key unemployment programs that are set to expire in early September.,,[],,,https://money.yahoo.com/biden-calls-on-states-to-use-stimulus-for-unemployment-185931244.html,https://s.yimg.com/ny/api/res/1.2/vZBVPoUT0tV_WpXMdSp_hQ--/YXBwaWQ9aGlnaGxhbmRlcjt3PTIwMDA7aD0xMzMz/https://s.yimg.com/os/creatr-uploaded-images/2021-08/462f74b0-011c-11ec-bdbd-dbc69c19f94f,
https://www.msn.com/en-us/money/companies/toyota-cuts-production-amid-supply-chain-shortages-due-to-delta-variant/ar-AANvqJw?ocid=BingNews,Toyota cuts production amid supply chain shortages due to delta variant,Toyota is scaling back production in North America and Japan as the surging coronavirus pandemic in Southeast Asia and elsewhere crimps supplies.,,['Associated Press'],,,https://www.marketwatch.com/story/toyota-cuts-production-amid-supply-chain-shortages-due-to-delta-variant-01629386913,https://images.mktw.net/im-388300/social,false
https://www.msn.com/en-us/news/politics/two-u-s-senators-test-positive-for-covid-19-in-breakthrough-infections/ar-AANvyQv?ocid=BingNews,Are you a robot?,,,[],2021-08-19 00:00:00,,,,
https://www.msn.com/en-us/money/realestate/as-mortgage-rates-hold-near-historical-lows-will-enough-americans-take-advantage-of-the-savings/ar-AANvcCk?ocid=BingNews,"As mortgage rates hover near historic lows, will Americans be able to take advantage of the savings?",Supply restrictions and difficulty accessing credit could make the continued spate of low interest rates a wasted opportunity for many people.,,"['Jacob Passy', 'Zillow Senior Economist Matthew Speakman']",,,https://www.marketwatch.com/story/as-mortgage-rates-hold-near-historical-lows-will-enough-americans-take-advantage-of-the-savings-11629382511,https://images.mktw.net/im-388238/social,false
https://www.msn.com/en-us/money/retirement/retirees-are-getting-hit-by-rising-prices-heres-what-will-soften-the-blow/ar-AANvlhT?ocid=BingNews,Retirees are getting hit by rising prices. Here's what will soften the blow,,success,"['Jeanne Sahadi', 'Cnn Business']",2021-08-19 00:00:00,2021-08-19T13:45:02Z,https://www.cnn.com/2021/08/19/success/high-inflation-low-rates-retirees-feseries/index.html,https://cdn.cnn.com/cnnnext/dam/assets/210818104047-elderly-woman-retiree-bills-stock-super-tease.jpg,false
https://www.msn.com/en-us/money/companies/opioid-abuse-is-a-truly-horrible-problem-mortimer-sackler-says/ar-AANvEyC?ocid=BingNews,Are you a robot?,,,[],2021-08-19 00:00:00,,,,
https://www.msn.com/en-us/finance/markets/stocks-shrug-off-fed-taper-plans-oil-skids/ar-AANuPFM?ocid=BingNews,"Stocks finish mixed, oil skids",U.S. stock indexes ended little changed Thursday as investors looked past the Federal Reserve’s minutes released the prior day which indicated the central bank could begin its taper later this year.,,['Jonathan Garber'],,2021-08-19T16:08:06-04:00,https://www.foxbusiness.com/markets/stock-futures-pressured-fed-taper-plans-oil,https://a57.foxnews.com/static.foxbusiness.com/foxbusiness.com/content/uploads/2021/06/0/0/nyse-traders-volatility-Feb-2018-1.jpg?ve=1&tl=1,false
https://www.msn.com/en-us/money/careersandeducation/student-loans-a-teacher-penalty-is-crushing-generations-of-educators-with-debt/ar-AANvkMt?ocid=BingNews,Student loans: A 'teacher penalty' is crushing generations of educators with debt,"Educators across America are heavily weighed down by student debt, according to a new report from the National Education Association (NEA).",,[],,,https://finance.yahoo.com/news/student-loans-teacher-penalty-165647925.html,https://s.yimg.com/ny/api/res/1.2/QWqNhDzq6hHnB4jBTJbSLQ--/YXBwaWQ9aGlnaGxhbmRlcjt3PTIwMDA7aD0xMzM1/https://s.yimg.com/os/creatr-uploaded-images/2021-08/e3dc48f0-010d-11ec-bbee-09f3889bef00,
