article_url,article_title,meta_description,section,authors,publish_date,modified_date,canonical_link,top_image,is_opinion
https://www.msn.com/en-us/news/politics/number-of-texas-state-democrats-to-test-positive-for-covid-19-rises-to-5/ar-AAMiwln?ocid=BingNews,Number of Texas state Democrats to test positive for COVID-19 rises to 5,"Two more Texas state Democrats have tested positive for COVID-19 after traveling to Washington, D.C., last week, bringing the total number of cases to five as of Sunday evening.",,[],2021-07-18 20:59:58-04:00,2021-07-19T09:35:49-04:00,https://thehill.com/homenews/state-watch/563620-number-of-texas-state-democrats-to-test-positive-for-covid-19-rises-to-5,https://thehill.com/sites/default/files/article_images/martinezfischertrey_071321getty_1.jpg,
https://www.msn.com/en-us/news/politics/mullen-calls-reports-of-post-election-chaos-in-wh-disturbing/ar-AAMikgJ?ocid=BingNews,"Mullen says reports post-election chaos within Trump White House are ""incredibly disturbing""","New books detail the concerns General Mark Milley, chairman of the Joint Chiefs of Staff, had about Mr. Trump in the weeks after the presidential election.",,['Melissa Quinn'],,,https://www.cbsnews.com/news/admiral-mike-mullen-donald-trump-white-house-mark-milley/,https://cbsnews1.cbsistatic.com/hub/i/r/2021/07/18/17672e2a-7727-4f43-97eb-2290a85c40ba/thumbnail/1200x630/bc903ccc7f9c6b1a5af28a2924b161da/1626624857380.png,false
https://www.msn.com/en-us/news/us/los-angeles-county-reinstates-mask-mandate-amid-covid-spike/ar-AAMiAGk?ocid=BingNews,Los Angeles County reinstates mask mandate as Delta variant fuels COVID spike,New cases have spiked almost 70% in the U.S. over the past week with eight states plagued with rapidly rising infections.,,['Lilia Luciano'],,,https://www.cbsnews.com/news/los-angeles-mask-mandate/,https://cbsnews2.cbsistatic.com/hub/i/r/2021/07/18/2502862f-ee88-400d-b157-4403cc0587f9/thumbnail/1200x630/594ed2b51fa80d396eb16c8886515d5b/0718-wn-luciano2.png,false
https://www.msn.com/en-us/news/us/spreading-like-wildfire-fauci-surgeon-general-take-aim-at-covid-misinformation-online/ar-AAMi8Dj?ocid=BingNews,"'Spreading like wildfire': Fauci, surgeon general take aim at COVID misinformation online","Dr. Anthony Fauci speculates smallpox, polio would still exist if the efforts to vaccinate against those diseases had experienced similar pushback.",,[],2021-07-18 00:00:00,,https://www.usatoday.com/story/news/politics/2021/07/18/fauci-surgeon-general-criticize-spread-covid-misinformation-online/8007255002/,"https://www.gannett-cdn.com/presto/2020/04/21/USAT/0158016f-8ad8-4820-bd20-8dea3ecda057-Vivek.jpg?crop=398,224,x0,y60&width=398&height=224&format=pjpg&auto=webp",false
https://www.msn.com/en-us/sports/olympics/coco-gauff-out-of-olympics-after-testing-positive-for-covid-19/ar-AAMiuNz?ocid=BingNews,Coco Gauff out of Tokyo Olympics after testing positive for COVID-19,"U.S. Olympian Coco Gauff announced she tested positive for COVID-19 and won't play in the Tokyo Games, which start this week.",,"['Alex Sundby', 'Alex Sundis A Senior Editor For Cbsnews.Com', 'Alex Sund']",,,https://www.cbsnews.com/news/coco-gauff-covid-19-olympics-2021/,https://cbsnews3.cbsistatic.com/hub/i/r/2021/07/18/639802db-f610-49b1-a237-3f010fef216b/thumbnail/1200x630g3/c9d0cf443e3e890119ea70fe9151890e/coco-gauff-2021-07-01t144909z.jpg,false
https://www.msn.com/en-us/health/medical/la-county-now-requires-masks-indoors-but-will-people-follow-the-rules/ar-AAMia6F?ocid=BingNews,L.A. County now requires masks indoors. But will people follow the rules?,"L.A. County now requires masks in indoor public places, opening a new battle line as the coronavirus is rising significantly among the unvaccinated.",California,"['Rong-Gong Lin Ii Is A Metro Reporter Based In San Francisco Who Specializes In Covering Statewide Earthquake Safety Issues', 'The Pandemic. The Bay Area Native Is A Graduate Of Uc Berkeley', 'Started At The Los Angeles Times In', 'Luke Money Is A Metro Reporter Covering Breaking News At The Los Angeles Times. He Previously Was A Reporter', 'Assistant City Editor For The Daily Pilot', 'A Times Community News Publication In Orange County', 'Before That Wrote For The Santa Clarita Valley Signal. He Earned His Bachelor S Degree In Journalism The University Of Arizona.', 'Hannah Fry Is A Metro Reporter Covering Orange County For The Los Angeles Times. She Joined The Newspaper In As A Reporter For The Daily Pilot', 'A Times Community News Publication. Fry Most Recently Covered Breaking News For The Times', 'Was Part Of The Team That Was A Pulitzer Finalist For Its Coverage Of A Boat Fire That Killed People Off The Coast Of Santa Barbara. She Grew Up In Orange County']",2021-07-18 00:00:00,,https://www.latimes.com/california/story/2021-07-18/la-county-indoor-masks-will-people-follow-rule,https://ca-times.brightspotcdn.com/dims4/default/5058219/2147483647/strip/true/crop/6240x3276+0+499/resize/1200x630!/quality/90/?url=https%3A%2F%2Fcalifornia-times-brightspot.s3.amazonaws.com%2F16%2F16%2Fcda288634752ad26a74caf826024%2Fla-photos-1staff-811329-la-me-indoor-masks-delta-variant-01.FO%20copy.jpg,false
https://www.msn.com/en-us/news/world/spyware-meant-to-track-terrorists-was-used-against-journalists-and-activists-too/ar-AAMil31?ocid=BingNews,"Spyware meant to track terrorists was used against journalists, too",A forensic analysis of dozens of smartphones belonging to journalists and activists around the world discovered spyware created by NSO Group.,Tech,[],2021-07-18 19:35:56+00:00,2021-07-18T19:37:20+00:00,https://mashable.com/article/nso-group-pegasus-spyware-activists-journalists,https://helios-i.mashable.com/imagery/articles/036UrKZUnzmdB4XpXOS19Mb/hero-image.fill.size_1200x675.v1626637691.jpg,
https://www.msn.com/en-us/news/politics/sen-graham-says-hell-follow-the-lead-of-texas-house-dems-who-fled-state-and-leave-for-vote-on-spending-bill/ar-AAMioiq?ocid=BingNews,Sen. Graham says he'll follow the lead of Texas House Dems who fled state and leave for vote on spending bill,"Sen. Lindsey Graham, R-S.C., condemned the Democratic spending package and said during an exclusive interview on Fox News' “Sunday Morning Futures” that, if needed, he will follow the lead of the Texas House Democrats who fled their home state in an effort to kill GOP-backed voting legislation.",,"['Talia Kaplan', 'Talia Kaplan Is A Reporter For Foxnews.Com. Follow Her On Twitter']",,2021-08-02T22:47:36-04:00,https://www.foxnews.com/politics/sen-graham-says-hell-follow-the-lead-of-texas-house-dems-who-fled-state-and-leave-for-vote-on-spending-bill,https://static.foxnews.com/foxnews.com/content/uploads/2021/07/Sen-Graham-on-migrant-surge-and-Bidens-effort-to-tie-infrastructure-spending-bills-1.jpg,false
https://www.msn.com/en-us/weather/topstories/it-happened-so-fast-wildfire-explodes-near-lake-tahoe-forcing-hundreds-to-flee/ar-AAMij5G?ocid=BingNews,"Wildfire explodes near Lake Tahoe, forcing hundreds to flee; critically dangerous fire weather expected through Monday","A fire roaring near Lake Tahoe that forced hundreds to flee blew up to cover 30 square miles Sunday, one of more than 80 fires raging across the West.",,[],2021-07-18 00:00:00,,https://www.usatoday.com/story/news/nation/2021/07/18/lake-tahoe-wildfire-burns-forces-evacuations-and-closures/8008369002/,"https://www.gannett-cdn.com/presto/2021/07/18/USAT/4928be5c-1963-4f04-8ff3-00b6c28a55cf-AP_APTOPIX_California_Wildfires_1.jpg?crop=6047,3402,x0,y303&width=3200&height=1801&format=pjpg&auto=webp",false
https://www.msn.com/en-us/news/world/merkel-calls-for-climate-change-action-as-she-surveys-deadly-flood-damage/ar-AAMiclb?ocid=BingNews,Angela Merkel calls for climate change action as she surveys deadly German flood damage,"German Chancellor Angela Merkel pledged financial relief for areas devastated by deadly flooding, as the death toll from torrential rain continues to rise.",,"['Claudio Lavanga', 'Claudio Lavanga Is Rome-Based Producer', 'Correspondent For Nbc News.', 'Isobel Van Hagen']",2021-07-18 15:30:00+00:00,Sun Jul 18 2021 23:13:44 GMT+0000 (UTC),https://www.nbcnews.com/news/world/angela-merkel-calls-climate-change-action-she-surveys-deadly-flood-n1274310,"https://media-cldnry.s-nbcnews.com/image/upload/t_nbcnews-fp-1200-630,f_auto,q_auto:best/newscms/2021_28/3492046/210718-angela-merkel-schuld-jm-0946.jpg",false
https://www.msn.com/en-us/news/us/us-appeals-court-blocks-ruling-that-would-have-suspended-cdc-cruise-ship-rules/ar-AAMiwT8?ocid=BingNews,U.S. appeals court blocks ruling that would have suspended CDC cruise ship rules,A U.S. appeals court late Saturday in a 2-1 ruling put on hold a lower-court decision that said the U.S. Centers for Disease Control and Prevention (CDC) could not enforce its coronavirus cruise ship rules in the state.,United States,['David Shepardson'],2021-07-19 09:17:00+00:00,2021-07-19T09:18:47.922Z,https://www.reuters.com/world/us/us-appeals-court-blocks-ruling-that-would-have-suspended-cdc-cruise-ship-rules-2021-07-18/,https://www.reuters.com/resizer/WmXgbiUxx_bgrcT7vcgYp90ARqY=/1200x628/smart/filters:quality(80)/cloudfront-us-east-2.images.arcpublishing.com/reuters/UOFN7N76LJPOTLIXUS7KUEQ67Y.jpg,
https://www.msn.com/en-us/sports/nfl/younghoe-koo-says-his-jeep-was-stolen-asks-for-cleats-back/ar-AAMiyzJ?ocid=BingNews,"Younghoe Koo says his Jeep was stolen, asks for cleats back",Koo said his black Jeep Grand Cherokee was taken but sounded more upset about losing his cleats that were in the car.,,"['Matt Urben', 'July', 'Pm Et']",2021-07-18 00:00:00,2021-07-19T17:37:42+00:00,https://thefalconswire.usatoday.com/2021/07/18/atlanta-falcons-younghoe-koo-jeep-nfl-news/,https://thefalconswire.usatoday.com/wp-content/uploads/sites/56/2021/05/USATSI_16145640-e1626660552713.jpg?w=1024&h=576&crop=1,
https://www.msn.com/en-us/sports/nfl/vikings-odds-to-win-the-nfc-north-in-2021/ar-AAMiy3u?ocid=BingNews,Vikings' odds to win the NFC North in 2021,"The Vikings have the second-best odds of winning the NFC North at the moment, according to BetMGM.",,"['Jack White', 'July', 'Pm Ct']",2021-07-18 00:00:00,2021-07-19T14:07:31+00:00,https://vikingswire.usatoday.com/2021/07/18/vikings-odds-to-win-the-nfc-north-in-2021/,https://vikingswire.usatoday.com/wp-content/uploads/sites/44/2020/11/USATSI_15142767.jpg?w=1024&h=576&crop=1,
https://www.msn.com/en-us/sports/nba/phoenix-suns-look-back-at-third-straight-nba-finals-loss-ahead-to-win-or-go-home-game-6/ar-AAMijDP?ocid=BingNews,"Phoenix Suns: Look back at third straight NBA Finals loss, ahead to win-or-go-home Game 6",The Phoenix Suns are at the brink of elimination after losing Game 5 at home to the Milwaukee Bucks.,,[],2021-07-18 00:00:00,,https://www.azcentral.com/story/sports/nba/suns/2021/07/18/after-third-straight-nba-finals-loss-phoenix-suns-face-win-go-home-game-6/8008508002/,"https://www.gannett-cdn.com/presto/2021/07/18/PPHX/eb8a02ff-b881-47bf-bd92-de04dcfe5713-cent02-7gpa0r7aiczpgdnz837_original.jpg?crop=3399,1912,x0,y145&width=3200&height=1801&format=pjpg&auto=webp",false
https://www.msn.com/en-us/sports/nfl/2021-90-man-offseason-roster-as-cowboys-cut-cb-with-camp-approaching/ar-AAMiAvY?ocid=BingNews,2021 90-man offseason roster as Cowboys cut CB with camp approaching,"A position by position gallery of each player, complete with jersey number to serve as a guide for when things kick off this week in Oxmard.",,"['K.D. Drummond', 'Todd Brock', 'July', 'Pm Ct']",2021-07-19 00:05:31+00:00,2021-07-19T12:56:54+00:00,https://cowboyswire.usatoday.com/gallery/2021-90-man-offseason-roster-as-cowboys-cut-cb-with-camp-approaching/,https://cowboyswire.usatoday.com/wp-content/uploads/sites/73/2021/07/USATSI_16200816-e1626653000198.jpg?w=1024&h=576&crop=1,
https://www.msn.com/en-us/sports/nfl/cardinals-wr-christian-kirk-ready-to-have-best-season-yet-in-2021/ar-AAMiA9f?ocid=BingNews,Cardinals WR Christian Kirk ready to have 'best season yet' in 2021,Cardinals WR Christian Kirk has not been bad in his career but also has underachieved. He is planning on ending that in 2021.,,"['Jess Root', 'Site Editor', 'Nick Wojton', 'Jon Heath', 'July', 'Pm Mt']",2021-07-18 00:00:00,2021-07-18T23:22:22+00:00,https://cardswire.usatoday.com/2021/07/18/cardinals-wr-christian-kirk-ready-to-have-best-season-yet-in-2021/,https://cardswire.usatoday.com/wp-content/uploads/sites/60/2020/10/USATSI_15053652.jpg?w=1024&h=576&crop=1,
https://www.msn.com/en-us/sports/nfl/houston-texans-2021-player-profile-de-jordan-jenkins/ar-AAMirdC?ocid=BingNews,Houston Texans 2021 player profile: DE Jordan Jenkins,Jordan Jenkins had a down season in 2020. Can the former 2016 third-round pick have a bounce-back season with the Houston Texans?,,"['Coty Davis', 'Mark Lane', 'July', 'Pm Ct']",2021-07-18 22:08:04+00:00,2021-07-18T22:08:04+00:00,https://texanswire.usatoday.com/lists/texans-2021-player-profile-jordan-jenkins/,https://texanswire.usatoday.com/wp-content/uploads/sites/54/2021/07/Texans_tradingCards_JordanJenkins.png?w=1024&h=576&crop=1,
https://www.msn.com/en-us/sports/nba/warriors-fans-and-kevin-durant-are-still-arguing-about-his-dubs-tenure-on-twitter/ar-AAMiAWC?ocid=BingNews,Warriors fans and Kevin Durant are still arguing about his Dubs tenure on Twitter,KD says he's not jealous of Steph Curry and he's annoyed by a book that was released last...,Golden State Warriors,"['Alex Shultz', 'Written By']",2021-07-19 00:19:37,2021-07-19 00:19:37,https://www.sfgate.com/warriors/article/Warriors-fans-and-Kevin-Durant-are-still-arguing-16323083.php,https://s.hdnux.com/photos/01/21/04/32/21251716/3/rawImage.jpg,
https://www.msn.com/en-us/sports/mlb/charlie-blackmon-s-walk-off-heroics-snap-rockies-losing-streak-to-dodgers/ar-AAMiF4n?ocid=BingNews,Charlie Blackmon’s walk-off heroics snap Rockies’ losing streak to Dodgers,"Blackmon's two-out, walk-off home run in the bottom of the 10th inning Sunday gave Colorado a 6-5 victory at Coors Field to snap an eight-game losing streak against the Dodgers.",,"['Mike Chambers', 'Avalanche', 'General Assignment Reporter', 'Mike Chambers Is The Avalanche Beat Writer For The Denver Post. A Colorado Native', 'He Wrote His First Story For The Paper As A Freelancer In', 'Joined The Staff In As A General-Assignment Writer Mostly Covering The University Of Denver Hockey Team. Mike Graduated Cherry Creek High School', 'Has A Journalism Degree The University Of Northern Colorado.']",2021-07-18 00:00:00,2021-07-19T00:05:13+00:00,https://www.denverpost.com/2021/07/18/charlie-blackmon-walk-off-rockies-dodgers/,https://www.denverpost.com/wp-content/uploads/2021/07/AP21199822155975.jpg?w=1024&h=693,
https://www.msn.com/en-us/sports/other/5-biggest-takeaways-from-ufc-on-espn-26-is-islam-makhachev-the-world-s-best-lightweight/ar-AAMibmm?ocid=BingNews,5 biggest takeaways from UFC on ESPN 26: Is Islam Makhachev the world's best lightweight?,"Thoughts and analysis of the biggest storylines coming out of UFC on ESPN 26, which took place Saturday in Las Vegas.",,"['Mike Bohn', 'Mma Junkie Staff', 'Nolan King', 'Farah Hannoun', 'Danny Segura', 'Matthew Wells']",2021-07-18 17:50:04+00:00,2021-07-18T16:36:19+00:00,https://mmajunkie.usatoday.com/lists/ufc-on-espn-26-takeaways-reaction-analysis-islam-makhachev-miesha-tate-jeremy-stephens,https://mmajunkie.usatoday.com/wp-content/uploads/sites/91/2021/07/islam-makhachev-thiago-moises-ufc-on-espn-26-3.jpg?w=1024&h=576&crop=1,
https://www.msn.com/en-us/sports/soccer/usmnt-tops-gold-cup-group-but-enters-knockout-stage-with-convincing-to-do/ar-AAMitWT?ocid=BingNews,"Gold Cup: USMNT holds off Canada, tops group, has convincing to do","The U.S. scored 20 seconds in vs. Canada and held on for the result that mattered, but beneath the surface there were some flaws that must be addressed.",Soccer,['Brian Straus'],2021-07-18 00:00:00,,https://www.si.com/soccer/2021/07/18/usmnt-canada-concacaf-gold-cup-moore-berhalter,https://www.si.com/.image/t_share/MTgyNTI2NDU4NDgzMTg4ODY3/shaq-moore-usmnt-canada-goal.jpg,
https://www.msn.com/en-us/sports/mlb/rod-c3-b3n-dominates-through-7-white-sox-blank-astros-4-0/ar-AAMisMh?ocid=BingNews,"Rodón dominates through 7, White Sox blank Astros 4-0","CHICAGO (AP) — Carlos Rodón allowed one hit through seven dominant innings, Yoán Moncada and Tim Anderson hit solo homers and the Chicago White Sox topped the Houston Astros 4-0 on Sunday. Danny Mendick and Adam Engel added RBI singles, and the White Sox stymied Astros hitters for the second straight game after losing their first five this season to Houston — and being outscored 34-9 in those contests.",Sports,['Matt Carlson'],2021-07-18 20:59:24+00:00,2021-07-18T22:15:10Z,https://apnews.com/1a040aaf03b740f4ade7555165879fa4,https://storage.googleapis.com/afs-prod/media/0c8f09e51213496090129834b77adacf/3000.jpeg,
https://www.msn.com/en-us/sports/nhl/11-players-49ers-would-protect-in-an-nhl-style-expansion-draft/ar-AAMiso8?ocid=BingNews,11 players 49ers would protect in an NHL-style expansion draft,The San Francisco 49ers would have some tough decisions to make if the NFL expanded and did an NHL-style expansion draft.,,"['Kyle Madson', 'July', 'Pm Pt']",2021-07-18 20:04:38+00:00,2021-07-18T20:04:38+00:00,https://ninerswire.usatoday.com/lists/11-players-49ers-would-protect-in-an-nhl-style-expansion-draft/,https://ninerswire.usatoday.com/wp-content/uploads/sites/77/2020/01/usatsi_13897685.jpg?w=1024&h=576&crop=1,
https://www.msn.com/en-us/news/crime/shooting-near-nationals-park-puts-renewed-focus-on-another-weekend-of-gun-violence-in-us/ar-AAMipxi?ocid=BingNews,Shooting near Nationals Park puts renewed focus on another weekend of gun violence in US,"A series of shootings over the weekend in Chicago, Philadelphia, Washington, DC, and other American cities underscored the ongoing rise in shootings and gun violence in the US this year.",us,['Eric Levenson'],2021-07-18 00:00:00,2021-07-19T16:46:17Z,https://www.cnn.com/2021/07/18/us/us-violence-weekend/index.html,https://cdn.cnn.com/cnnnext/dam/assets/210717220335-01-nationals-park-dc-incident-0717-super-tease.jpg,false
https://www.msn.com/en-us/news/politics/desantis-fires-up-crowd-of-young-conservatives-in-tampa/ar-AAMiJMq?ocid=BingNews,DeSantis fires up crowd of young conservatives in Tampa,Governor discusses his most recent trip to the Texas border during the Student Action Summit Sunday.,,"['Tampa Publishing Company', 'Michaela Mulligan', 'Breaking Reporter']",2021-07-18 00:00:00,,https://www.tampabay.com/news/florida-politics/2021/07/18/desantis-fires-up-crowd-of-young-conservatives-in-tampa/,https://www.tampabay.com/resizer/uMl7hntP9GsiBI3Zeyf1UxPMaHo=/fit-in/800x450/smart/filters:fill(000)/cloudfront-us-east-1.images.arcpublishing.com/tbt/6CPZYQP5XBANJI47QEEFZIBIII.jpg,
https://www.msn.com/en-us/health/medical/officials-investigating-14-person-covid-19-outbreak-in-vancouver-hospital/ar-AAMiKgW?ocid=BingNews,Officials investigating 14-person COVID-19 outbreak in Vancouver hospital,,Coronavirus,"['April', 'Rubin', 'Arubin Oregonian.Com', 'April Rubin', 'The Oregonian Oregonlive']",2021-07-19 01:04:05.795000+00:00,2021-07-19T23:38:30.754Z,https://www.oregonlive.com/coronavirus/2021/07/officials-investigating-14-person-covid-19-outbreak-in-vancouver-hospital.html,https://www.oregonlive.com/resizer/E-cbGQigPLlHK6Br5ffAmYKE93Y=/1280x0/smart/cloudfront-us-east-1.images.arcpublishing.com/advancelocal/OFFUXMPCNFD6PAETC3JBROF67M.JPG,
https://www.msn.com/en-us/news/us/the-delta-variant-is-so-contagious-those-unprotected-will-likely-get-it-a-trump-administration-fda-chief-says/ar-AAMhv8N?ocid=BingNews,"The Delta variant is so contagious, those unprotected will likely get it, a Trump administration FDA chief says","Millions of Americans are jeopardizing their health, freedom and finances by not getting vaccinated and putting themselves at risk of the most infectious coronavirus strain yet, current and former federal health officials say.",health,"['Aya Elamroussi', 'Holly Yan']",2021-07-18 00:00:00,2021-07-18T23:36:52Z,https://www.cnn.com/2021/07/18/health/us-coronavirus-sunday/index.html,https://cdn.cnn.com/cnnnext/dam/assets/210718020311-01-coronavirus-test-la-0714-super-tease.jpg,false
https://www.msn.com/en-us/sports/olympics/teen-tennis-star-coco-gauff-tests-positive-for-covid-will-sit-out-tokyo-olympics/ar-AAMiiWS?ocid=BingNews,"Teen tennis star Coco Gauff tests positive for Covid, will sit out Tokyo Olympics","Tennis player Coco Gauff has tested positive for Covid-19 and won't compete in the Tokyo Olympics, where she had been expected to lead Team USA.",,"['Doha Madani Is A Breaking News Reporter For Nbc News. Pronouns', 'She Her.']",2021-07-18 20:28:00+00:00,Mon Jul 19 2021 03:28:43 GMT+0000 (UTC),https://www.nbcnews.com/news/sports/teen-tennis-star-coco-gauff-tests-positive-covid-will-sit-n1274319,"https://media-cldnry.s-nbcnews.com/image/upload/t_nbcnews-fp-1200-630,f_auto,q_auto:best/newscms/2021_28/3492083/210718-coco-gauff-jm-1522.jpg",false
https://www.msn.com/en-us/news/us/more-action-needed-to-fix-chemical-safety-board-crucial-to-nj-advocates-say/ar-AAMiqy7?ocid=BingNews,"More action needed to fix Chemical Safety Board crucial to N.J., advocates say",,Politics,"['Jonathan D. Salant', 'Jsalant Njadvancemedia.Com', 'Nj Advance Media For Nj.Com']",2021-07-18 20:30:00.270000+00:00,2021-07-19T11:32:27.308Z,https://www.nj.com/politics/2021/07/more-action-needed-to-fix-chemical-safety-board-crucial-to-nj-advocates-say.html,https://www.nj.com/resizer/n1cN7vXjmCrQs6FeNQd7rvXDm_Y=/1280x0/smart/cloudfront-us-east-1.images.arcpublishing.com/advancelocal/Q2OPOX4OZVBDNJAQ3QAHES6KFE.JPG,
https://www.msn.com/en-us/news/us/los-angeles-hopes-new-mask-mandate-will-reverse-virus-spike/ar-AAMidHW?ocid=BingNews,Los Angeles hopes new mask mandate will reverse virus spike,"LOS ANGELES (AP) — Los Angeles County residents are again required to wear masks indoors regardless of their vaccination status — a new mandate starting this weekend that health officials hope will reverse the latest spikes in coronavirus cases, hospitalizations and deaths.",Los Angeles,[],2021-07-18 18:18:15+00:00,2021-07-19T14:15:08Z,https://apnews.com/2a84d86250b0dcd3befa6b4bd266f5b6,https://storage.googleapis.com/afs-prod/media/1adc18aeb7724566b0af2fd2e14fc20f/3000.jpeg,
https://www.msn.com/en-us/news/crime/rep-thompson-challenging-authenticity-of-police-reports-alleging-past-domestic-abuse-attorney-says/ar-AAMimW6?ocid=BingNews,"Rep. Thompson challenging ‘authenticity’ of police reports alleging past domestic abuse, attorney says",,,"['Mara H. Gottfried', 'St. Paul Crime', 'Public Safety Reporter', 'Mara Gottfried Has Been A Pioneer Press Reporter Since', 'Mostly Covering Public Safety. Gottfried Lived In St. Paul As A Young Child', 'Returned To The Twin Cities After Graduating The University Of Maryland. You Can Reach Her At']",2021-07-18 00:00:00,2021-07-21T14:41:13+00:00,https://www.twincities.com/2021/07/18/rep-thompson-challenging-authenticity-of-police-reports-about-past-domestic-abuse-attorney-says/,https://www.twincities.com/wp-content/uploads/2021/07/John-Thompson-67A-crop-e1625855663708.jpg?w=930&h=523,
https://www.msn.com/en-us/news/us/mat-george-arizona-podcaster-and-asu-graduate-was-killed-in-los-angeles-hit-and-run/ar-AAMiwey?ocid=BingNews,"Mat George, Arizona podcaster and ASU grad, killed in Los Angeles hit-and-run, co-host says","Mat George, co-host of the podcast “She Rates Dogs,” was an Arizona State University graduate who moved to Los Angeles to pursue a podcasting career.",,[],2021-07-18 00:00:00,,https://www.azcentral.com/story/news/local/arizona-breaking/2021/07/18/mat-george-she-rates-dogs-killed-los-angeles-hit-and-run/8009596002/,"https://www.gannett-cdn.com/presto/2021/07/18/PPHX/167ee2dd-040a-4e66-92d9-6db9cdcbf68a-mat_george.png?crop=866,487,x0,y166&width=866&height=487&format=pjpg&auto=webp",false
https://www.msn.com/en-us/news/us/an-armed-anarchist-haven-alpaca-farm-prospers-as-a-one-of-a-kind-queer-community/ar-AAMhPAP?ocid=BingNews,"Joy, safety and alpacas: Queer community thrives on trans-owned ranch","In late June, about 50 volunteers visited the Tenacious Unicorn Ranch, a safe haven for LGBTQ people in southern Colorado, to help shear its alpacas.",,"['Jo Yurcaba', 'Jo Yurcaba Is An Associate Editor At Nbc Out.']",2021-07-19 12:30:11+00:00,Mon Jul 19 2021 12:30:11 GMT+0000 (UTC),https://www.nbcnews.com/nbc-out/out-community-voices/joy-safety-alpacas-queer-community-thrives-trans-owned-ranch-rcna1401,"https://media-cldnry.s-nbcnews.com/image/upload/t_nbcnews-fp-1200-630,f_auto,q_auto:best/rockcms/2021-07/210716-unicorn-ranch-al-1137-c5977b.jpg",false
https://www.msn.com/en-us/news/us/twitter-suspends-nj-lawmaker-for-questioning-vaccine-mandates-he-wants-an-apology/ar-AAMil8C?ocid=BingNews,Twitter suspends N.J. lawmaker for questioning vaccine mandates. He wants an apology.,,Politics,"['Blake Nelson', 'Bnelson Njadvancemedia.Com', 'Nj Advance Media For Nj.Com']",2021-07-18 20:01:51.082000+00:00,2021-07-19T13:24:06.771Z,https://www.nj.com/politics/2021/07/nj-lawmaker-wants-apology-after-twitter-suspended-his-account-for-questioning-vaccine-mandates.html,https://www.nj.com/resizer/Et3NGy72oCeazrGCE-G94MUg9Cw=/1280x0/smart/cloudfront-us-east-1.images.arcpublishing.com/advancelocal/MVH6URN72FCDDPAK4RZRNIIBPM.png,
https://www.msn.com/en-us/news/us/court-blocks-order-lifting-cdc-virus-rules-on-cruise-ships/ar-AAMi5hL?ocid=BingNews,Court blocks order lifting CDC virus rules on cruise ships,"ST. PETERSBURG, Fla. (AP) — Pandemic restrictions on Florida-based cruise ships will remain in place after a federal appeals court temporarily blocked a previous ruling that sided with a Florida lawsuit challenging the regulations.",Lifestyle,['Curt Anderson'],2021-07-18 15:13:48+00:00,2021-07-18T16:04:08Z,https://apnews.com/da4e172c10411ed56e1ff38e74d61895,https://storage.googleapis.com/afs-prod/media/f1da0a4454fe41b394411cd130746256/3000.jpeg,
