article_url,article_title,meta_description,section,authors,publish_date,modified_date,canonical_link,top_image,is_opinion
https://roanoke.com/news/local/education/virginia-tech-researchers-trying-to-teach-robot-dog-new-tricks-on-construction-sites/article_e32d2446-0046-11ec-a507-b3bd84f49965.html,Virginia Tech researchers trying to teach robot dog new tricks on construction sites,"The machine, named Spot, is part of a yearlong study.",,"['Amy Friedenberger Amy.Friedenberger Roanoke.Com', 'Amy Friedenberger', 'Matt Gentry Photos', 'The Roanoke Times', 'Matt Gentry']",,,https://roanoke.com/news/local/education/virginia-tech-researchers-trying-to-teach-robot-dog-new-tricks-on-construction-sites/article_e32d2446-0046-11ec-a507-b3bd84f49965.html,https://bloximages.newyork1.vip.townnews.com/roanoke.com/content/tncms/assets/v3/editorial/2/fa/2fa89cd0-fec4-11eb-a13f-b799fc16a174/611ab5bd2837c.image.jpg?crop=1740%2C979%2C0%2C106&resize=1120%2C630&order=crop%2Cresize,
https://www.msn.com/en-us/news/crime/man-faces-charges-for-trying-to-kill-woman-in-christiansburg/ar-AANvEes?ocid=BingNews,Man faces charges for trying to kill woman in Christiansburg,He was shot by a Montgomery County Sheriff’s deputy as the suspect allegedly cut a woman with a knife.,,[],2021-08-19 00:00:00,,https://www.wdbj7.com/2021/08/19/man-faces-charges-attempt-womans-life-christiansburg/,https://gray-wdbj-prod.cdn.arcpublishing.com/resizer/e2Yl04F_1xxX-ewzRUmQrxQTTW8=/980x0/smart/filters:quality(85)/cloudfront-us-east-1.images.arcpublishing.com/gray/W4VLFZAYANF53PLFUFYH3RQ2BU.jpg,
https://roanoke.com/opinion/columnists/younos-virtual-water-consumption-the-invisible-wasted-waters/article_5de16734-f173-11eb-8deb-e7a287da5bad.html,Younos: Virtual water consumption: The invisible wasted waters,"In the United States, June to August is the moving time as many people are transferring to new jobs and new locations.",,['Tamim Younos'],,,https://roanoke.com/opinion/columnists/younos-virtual-water-consumption-the-invisible-wasted-waters/article_5de16734-f173-11eb-8deb-e7a287da5bad.html,https://bloximages.newyork1.vip.townnews.com/roanoke.com/content/tncms/assets/v3/editorial/e/48/e484fb9a-7c27-5836-9f4d-44653bf01e0c/5f6a1ffc59508.image.jpg?crop=503%2C283%2C0%2C138&resize=503%2C283&order=crop%2Cresize,
https://www.wric.com/news/local-news/vdh-confirms-covid-19-death-of-child-between-10-and-19-in-chesterfield-health-district/,VDH confirms COVID-19 death of child between 10 and 19 in Chesterfield Health District,"A child between the age of 10 and 19 died in the Chesterfield Health District on July 27, according to data from the Virginia Department of Health.",,"['Keyris Manzanares', 'Tristi Rodriguez', 'Nexstar Media Wire', 'Nathan Crawford']",2021-08-19 19:31:22+00:00,2021-08-20T00:20:10+00:00,https://www.wric.com/news/local-news/vdh-confirms-covid-19-death-of-child-between-10-and-19-in-chesterfield-health-district/,https://www.wric.com/wp-content/uploads/sites/74/2021/08/GettyImages-1327064894.jpg?w=1280,
https://www.msn.com/en-us/news/us/220-in-roanoke-reopens-after-hours-long-cleanup/ar-AANtjmm?ocid=BingNews,220 in Roanoke reopens after hours-long cleanup,A crash Wednesday afternoon between Colonial and Franklin involved a tractor trailer and at least one car.,,[],2021-08-18 00:00:00,,https://www.wdbj7.com/2021/08/18/crash-cleanup-closes-part-220-roanoke/,https://gray-wdbj-prod.cdn.arcpublishing.com/resizer/8YyO6QOOpmAzjjT17qa0EcGgYbk=/980x0/smart/filters:quality(85)/cloudfront-us-east-1.images.arcpublishing.com/gray/D7Q2J2M2JVCI7HN4ZPJYV6VNX4.jpg,
https://www.wsls.com/weather/2021/08/19/watch-for-scattered-storms-through-friday-summer-heat-this-weekend/,"Watch for scattered storms through Friday, summer heat this weekend",Moisture from Henri helps to give us a few more storms by Friday before a hot and mainly dry weekend,Weather,['Chris Michaels'],2021-08-19 00:00:00,2021-08-20T02:02:28.083Z,https://www.wsls.com/weather/2021/08/19/watch-for-scattered-storms-through-friday-summer-heat-this-weekend/,https://www.wsls.com/resizer/XpgKcoFubOuUWzLqVKteWjb6qgc=/800x450/smart/filters:format(jpeg):strip_exif(true):strip_icc(true):no_upscale(true):quality(65)/cloudfront-us-east-1.images.arcpublishing.com/gmg/HVHGEH27CNC5NB5E7OV2CFWWPI.png,false
https://www.wtvr.com/news/local-news/chesterfield-teen-raises-money-for-safe-rooms,Chesterfield teen raises money for 'safe rooms' that protect abused kids,A 13-year-old activist from Chesterfield is working to help other kids dealing with tough situations at home.,Local News,['Wtvr Cbs Web Staff'],2021-08-19 17:10:36.577000,2021-08-20T16:27:41.762,https://www.wtvr.com/news/local-news/chesterfield-teen-raises-money-for-safe-rooms,https://ewscripps.brightspotcdn.com/dims4/default/b2c290c/2147483647/strip/true/crop/901x473+0+19/resize/1200x630!/quality/90/?url=http%3A%2F%2Fewscripps-brightspot.s3.amazonaws.com%2F9b%2F94%2Fb714011b44cb8fabaa64e39ced10%2Felijah-lee.png,
https://www.msn.com/en-us/foodanddrink/foodnews/mornin-e2-80-99-hunters-for-the-hungry-celebrates-30-years-of-providing-fresh-venison-to-those-in-need/ar-AANvbZn?ocid=BingNews,Mornin’: Hunters for the Hungry celebrates 30 years of providing fresh venison to those in need,"Lynchburg Hillcats is hosting the non-profit at Thursday night’s game. Come dressed in ""Camo for a Cause!""",,[],2021-08-19 00:00:00,,https://www.wdbj7.com/2021/08/19/mornin-hunters-hungry-celebrates-30-years-providing-fresh-venison-those-need/,https://gray-wdbj-prod.cdn.arcpublishing.com/resizer/limLFgEcmbaRnIW3UvGq7p1nV3g=/980x0/smart/filters:quality(85)/cloudfront-us-east-1.images.arcpublishing.com/gray/IFVYF4RYNJFPZLVMDGCA6ETNFE.png,
https://www.msn.com/en-us/news/world/no-charge-for-stabbing-suspect-over-babys-death/ar-AANv93K?ocid=BingNews,Belgium stabbing suspect won’t be charged over unborn baby’s death,"A man in Belgium is charged with allegedly stabbing his partner, but not her unborn baby's death.",Europe,[],,,https://www.bbc.com/news/world-europe-58268825,https://ichef.bbci.co.uk/news/1024/branded_news/4260/production/_120029961_gettyimages-78514429-594x594.jpg,
https://www.msn.com/en-us/news/world/videos-show-american-soldiers-help-woman-child-over-wall-at-kabul-airport/ar-AANvc2q?ocid=BingNews,"Videos show American soldiers help woman, child over wall at Kabul airport",Videos shared on social media shows a crowd at the Kabul Airport look on Tuesday while a woman and child is helped over a wall by American soldiers.,,['Elisha Fieldstadt Is A Breaking News Reporter For Nbc News.'],2021-08-19 14:36:00+00:00,Thu Aug 19 2021 15:56:02 GMT+0000 (UTC),https://www.nbcnews.com/news/world/videos-show-american-soldiers-help-woman-child-over-wall-kabul-n1277142,"https://media-cldnry.s-nbcnews.com/image/upload/t_nbcnews-fp-1200-630,f_auto,q_auto:best/newscms/2021_33/3500136/210819-afghanistan-al-0800.jpg",false
https://www.msn.com/en-us/news/world/un-says-humanitarian-conditions-hellish-in-ethiopias-war/ar-AANvGHy?ocid=BingNews,UN says humanitarian conditions ‘hellish’ in Ethiopia’s war,"NAIROBI, Kenya (AP) — The United Nations secretary-general said Thursday that humanitarian conditions in Ethiopia are “hellish” as the nine-month Tigray conflict  spreads in Africa’s second most populous country.",Kenya,['Cara Anna'],2021-08-19 18:11:44+00:00,2021-08-19T19:07:14Z,https://apnews.com/0015fb0dcdf13768b7c63b7c227878ad,https://storage.googleapis.com/afs-prod/media/dc426c0537e744f697beb7d43f830886/3000.jpeg,
https://www.msn.com/en-us/news/world/gangs-abduct-2-doctors-in-haiti-including-a-needed-surgeon/ar-AANvuug?ocid=BingNews,"Gangs abduct 2 doctors in Haiti, including a needed surgeon","LES CAYES, Haiti (AP) — Two doctors at hospitals treating earthquake victims in Haiti’s capital have been kidnapped, forcing one of the institutions to declare a two-day shutdown in protest, officials said Thursday.",Caribbean,"['Mark Stevenson', 'Evens Sanon']",2021-08-19 16:47:40+00:00,2021-08-19T22:37:08Z,https://apnews.com/7e3768c0facf523ec085ab592fd1c47c,https://storage.googleapis.com/afs-prod/media/5493edab5d584011ad936d18a34824f7/3000.jpeg,
https://www.msn.com/en-us/news/us/latest-news-from-afghanistan-7000-evacuated-from-kabul-biden-holds-firm-on-withdrawal/ar-AANuYWH?ocid=BingNews,"Latest news from Afghanistan: 7,000 evacuated from Kabul, with thousands more waiting at airport",Biden says the US cannot protect women through military occupation. GOP leaders ask for classified update. Here's the latest on Afghanistan.,,[],2021-08-19 00:00:00,,https://www.usatoday.com/story/news/politics/2021/08/19/afghanistan-updates-taliban-control-us-evacuations/8191494002/,"https://www.gannett-cdn.com/presto/2021/08/19/USAT/d8567113-4d9f-480e-aab4-e6952b57cc53-AFP_AFP_9LC7QX.jpg?crop=5699,3206,x0,y289&width=3200&height=1801&format=pjpg&auto=webp",false
https://www.msn.com/en-us/money/other/ftc-renews-attack-on-facebooks-alleged-monopoly-power/ar-AANvvjB?ocid=BingNews,"FTC doubles down, hits Facebook with amended antitrust complaint",The amended complaint on Thursday comes after a previous one was dismissed.,,"['Abc News', 'Catherine Thorbecke', 'August']",,,https://abcnews.go.com/Technology/ftc-doubles-hits-facebook-amended-antitrust-complaint/story?id=79541588,https://s.abcnews.com/images/International/facebook-logo-gty-rc-210819_1629389129923_hpMain_16x9_992.jpg,false
https://www.msn.com/en-us/news/world/analysis-bidens-presidency-is-under-scrutiny-as-never-before-over-afghan-chaos/ar-AANtM8o?ocid=BingNews,Analysis: Biden's presidency is under scrutiny as never before over Afghan chaos,"President Joe Biden is struggling against an intensifying examination of his judgment, competence and even his empathy over the chaotic US exit from Afghanistan. And each attempt the administration makes to quell a furor that's tarnishing America's image only provokes more questions about its failures of planning and execution.",politics,['Analysis Stephen Collinson'],2021-08-19 00:00:00,2021-08-19T18:57:26Z,https://www.cnn.com/2021/08/19/politics/joe-biden-presidency-under-scrutiny/index.html,https://cdn.cnn.com/cnnnext/dam/assets/210818181116-02-biden-remarks-081821-super-tease.jpg,false
https://www.msn.com/en-us/news/world/afghan-footballer-falls-to-death-from-us-plane/ar-AANvxh5?ocid=BingNews,Zaki Anwari: Afghan footballer falls to death from US plane in Kabul,"Zaki Anwari, 19, had played for Afghanistan's national youth team before trying to flee the country.",Asia,[],,,https://www.bbc.com/news/world-asia-58272740,https://ichef.bbci.co.uk/news/1024/branded_news/9ED2/production/_120085604_mediaitem120032900.jpg,
https://www.msn.com/en-us/news/world/allies-embraced-biden-did-kabul-lay-bare-great-illusion/ar-AANvxHJ?ocid=BingNews,Allies embraced Biden. Did Kabul lay bare “great illusion”?,"BRUSSELS (AP) — Well before U.S. President Joe Biden took office early this year, the European Union's foreign policy chief sang his praises and hailed a new era in cooperation. So did almost all of Washington's Western allies.",Joe Biden,['Raf Casert'],2021-08-19 18:27:48+00:00,2021-08-19T18:27:35Z,https://apnews.com/84ee5e455a70def86647bbfd22bdfbd7,https://storage.googleapis.com/afs-prod/media/c5ecc6010dfa42fab5ce76857ff5f609/3000.jpeg,
https://www.msn.com/en-us/news/technology/starlink-s-megaconstellation-of-12-000-satellites-could-account-for-90-of-near-misses-in-orbit-scientist-predicts/ar-AANvrw6?ocid=BingNews,"Starlink's 'megaconstellation' of 12,000 satellites could account for 90% of near misses in orbit, scientist predicts","Once the megaconstellation reaches its intended size, it will account for nearly all close encounters, research published by Space.com suggests.",,['Kumutha Ramanathan'],2021-08-19 00:00:00,2021-08-19T16:16:21Z,https://www.businessinsider.com/starlink-will-ultimately-account-for-90-of-orbital-near-misses-2021-8,https://i.insider.com/611e7ed73480870019681f44?width=1200&format=jpeg,false
https://www.msn.com/en-us/news/us/city-of-st-augustine-opens-free-solar-powered-covid-19-testing-site-on-thursday/ar-AANvBL4?ocid=BingNews,City of St. Augustine opens free solar-powered COVID-19 testing site on Thursday,,,[],,,https://www.actionnewsjax.com/news/local/city-st-augustine-opens-free-solar-powered-covid-19-testing-site-thursday/BZ44GGKBXNF3HDMODFJAHK2BHA/,https://d1hfln2sfez66z.cloudfront.net/08-19-2021/t_a47a3cf86b594408a5613d6a36f29a25_name_file_960x540_1200_v3_1_.jpg,
https://www.msn.com/en-us/weather/topstories/a-1980s-ban-on-cfcs-to-heal-the-ozone-layer-is-also-shaving-degrees-off-global-warming-study-says/ar-AANv5jl?ocid=BingNews,"A 1980s ban on CFCs to heal the ozone layer is also shaving degrees off global warming, study says","The world would be on track for a collapse of the ozone layer and an additional 2.5 degrees Celsius of global warming by the end of the century if it hadn't agreed in the 1980s to ban CFCs, chemicals once commonly used in aerosol sprays, refrigeration and air conditioners, according to a new study.",world,['Angela Dewan'],2021-08-19 00:00:00,2021-08-19T13:52:09Z,https://www.cnn.com/2021/08/19/world/cfcs-ozone-montreal-protocol-climate-study-intl-scn/index.html,https://cdn.cnn.com/cnnnext/dam/assets/210819092306-ozone-map-0817-nasa-handout-super-tease.jpg,false
https://www.msn.com/en-us/weather/topstories/african-dust-to-create-haze-over-florida-and-suppress-hurricanes/ar-AANvT1s?ocid=BingNews,African dust to create haze over Florida and suppress hurricanes,A plume of African dust is sweeping across the Atlantic and is expected to suppress the formation of tropical storms and hurricanes.,"Weather Forecast, News",['David Fleshler'],2021-08-19 00:00:00,,https://www.sun-sentinel.com/news/weather/fl-ne-african-dust-florida-20210819-hxkhscnatvgyzokitq2ll5inke-story.html,https://www.sun-sentinel.com/resizer/s-zfQF_669qFcXMS2tdTvKcQOgw=/1200x0/top/cloudfront-us-east-1.images.arcpublishing.com/tronc/AIZI2N3PCVAHNGPLV2MOB3JUDI.PNG,false
https://www.msn.com/en-us/weather/topstories/siberia-s-massive-wildfires-are-unlocking-extreme-carbon-pollution/ar-AANvvjl?ocid=BingNews,Siberia’s massive wildfires are unlocking extreme carbon pollution,The fires have released roughly as much carbon as Germany does in a year and sent plumes of smoke spilling over the North Pole.,Environment,"['Madeleine Stone', 'Emile Ducke', 'Photographs By', 'Published August']",,08-19-2021,https://www.nationalgeographic.com/environment/article/siberias-massive-wildfires-are-unlocking-extreme-carbon-pollution,https://i.natgeofe.com/n/91611e1e-7280-4617-81c8-b1bf539f7b0f/001_MM9750_210807_00306T_16x9.jpg?w=1200,
https://www.msn.com/en-us/weather/topstories/large-dust-plume-from-the-sahara-desert-could-briefly-slow-hurricane-activity/ar-AANvJSa?ocid=BingNews,Large dust plume from the Sahara Desert could briefly slow hurricane activity,The dust also will make for spectacular sunsets by the time it reaches Tampa Bay next week.,,"['Josh Fiallo', 'Breaking Reporter']",2021-08-19 00:00:00,,https://www.tampabay.com/hurricane/2021/08/19/large-dust-plume-from-the-sahara-desert-could-briefly-slow-hurricane-activity/,https://www.tampabay.com/resizer/9J_Hkb1wimh8MZjzJLB4Lf87E5s=/800x450/smart/cloudfront-us-east-1.images.arcpublishing.com/tbt/2EIB225B2BHYRJPDMHXVPWPPIE.jpeg,
https://www.msn.com/en-us/news/technology/rattlesnakes-change-their-rattle-frequency-based-on-nearby-threats/ar-AANvdfc?ocid=BingNews,"Rattlesnakes change their rattle frequency based on nearby threats, a study finds","The venomous reptiles change their rattling to a higher frequency when humans approach, which tricks people into thinking the snakes are closer than they really are, according to a new study.",world,['Megan Marples'],2021-08-19 00:00:00,2021-08-19T15:04:57Z,https://www.cnn.com/2021/08/19/world/rattlesnake-rattling-frequency-study-scn/index.html,https://cdn.cnn.com/cnnnext/dam/assets/210818154058-western-diamondback-rattlesnake-stock-super-tease.jpg,false
https://www.msn.com/en-us/news/technology/physicists-give-weird-new-phase-of-matter-an-extra-dimension/ar-AANvG3x?ocid=BingNews,Physicists give weird new phase of matter an extra dimension,The supersolid's atoms can move without ever losing energy,,['Ben Turner'],2021-08-19 15:00:00+00:00,2021-08-19T15:00:00.111Z,https://www.livescience.com/first-2d-supersolid.html,https://cdn.mos.cms.futurecdn.net/FUkao8z4WsNp4U6ZKffDvZ-1200-80.jpeg,
https://www.msn.com/en-us/news/technology/after-a-few-hiccups-nasa-s-perseverance-begins-its-main-missions-on-mars/ar-AANvqf6?ocid=BingNews,"After a few hiccups, NASA’s Perseverance begins its main missions on Mars","After six months of preliminary tests, the Mars rover and its related instruments are ready to begin their main scientific quests.",,"['Leto Sapunar', 'Leto Is A Freelance Science Journalist. He Studied Physics At Oregon State University', 'Then Got A Master S At Nyu S Science Health', 'Environmental Reporting Program', 'Sherp . You Can Also Find His Bylines At Scientific American', 'Inside Climate News', 'Retraction Watch Among Other Outlets. When He S Not Working', 'He S Writing Science Fiction Or Climbing Something']",2021-08-19 17:53:55+00:00,2021-08-19T19:19:22+00:00,https://www.popsci.com/space/nasa-perseverance-begins-mission-to-mars/,https://www.popsci.com/uploads/2021/08/19/Mars-Jezero-Mastcam-Z-crop.jpg,
https://www.msn.com/en-us/news/politics/fracking-linked-to-surface-water-quality-for-first-time-in-new-study/ar-AANvF24?ocid=BingNews,Fracking linked to surface water quality for first time in new study,"The effects of fracking on nearby water sources may be worse than previously thought, according to a new study that found hydraulic fracturing can alter the composition of surface water and not just groundwater.",,[],2021-08-19 14:30:58-04:00,2021-08-19T14:54:22-04:00,https://thehill.com/policy/equilibrium-sustainability/568610-fracking-linked-to-surface-water-quality-for-first-time-in,https://thehill.com/sites/default/files/fracking10012020.jpg,
https://www.msn.com/en-us/weather/topstories/rain-falls-at-the-summit-of-greenland-ice-sheet-for-first-time-on-record/ar-AANvDRF?ocid=BingNews,Rain falls at the summit of Greenland Ice Sheet for first time on record,"Greenland experienced a major melting event again this year, and this time it rained.",Capital Weather Gang,[],2021-08-19 00:00:00,2021-08-19T20:31:36.020Z,https://www.washingtonpost.com/weather/2021/08/19/greenland-melt-august-summit-rain/,https://www.washingtonpost.com/wp-apps/imrs.php?src=https://arc-anglerfish-washpost-prod-washpost.s3.amazonaws.com/public/2QB5GXTDDBGORH7JHQOSC5NGOI.jpg&w=1440,false
https://www.msn.com/en-us/news/us/unc-tradition-comes-under-fire-amid-covid-19-surge/ar-AANv0cV?ocid=BingNews,UNC tradition comes under fire amid COVID-19 surge,"CHAPEL HILL, N.C. (AP) — A tradition at a North Carolina university has come under scrutiny after pictures the school posted on social media showed hundreds of students gathered at a campus landmark waiting to get a drink of water in the midst of a COVID-19 surge.",University of North Carolina,[],2021-08-19 13:53:50+00:00,2021-08-19T13:53:42Z,https://apnews.com/69e9e1a9a85b3353d6577a56d6923597,https://apnews.com/images/ShareLogo2.png,
https://www.msn.com/en-us/money/companies/facebook-hit-by-new-u-s-antitrust-case-as-ftc-seeks-do-over/ar-AANvfsh?ocid=BingNews,Are you a robot?,,,[],2021-08-19 00:00:00,,,,
https://www.msn.com/en-us/money/other/facebook-s-new-zoom-competitor-adds-virtual-reality-to-conference-calls-here-s-what-it-s-like/ar-AANvla5?ocid=BingNews,"Facebook Announces Workrooms, a Collaborative VR Space","Facebook announced Horizon Workrooms, a “mixed reality” meeting tool that the tech giant is calling its “flagship collaboration experience.”",,['Peter Allen Clark'],,,https://time.com/6091395/facebook-workrooms-vr-metaverse/,https://api.time.com/wp-content/uploads/2021/08/Horizon-Workrooms-Key-Art.png?w=1200&h=628&crop=1,false
https://www.msn.com/en-us/travel/news/as-cruise-ship-passengers-and-crew-contract-covid-19-cruise-lines-upgrade-their-protocols/ar-AANvpwd?ocid=BingNews,"As cruise ship passengers and crew contract COVID-19, cruise lines upgrade their protocols","Additionally, Port Canaveral, Florida is being cautious in it outlook for the coming year, despite the resumption of cruises there at a steady pace.",,[],2021-08-19 00:00:00,,https://www.floridatoday.com/story/money/business/2021/08/19/cruise-lines-upgrade-their-covid-19-protocols-cases-reported-ships/8185670002/,"https://www.gannett-cdn.com/presto/2021/08/01/PBRE/abf5317d-ef65-4f55-b6c0-9935b02d903d-crb073121_mardi_8_.jpg?crop=2541,1430,x0,y0&width=2541&height=1430&format=pjpg&auto=webp",false
https://www.msn.com/en-us/money/other/t-mobile-breach-exposed-personal-data-of-almost-50-million-people/ar-AANvHIk?ocid=BingNews,T-Mobile breach exposed personal data of almost 50 million people,"Attackers captured the names, dates of birth, Social Security numbers and driver's license numbers of millions of current, former and potential T-Mobile customers.",,"['Lance Whitney', 'On August', 'Am Pst']",,,https://www.techrepublic.com/article/t-mobile-breach-exposed-personal-data-of-almost-50-million-people/,https://www.techrepublic.com/a/hub/i/r/2020/06/29/e6de3656-9dfa-48f3-b9d3-e0657abef7dd/thumbnail/770x578/e83e551c932611db5b5b8c8f4f3c044e/incident-response-cover-copy.jpg,
https://www.msn.com/en-us/news/technology/intel-architect-koduri-says-every-chip-will-be-a-neural-net-processor/ar-AANvf5q?ocid=BingNews,Intel architect Koduri says every chip will be a neural net processor,"Intel argues the acceleration of matrix multiplications is now an essential measure of the performance and efficiency of chips, with a raft of capabilities for forthcoming processors Alder Lake, Sapphire Rapids and Ponte Vecchio.",,['Tiernan Ray'],,,https://www.zdnet.com/article/intel-architect-koduri-says-every-chip-will-be-a-neural-net-processor/,https://www.zdnet.com/a/hub/i/r/2021/08/19/ee4e435a-543b-4e27-b55e-2382cc670b34/thumbnail/770x578/3097c1f5ba032c104474e5e733ef2820/intel-raja-koduri-2021.png,
https://www.msn.com/en-us/money/other/twitters-latest-round-of-updates-are-about-to-hit-your-dms/ar-AANvA8L?ocid=BingNews,Twitter's latest round of updates are about to hit your DMs,Twitter is introducing several improvements to direct messages the company says it plans to roll out in the coming weeks..,,[],,,https://www.engadget.com/twitter-direct-message-updates-195652044.html,https://s.yimg.com/os/creatr-uploaded-images/2021-08/0ca17b90-0125-11ec-bdff-1acf9a5fda63,
https://www.msn.com/en-us/news/technology/facebook-brings-metaverse-to-work-with-horizon-workrooms-and-you-thought-zoom-fatigue-was-bad/ar-AANvsb1?ocid=BingNews,Facebook brings metaverse to work with Horizon Workrooms (and you thought Zoom fatigue was bad),"According to Facebook, Horizon Workrooms is ""one of the best ways to work if you can't be physically together.""",,['Larry Dignan'],,,https://www.zdnet.com/article/facebook-brings-metaverse-to-work-with-horizon-workrooms-and-you-thought-zoom-fatigue-was-bad/,https://www.zdnet.com/a/hub/i/r/2021/08/19/31532e44-9f00-4bec-bdc7-a4c8577bd196/thumbnail/770x578/9491d80273c64dbb73886bfa8a5d81c1/horizon-workrooms-still-6.jpg,
https://www.msn.com/en-us/money/other/microsoft-announces-price-increase-for-office-365-and-microsoft-365/ar-AANvFBX?ocid=BingNews,Microsoft announces price increase for Office 365 and Microsoft 365,"Microsoft is bumping prices for its Office 365 and Microsoft 365 services next year. The prices go up for businesses in March 2022, the first time in a decade.",,"['Tom Warren', 'Aug']",2021-08-19 00:00:00,2021-08-19T15:28:37-04:00,https://www.theverge.com/2021/8/19/22632888/microsoft-office-365-price-increase-march-2022,https://cdn.vox-cdn.com/thumbor/_1IPXhdaNmamW8YvuhgVIcjD6vg=/0x146:2040x1214/fit-in/1200x630/cdn.vox-cdn.com/uploads/chorus_asset/file/10793347/acastro_180507_1777_microsoft_0003.jpg,
https://www.msn.com/en-us/money/news/auto-production-was-supposed-to-be-getting-better-then-came-the-covid-surge/ar-AANvBtu?ocid=BingNews,Get used to high car prices: Auto production isn't returning to normal,"This quarter was supposed to be when computer chip supply and auto production were returning to normal. Instead, the surge in Covid cases, especially in Southeast Asia, is causing a new round of parts shortages and auto plant shutdowns around the globe. That could keep already astronomical car prices high.",business,"['Chris Isidore', 'Cnn Business']",2021-08-19 00:00:00,2021-08-19T16:47:12Z,https://www.cnn.com/2021/08/19/business/auto-production-covid-surge/index.html,https://cdn.cnn.com/cnnnext/dam/assets/210819114035-toyota-japan-motomachi-plant-file-restricted-super-tease.jpg,false
https://www.msn.com/en-us/news/technology/the-new-moto-edge-is-trying-to-walk-a-fine-line-between-mid-range-and-premium/ar-AANvQCt?ocid=BingNews,The New Moto Edge Is Trying to Walk a Fine Line Between Mid-Range and Premium,"The new Moto Edge will start at $700, but will come with a $200 limited time discount at launch.",,[],,,https://gizmodo.com/the-new-moto-edge-is-trying-to-walk-a-fine-line-between-1847519067,"https://i.kinja-img.com/gawker-media/image/upload/c_fill,f_auto,fl_progressive,g_center,h_675,pg_1,q_80,w_1200/b95b5595ddb8dd2ec7eab9091a6fb0ec.jpg",
https://www.msn.com/en-us/news/technology/waymos-autonomous-vehicles-have-clocked-20-million-miles-on-public-roads/ar-AANvOfx?ocid=BingNews,Waymo's autonomous vehicles have clocked 20 million miles on public roads,The company provided an update on its self-driving program..,,[],,,https://www.engadget.com/waymo-autonomous-vehicles-update-san-francisco-193934150.html,https://s.yimg.com/os/creatr-uploaded-images/2021-08/2229add0-0124-11ec-bfdd-21d53ef207c7,
