article_headline,article_url,article_topic,source_name,source_url,article_datetime,article_position,article_isopinion,article_isad
"From ""Twilight"" to ""Never Have I Ever,"" here's what makes the greatest love triangles so potent",https://www.msn.com/en-us/entertainment/news/from-twilight-to-never-have-i-ever-heres-what-makes-the-greatest-love-triangles-so-potent/ar-AAMw4Er?ocid=BingNews,Entertainment,Salon,Unavailable,10h,7.0,False,False
Jennifer Lopez and Ben Affleck: Looks like they have made it Instagram official,https://www.msn.com/en-us/entertainment/entertainment-celebrity/jennifer-lopez-and-ben-affleck-looks-like-they-have-made-it-instagram-official/ar-AAMwrwg?ocid=BingNews,Entertainment,CNN,Unavailable,2h,8.0,False,False
Camila Cabello Responds to Backlash Over Dancer in ‘Don’t Go Yet’ Performance,https://www.msn.com/en-us/music/news/camila-cabello-responds-to-backlash-over-dancer-in-don-t-go-yet-performance/ar-AAMwpvQ?ocid=BingNews,Entertainment,Billboard,Unavailable,1h,9.0,False,False
‘Lucifer’ Sets Season 6 Return To Netflix At Comic-Con@Home,https://www.msn.com/en-us/entertainment/news/lucifer-sets-season-6-return-to-netflix-at-comic-con-home/ar-AAMwpDp?ocid=BingNews,Entertainment,Deadline,Unavailable,1h,10.0,False,False
"Prosecutors Air More Claims in R. Kelly Case, One Involving an Underage Boy",https://www.msn.com/en-us/music/news/prosecutors-air-more-claims-in-r-kelly-case-one-involving-an-underage-boy/ar-AAMwAkc?ocid=BingNews,Entertainment,Billboard,Unavailable,5h,11.0,False,False
‘Walking Dead’ Unveils Final Season Trailer: “This Is A Path You Don’t Want To Go Down” – Comic-Con,https://www.msn.com/en-us/tv/news/e2-80-98walking-dead-e2-80-99-unveils-final-season-trailer-e2-80-9cthis-is-a-path-you-don-e2-80-99t-want-to-go-down-e2-80-9d-e2-80-93-comic-con/ar-AAMwpfj?ocid=BingNews,Entertainment,Deadline,Unavailable,2h,12.0,False,False
"New Capitol Police chief: Officers testifying ""need to be heard""",https://www.msn.com/en-us/news/us/new-capitol-police-chief-officers-testifying-need-to-be-heard/ar-AAMwtYz?ocid=BingNews,Politics,CBS News,Unavailable,3h,1.0,False,False
Trump encourages potential Texas election audit,https://www.msn.com/en-us/news/politics/trump-encourages-potential-texas-election-audit/ar-AAMwrMn?ocid=BingNews,Politics,Washington Examiner,Unavailable,2h,2.0,False,False
Rand Paul sends criminal referral to DOJ saying Fauci lied about gain-of-function research funding,https://www.msn.com/en-us/news/us/rand-paul-sends-criminal-referral-to-doj-saying-fauci-lied-about-gain-of-function-research-funding/ar-AAMwAhz?ocid=BingNews,Politics,Washington Examiner,Unavailable,2h,3.0,False,False
"U.S. will not investigate nursing home deaths in New York, two other states -letter",https://www.msn.com/en-us/news/us/us-will-not-investigate-nursing-home-deaths-in-new-york-two-other-states-letter/ar-AAMwheJ?ocid=BingNews,Politics,Reuters,Unavailable,7h,4.0,False,False
"Biden job approval rating drops to 50% in Gallup poll, his lowest to date, though he remains in positive territory",https://www.msn.com/en-us/news/politics/biden-job-approval-rating-drops-to-50-25-in-gallup-poll-his-lowest-to-date-though-he-remains-in-positive-territory/ar-AAMwfoB?ocid=BingNews,Politics,Business Insider,Unavailable,5h,5.0,False,False
Stoking fears of immigrants has been part of the Republican platform for decades. But something is different this time,https://www.msn.com/en-us/news/politics/stoking-fears-of-immigrants-has-been-part-of-the-republican-platform-for-decades-but-something-is-different-this-time/ar-AAMwhFd?ocid=BingNews,Politics,The Boston Globe,Unavailable,5h,6.0,False,False
"Biden Slams Trump for Calling Capitol Rioters 'Wonderful,' Makes Forceful Return to Campaign Trail",https://www.msn.com/en-us/news/politics/biden-slams-trump-for-calling-capitol-rioters-wonderful-makes-forceful-return-to-campaign-trail/ar-AAMwBiw?ocid=BingNews,Politics,Newsweek,Unavailable,3h,7.0,False,False
Cawthorn stands by call for criminal charges against Fauci: He 'broke his oath',https://www.msn.com/en-us/news/politics/cawthorn-stands-by-call-for-criminal-charges-against-fauci-he-broke-his-oath/ar-AAMwsGr?ocid=BingNews,Politics,FOX News,Unavailable,6h,8.0,False,False
Scalise blasts 'unconscionable' DOJ move to drop Cuomo nursing home investigation,https://www.msn.com/en-us/news/us/scalise-blasts-unconscionable-doj-move-to-drop-cuomo-nursing-home-investigation/ar-AAMwmue?ocid=BingNews,Politics,FOX News,Unavailable,3h,9.0,False,False
Josh Hawley proposes anti-critical race theory 'Love America Act',https://www.msn.com/en-us/news/politics/josh-hawley-proposes-anti-critical-race-theory-love-america-act/ar-AAMwmw8?ocid=BingNews,Politics,Washington Examiner,Unavailable,3h,10.0,False,False
"Trump rally updates: ‘Stolen election,’ ‘vaccine hoax’; MAGA: Trump merch overruns downtown Phoenix",https://www.msn.com/en-us/news/politics/trump-rally-updates-trump-supporters-want-a-2024-presidential-bid/ar-AAMwdDd?ocid=BingNews,Politics,Arizona Republic,Unavailable,3h,11.0,False,False
Army combat veteran who owns steel company asks Biden to bring back 'Made in America' showcase,https://www.msn.com/en-us/news/us/army-combat-veteran-who-owns-steel-company-asks-biden-to-bring-back-made-in-america-showcase/ar-AAMwpIR?ocid=BingNews,Politics,FOX News,Unavailable,49m,12.0,False,False
'We can expect fireworks': 6 experts sound off on their expectations for Robinhood's hugely anticipated IPO,https://www.msn.com/en-us/money/savingandinvesting/we-can-expect-fireworks-6-experts-sound-off-on-their-expectations-for-robinhoods-hugely-anticipated-ipo/ar-AAMw0Mq?ocid=BingNews,Business,Business Insider,Unavailable,11h,1.0,False,False
USPS will move forward with higher prices despite lawmaker concerns: letter,https://www.msn.com/en-us/money/news/usps-will-move-forward-with-higher-prices-despite-lawmaker-concerns-letter/ar-AAMwlbm?ocid=BingNews,Business,Fox Business,Unavailable,7h,2.0,False,False
"Fed to meet as inflation, virus variants complicate US recovery",https://www.msn.com/en-us/money/markets/fed-to-meet-as-inflation-virus-variants-complicate-us-recovery/ar-AAMwCcg?ocid=BingNews,Business,AFP,Unavailable,22m,3.0,False,False
What happens to federal unemployment benefits after the summer? Here's what we know,https://www.msn.com/en-us/news/technology/what-happens-to-federal-unemployment-benefits-after-the-summer-here-s-what-we-know/ar-BB1cLFPk?ocid=BingNews,Business,CNET,Unavailable,1h,4.0,False,False
"How paying colonizers for freedom stunted economic growth in Haiti, other nations",https://www.msn.com/en-us/news/world/how-paying-colonizers-for-freedom-stunted-economic-growth-in-haiti-other-nations/ar-AAMwcuy?ocid=BingNews,Business,ABC News,Unavailable,43m,5.0,False,False
Frito-Lay Workers Celebrate Successful Strike: 'We Definitely Have Leverage Right Now',https://www.msn.com/en-us/news/world/frito-lay-workers-celebrate-successful-strike-we-definitely-have-leverage-right-now/ar-AAMwDjq?ocid=BingNews,Business,Newsweek,Unavailable,2h,6.0,False,False
700 workers to lose jobs in sale of People's United Bank,https://www.msn.com/en-us/money/companies/700-workers-to-lose-jobs-in-sale-of-peoples-united-bank/ar-AAMwyEH?ocid=BingNews,Business,Associated Press,Unavailable,2h,7.0,False,False
Robinhood CEO says he is considering offering U.S. retirement accounts,https://www.msn.com/en-us/money/savingandinvesting/robinhood-ceo-says-he-is-considering-offering-us-retirement-accounts/ar-AAMwmyB?ocid=BingNews,Business,Reuters,Unavailable,2h,8.0,False,False
Some families could be getting a little extra money in their pockets this year.,https://www.msn.com/en-us/money/taxes/some-families-could-be-getting-a-little-extra-money-in-their-pockets-this-year/ar-AAMwDbi?ocid=BingNews,Business,WHBQ Memphis,Unavailable,1h,9.0,False,False
"Tokyo Olympics TV schedule: Day 2 features debut of Team USA men's hoops, women's gymnastics",https://www.msn.com/en-us/sports/olympics/tokyo-olympics-tv-schedule-day-2-features-debut-of-team-usa-mens-hoops-womens-gymnastics/ar-AAMwFNr?ocid=BingNews,Business,Yahoo! Sports,Unavailable,53m,10.0,False,False
N.Y. Infections Rise; French Protest as Cases Jump: Virus Update,https://www.msn.com/en-us/money/other/n-y-infections-rise-french-protest-as-cases-jump-virus-update/ar-AAMuMt5?ocid=BingNews,Business,Bloomberg,Unavailable,3h,11.0,False,False
Out-of-network ATM fees suspended for Nevada unemployment debit cards,https://www.msn.com/en-us/money/personalfinance/out-of-network-atm-fees-suspended-for-nevada-unemployment-debit-cards/ar-AAMwwyG?ocid=BingNews,Business,KSNV – Las Vegas,Unavailable,17m,12.0,False,False
