article_headline,article_url,article_topic,source_name,source_url,article_datetime,article_position,article_isopinion,article_isad
Infrastructure bill stalls after Democratic leaders fail to wrangle support,https://www.msn.com/en-us/news/politics/infrastructure-bill-stalls-after-democratic-leaders-fail-to-wrangle-support/ar-AAP2BEt?ocid=BingNews,Politics,NBC News,Unavailable,9m,2.0,False,False
U.S. Rep. Bob Gibbs tested positive for coronavirus. He’s the third Ohio Congress member diagnosed with the virus in two weeks,https://www.msn.com/en-us/news/politics/us-rep-bob-gibbs-tested-positive-for-coronavirus-he-s-the-third-ohio-congress-member-diagnosed-with-the-virus-in-two-weeks/ar-AAP2WBg?ocid=BingNews,Politics,The Plain Dealer Cleveland,Unavailable,5h,3.0,False,False
Biden Approval Rating Drops Among Democrats as Infrastructure Stalemate Persists: Poll,https://www.msn.com/en-us/news/politics/biden-approval-rating-drops-among-democrats-as-infrastructure-stalemate-persists-poll/ar-AAP37LW?ocid=BingNews,Politics,Newsweek,Unavailable,2h,4.0,False,False
Gov. Kay Ivey calls Alabama prison-building plan ‘major step forward’,https://www.msn.com/en-us/news/crime/gov-kay-ivey-calls-alabama-prison-building-plan-major-step-forward/ar-AAP3tsk?ocid=BingNews,Politics,AL.com,Unavailable,15m,5.0,False,False
The emergence of ‘woke’ as a pejorative masks a deeper insecurity,https://www.msn.com/en-us/news/politics/the-emergence-of-woke-as-a-pejorative-masks-a-deeper-insecurity/ar-AAP3cGn?ocid=BingNews,Politics,The Washington Post,Unavailable,3h,6.0,False,False
Jayapal says progressives will reduce $3.5T spending demand,https://www.msn.com/en-us/news/politics/jayapal-says-progressives-will-reduce-35t-spending-demand/ar-AAP3clm?ocid=BingNews,Politics,FOX News,Unavailable,3h,7.0,False,False
Sotomayor Declines to Block NYC Teacher-Vaccination Requirement,https://www.msn.com/en-us/news/us/sotomayor-declines-to-block-nyc-teacher-vaccination-requirement/ar-AAP3lET?ocid=BingNews,Politics,National Review,Unavailable,2h,8.0,False,False
Kristi Noem Denies She Intervened to Get Daughter's Appraiser License Approved by State,https://www.msn.com/en-us/news/politics/kristi-noem-denies-she-intervened-to-get-daughter-s-appraiser-license-approved-by-state/ar-AAP3dr4?ocid=BingNews,Politics,Newsweek,Unavailable,2h,9.0,False,False
Surprising Data Shows Political Letter-Writing Still Gets Out the Vote,https://www.msn.com/en-us/news/politics/surprising-data-shows-political-letter-writing-still-gets-out-the-vote/ar-AAP36ww?ocid=BingNews,Politics,Time,Unavailable,5h,10.0,False,False
"Oakland County Rep. Andrea Schroeder, 57, dies after battling stomach cancer",https://www.msn.com/en-us/news/us/oakland-county-rep-andrea-schroeder-57-dies-after-battling-stomach-cancer/ar-AAP3bze?ocid=BingNews,Politics,Detroit Free Press,Unavailable,4h,11.0,False,False
Tennessee Republicans again seek special session to relax COVID-19 restrictions,https://www.msn.com/en-us/news/politics/tennessee-republicans-again-seek-special-session-to-relax-covid-19-restrictions/ar-AAP36mA?ocid=BingNews,Politics,The Tennessean (Nashville),Unavailable,5h,12.0,False,False
"Stock market news live updates: Stocks rebound after September slump, Dow posts best start to October since 2003",https://www.msn.com/en-us/money/markets/stock-market-news-live-updates-stocks-rebound-after-september-slump-dow-posts-best-start-to-october-since-2003/ar-AAP0ToQ?ocid=BingNews,Business,Yahoo! Finance,Unavailable,4h,1.0,False,False
"Dallas radio host charged with fraud by SEC for using oil and gas funds for club memberships, loans",https://www.msn.com/en-us/money/markets/dallas-radio-host-charged-with-fraud-by-sec-for-using-oil-and-gas-funds-for-club-memberships-loans/ar-AAP3gTH?ocid=BingNews,Business,Dallas Morning News,Unavailable,2h,2.0,False,False
Developer behind massive One Central proposal teams with Chicago Urban League on equity plan: ‘The private sector hasn’t done enough’,https://www.msn.com/en-us/news/us/developer-behind-massive-one-central-proposal-teams-with-chicago-urban-league-on-equity-plan-the-private-sector-hasn-t-done-enough/ar-AAP3oFG?ocid=BingNews,Business,Chicago Tribune,Unavailable,34m,3.0,False,False
"Oil could surge above $100 in the event of a cold winter - and spark inflation that drives the next macro crisis, BofA says",https://www.msn.com/en-us/finance/markets/oil-could-surge-above-24100-in-the-event-of-a-cold-winter-and-spark-inflation-that-drives-the-next-macro-crisis-bofa-says/ar-AAP2SVj?ocid=BingNews,Business,Business Insider,Unavailable,8h,4.0,False,False
Inflation Climbs at Fastest Pace in 30 Years as Supply Chain Snarls Linger,https://www.msn.com/en-us/money/markets/inflation-climbs-at-fastest-pace-in-30-years-as-supply-chain-snarls-linger/ar-AAP2vpm?ocid=BingNews,Business,The New York Times,Unavailable,1h,5.0,False,False
"New Vehicle Prices in U.S. Set Record, Approaching $43K as Inventory Drought Continues",https://www.msn.com/en-us/finance/companies/new-vehicle-prices-in-us-set-record-approaching-2443k-as-inventory-drought-continues/ar-AAP3gct?ocid=BingNews,Business,Newsweek,Unavailable,3h,6.0,False,False
"Low-wage workers are getting 'eye-popping' pay raises, Goldman Sachs says",https://www.msn.com/en-us/money/markets/low-wage-workers-are-getting-eye-popping-pay-raises-goldman-sachs-says/ar-AAP2AY5?ocid=BingNews,Business,CNN,Unavailable,10h,7.0,False,False
Pizza chain Lou Malnati’s reportedly sold to private investment firm,https://www.msn.com/en-us/money/companies/pizza-chain-lou-malnati-s-brings-on-new-investor-replacing-bdt-capital/ar-AAP2KVz?ocid=BingNews,Business,Chicago Tribune,Unavailable,8h,8.0,False,False
New study turns down the heat on D-FW home prices,https://www.msn.com/en-us/money/realestate/new-study-turns-down-the-heat-on-d-fw-home-prices/ar-AAP38qG?ocid=BingNews,Business,Dallas Morning News,Unavailable,5h,9.0,False,False
This is how to close the gender financing gap,https://www.msn.com/en-us/money/smallbusiness/this-is-how-to-close-the-gender-financing-gap/ar-AAP2HvQ?ocid=BingNews,Business,Fast Company,Unavailable,11h,10.0,False,False
"BofA outage shuts out thousands online, Friday",https://www.msn.com/en-us/news/us/bofa-outage-shuts-out-thousands-online-friday/ar-AAP3c9P?ocid=BingNews,Business,The Boston Globe,Unavailable,3h,11.0,False,False
Snowcone the Happy Unicorn is the latest victim of manufacturing chaos,https://www.msn.com/en-us/money/smallbusiness/snowcone-the-happy-unicorn-is-the-latest-victim-of-manufacturing-chaos/ar-AAP2Rnz?ocid=BingNews,Business,CNN,Unavailable,6h,12.0,False,False
