article_headline,article_url,article_topic,source_name,source_url,article_datetime,article_position,article_isopinion,article_isad
Man who took photo outside Pelosi's office on Jan. 6 pleads guilty to riot charge,https://www.msn.com/en-us/news/us/guilty-pleas-for-men-who-took-photos-at-pelosis-office-on-jan-6/ar-AAMu39p?ocid=BingNews,Politics,Reuters,Unavailable,1h,1.0,False,False
The bust of Nathan Bedford Forrest is out of the Tennessee Capitol. Here's how it happened,https://www.msn.com/en-us/news/us/the-bust-of-nathan-bedford-forrest-is-out-of-the-tennessee-capitol-heres-how-it-happened/ar-AAMu1kD?ocid=BingNews,Politics,The Tennessean (Nashville),Unavailable,1h,2.0,False,False
"In one quote, the core of the effort to undermine the 2020 election is revealed",https://www.msn.com/en-us/news/politics/in-one-quote-the-core-of-the-effort-to-undermine-the-2020-election-is-revealed/ar-AAMtGi9?ocid=BingNews,Politics,The Washington Post,Unavailable,4h,3.0,False,False
Exclusive-'QAnon Shaman' in plea negotiations after mental health diagnosis -lawyer,https://www.msn.com/en-us/news/crime/exclusive-qanon-shaman-in-plea-negotiations-after-mental-health-diagnosis-lawyer/ar-AAMtoT4?ocid=BingNews,Politics,Reuters,Unavailable,8h,4.0,False,False
Trump World is already weighing veeps for 2024. Hint: It ain’t Pence.,https://www.msn.com/en-us/news/politics/trump-world-is-already-weighing-veeps-for-2024-hint-it-ain-t-pence/ar-AAMtarw?ocid=BingNews,Politics,POLITICO,Unavailable,9h,5.0,False,False
"Man pleads guilty to kidnapping, killing young Amish woman",https://www.msn.com/en-us/news/crime/man-pleads-guilty-to-kidnapping-killing-young-amish-woman/ar-AAMukcB?ocid=BingNews,Politics,Associated Press,Unavailable,56m,6.0,False,False
"Christine Blasey Ford lawyers call Kavanaugh investigation a ""sham"" after new details emerge",https://www.msn.com/en-us/news/politics/christine-blasey-ford-lawyers-call-kavanaugh-investigation-a-sham-after-new-details-emerge/ar-AAMu3rg?ocid=BingNews,Politics,POLITICO,Unavailable,1h,7.0,False,False
Democrats Test Midterm Strategy in Virginia Governor’s Race,https://www.msn.com/en-us/news/politics/democrats-test-midterm-strategy-in-virginia-governor-s-race/ar-AAMu8de?ocid=BingNews,Politics,Bloomberg,Unavailable,2h,8.0,False,False
"Brett Kavanaugh investigation: FBI says it got more than 4,500 tips on Kavanaugh, providing 'relevant' ones to White House",https://www.msn.com/en-us/news/us/brett-kavanaugh-investigation-fbi-says-it-got-more-than-4500-tips-on-kavanaugh-providing-relevant-ones-to-white-house/ar-AAMsbWE?ocid=BingNews,Politics,CNN,Unavailable,4h,9.0,False,False
"Rep. Bill Seitz, resolute defender of House Bill 6, reacts to new FirstEnergy admissions of corruption",https://www.msn.com/en-us/news/politics/rep-bill-seitz-resolute-defender-of-house-bill-6-reacts-to-new-firstenergy-admissions-of-corruption/ar-AAMuhRm?ocid=BingNews,Politics,The Plain Dealer Cleveland,Unavailable,44m,10.0,False,False
"Give us the money we’re owed, N.J. congressmen say to NYC on federal transit funding grab",https://www.msn.com/en-us/news/us/give-us-the-money-we-re-owed-nj-congressmen-say-to-nyc-on-federal-transit-funding-grab/ar-AAMunvP?ocid=BingNews,Politics,NJ.com,Unavailable,26m,11.0,False,False
Trump advisor says there is 'zero' chance the former president will pick Pence as his running mate if he runs in 2024: report,https://www.msn.com/en-us/news/politics/trump-advisor-says-there-is-zero-chance-the-former-president-will-pick-pence-as-his-running-mate-if-he-runs-in-2024-report/ar-AAMuaau?ocid=BingNews,Politics,Business Insider,Unavailable,1h,12.0,False,False
Pfizer to Supply U.S. With Millions of Shots for Young Kids,https://www.msn.com/en-us/health/medical/pfizer-to-supply-u-s-with-millions-of-shots-for-young-kids/ar-AAMtBpt?ocid=BingNews,Business,Bloomberg,Unavailable,1h,1.0,False,False
How to Trade Boston Beer After Its Steep Earnings Plunge,https://www.msn.com/en-us/money/topstocks/how-to-trade-boston-beer-after-its-steep-earnings-plunge/ar-AAMukxx?ocid=BingNews,Business,TheStreet,Unavailable,34m,2.0,False,False
Lucid Motors stock to start trading Monday,https://www.msn.com/en-us/money/companies/lucid-motors-stock-to-start-trading-monday/ar-AAMu4aw?ocid=BingNews,Business,MarketWatch,Unavailable,42m,3.0,False,False
Tom Barrack's SPAC withdraws its IPO filing days after the billionaire was arrested and charged with illegal lobbying,https://www.msn.com/en-us/money/companies/tom-barracks-spac-withdraws-its-ipo-filing-days-after-the-billionaire-was-arrested-and-charged-with-illegal-lobbying/ar-AAMu0TT?ocid=BingNews,Business,Business Insider,Unavailable,2h,4.0,False,False
A Black entrepreneur wanted to find success in the Seaport. Instead she had to go to New York. Her business is taking off,https://www.msn.com/en-us/news/us/a-black-entrepreneur-wanted-to-find-success-in-the-seaport-instead-she-had-to-go-to-new-york-her-business-is-taking-off/ar-AAMueW1?ocid=BingNews,Business,The Boston Globe,Unavailable,1h,5.0,False,False
More than a third of Americans are considering quitting their jobs,https://www.msn.com/en-us/money/markets/more-than-a-third-of-americans-are-considering-quitting-their-jobs/ar-AAMttri?ocid=BingNews,Business,Yahoo! Finance,Unavailable,3h,6.0,False,False
"Stock market news live updates: Futures rally, zero in on records as markets try to extend win streak",https://www.msn.com/en-us/money/savingandinvesting/stock-market-news-live-updates-stocks-rally-zero-in-on-records-as-markets-try-to-extend-win-streak/ar-AAMseoe?ocid=BingNews,Business,Yahoo! Finance,Unavailable,4h,7.0,False,False
"A Dow finish above 35,000 would mark fifth 1,000-point milestone of 2021",https://www.msn.com/en-us/money/markets/a-dow-finish-above-35000-would-mark-fifth-1000-point-milestone-of-2021/ar-AAMu366?ocid=BingNews,Business,MarketWatch,Unavailable,1h,8.0,False,False
UPDATE 1-Schlumberger profit rises as oilfield activity returns,https://www.msn.com/en-us/money/companies/update-1-schlumberger-profit-rises-as-oilfield-activity-returns/ar-AAMtwKd?ocid=BingNews,Business,Reuters,Unavailable,7h,9.0,False,False
"China Sanctions Wilbur Ross, Others Over U.S. Hong Kong Warning",https://www.msn.com/en-us/finance/other/china-sanctions-wilbur-ross-others-over-us-hong-kong-warning/ar-AAMu2zq?ocid=BingNews,Business,Bloomberg,Unavailable,2h,10.0,False,False
Intel stock drops as signs of continued AMD share gains eclipse earnings beat,https://www.msn.com/en-us/money/companies/intel-stock-drops-as-signs-of-continued-amd-share-gains-eclipse-earnings-beat/ar-AAMu4KE?ocid=BingNews,Business,MarketWatch,Unavailable,2h,11.0,False,False
Boston Beer stock is crashing because the hard seltzer boom is basically over,https://www.msn.com/en-us/money/topstocks/boston-beer-stock-is-crashing-because-the-hard-seltzer-boom-is-basically-over/ar-AAMtx5g?ocid=BingNews,Business,Yahoo! Finance,Unavailable,7h,12.0,False,False
