article_headline,article_url,article_topic,source_name,source_url,article_datetime,article_position,article_isopinion,article_isad
Infrastructure bill stalls after Democratic leaders fail to wrangle support,https://www.msn.com/en-us/news/politics/infrastructure-bill-stalls-after-democratic-leaders-fail-to-wrangle-support/ar-AAP2BEt?ocid=BingNews,Top stories,NBC News,Unavailable,8m,1.0,False,False
California to be 1st state in nation to require COVID-19 vaccines for school children,https://www.msn.com/en-us/news/us/california-to-be-1st-state-in-nation-to-require-covid-19-vaccines-for-school-children/ar-AAP2Q28?ocid=BingNews,Top stories,ABC News,Unavailable,5h,2.0,False,False
McConnell and Graham ask CBO for 'true cost' of Biden spending plan,https://www.msn.com/en-us/news/politics/mcconnell-and-graham-ask-cbo-for-true-cost-of-biden-spending-plan/ar-AAP323Y?ocid=BingNews,Top stories,Fox Business,Unavailable,5h,3.0,False,False
The House missed its deadline to pass infrastructure. That doesn't mean the bill has hit a dead end.,https://www.msn.com/en-us/news/politics/the-house-missed-its-deadline-to-pass-infrastructure-that-doesnt-mean-the-bill-has-hit-a-dead-end/ar-AAP1BQy?ocid=BingNews,Top stories,USA TODAY,Unavailable,11h,4.0,False,False
Biden heads to Capitol Hill to meet with House Democrats amid infighting,https://www.msn.com/en-us/news/politics/biden-heads-to-capitol-hill-to-meet-with-house-democrats-amid-infighting/ar-AAP2UcR?ocid=BingNews,Top stories,ABC News,Unavailable,2h,5.0,False,False
Merck reports promising results from experimental COVID-19 pill,https://www.msn.com/en-us/health/medical/merck-reports-promising-results-from-experimental-covid-19-pill/ar-AAP28vy?ocid=BingNews,Top stories,CBS News,Unavailable,13h,6.0,False,False
NWSL commissioner is ousted as fallout over sexual coercion scandal continues,https://www.msn.com/en-us/sports/soccer/nwsl-commissioner-is-ousted-as-fallout-over-sexual-coercion-scandal-continues/ar-AAP3kl6?ocid=BingNews,Top stories,USA TODAY SPORTS,Unavailable,22m,7.0,False,False
Psaki admits Biden likely will not get his full $3.5T spending proposal,https://www.msn.com/en-us/news/politics/psaki-admits-biden-likely-will-not-get-his-full-35t-spending-proposal/ar-AAP34KX?ocid=BingNews,Top stories,FOX News,Unavailable,3h,8.0,False,False
How to get your COVID-19 vaccine booster shot in Indiana,https://www.msn.com/en-us/health/medical/how-to-get-your-covid-19-vaccine-booster-shot-in-indiana/ar-AAP0wWb?ocid=BingNews,Top stories,Indianapolis Star,Unavailable,4h,9.0,False,False
"Mayor vows ‘consequences’ for city workers who miss looming COVID-19 vaccine deadline, but unions push back",https://www.msn.com/en-us/news/us/mayor-vows-consequences-for-city-workers-who-miss-looming-covid-19-vaccine-deadline-but-unions-push-back/ar-AAP3nYB?ocid=BingNews,Top stories,Chicago Tribune,Unavailable,1h,10.0,False,False
"New COVID-19 pills may keep recently diagnosed patients out of hospital, company says",https://www.msn.com/en-us/health/medical/new-covid-19-pills-may-keep-recently-diagnosed-patients-out-of-hospital-company-says/ar-AAP25CB?ocid=BingNews,Top stories,ABC News,Unavailable,13h,11.0,False,False
Supreme Court Justice Brett Kavanaugh tests positive for COVID-19 days before new term to begin,https://www.msn.com/en-us/news/us/supreme-court-justice-brett-kavanaugh-tests-positive-for-covid-19-days-before-new-term-to-begin/ar-AAP2owi?ocid=BingNews,Top stories,USA TODAY,Unavailable,40m,12.0,False,False
Packers expected to place WR Marquez Valdes-Scantling on injured reserve,https://www.msn.com/en-us/sports/nfl/packers-expected-to-place-wr-marquez-valdes-scantling-on-injured-reserve/ar-AAP3kbk?ocid=BingNews,Sports,Packers Wire,Unavailable,47m,1.0,False,False
NWSL commissioner is ousted as fallout over sexual coercion scandal continues,https://www.msn.com/en-us/sports/soccer/nwsl-commissioner-is-ousted-as-fallout-over-sexual-coercion-scandal-continues/ar-AAP3kl6?ocid=BingNews,Sports,USA TODAY SPORTS,Unavailable,23m,2.0,False,False
"IHSAA football Week 7 live updates: Scores, instant highlights from across Central Indiana",https://www.msn.com/en-us/sports/more-sports/ihsaa-football-week-7-live-updates-scores-instant-highlights-from-across-central-indiana/ar-AAP32bw?ocid=BingNews,Sports,Indianapolis Star,Unavailable,1h,3.0,False,False
"Raiders, Chargers injury report: CB Nate Hobbs, DT Solomon Thomas upgraded to full",https://www.msn.com/en-us/sports/nfl/raiders-chargers-injury-report-cb-nate-hobbs-dt-solomon-thomas-upgraded-to-full/ar-AAP3k0o?ocid=BingNews,Sports,Raiders Wire,Unavailable,1h,4.0,False,False
An update on Vikings RB Dalvin Cook's injury,https://www.msn.com/en-us/sports/nfl/an-update-on-vikings-rb-dalvin-cooks-injury/ar-AAP3jQH?ocid=BingNews,Sports,Vikings Wire,Unavailable,1h,5.0,False,False
"Robert Saleh: When it clicks for Zach Wilson, everyone’s going to see why he was the No. 2 pick",https://www.msn.com/en-us/sports/nfl/robert-saleh-when-it-clicks-for-zach-wilson-everyone-s-going-to-see-why-he-was-the-no-2-pick/ar-AAP3lVm?ocid=BingNews,Sports,NBC Sports,Unavailable,1h,6.0,False,False
Watch: Steph Curry drilling 3-pointers at Warriors training camp,https://www.msn.com/en-us/sports/nba/watch-steph-curry-drilling-3-pointers-at-warriors-training-camp/ar-AAP39sP?ocid=BingNews,Sports,WarriorsWire,Unavailable,1h,7.0,False,False
49ers injury report: 2 key offensive weapons 'questionable' vs. Seahawks,https://www.msn.com/en-us/sports/nfl/49ers-injury-report-2-key-offensive-weapons-questionable-vs-seahawks/ar-AAP37Kl?ocid=BingNews,Sports,Niners Wire,Unavailable,1h,8.0,False,False
"Phoenix Suns, Mercury to play home doubleheader on Wednesday",https://www.msn.com/en-us/sports/more-sports/phoenix-suns-mercury-to-play-home-doubleheader-on-wednesday/ar-AAP3a2d?ocid=BingNews,Sports,Arizona Republic,Unavailable,29m,9.0,False,False
Chicago Bears will make game-time decision on whether Andy Dalton or Justin Fields start,https://www.msn.com/en-us/sports/nfl/chicago-bears-will-make-game-time-decision-on-whether-andy-dalton-or-justin-fields-start/ar-AAP3bkf?ocid=BingNews,Sports,USA TODAY SPORTS,Unavailable,2h,10.0,False,False
Barry Alvarez Field? Yep. Wisconsin will honor its former coach and AD in a ceremony at Camp Randall Stadium,https://www.msn.com/en-us/sports/ncaafb/barry-alvarez-field-yep-wisconsin-will-honor-its-former-coach-and-ad-in-a-ceremony-at-camp-randall-stadium/ar-AAP39Mu?ocid=BingNews,Sports,Milwaukee Journal-Sentinel,Unavailable,39m,11.0,False,False
Tyler Alexander is one of Tigers’ most prolific pitchers. It hasn’t gone unnoticed by his manager.,https://www.msn.com/en-us/sports/mlb/tyler-alexander-is-one-of-tigers-most-prolific-pitchers-it-hasn-t-gone-unnoticed-by-his-manager/ar-AAP3mbb?ocid=BingNews,Sports,MLive - Jackson,Unavailable,45m,12.0,False,False
"There are marquee matchups all over tonight. Check here for Iowa high school football Week 6 live updates, analysis",https://www.msn.com/en-us/sports/ncaafb/there-are-marquee-matchups-all-over-tonight-check-here-for-iowa-high-school-football-week-6-live-updates-analysis/ar-AAP3gVd?ocid=BingNews,U.S.,Des Moines Register,Unavailable,17m,1.0,False,False
"Mayor vows ‘consequences’ for city workers who miss looming COVID-19 vaccine deadline, but unions push back",https://www.msn.com/en-us/news/us/mayor-vows-consequences-for-city-workers-who-miss-looming-covid-19-vaccine-deadline-but-unions-push-back/ar-AAP3nYB?ocid=BingNews,U.S.,Chicago Tribune,Unavailable,1h,2.0,False,False
Jeff Bezos Is Being Knocked Back Down to Earth,https://www.msn.com/en-us/news/technology/jeff-bezos-is-being-knocked-back-down-to-earth/ar-AAP328N?ocid=BingNews,U.S.,The Atlantic,Unavailable,4h,3.0,False,False
"Tarrant reports 17 COVID deaths, including woman in 20s, men in their 30s, 40s",https://www.msn.com/en-us/news/us/tarrant-reports-17-covid-deaths-including-woman-in-20s-men-in-their-30s-40s/ar-AAP3886?ocid=BingNews,U.S.,Fort Worth Star-Telegram,Unavailable,52m,4.0,False,False
Violence at Hillsborough’s Greco Middle School prompts call for help,https://www.msn.com/en-us/news/us/violence-at-hillsborough-s-greco-middle-school-prompts-call-for-help/ar-AAP3gQn?ocid=BingNews,U.S.,Tampa Bay Times,Unavailable,2h,5.0,False,False
COVID vaccine live updates: Here’s what to know in North Carolina on Oct. 1,https://www.msn.com/en-us/news/us/covid-vaccine-live-updates-here-s-what-to-know-in-north-carolina-on-oct-1/ar-AAP2hjY?ocid=BingNews,U.S.,The Charlotte Observer,Unavailable,2h,6.0,False,False
"‘Hero’ husband killed by flying tool on I-95 averts crash, saves wife",https://www.msn.com/en-us/news/us/hero-husband-killed-by-flying-tool-on-i-95-averts-crash-saves-wife/ar-AAP3d7m?ocid=BingNews,U.S.,Boston Herald,Unavailable,2h,7.0,False,False
California becomes first state to require COVID-19 vaccine for students,https://www.msn.com/en-us/news/us/california-becomes-first-state-to-require-covid-19-vaccine-for-students/ar-AAP2V4v?ocid=BingNews,U.S.,CBS News,Unavailable,5h,8.0,False,False
"Judge saves US visas for some, not all lottery winners",https://www.msn.com/en-us/news/politics/judge-saves-us-visas-for-some-not-all-lottery-winners/ar-AAP322m?ocid=BingNews,U.S.,Associated Press,Unavailable,4h,9.0,False,False
Ankeny students get applause after forum calling for more diverse curriculum,https://www.msn.com/en-us/news/us/ankeny-students-get-applause-after-forum-calling-for-more-diverse-curriculum/ar-AAP3gqG?ocid=BingNews,U.S.,Des Moines Register,Unavailable,2h,10.0,False,False
"School board group asks Biden to use the Patriot Act against parents over opposition to COVID measures, CRT",https://www.msn.com/en-us/news/us/school-board-group-asks-biden-to-use-the-patriot-act-against-parents-over-opposition-to-covid-measures-crt/ar-AAP37mw?ocid=BingNews,U.S.,FOX News,Unavailable,3h,11.0,False,False
"Michigan reports 8,058 new COVID-19 cases and 79 deaths in 2 days",https://www.msn.com/en-us/health/medical/michigan-reports-8058-new-covid-19-cases-and-79-deaths-in-2-days/ar-AAP3iNr?ocid=BingNews,U.S.,Detroit Free Press,Unavailable,2h,12.0,False,False
"Kunga Fest returns, donations to help abandoned girls in India",https://www.msn.com/en-us/news/us/kunga-fest-returns-donations-to-help-abandoned-girls-in-india/ar-AAP3doV?ocid=BingNews,Local,WDBJ on MSN.com,Unavailable,1h,1.0,False,False
HOMETOWN EATS: Bull & Bones Brewhaus and Grill in Blacksburg,https://www.msn.com/en-us/foodanddrink/foodnews/hometown-eats-bull-26-bones-brewhaus-and-grill-in-blacksburg/ar-AAP2fP9?ocid=BingNews,Local,WDBJ on MSN.com,Unavailable,14h,2.0,False,False
Axe-throwing could be added to new Blacksburg arcade,https://www.msn.com/en-us/news/us/axe-throwing-could-be-added-to-new-blacksburg-arcade/ar-AAP0QPP?ocid=BingNews,Local,WDBJ on MSN.com,Unavailable,1d,3.0,False,False
Blacksburg yoga studio hosting Kunga Fest to raise money for trafficked girls in India,https://www.wsls.com/news/local/2021/09/30/blacksburg-yoga-studio-hosting-kunga-fest-to-raise-money-for-trafficked-girls-in-india/,Local,WSLS 10,Unavailable,21h,4.0,False,False
"New space for the Market of Virginia Tech provides more than 125 Hokies with more than 14,000 meals since last year",https://www.wsls.com/video/news/2021/09/30/new-space-for-the-market-of-virginia-tech-provides-more-than-125-hokies-with-more-than-14000-meals-since-last-year-/,Local,WSLS 10,Unavailable,22h,5.0,False,False
Two Radford elementary schools transform halls into biomedical labs,https://www.msn.com/en-us/finance/careersandeducation/two-radford-elementary-schools-transform-halls-into-biomedical-labs/ar-AAP0Jr3?ocid=BingNews,Local,WDBJ on MSN.com,Unavailable,1d,6.0,False,False
Blue Ridge Arcade: Blacksburg’s latest downtown addition,http://www.collegiatetimes.com/lifestyles/blue-ridge-arcade-blacksburg-s-latest-downtown-addition/article_c4cfc594-220b-11ec-9795-db66fd89054d.html,Local,Collegiate Times,Unavailable,1d,7.0,False,False
Hundreds gather at Virginia Tech to protest sexual violence,https://www.msn.com/en-us/news/us/hundreds-gather-at-virginia-tech-to-protest-sexual-violence/ar-AAOXD4I?ocid=BingNews,Local,WDBJ on MSN.com,Unavailable,2d,8.0,False,False
"Police identify 31-year-old man shot, killed inside a Roanoke convenience store",https://www.wsls.com/news/local/2021/09/30/20-year-old-charged-with-shooting-killing-a-man-inside-a-roanoke-convenience-store/,Local,WSLS 10,Unavailable,1h,9.0,False,False
Man in hospital after Roanoke shooting,https://www.msn.com/en-us/news/crime/man-in-hospital-after-roanoke-shooting/ar-AAP3dXI?ocid=BingNews,Local,Roanoke-Lynchburg WDBJ-TV on MSN.com,Unavailable,2h,10.0,False,False
Name released of man shot to death in Roanoke,https://www.msn.com/en-us/news/crime/name-released-of-man-shot-to-death-in-roanoke/ar-AAP33Tz?ocid=BingNews,Local,Roanoke-Lynchburg WDBJ-TV on MSN.com,Unavailable,5h,11.0,False,False
Hundreds of Virginia Tech students protest after reports of sexual assaults,https://www.wsls.com/news/local/2021/09/29/hundreds-of-virginia-tech-students-protest-after-reports-of-sexual-assaults/,Local,WSLS 10,Unavailable,2d,12.0,False,False
"Haitian migrants thought Biden would welcome them. Now deported to Haiti, they have one mission: Leave again.",https://www.msn.com/en-us/news/world/haitian-migrants-thought-biden-would-welcome-them-now-deported-to-haiti-they-have-one-mission-leave-again/ar-AAP3bOw?ocid=BingNews,World,The Washington Post,Unavailable,4h,1.0,False,False
DHS: Hundreds of Afghan evacuees are leaving military bases in the US without completing resettlement,https://www.msn.com/en-us/news/us/dhs-hundreds-of-afghan-evacuees-are-leaving-military-bases-in-the-us-without-completing-resettlement/ar-AAP3hkA?ocid=BingNews,World,FOX News,Unavailable,51m,2.0,False,False
Democrats struggle to reach deal in Congress on Biden's agenda,https://www.msn.com/en-us/news/politics/democrats-struggle-to-reach-deal-in-congress-on-bidens-agenda/ar-AAP2sHq?ocid=BingNews,World,Reuters,Unavailable,11h,3.0,False,False
US official in Haiti apologizes for treatment of migrants,https://www.msn.com/en-us/news/world/us-official-in-haiti-apologizes-for-treatment-of-migrants/ar-AAP2UQ4?ocid=BingNews,World,Associated Press,Unavailable,5h,4.0,False,False
"Biden's top trade advisor will say China isn't complying with phase 1 deal reached under Trump, according to sources",https://www.msn.com/en-us/money/markets/bidens-top-trade-advisor-will-say-china-isnt-complying-with-phase-1-deal-reached-under-trump-according-to-sources/ar-AAP3eeS?ocid=BingNews,World,CNBC,Unavailable,2h,5.0,False,False
Anti-Defamation League CEO says he spoke with vice president's office about Israel interaction,https://www.msn.com/en-us/news/politics/kamala-harris-office-doing-clean-up-after-exchange-with-student-on-israel/ar-AAP1lnI?ocid=BingNews,World,CNN,Unavailable,3h,6.0,False,False
German parking garage unveils diversity parking spots for LGBTQ and migrants,https://www.msn.com/en-us/news/world/german-parking-garage-unveils-diversity-parking-spots-for-lgbtq-and-migrants/ar-AAP3en5?ocid=BingNews,World,FOX News,Unavailable,2h,7.0,False,False
Vaccine hesitancy: These EU nations are still miles behind their neighbors,https://www.msn.com/en-us/news/world/vaccine-hesitancy-these-eu-nations-are-still-miles-behind-their-neighbors/ar-AAP1yO4?ocid=BingNews,World,CNN,Unavailable,11h,8.0,False,False
Puerto Rico is on the brink of a power supply crisis. Protesters demand answers.,https://www.msn.com/en-us/news/us/puerto-rico-is-on-the-brink-of-a-power-supply-crisis-protesters-demand-answers/ar-AAP30np?ocid=BingNews,World,NBC News,Unavailable,1h,9.0,False,False
Ex-president Saakashvili held on return to Georgia,https://www.msn.com/en-us/news/world/ex-president-saakashvili-held-on-return-to-georgia/ar-AAP2KE7?ocid=BingNews,World,BBC News,Unavailable,7h,10.0,False,False
Brazil's Amazon records least September fires in 20 years,https://www.msn.com/en-us/news/world/brazils-amazon-records-least-september-fires-in-20-years/ar-AAP2JtG?ocid=BingNews,World,Associated Press,Unavailable,8h,11.0,False,False
Guinea coup leader sworn in as president,https://www.msn.com/en-us/news/world/guinea-coup-leader-sworn-in-as-president/ar-AAP2jIQ?ocid=BingNews,World,BBC News,Unavailable,11h,12.0,False,False
NASA Thrilled as Mars Lander Captures Stunning Close-Ups of the Planet's Surface,https://www.msn.com/en-us/news/technology/nasa-thrilled-as-mars-lander-captures-stunning-close-ups-of-the-planets-surface/ar-AAP3lOh?ocid=BingNews,Science,Newsweek,Unavailable,1h,1.0,False,False
Amazon's controversial vision for the future of your home security,https://www.msn.com/en-us/news/technology/amazons-controversial-vision-for-the-future-of-your-home-security/ar-AAP1VFQ?ocid=BingNews,Science,CNN,Unavailable,5h,2.0,False,False
This solar event will halt communication with Mars missions for 2 weeks,https://www.msn.com/en-us/news/technology/this-solar-event-will-halt-communication-with-mars-missions-for-2-weeks/ar-AAP3jzx?ocid=BingNews,Science,WPTZ Plattsburgh-Burlington,Unavailable,1h,3.0,False,False
"After 3.5 million-year hiatus, the largest comet ever discovered is headed our way",https://www.msn.com/en-us/news/technology/after-35-million-year-hiatus-the-largest-comet-ever-discovered-is-headed-our-way/ar-AAP321F?ocid=BingNews,Science,Live Science,Unavailable,7h,4.0,False,False
Scientists decipher Marie Antoinette's redacted love notes,https://www.msn.com/en-us/news/world/scientists-decipher-marie-antoinette-s-redacted-love-notes/ar-AAP31E4?ocid=BingNews,Science,Associated Press,Unavailable,5h,5.0,False,False
"NASA Won't Rename Telescope After 1,200 People Protest LGBT Discrimination",https://www.msn.com/en-us/news/technology/nasa-wont-rename-telescope-after-1200-people-protest-lgbt-discrimination/ar-AAP2HQE?ocid=BingNews,Science,Newsweek,Unavailable,7h,6.0,False,False
"Europe, Japan probes to get 1st look at destination Mercury",https://www.msn.com/en-us/news/technology/europe-japan-probes-to-get-1st-look-at-destination-mercury/ar-AAP2UpL?ocid=BingNews,Science,Associated Press,Unavailable,6h,7.0,False,False
BepiColombo mission flies by Mercury for the first time Friday,https://www.msn.com/en-us/news/technology/bepicolombo-mission-flies-by-mercury-for-the-first-time-friday/ar-AAP349l?ocid=BingNews,Science,CNN,Unavailable,13m,8.0,False,False
Reuters Science News Summary,https://www.msn.com/en-us/news/us/reuters-science-news-summary/ar-AAP3cdp?ocid=BingNews,Science,Reuters,Unavailable,3h,9.0,False,False
"COVID lockdowns may have changed bird behavior, study finds",https://www.msn.com/en-us/news/us/covid-lockdowns-may-have-changed-bird-behavior-study-finds/ar-AAP3aa1?ocid=BingNews,Science,CBS News,Unavailable,42m,10.0,False,False
Everything you need to know about Fishing in New World,https://www.msn.com/en-us/sports/esports/everything-you-need-to-know-about-fishing-in-new-world/ar-AAP3r05?ocid=BingNews,Science,Dot Esports,Unavailable,55m,11.0,False,False
Reap the benefits of coordinating the work of data scientists and analysts,https://www.msn.com/en-us/news/technology/reap-the-benefits-of-coordinating-the-work-of-data-scientists-and-analysts/ar-AAP3fmv?ocid=BingNews,Science,TechRepublic,Unavailable,2h,12.0,False,False
6 of the Best New Features From Apple's Upcoming macOS Monterey,https://www.msn.com/en-us/news/technology/6-of-the-best-new-features-from-apples-upcoming-macos-monterey/ar-AAP39zv?ocid=BingNews,Technology,Time,Unavailable,1h,1.0,False,False
NASA Thrilled as Mars Lander Captures Stunning Close-Ups of the Planet's Surface,https://www.msn.com/en-us/news/technology/nasa-thrilled-as-mars-lander-captures-stunning-close-ups-of-the-planet-s-surface/ar-AAP3lOh?ocid=BingNews,Technology,Newsweek,Unavailable,1h,2.0,False,False
It's time to get off Windows and SQL Server 2012 (or run them on Azure),https://www.msn.com/en-us/news/technology/its-time-to-get-off-windows-and-sql-server-2012-or-run-them-on-azure/ar-AAP3gLI?ocid=BingNews,Technology,TechRepublic,Unavailable,4h,3.0,False,False
Jeff Bezos calls Amazon’s ‘New World’ video game a ‘success’ — but it’s too early to determine that,https://www.msn.com/en-us/lifestyle/lifestyle-buzz/jeff-bezos-calls-amazon-s-new-world-video-game-a-success-but-it-s-too-early-to-determine-that/ar-AAP3cA4?ocid=BingNews,Technology,Geekwire,Unavailable,3h,4.0,False,False
"$89 million in crypto was mistakenly sent out to users of a decentralized finance platform, and now its CEO is asking users to voluntarily send it back",https://www.msn.com/en-us/news/technology/89-million-in-crypto-was-mistakenly-sent-out-to-users-of-a-decentralized-finance-platform-and-now-its-ceo-is-asking-users-to-voluntarily-send-it-back/ar-AAP36Y6?ocid=BingNews,Technology,Business Insider,Unavailable,4h,5.0,False,False
BMW’s iX SUV sets the automaker on the correct EV path,https://www.msn.com/en-us/news/technology/bmw-e2-80-99s-ix-suv-sets-the-automaker-on-the-correct-ev-path/ar-AAP3b5r?ocid=BingNews,Technology,Engadget,Unavailable,4h,6.0,False,False
Boston tech scene continues the deal momentum this week,https://www.msn.com/en-us/money/technologyinvesting/boston-tech-scene-continues-the-deal-momentum-this-week/ar-AAP322Q?ocid=BingNews,Technology,The Boston Globe,Unavailable,4h,7.0,False,False
Media company Ozy is shutting down as problems mount,https://www.msn.com/en-us/money/news/media-company-ozy-is-shutting-down-as-problems-mount/ar-AAP3e7Z?ocid=BingNews,Technology,Associated Press,Unavailable,2h,8.0,False,False
California to require all schoolchildren to get COVID shots,https://www.msn.com/en-us/news/politics/california-to-require-all-schoolchildren-to-get-covid-shots/ar-AAP2Pk8?ocid=BingNews,Technology,Associated Press,Unavailable,7h,9.0,False,False
Amazon's controversial vision for the future of your home security,https://www.msn.com/en-us/news/technology/amazons-controversial-vision-for-the-future-of-your-home-security/ar-AAP1VFQ?ocid=BingNews,Technology,CNN,Unavailable,5h,10.0,False,False
Why does Blink still exist?,https://www.msn.com/en-us/money/other/why-does-blink-still-exist/ar-AAP2Neq?ocid=BingNews,Technology,The Verge,Unavailable,7h,11.0,False,False
Scientists decipher Marie Antoinette's redacted love notes,https://www.msn.com/en-us/news/world/scientists-decipher-marie-antoinette-s-redacted-love-notes/ar-AAP31E4?ocid=BingNews,Technology,Associated Press,Unavailable,5h,12.0,False,False
David Lee Roth Announces Retirement: ‘I’m Throwing in the Shoes’,https://www.msn.com/en-us/music/news/david-lee-roth-announces-retirement-i-m-throwing-in-the-shoes/ar-AAP39CW?ocid=BingNews,Entertainment,Rolling Stone,Unavailable,1h,1.0,False,False
Ozy Media to Shut Down Amid Scrutiny,https://www.msn.com/en-us/entertainment/news/ozy-media-to-shut-down-amid-scrutiny/ar-AAP3dXL?ocid=BingNews,Entertainment,The Hollywood Reporter,Unavailable,3h,2.0,False,False
‘Maid’ Review: Margaret Qualley Gives an Award-Worthy Performance in Netflix Limited Series,https://www.msn.com/en-us/tv/news/maid-review-margaret-qualley-gives-an-award-worthy-performance-in-netflix-limited-series/ar-AAP2X2U?ocid=BingNews,Entertainment,IndieWire,Unavailable,4h,3.0,False,False
Princess Beatrice's Baby's Name Is a Sweet Nod to Her Red Hair — and Her Mom Fergie's!,https://www.msn.com/en-us/lifestyle/lifestyle-buzz/princess-beatrices-babys-name-is-a-sweet-nod-to-her-red-hair-e2-80-94-and-her-mom-fergies/ar-AAP30oM?ocid=BingNews,Entertainment,People,Unavailable,3h,4.0,False,False
Natalie Morales Poised To Join ‘The Talk’ Following Exit From NBC News,https://www.msn.com/en-us/tv/news/natalie-morales-poised-to-join-the-talk-following-exit-from-nbc-news/ar-AAP3jlt?ocid=BingNews,Entertainment,Deadline,Unavailable,2h,5.0,False,False
"Tony Winner Matthew López to Make Directorial Debut With LGBTQ+ Romance ‘Red, White & Royal Blue’ (EXCLUSIVE)",https://www.msn.com/en-us/movies/news/tony-winner-matthew-l%C3%B3pez-to-make-directorial-debut-with-lgbtqplus-romance-red-white-and-royal-blue-exclusive/ar-AAP35Wv?ocid=BingNews,Entertainment,Variety,Unavailable,5h,6.0,False,False
'Jeopardy!' champion Matt Amodio tops James Holzhauer's 32-day winning streak,https://www.msn.com/en-us/sports/more-sports/jeopardy-champion-matt-amodio-tops-james-holzhauers-32-day-winning-streak/ar-AAP3jY9?ocid=BingNews,Entertainment,USA TODAY,Unavailable,59m,7.0,False,False
UK’s Princess Beatrice names first child Sienna Elizabeth,https://www.msn.com/en-us/news/world/uk-s-princess-beatrice-names-first-child-sienna-elizabeth/ar-AAP2R4i?ocid=BingNews,Entertainment,Associated Press,Unavailable,7h,8.0,False,False
"Jingle Ball Tour Returns With Dua Lipa, Doja Cat, Ed Sheeran & More",https://www.msn.com/en-us/music/news/jingle-ball-tour-returns-with-dua-lipa-doja-cat-ed-sheeran-and-more/ar-AAP2npW?ocid=BingNews,Entertainment,Billboard,Unavailable,11h,9.0,False,False
Andy Serkis on ‘Venom: Let There Be Carnage’ and That Mid-Credits Scene,https://www.msn.com/en-us/movies/reviews/andy-serkis-on-venom-let-there-be-carnage-and-that-mid-credits-scene/ar-AAP3aVl?ocid=BingNews,Entertainment,The Hollywood Reporter,Unavailable,8h,10.0,False,False
The best new rom-com reads to get us through the rest of 2021,https://www.msn.com/en-us/news/us/the-best-new-rom-com-reads-to-get-us-through-the-rest-of-2021/ar-AAP34HJ?ocid=BingNews,Entertainment,USA TODAY,Unavailable,4h,11.0,False,False
‘Aladdin’ on Broadway Canceled for Two Weeks Following Additional Breakthrough COVID Cases,https://www.msn.com/en-us/tv/news/aladdin-on-broadway-canceled-for-two-weeks-following-additional-breakthrough-covid-cases/ar-AAP3nUG?ocid=BingNews,Entertainment,The Hollywood Reporter,Unavailable,1h,12.0,False,False
"Biden Says Infrastructure Can Wait, Spending Plan May Shrink",https://www.msn.com/en-us/news/politics/biden-says-infrastructure-can-wait-spending-plan-may-shrink/ar-AAP3jst?ocid=BingNews,Politics,Bloomberg,Unavailable,50m,1.0,False,False
