article_url,article_title,meta_description,section,authors,publish_date,modified_date,canonical_link,top_image,is_opinion
https://news.google.com/articles/CBMigAFodHRwczovL21tYWp1bmtpZS51c2F0b2RheS5jb20vMjAyMS8wOC9rZWx2aW4tZ2FzdGVsdW0tZ2xhZC11c2FkYS1uby1sb25nZXItcGVuYWxpemVzLW1hcmlqdWFuYS1ub3Qtc29tZXRoaW5nLXRoYXRzLWFuLWFkdmFudGFnZdIBhAFodHRwczovL21tYWp1bmtpZS51c2F0b2RheS5jb20vMjAyMS8wOC9rZWx2aW4tZ2FzdGVsdW0tZ2xhZC11c2FkYS1uby1sb25nZXItcGVuYWxpemVzLW1hcmlqdWFuYS1ub3Qtc29tZXRoaW5nLXRoYXRzLWFuLWFkdmFudGFnZS9hbXA?hl=en-US&gl=US&ceid=US%3Aen,Kelvin Gastelum glad USADA no longer penalizes marijuana: 'Not something that's an advantage',UFC middleweight Kelvin Gastelum is happy USADA is no longer penalizing fighters for positive marijuana tests.,,"['Danny Segura', 'Mma Junkie Staff', 'Nolan King', 'Farah Hannoun']",2021-08-20 22:20:20+00:00,2021-08-20T20:38:59+00:00,https://mmajunkie.usatoday.com/2021/08/kelvin-gastelum-glad-usada-no-longer-penalizes-marijuana-not-something-thats-an-advantage,https://mmajunkie.usatoday.com/wp-content/uploads/sites/91/2019/09/kelvin-gastelum-ufc-242-qa-guest-fighters.jpg?w=1000&h=576&crop=1,
https://news.google.com/articles/CBMiTmh0dHBzOi8vd3d3LmZveG5ld3MuY29tL3Nwb3J0cy9lbGxhLWJydW5pbmctbGl0dGxlLWxlYWd1ZS13b3JsZC1zZXJpZXMtaGlzdG9yedIBUmh0dHBzOi8vd3d3LmZveG5ld3MuY29tL3Nwb3J0cy9lbGxhLWJydW5pbmctbGl0dGxlLWxlYWd1ZS13b3JsZC1zZXJpZXMtaGlzdG9yeS5hbXA?hl=en-US&gl=US&ceid=US%3Aen,Ella Bruning makes Little League World Series history in victory,"Ella Bruning is the only girl competing in the 2021 Little League World Series, and she became a part of history on Friday night.",,"['Ryan Gaydos', 'Ryan Gaydos Is The Sports Editor For Foxnews.Com. Follow Him On Social Media']",,2021-08-21T12:07:07-04:00,https://www.foxnews.com/sports/ella-bruning-little-league-world-series-history,https://static.foxnews.com/foxnews.com/content/uploads/2021/08/Ella-Bruning2.jpg,false
https://news.google.com/articles/CAIiEDGGVnQ8Yt7ER9QhqD0Lbf8qGQgEKhAIACoHCAowjsP7CjCSpPQCMM_b5QU?hl=en-US&gl=US&ceid=US%3Aen,Ella Bruning makes history in Texas' win vs. Washington in Little League Baseball World Series,"Ella Bruning, the only girl in this year's Little League Baseball World Series and just the 20th to play in competition, helped Texas beat Washington.",,[],,,https://www.usatoday.com/story/sports/2021/08/20/little-league-world-series-ella-bruning-texas-washington/8220996002/,"https://www.gannett-cdn.com/presto/2021/08/21/USAT/d2a38970-0294-462f-ad48-a41e7b9f6e53-XXX_Washington_Texas_06.jpg?crop=3973,2235,x0,y140&width=3200&height=1801&format=pjpg&auto=webp",false
https://news.google.com/articles/CAIiEGwksJ3yUnYMuYbpEIgRHngqFwgEKg8IACoHCAowjuuKAzCWrzwwt4QY?hl=en-US&gl=US&ceid=US%3Aen,"The Little League World Series Is the Pinnacle for the Umpires, Too","The players dream of nationally televised glory. But for the nervous and excited volunteer umpires, the goal is to go unnoticed.",Sports,['John Branch'],2021-08-21 09:00:10+00:00,2021-08-21T09:00:10.000Z,https://www.nytimes.com/2021/08/21/sports/little-league-world-series-umpires.html,https://static01.nyt.com/images/2021/08/21/sports/21umpires-littleleague/21umpires-littleleague-facebookJumbo.jpg,false
https://news.google.com/articles/CBMiYmh0dHBzOi8vd3d3LnN1bmdhemV0dGUuY29tL25ld3MvdG9wLW5ld3MvMjAyMS8wOC9mZXN0aXZpdGllcy1kcmF3LWNyb3dkcy10by1kb3dudG93bi13aWxsaWFtc3BvcnQv0gEA?hl=en-US&gl=US&ceid=US%3Aen,Festivities draw crowds to downtown Williamsport,"Williamsport Welcomed the World to a bustling downtown environment Friday night, providing an outlet for the community and baseball fans to enjoy street festivi",,[],,,https://www.sungazette.com/news/top-news/2021/08/festivities-draw-crowds-to-downtown-williamsport/,https://ogden_images.s3.amazonaws.com/www.sungazette.com/images/2021/08/20205749/JMN_0469-750x500.jpg,
https://news.google.com/articles/CBMicmh0dHBzOi8vd3d3Lm1saXZlLmNvbS9zcG9ydHMvMjAyMS8wOC9saXR0bGUtbGVhZ3VlLXdvcmxkLXNlcmllcy1ob3ctdG8td2F0Y2gtb24tYXVndXN0LTIxLWNoYW5uZWwtc3RyZWFtLXRpbWUuaHRtbNIBgQFodHRwczovL3d3dy5tbGl2ZS5jb20vc3BvcnRzLzIwMjEvMDgvbGl0dGxlLWxlYWd1ZS13b3JsZC1zZXJpZXMtaG93LXRvLXdhdGNoLW9uLWF1Z3VzdC0yMS1jaGFubmVsLXN0cmVhbS10aW1lLmh0bWw_b3V0cHV0VHlwZT1hbXA?hl=en-US&gl=US&ceid=US%3Aen,"Little League World Series - How to Watch on August 21 | Channel, Stream, Time",,Sports,"['Tyler', 'Kuehl', 'Tkuehl Mlive.Com']",2021-08-21 12:47:00.180000+00:00,2021-08-21T12:47:00.180Z,https://www.mlive.com/sports/2021/08/little-league-world-series-how-to-watch-on-august-20-channel-stream-time.html,https://www.mlive.com/resizer/Sk4HgqLwvvUoJt0kCuLSQwerQy4=/1280x0/smart/cloudfront-us-east-1.images.arcpublishing.com/advancelocal/GUSXSM73ZNBJDCHTMCW3IDIIKQ.jpg,
https://news.google.com/articles/CAIiEPYGRDvh9QBlu-WUKRURN-4qFggEKg4IACoGCAow3O8nMMqOBjD38Ak?hl=en-US&gl=US&ceid=US%3Aen,"NASA’s Perseverance to attempt second Mars soil scoop, hoping rocks don’t ‘crumble’","NASA’s Perseverance rover will drive to a new location in the coming weeks to drill for its first Mars soil sample, scientists say, weeks after the robot’s first attempt resulted in an empty sample tube.",,"['Joey Roulette', 'Aug']",2021-08-20 17:39:13-04:00,2021-08-20T17:39:13-04:00,https://www.theverge.com/2021/8/20/22633888/nasa-perseverance-rover-second-mars-soil-sample,https://cdn.vox-cdn.com/thumbor/aXp1riqDRwFnKygYjv4YmmDTejQ=/0x120:1280x790/fit-in/1200x630/cdn.vox-cdn.com/uploads/chorus_asset/file/22796039/26115_NavCam_Left_LF_0164_0681506334_116CWS_N0060000NCAM00315_0A00LLJ01.jpeg,
https://news.google.com/articles/CAIiEA9fP5BX3kHCIyeVtl_DrD4qFAgEKgsIACoFCAowgGAwADCElosG?hl=en-US&gl=US&ceid=US%3Aen,Scientists finally know what happened to Perseverance's mysterious disappearing rock sample,Perseverance drilled a hole in a Martian rock to collect a sample — then the sample disappeared,Science & Health,[],2021-08-20 20:32:59,2021-08-20 20:33:03,https://www.salon.com/2021/08/20/scientists-finally-know-what-happened-to-perseverances-mysterious-disappearing-rock-sample/,https://mediaproxy.salon.com/width/1200/https://media.salon.com/2021/02/mars-rover-perseverance-0218211.jpg,
https://news.google.com/articles/CAIiED8PKsqXk93WK-Dlc1K0QT8qGQgEKhAIACoHCAowwOrvCjD-_s4CMOzK1QY?hl=en-US&gl=US&ceid=US%3Aen,Take a tour of Mars’s Gale Crater with the Curiosity rover,"NASA has shared an incredible video touring of the surface of Mars, as captured by the Curiosity rover.",News,"['Georgina Torbet', 'August']",2021-08-21 15:10:42+00:00,,https://www.digitaltrends.com/news/mars-gale-crater-tour/,https://icdn.digitaltrends.com/image/digitaltrends/1-banner-pia22486_-2e16d0ba-width-1280-fill-1280x551-c101.jpg,
https://news.google.com/articles/CAIiEPH0LBccH7T0w8Fnzg0tN8MqMwgEKioIACIQiaYKTaVj4jekEifjHCx8jCoUCAoiEImmCk2lY-I3pBIn4xwsfIww37rKBg?hl=en-US&gl=US&ceid=US%3Aen,Perseverance rover spots tiny Mars moon Deimos (video),"NASA's Perseverance rover has given us an otherworldly skywatching treat — the minuscule Mars moon Deimos, twinkling in the dusty Red Planet skies.",,['Mike Wall'],2021-08-20 20:58:44+00:00,2021-08-20T20:58:57.206Z,https://www.space.com/perseverance-rover-mars-moon-deimos-video,https://cdn.mos.cms.futurecdn.net/GmvJ8fFVHmru2epRSrynpY-1200-80.jpg,
https://news.google.com/articles/CAIiELEy29qJwwSkzwvsex55AfkqEwgEKgwIACoFCAow4GowoAgwkRo?hl=en-US&gl=US&ceid=US%3Aen,"China's Mars rover outlasts its life expectancy, keeps on going","The more Mars rovers, the merrier.",,['Amanda Kooser'],,,https://www.cnet.com/news/chinas-mars-rover-outlasts-its-life-expectancy-keeps-on-going/,https://www.cnet.com/a/img/k17pVW6hidlVUq2oR1V6cPXih4k=/1200x630/2021/08/20/17d7bd41-9f69-4031-92c6-79e8d8d1ae8c/zhurongselfie.jpg,false
https://news.google.com/articles/CAIiEPBLGHRgyCZifQoqPL6lN40qMwgEKioIACIQFloNoavzTzBvP2PfEiuO2yoUCAoiEBZaDaGr808wbz9j3xIrjtswiPCRBw?hl=en-US&gl=US&ceid=US%3Aen,"Humans Poked an Asteroid. Next Century, the Asteroid Might Poke Back","Back in 2016, humanity launched into the void a spacecraft called OSIRIS-Rex. The moniker stands for Origins, Spectral Interpretation, Resource Identification, Security-Regolith Explorer, words which were supposed to explain the goal of the mission. Since they don’t, here it is in words we can all understand: a spacecraft tasked with taking a piece of an asteroid and bringing it back to Earth.",,['Daniel Patrascu'],2021-08-21 09:00:53+00:00,,https://www.autoevolution.com/news/humans-poked-an-asteroid-next-century-the-asteroid-might-poke-back-167793.html,https://s1.cdn.autoevolution.com/images/news/humans-poked-an-asteroid-next-century-the-asteroid-might-poke-back-167793_1.jpg,
https://news.google.com/articles/CCAiC25lclhCVjNBVlVBmAEB?hl=en-US&gl=US&ceid=US%3Aen,Huge near asteroid will fly safely past Earth on Saturday,"Asteroid 2016 AJ193 will pass near earth on Saturday, August 21, 2021. There is no danger of it striking the planet. The space rock is estimated to be just u...",,[],,,https://www.youtube.com/watch?v=nerXBV3AVUA,https://i.ytimg.com/vi/nerXBV3AVUA/hqdefault.jpg,
https://news.google.com/articles/CAIiEHu_8jGBK93qiKOxeVredeEqFwgEKg4IACoGCAowtro_MOevCDDQ6JgH?hl=en-US&gl=US&ceid=US%3Aen,"NASA will attempt to deflect an asteroid, impact to happen next fall","NASA will be attempting to deflect an asteroid with what the space agency is calling a 'Double Asteroid Redirection Test', or DART.","Science, Space, Health & Robotics",['Jak Connor'],2021-08-20 03:32:01-05:00,2021-08-20T03:32:29-05:00,https://www.tweaktown.com/news/81198/nasa-will-attempt-to-deflect-an-asteroid-impact-happen-next-fall/index.html,https://news.google.com/articles/favicon.ico,
https://news.google.com/articles/CBMiZGh0dHBzOi8vd3d3LmJpZ2NvdW50cnlob21lcGFnZS5jb20vd2VhdGhlci9sYXJnZS1hc3Rlcm9pZC10by1tYWtlLWEtY2xvc2UtcGFzcy1ieS1lYXJ0aC1vbi1zYXR1cmRheS_SAWhodHRwczovL3d3dy5iaWdjb3VudHJ5aG9tZXBhZ2UuY29tL3dlYXRoZXIvbGFyZ2UtYXN0ZXJvaWQtdG8tbWFrZS1hLWNsb3NlLXBhc3MtYnktZWFydGgtb24tc2F0dXJkYXkvYW1wLw?hl=en-US&gl=US&ceid=US%3Aen,Large asteroid to make a close pass by Earth on Saturday,"ABILENE, Texas (KTAB/KRBC) — A large asteroid will make a pass by Earth Saturday, August 21, 2021. It has been designated by NASA Jet Propulsion Laboratory (JPL) as asteroid 2016 AJ193. NASA has designated this asteroid to be “Potentially Dangerous” because of its close pass to Earth. Potentially Hazardous Asteroids (PHAs) are defined as asteroids with a […]",,['Kayleigh Thomas'],2021-08-20 21:18:51+00:00,2021-08-21T02:16:18+00:00,https://www.bigcountryhomepage.com/weather/large-asteroid-to-make-a-close-pass-by-earth-on-saturday/,https://www.bigcountryhomepage.com/wp-content/uploads/sites/56/2021/04/GettyImages-1188568318.jpg?w=1280,
https://news.google.com/articles/CAIiEDl3W_21Ul2oSIQMOsqkQKEqMwgEKioIACIQiaYKTaVj4jekEifjHCx8jCoUCAoiEImmCk2lY-I3pBIn4xwsfIww5LrKBg?hl=en-US&gl=US&ceid=US%3Aen,What can we do with a captured asteroid?,Asteroids are packed with gold and other valuable resources. And the best way to harvest those metals may be to bring space rocks to Earth.,,['Paul Sutter'],2021-08-20 16:06:40+00:00,2021-08-20T16:06:40.634Z,https://www.space.com/asteroid-mining-bring-space-rocks-to-earth,https://cdn.mos.cms.futurecdn.net/vTGJApE9dzqXTRGzDS4uYL-1200-80.jpg,
https://news.google.com/articles/CAIiEN8TnvTIXAxctah_4jSPAxgqFwgEKg8IACoHCAowjuuKAzCWrzwwt4QY?hl=en-US&gl=US&ceid=US%3Aen,The F.D.A. is aiming to give full approval to Pfizer’s Covid vaccine on Monday.,"Federal regulators are winding down the process of licensing Pfizer’s two-dose coronavirus vaccine, setting up an approval possibly by Monday and potentially kicking off a wave of new mandates.",World,"['Noah Weiland', 'Sharon Lafraniere']",2021-08-21 13:41:08+00:00,2021-08-21T19:16:33.367Z,https://www.nytimes.com/live/2021/08/21/world/covid-delta-variant-vaccine,https://static01.nyt.com/images/2021/08/20/us/20virus-briefing-pfizer/merlin_193078188_7aee1bca-02cb-4b61-bb39-aaeadc48dc0d-facebookJumbo.jpg,false
https://news.google.com/articles/CAIiEGWAmfDpJ0wBM2ERw-g6xuQqEwgEKgwIACoFCAow4GowoAgwkRo?hl=en-US&gl=US&ceid=US%3Aen,"FDA set to give Pfizer's COVID-19 vaccine full approval next week, report says",The shot is currently being given in the US under an emergency use authorization.,,['Carrie Mihalcik'],,,https://www.cnet.com/health/fda-set-to-give-pfizers-covid-19-vaccine-full-approval-next-week-report-says/,https://www.cnet.com/a/img/UlJxXADGc-2Ew8BzPA1CLT01b_0=/1200x630/2020/12/16/a53541a0-0d17-4a67-b5d8-217296485c67/001-syringe-glove-mask-covid-coronavirus-vaccine-pfizer-moderna-astrazenica-race-stock-prices-biosecurity.jpg,false
https://news.google.com/articles/CAIiEGyZVuWqOSSp8cp-id-W7H0qGQgEKhAIACoHCAownvOTCzCHjqkDMLa6lAc?hl=en-US&gl=US&ceid=US%3Aen,COVID-19 vaccine booster shots: What you need to know,This week the Biden administration announced it was recommending booster shots of the Moderna and Pfizer vaccines for many Americans as early as Sept. 20.,,[],,,https://news.yahoo.com/covid-19-vaccine-booster-shots-what-you-need-to-know-163517418.html,https://s.yimg.com/ny/api/res/1.2/3Q5L0G1ahGz20w9j1lLSZg--/YXBwaWQ9aGlnaGxhbmRlcjt3PTIwMDA7aD0xNTAw/https://s.yimg.com/os/creatr-uploaded-images/2021-08/cc1b1360-01ce-11ec-9ef9-a166ba54304b,
https://news.google.com/articles/CBMiN2h0dHBzOi8va2huLm9yZy9tb3JuaW5nLWJyaWVmaW5nL2ZyaWRheS1hdWd1c3QtMjAtMjAyMS_SAQA?hl=en-US&gl=US&ceid=US%3Aen,"Friday, August 20, 2021","TGIF! This roundup covers vaccine rates, boosters, rise in covid deaths, school mask wars, HIV, air quality and more. Also, weekend reads.",,['- Anonymous'],2021-08-20 13:12:12+00:00,2021-08-20T13:27:42+00:00,https://khn.org/morning-briefing/friday-august-20-2021/,https://khn.org/wp-content/uploads/sites/2/2018/03/khnnewsletterpromo2018.png,
https://news.google.com/articles/CAIiECgE0QDBxKUmuq3fHy8o0ScqGAgEKg8IACoHCAow6-akCjDO93cwro3sAQ?hl=en-US&gl=US&ceid=US%3Aen,"Maine CDC reports 205 COVID-19 cases, two deaths",,,"['Rob Wolfe', 'Email Writer']",2021-08-21 13:37:28+00:00,2021-08-21T19:02:45+00:00,https://www.pressherald.com/2021/08/21/maine-cdc-reports-205-covid-19-cases-two-deaths/,https://multifiles.pressherald.com/uploads/sites/10/2021/08/covid-new-case-numbers-0820.jpeg,
https://news.google.com/articles/CBMiT2h0dHBzOi8vd3d3LndhYmkudHYvMjAyMS8wOC8yMC9tYWluZS1jZGMtaW52ZXN0aWdhdGVzLWNvdmlkLTE5LWJyZXdlci1idXNpbmVzcy_SAQA?hl=en-US&gl=US&ceid=US%3Aen,Maine CDC investigates COVID-19 at Brewer business,A sign on the door says the facility is closed until further notice.,,[],,,https://www.wabi.tv/2021/08/20/maine-cdc-investigates-covid-19-brewer-business/,https://gray-wabi-prod.cdn.arcpublishing.com/resizer/MKr0o-SpKo5rV0nnILQS9DJRXgM=/980x0/smart/filters:quality(85)/cloudfront-us-east-1.images.arcpublishing.com/gray/LLADXF2XR5BMBEI4MFSIGC6CME.JPG,
https://news.google.com/articles/CBMijgFodHRwczovL2JhbmdvcmRhaWx5bmV3cy5jb20vMjAyMS8wOC8yMS9uZXdzLzItbW9yZS1tYWluZXJzLWhhdmUtZGllZC1hbmQtYW5vdGhlci0yMDUtY29yb25hdmlydXMtY2FzZXMtcmVwb3J0ZWQtYWNyb3NzLXRoZS1zdGF0ZS0wdnpvYTluNTA3d24v0gEA?hl=en-US&gl=US&ceid=US%3Aen,2 more Mainers have died and another 205 coronavirus cases reported across the state,"That brings the total number of coronavirus cases reported across Maine to 73,659 and the death toll to 924.",,[],2021-08-21 12:24:00+00:00,2021-08-21T16:48:37+00:00,https://bangordailynews.com/2021/08/21/news/2-more-mainers-have-died-and-another-205-coronavirus-cases-reported-across-the-state-0vzoa9n507wn/,https://bdn-data.s3.amazonaws.com/uploads/2021/08/Fair-Vax-082021-C-LCO.jpg,
https://news.google.com/articles/CAIiEB6JKeYhEYSqp8kDCZfnVBMqGAgEKg8IACoHCAow6-akCjDO93cwro3sAQ?hl=en-US&gl=US&ceid=US%3Aen,Positive test rate for COVID-19 increases as Maine reports another 185 cases,,,"['Eric Russell', 'Follow On Facebook', 'Follow On Twitter', 'Email Writer']",2021-08-20 12:28:36+00:00,2021-08-21T04:07:55+00:00,https://www.pressherald.com/2021/08/20/maine-closes-out-work-week-with-185-new-covid-19-cases-1-death/,https://multifiles.pressherald.com/uploads/sites/4/2021/08/covid-new-case-numbers-0820.jpeg,
https://news.google.com/articles/CBMiRmh0dHBzOi8vd3d3LndhYmkudHYvMjAyMS8wOC8yMS8yMDQtbmV3LWNvcm9uYXZpcnVzLWNhc2VzLTItbmV3LWRlYXRocy_SAQA?hl=en-US&gl=US&ceid=US%3Aen,"204 new coronavirus cases, 2 new deaths","204 newly recorded coronavirus cases, 2 new deaths according to Maine CDC",,['Wabi News Desk'],,,https://www.wabi.tv/2021/08/21/204-new-coronavirus-cases-2-new-deaths/,https://gray-wabi-prod.cdn.arcpublishing.com/resizer/LzPlZ1jIlxU_bzlHryUZ7hZNzFs=/980x0/smart/filters:quality(85)/cloudfront-us-east-1.images.arcpublishing.com/gray/46CGGNJUYNCC7CN3KK36PP3GEA.JPG,
https://news.google.com/articles/CCAiC19CSExKTzJlRDUwmAEB?hl=en-US&gl=US&ceid=US%3Aen,"Hospitals struggle to find beds for mostly younger, unvaccinated COVID-19 patients l WNT","Health officials are reporting overwhelming situations, driven by the highly contagious delta variant in states where vaccination rates are low.WATCH THE FUL...",,[],,,https://www.youtube.com/watch?v=_BHLJO2eD50,https://i.ytimg.com/vi/_BHLJO2eD50/hqdefault.jpg,
https://news.google.com/articles/CAIiECOakITL93mee2EX9T7KbYMqGQgEKhAIACoHCAowocv1CjCSptoCMPrTpgU?hl=en-US&gl=US&ceid=US%3Aen,What should you do if you get a breakthrough infection? Our expert weighs in,"Many people have questions about what to do if they are vaccinated but test positive. Should they isolate, and for how long? What about family members? CNN Medical Analyst Dr. Leana Wen has some answers.",health,['Katia Hetter'],,2021-08-21T18:33:37Z,https://www.cnn.com/2021/08/21/health/vaccinated-breakthrough-infections-covid-wellness/index.html,https://cdn.cnn.com/cnnnext/dam/assets/210820151736-nasal-swab-0421-germany-file-super-tease.jpg,false
https://news.google.com/articles/CAIiEDEj2mb1l0WlEf-P1UaLrMUqGQgEKhAIACoHCAow4uzwCjCF3bsCMIrOrwM?hl=en-US&gl=US&ceid=US%3Aen,Are you a robot?,,,[],,,,,
https://news.google.com/articles/CCAiC295ejAtQkYycEgwmAEB?hl=en-US&gl=US&ceid=US%3Aen,COVID vaccines now mandatory for public college students,NEWS: The Nevada State Board of Health approved the Mandate Friday and it will come into effect November 1.,,[],,,https://www.youtube.com/watch?v=oyz0-BF2pH0,https://i.ytimg.com/vi/oyz0-BF2pH0/hqdefault.jpg,
https://news.google.com/articles/CBMiVWh0dHBzOi8vd3d3Lm5iYzE1LmNvbS8yMDIxLzA4LzIwL2hhbGYtd2lzY29uc2luLW1lbi1yZWFjaC1jb3ZpZC0xOS12YWNjaW5lLW1pbGVzdG9uZS_SAQA?hl=en-US&gl=US&ceid=US%3Aen,Half of Wisconsin men reach COVID-19 vaccine milestone,Wisconsin men hit a new milestone Friday in COVID-19 vaccination progress.,,[],,,https://www.nbc15.com/2021/08/20/half-wisconsin-men-reach-covid-19-vaccine-milestone/,https://gray-wmtv-prod.cdn.arcpublishing.com/resizer/N1rjS-F9p8XP9SPSu58Lx4FK6I0=/980x0/smart/filters:quality(85)/cloudfront-us-east-1.images.arcpublishing.com/gray/MP4VWXGE3NCMVOKG6QCG5XQMBA.jpg,
https://news.google.com/articles/CBMiZWh0dHBzOi8vd3d3LndiYXkuY29tLzIwMjEvMDgvMTkvY292aWQtMTktd2lzY29uc2luLWRocy1jb21wYXJlcy12YWNjaW5hdGVkLXVudmFjY2luYXRlZC1jYXNlLW51bWJlcnMv0gEA?hl=en-US&gl=US&ceid=US%3Aen,COVID-19 in Wisconsin: DHS compares vaccinated to unvaccinated case numbers,"As the delta variant became the dominant strain, hospitalization and death rates for the fully vaccinated were significantly lower than the rest of the population.",,['Wbay News Staff'],,,https://www.wbay.com/2021/08/19/covid-19-wisconsin-dhs-compares-vaccinated-unvaccinated-case-numbers/,https://gray-wbay-prod.cdn.arcpublishing.com/resizer/yedJ6I1I5T_YKskd39LbMiknTm0=/980x0/smart/filters:quality(85)/cloudfront-us-east-1.images.arcpublishing.com/gray/2DNOSGGG7FEUXHS2A6ODJAG5J4.png,
https://news.google.com/articles/CBMiVWh0dHBzOi8vd3d3Lndwci5vcmcvd2lzY29uc2lucy1jb3ZpZC1jb25kaXRpb24tZGVsdGEtc3VyZ2UtZGlzcnVwdHMtdGhpcmQtc2Nob29sLXllYXLSAQA?hl=en-US&gl=US&ceid=US%3Aen,Wisconsin's Covid Condition: The Delta Surge Disrupts a Third School Year,Schoolchildren across Wisconsin are returning to classrooms as the Delta variant pushes the COVID-19,,['Pbs Wisconsin'],2021-08-20 15:15:01-05:00,2021-08-20T15:15:01-05:00,https://pbswisconsin.org/news-item/wisconsins-covid-condition-the-delta-surge-disrupts-a-third-school-year/,https://www.wpr.org/s3/files/styles/facebook/s3/covid-vaccinations-school-milwaukee-macdowell-770x433-c.jpg?itok=K_QtYtVu,
https://news.google.com/articles/CAIiEPVN0Y8NOZ5BP0CtjcbHCFwqGQgEKhAIACoHCAow4bjwCjCW27oCMLickgM?hl=en-US&gl=US&ceid=US%3Aen,State health data show unvaccinated almost 4 times as likely to be hospitalized with COVID-19,"Breakthrough infections have risen from fewer than 57 per 100,000 fully vaccinated people in February to more than 125 last month.",,"['Mitchell Schmidt', 'Wisconsin State Journal', 'State Journal Staff', 'Brett Coomer', 'Associated Press', 'Ruthie Hauge']",,,https://madison.com/wsj/news/local/govt-and-politics/state-health-data-show-unvaccinated-almost-4-times-as-likely-to-be-hospitalized-with-covid/article_eaa0c7e1-c0c7-5bc9-9ff8-38f18c3e9724.html,https://bloximages.chicago2.vip.townnews.com/madison.com/content/tncms/assets/v3/editorial/e/aa/eaa0c7e1-c0c7-5bc9-9ff8-38f18c3e9724/611e86561a14e.preview.jpg?crop=1763%2C992%2C0%2C91&resize=1120%2C630&order=crop%2Cresize,
https://news.google.com/articles/CBMiggFodHRwczovL3d3dy53ZWFyZWdyZWVuYmF5LmNvbS9jb3JvbmF2aXJ1cy90aHJlZS1uLWUtd2ktY291bnRpZXMtcmVhY2gtdmVyeS1oaWdoLWNvdmlkLTE5LWNhc2UtYWN0aXZpdHktbGV2ZWxzLW92ZXItMS01ay1uZXctY2FzZXMv0gGGAWh0dHBzOi8vd3d3LndlYXJlZ3JlZW5iYXkuY29tL2Nvcm9uYXZpcnVzL3RocmVlLW4tZS13aS1jb3VudGllcy1yZWFjaC12ZXJ5LWhpZ2gtY292aWQtMTktY2FzZS1hY3Rpdml0eS1sZXZlbHMtb3Zlci0xLTVrLW5ldy1jYXNlcy9hbXAv?hl=en-US&gl=US&ceid=US%3Aen,"Three N.E. WI counties reach very high COVID-19 case activity levels, over 1.5k new cases","THURSDAY 8/19/2021 1:55 p.m. The Wisconsin Department of Health Services has reported 642,969 total positive coronavirus test results in the state and 7,503 total COVID-19 deaths. Of the SARS-CoV-2 variants in Wisconsin, DHS is reporting 3,614 known cases of B.1.1.7 (Alpha), 67 cases of B.1.351 (Beta), 828 cases of B.1.617.2 (Delta), and 341 cases of […]",,"['Cora Seibt', 'Brenda Ordonez', 'Tracy Bloom', 'Nexstar Media Wire', 'Denise Craig']",2021-08-19 18:54:38+00:00,2021-08-19T21:15:20+00:00,https://www.wearegreenbay.com/coronavirus/three-n-e-wi-counties-reach-very-high-covid-19-case-activity-levels-over-1-5k-new-cases/,https://www.wearegreenbay.com/wp-content/uploads/sites/70/2020/10/Covid-19-Wisconsin-Blue-MON.jpg?w=1280,
https://news.google.com/articles/CBMiUWh0dHBzOi8vd3d3LmZveDZub3cuY29tL25ld3Mvd2lzY29uc2lucy1jb3ZpZC1icmVha3Rocm91Z2gtY2FzZXMtbW9yZS10aGFuLWRvdWJsZdIBVWh0dHBzOi8vd3d3LmZveDZub3cuY29tL25ld3Mvd2lzY29uc2lucy1jb3ZpZC1icmVha3Rocm91Z2gtY2FzZXMtbW9yZS10aGFuLWRvdWJsZS5hbXA?hl=en-US&gl=US&ceid=US%3Aen,Wisconsin's COVID breakthrough cases more than double,The number of fully vaccinated people in Wisconsin who were hospitalized with COVID-19 more than doubled from February to July.,,"['Jason Calvi', 'Scott Bauer']",,2021-08-19T17:50:47-05:00,https://www.fox6now.com/news/wisconsins-covid-breakthrough-cases-more-than-double,https://images.foxtv.com/static.fox6now.com/www.fox6now.com/content/uploads/2021/08/1280/720/wi-transmission-0819-no-labels.jpg?ve=1&tl=1,false
