article_url,article_title,meta_description,section,authors,publish_date,modified_date,canonical_link,top_image,is_opinion
https://news.google.com/articles/CAIiEONldrM41Ea1hbSAFcVBTr0qMwgEKioIACIQgUMYiNf7Etik57SMcMRnBioUCAoiEIFDGIjX-xLYpOe0jHDEZwYwoYrKBg?hl=en-US&gl=US&ceid=US%3Aen,Apple's stunning new iPad mini 6 might be happening after all,It's the redesign we've been waiting for.,,['Daniel Piper'],2021-08-21 08:00:35+00:00,2021-08-21T08:00:35.002Z,https://www.creativebloq.com/news/ipad-mini-molds-leak,https://cdn.mos.cms.futurecdn.net/5kqWzUfHio2bkHXukzoNcZ-1200-80.jpg,
https://news.google.com/articles/CBMiVmh0dHBzOi8vd3d3LnlhaG9vLmNvbS9lbnRlcnRhaW5tZW50L21pZ2h0LW15c3RlcmlvdXMtc2Vjb25kLWFwcGxlLWV2ZW50LTE2MDMwNDU5NS5odG1s0gFeaHR0cHM6Ly93d3cueWFob28uY29tL2FtcGh0bWwvZW50ZXJ0YWlubWVudC9taWdodC1teXN0ZXJpb3VzLXNlY29uZC1hcHBsZS1ldmVudC0xNjAzMDQ1OTUuaHRtbA?hl=en-US&gl=US&ceid=US%3Aen,There might be a mysterious second Apple event in September after the iPhone 13 launch,"The ongoing chip shortage and the delta variant continue to impact product launch events and operations worldwide. But there’s no indication the iPhone 13 series will see any launch delays this year. Apple announced in late July 2020 that the iPhone 12 press conference would be delayed. At the time, Apple did not mention a … The post There might be a mysterious second Apple event in September after the iPhone 13 launch appeared first on BGR.",,['Chris Smith'],,,https://www.yahoo.com/entertainment/might-mysterious-second-apple-event-160304595.html,https://s.yimg.com/uu/api/res/1.2/zbrfGLY5eSclXMxX08CzYw--~B/aD0xMTI1O3c9MjAwMDthcHBpZD15dGFjaHlvbg--/https://media.zenfs.com/en/bgr_208/3aa7b8c26d14af6b62f88cdbf840534c,
https://news.google.com/articles/CAIiENktaUmW8v6U2DpYQih-EEoqFwgEKg8IACoHCAowyIXgAjCQuhsw0fkk?hl=en-US&gl=US&ceid=US%3Aen,DigiTimes: Apple Planning Multiple Apple Events for September,"Apple is planning to hold multiple product events in September, rather than its strategy from last year to break up its fall product launches into...",,"['Sami Fathi', 'Juli Clover', 'Macrumors Staff', 'Hartley Charlton']",,,https://www.macrumors.com/2021/08/20/digitmes-mulitple-apple-events-for-september/,https://images.macrumors.com/t/ymVYvys_n-zIs2hr3644FOYTokU=/2236x/https://images.macrumors.com/article-new/2020/09/AppleEventLogoFeature.jpg,
https://news.google.com/articles/CAIiEAv2_OYrW77b3JJEQ_UMANoqFQgEKg0IACoGCAowypkBMNBDMNH7AQ?hl=en-US&gl=US&ceid=US%3Aen,"Apple iPad (2021): Rumors, release date, price, features, and more","There are rumors Apple might update its base model iPad later this year, here's what we think we know about the upcoming device.",article,[],2021-08-21 09:42:42-04:00,,https://www.imore.com/apple-ipad-2021-rumors-release-date-price-features-and-more,https://www.imore.com/sites/imore.com/files/styles/large/public/field/image/2021/02/ipad-2020-review-hero.jpg,
https://news.google.com/articles/CAIiEFVQOXwxTQ-xJxl-qGrovywqFwgEKg8IACoHCAowjuuKAzCWrzwwt4QY?hl=en-US&gl=US&ceid=US%3Aen,"Tom T. Hall, Country Music’s ‘Storyteller,’ Is Dead at 85","Mr. Hall, who wrote hits like “Harper Valley P.T.A.,” helped to imbue country lyrics with newfound depth and insight in the 1960s and ’70s.",Arts,['Bill Friskics-Warren'],2021-08-21 14:27:11+00:00,2021-08-21T14:27:23.000Z,https://www.nytimes.com/2021/08/21/arts/music/tom-t-hall-country-musics-storyteller-is-dead-at-85.html,https://static01.nyt.com/images/2021/08/22/us/20-Hall-obit/20-Hall-obit-facebookJumbo.jpg,false
https://news.google.com/articles/CAIiEJZKLkMacMUPAvzgSO_01n8qGQgEKhAIACoHCAowwL2ICzCckocDMOOUqQY?hl=en-US&gl=US&ceid=US%3Aen,"Tom T. Hall, country singer and 'Harper Valley P.T.A.' composer, dead at 85","""Harper Valley P.T.A."" composer Tom T. Hall has died at age 85.",,[],,2021-08-20T22:31:04-04:00,https://www.foxnews.com/entertainment/tom-t-hall-country-singer-and-harper-valley-p-t-a-composer-dead-at-85,https://static.foxnews.com/foxnews.com/content/uploads/2021/08/Tom-T-Hall.jpg,false
https://news.google.com/articles/CAIiEH3YbE5Z7pgrKfelZIYgPW4qGQgEKhAIACoHCAowocv1CjCSptoCMPrTpgU?hl=en-US&gl=US&ceid=US%3Aen,Country Music Hall of Fame artist Tom T. Hall dies at age 85,"Country music singer-songwriter Tom T. Hall died Friday at his home in Franklin, Tennessee, at the age of 85, according to his son.",entertainment,['Rebekah Riess'],,2021-08-21T12:43:19Z,https://www.cnn.com/2021/08/20/entertainment/tom-t-hall-obit/index.html,https://cdn.cnn.com/cnnnext/dam/assets/210820221932-01-tom-t-hall-obit-super-tease.jpg,false
https://news.google.com/articles/CBMibGh0dHBzOi8vd3d3LmJpbGxib2FyZC5jb20vYXJ0aWNsZXMvbmV3cy85NjE3OTYyL2NsaXZlLWRhdmlzLWludGVydmlldy13ZWxjb21lLWJhY2stbnljLWNlbnRyYWwtcGFyay1jb25jZXJ0L9IBcGh0dHBzOi8vd3d3LmJpbGxib2FyZC5jb20vYW1wL2FydGljbGVzL25ld3MvOTYxNzk2Mi9jbGl2ZS1kYXZpcy1pbnRlcnZpZXctd2VsY29tZS1iYWNrLW55Yy1jZW50cmFsLXBhcmstY29uY2VydC8?hl=en-US&gl=US&ceid=US%3Aen,"Clive Davis on 'Welcome Back NYC' Concert, the 'Power' of Central Park & Being 'Vigilant' About COVID","When the city of New York needed someone to help produce an iconic show held on Central Park’s Great Lawn to help signal the return of city life, they called on Clive Davis to mastermind what’s morphed into a genre-spanning affair.",,['Rob Ledonne'],,,https://www.billboard.com/articles/news/9617962/clive-davis-interview-welcome-back-nyc-central-park-concert/,https://static.billboard.com/files/media/Clive-Davis-bb21-2019-bbm-billboard-smptomes-1548-compressed.jpg,
https://news.google.com/articles/CCAiC2F5ZV9QcWRMcDRJmAEB?hl=en-US&gl=US&ceid=US%3Aen,Country singer Tom T. Hall dies; wrote ‘Harper Valley PTA’,Country singer Tom T. Hall dies; wrote ‘Harper Valley PTA’,,[],,,https://www.youtube.com/watch?v=aye_PqdLp4I,https://i.ytimg.com/vi/aye_PqdLp4I/hqdefault.jpg,
https://news.google.com/articles/CAIiECfOm4VfK5yTdpn9dfE_JzMqFggEKg0IACoGCAowoPUEMKAjMP6Y1gU?hl=en-US&gl=US&ceid=US%3Aen,‘Free Guy’ Holding Up Against Pandemic With $17M+; ‘Paw Patrol’ Arrests $13M+ – Box Office,"There are a majority of adult-skewing movies opening this weekend that were poised to perform poorly, and that would still be the case if they were in a pre-pandemic marketplace.",,"[""Anthony D'Alessandro""]",2021-08-21 15:32:16+00:00,2021-08-21T16:46:16+00:00,https://deadline.com/2021/08/ryan-reynolds-free-guy-paw-patrol-weekend-box-office-1234819266/,https://deadline.com/wp-content/uploads/2021/08/free-guy-2-1-e1629557229495.jpg?w=1024,
https://news.google.com/articles/CCAiC0h3R05kSW9xcVdVmAEB?hl=en-US&gl=US&ceid=US%3Aen,Paw Patrol: The Movie | 6 Minute Clip | In Theatres and Now Streaming | Paramount+,"SURPRISE! To celebrate today's release of PAW Patrol: The Movie, we've got a sneak peek at the first six minutes of the movie just for you! Can't get enough?...",,[],,,https://www.youtube.com/watch?v=HwGNdIoqqWU,https://i.ytimg.com/vi/HwGNdIoqqWU/hqdefault.jpg,
https://news.google.com/articles/CAIiEGUyycBcqIukJkXx9e5ukgUqGQgEKhAIACoHCAownsqUCzD9kaoDMIHdyAY?hl=en-US&gl=US&ceid=US%3Aen,Paw Patrol: The Movie Review,"Paw Patrol: The Movie dials up the action and danger for the big screen, offering a nice distraction for kids and a not-the-absolute-worst time for adults.",,[],,,https://www.ign.com/articles/paw-patrol-the-movie-review,https://assets-prd.ignimgs.com/2021/08/18/paw-patrol-3-horizontal-key-art-3840x2160-v2-1-1629304933731.png?width=1280,
https://news.google.com/articles/CBMia2h0dHBzOi8vd3d3LmhvbGx5d29vZHJlcG9ydGVyLmNvbS9tb3ZpZXMvbW92aWUtbmV3cy9mcmVlLWd1eS1ib3gtb2ZmaWNlLXBhdy1wYXRyb2wtcmVtaW5pc2NlbmNlLTEyMzUwMDExMDEv0gFvaHR0cHM6Ly93d3cuaG9sbHl3b29kcmVwb3J0ZXIuY29tL21vdmllcy9tb3ZpZS1uZXdzL2ZyZWUtZ3V5LWJveC1vZmZpY2UtcGF3LXBhdHJvbC1yZW1pbmlzY2VuY2UtMTIzNTAwMTEwMS9hbXAv?hl=en-US&gl=US&ceid=US%3Aen,Box Office: ‘Free Guy’ Heads for Happy $17M; ‘PAW Patrol’ Eyes $14M,'Free Guy' grossed $5.2 million on its second box office Friday while 'The Protégé' and 'Reminiscence' fall apart in their box office debuts.,,['Pamela Mcclintock'],2021-08-21 16:20:22+00:00,2021-08-21T17:11:50+00:00,https://www.hollywoodreporter.com/movies/movie-news/free-guy-box-office-paw-patrol-reminiscence-1235001101/,https://www.hollywoodreporter.com/wp-content/uploads/2019/06/paw_patrol_still.jpg?w=1024,
https://news.google.com/articles/CAIiELbLlSYCQSPpMyHvdnUk3_YqGQgEKhAIACoHCAowocv1CjCSptoCMIrUpgU?hl=en-US&gl=US&ceid=US%3Aen,Former R. Kelly tour manager reluctantly testifies about the singer's marriage to Aaliyah,"A former tour manager for R. Kelly told jurors on Friday that he was with Kelly and the late singer Aaliyah the day they applied for a marriage license in 1994, when she was just 15 years old.",us,['Sonia Moghe'],,2021-08-21T16:07:53Z,https://www.cnn.com/2021/08/21/us/r-kelly-trial-testimony-friday/index.html,https://cdn.cnn.com/cnnnext/dam/assets/210820233617-aaliyah-r-kelly-split-super-tease.jpg,false
https://news.google.com/articles/CBMiRmh0dHBzOi8vd3d3LnlhaG9vLmNvbS9uZXdzL3Ita2VsbHlzLWZvcm1lci10b3VyLW1hbmFnZXItMDIwMDQxMzE2Lmh0bWzSAU9odHRwczovL25ld3MueWFob28uY29tL2FtcGh0bWwvbmV3cy9yLWtlbGx5cy1mb3JtZXItdG91ci1tYW5hZ2VyLTAyMDA0MTMxNi5odG1s?hl=en-US&gl=US&ceid=US%3Aen,"R. Kelly's former tour manager was forced to testify, said the singer got 15-year-old Aaliyah pregnant",Demetrius Smith said he bribed an official to get Aaliyah a fake ID. He was ordered to take the stand about the night R. Kelly wed his child bride.,,['Haven Orecchio-Egresitz'],,,https://www.insider.com/manager-forced-to-testify-r-kelly-getting-aaliyah-pregnant-2021-8,https://s.yimg.com/ny/api/res/1.2/fEvsXBBli2Sxml7tk3uhHA--/YXBwaWQ9aGlnaGxhbmRlcjt3PTIwMDA7aD0xNTAw/https://s.yimg.com/uu/api/res/1.2/tXGwKN7fmk_2_deXUA2zUw--~B/aD0yMjY4O3c9MzAyNDthcHBpZD15dGFjaHlvbg--/https://media.zenfs.com/en/insider_articles_922/6892758be9084356fcba158bffc60556,
https://news.google.com/articles/CAIiEO3Vup84sUYIVcU07t3-U6gqGAgEKg8IACoHCAowhK-LAjD4ySww-9S0BQ?hl=en-US&gl=US&ceid=US%3Aen,R. Kelly married Aaliyah at 15 because he thought she was pregnant: ex-tour manager,"R. Kelly married the late pop star Aaliyah when she was just 15 because he believed she was pregnant -- part of a bid by the R&B singer to avoid jail, his former tour manager testified in Brooklyn federal court Friday.",,"['Social Links For Elizabeth Rosner', ""Social Links For Natalie O'Neill""]",2021-08-21 01:26:02+00:00,2021-08-21T01:38:06+00:00,https://nypost.com/2021/08/20/r-kelly-married-aaliyah-at-15-because-he-thought-she-was-pregnant-ex-tour-manager/,https://nypost.com/wp-content/uploads/sites/2/2021/08/r-kelly-aaliyah-050.jpg?quality=90&strip=all&w=1024,false
https://news.google.com/articles/CAIiEPGveL8jnljDoBnLAgI55eIqFwgEKg8IACoHCAowjuuKAzCWrzwwloIY?hl=en-US&gl=US&ceid=US%3Aen,"Ex-Manager Says R. Kelly Thought Aaliyah, 15, Was Pregnant With His Baby","The third day of Mr. Kelly’s trial focused on his 1994 marriage to the singer, which prompted early scrutiny of his dealings with underage girls.",New York,"['Troy Closson', 'Emily Palmer']",2021-08-20 18:24:57+00:00,2021-08-21T00:17:59.000Z,https://www.nytimes.com/2021/08/20/nyregion/r-kelly-trial-racketeering.html,https://static01.nyt.com/images/2021/08/20/nyregion/20kelly02/20kelly02-facebookJumbo.jpg,false
https://news.google.com/articles/CBMiR2h0dHBzOi8vd3d3LnlhaG9vLmNvbS9uZXdzL3Ita2VsbHktZW1wbG95ZWUtc2F5cy13b3JraW5nLTIxMTEwMDA2Ny5odG1s0gFQaHR0cHM6Ly9uZXdzLnlhaG9vLmNvbS9hbXBodG1sL25ld3Mvci1rZWxseS1lbXBsb3llZS1zYXlzLXdvcmtpbmctMjExMTAwMDY3Lmh0bWw?hl=en-US&gl=US&ceid=US%3Aen,"R. Kelly employee says working for singer was weirder than gigs with Kanye, Jay-Z, Taylor Swift: ‘It was almost like the Twilight Zone’","NEW YORK — A former employee of R&B superstar R. Kelly testified Friday that working for the singer was far stranger than others gigs with artists such as Kanye West, Jay-Z and Taylor Swift. Anthony Navarro, who worked for Kelly at his mansion in the Chicago suburbs between 2008 and 2009, told jurors that his experience working for Kelly was unlike any other music industry job. “It was almost ...",,"['Noah Goldberg', 'New York Daily News']",,,https://www.nydailynews.com/new-york/ny-r-kelly-trial-demetrius-smith-racketeering-sex-trafficking-20210820-anydeomd6zhrjkzmjk3kd3gi3a-story.html,https://s.yimg.com/uu/api/res/1.2/UQvqhzcr8k7QarBiocdYQQ--~B/aD0xMzM0O3c9MjAwMDthcHBpZD15dGFjaHlvbg--/https://media.zenfs.com/en/ny_daily_news_national_852/f0fa9ec65454b90f94e8105752625138,
https://news.google.com/articles/CCAiC3BOSGxEVEUtaGhNmAEB?hl=en-US&gl=US&ceid=US%3Aen,How Kylie Jenner & Travis Scott Are Prepping for Baby No. 2 | E! News,"After loyal fans of the ""KUWTK"" star figured out was expecting, a source tells E! News how Kylie and Travis Scott are preparing for their 2nd pregnancy!",,[],,,https://www.youtube.com/watch?v=pNHlDTE-hhM,https://i.ytimg.com/vi/pNHlDTE-hhM/maxresdefault.jpg,
https://news.google.com/articles/CAIiECFt0UrTzASfChAagSg1-CoqGQgEKhAIACoHCAow4bOVCzDCl6sDMPaglQc?hl=en-US&gl=US&ceid=US%3Aen,"Kylie Jenner is pregnant, expecting second child with Travis Scott","Kylie Jenner, 24, and Travis Scott, 30, are already parents to 3-year-old daughter, Stormi.",,[],,,https://www.yahoo.com/entertainment/kylie-jenner-pregnant-second-baby-travis-scott-181949385.html,https://s.yimg.com/ny/api/res/1.2/hpXlmygV2AcKX6vcmoUEnA--/YXBwaWQ9aGlnaGxhbmRlcjt3PTIwMDA7aD0xODUx/https://s.yimg.com/os/creatr-uploaded-images/2021-08/8de395c0-01df-11ec-bfdc-be7b7172e575,
https://news.google.com/articles/CCAiC1JsS0NsN1g0Rjd3mAEB?hl=en-US&gl=US&ceid=US%3Aen,Kylie Jenner PREGNANT With Baby No. 2,"Kylie Jenner is pregnant with her second child, multiple sources tell ET. The 24-year-old makeup mogul is already a mom to 3-year-old daughter Stormi, whom s...",,[],,,https://www.youtube.com/watch?v=RlKCl7X4F7w,https://i.ytimg.com/vi/RlKCl7X4F7w/maxresdefault.jpg,
https://news.google.com/articles/CAIiEJJktfQEpl4yeCjTgatsrioqGQgEKhAIACoHCAowmID5CjDdtOACMLzWtAU?hl=en-US&gl=US&ceid=US%3Aen,Caitlyn Jenner’s son Burt’s girlfriend is pregnant with third child,"Caitlyn Jenner's son Burt Jenner's girlfriend, Valerie Pitalo, is pregnant with their third child.",,['August'],2021-08-20 18:15:13+00:00,2021-08-20T19:14:49+00:00,https://pagesix.com/2021/08/20/caitlyn-jenners-son-burts-girlfriend-pregnant-with-3rd-child/,https://pagesix.com/wp-content/uploads/sites/3/2021/08/burt-jenner.jpg?quality=90&strip=all&w=1200,false
https://news.google.com/articles/CBMiSGh0dHBzOi8vbmV3cy55YWhvby5jb20vY2FpdGx5bi1qZW5uZXItcmV2ZWFscy1zaGUtYW5vdGhlci0xNjQ1MTU2NjUuaHRtbNIBUGh0dHBzOi8vbmV3cy55YWhvby5jb20vYW1waHRtbC9jYWl0bHluLWplbm5lci1yZXZlYWxzLXNoZS1hbm90aGVyLTE2NDUxNTY2NS5odG1s?hl=en-US&gl=US&ceid=US%3Aen,Caitlyn Jenner Reveals She Has Another Grandchild on the Way: 'Found That Out the Other Day',"Caitlyn Jenner said while campaigning at a California toy store that she has a 19th grandchild ""in the oven""",,['Benjamin Vanhoose'],,,https://people.com/parents/caitlyn-jenner-reveals-another-grandchild-on-the-way-just-found-out/,https://s.yimg.com/uu/api/res/1.2/yYmczhGkKdRzwBOSVttRQg--~B/aD0xMDAwO3c9MTUwMDthcHBpZD15dGFjaHlvbg--/https://media.zenfs.com/en/people_218/1997f5fdb8e03262414f076755c0e636,
https://news.google.com/articles/CAIiEHPUbkxhPTAsCW-bMXv5vGsqFQgEKgwIACoFCAowhgIwkDgwtPqTBw?hl=en-US&gl=US&ceid=US%3Aen,Pacquiao eyes Philippine presidency as he fights for boxing crown,A victory by the eight time world boxing champion against Cuban Yordenis Ugás could recalibrate 2022 presidential race.,,['Jc Gotinga'],,,https://www.aljazeera.com/news/2021/8/21/manny-pacquiao-fights-for-a-boxing-crown-philippine-presidency,https://www.aljazeera.com/wp-content/uploads/2021/08/2021-08-11T190140Z_225966911_RC273P91XL57_RTRMADP_3_BOXING-PACQUIAO-UGAS.jpg?resize=1200%2C630,
https://news.google.com/articles/CBMiS2h0dHBzOi8vbmV3cy55YWhvby5jb20vY29tbWVudGFyeS1tdXN0LW1hbm55LXBhY3F1aWFvcy1maW5hbC0xMjAwMzIyMjkuaHRtbNIBU2h0dHBzOi8vbmV3cy55YWhvby5jb20vYW1waHRtbC9jb21tZW50YXJ5LW11c3QtbWFubnktcGFjcXVpYW9zLWZpbmFsLTEyMDAzMjIyOS5odG1s?hl=en-US&gl=US&ceid=US%3Aen,Commentary: This is why tonight must be Manny Pacquiao's final fight,Manny Pacquiao caught a break when Errol Spence Jr. went down with an eye injury and must close his boxing career against Yordenis Ugás or risk ending his career being beaten into submission.,,['Dylan Hernández'],,,https://news.yahoo.com/commentary-must-manny-pacquiaos-final-120032229.html,https://s.yimg.com/uu/api/res/1.2/YcH65KIUvSifE2poed.iQw--~B/aD01NjA7dz04NDA7YXBwaWQ9eXRhY2h5b24-/https://media.zenfs.com/en/la_times_articles_853/baab7468440b1e06a083e629b9951837,
https://news.google.com/articles/CBMiUGh0dHBzOi8vd3d3LmZveGJ1c2luZXNzLmNvbS9mZWF0dXJlcy9tYW5ueS1wYXF1aWFvcy1wb2xpdGljcy1pbnRlcnZpZXctZ2FzcGFyaW5v0gFUaHR0cHM6Ly93d3cuZm94YnVzaW5lc3MuY29tL2ZlYXR1cmVzL21hbm55LXBhcXVpYW9zLXBvbGl0aWNzLWludGVydmlldy1nYXNwYXJpbm8uYW1w?hl=en-US&gl=US&ceid=US%3Aen,"Manny Pacquiao’s future: Politics, cryptos, hydrogen water after Ugás fight","Boxing legend Manny Pacquiao joins FOX Business Senior Correspondent, Charlie Gasparino, to discuss his next big fight, politics and crypto.",,['Charlie Gasparino'],,2021-08-20T19:37:42-04:00,https://www.foxbusiness.com/features/manny-paquiaos-politics-interview-gasparino,https://a57.foxnews.com/static.foxbusiness.com/foxbusiness.com/content/uploads/2018/02/0/0/Manny-Pacquiao-2.jpg?ve=1&tl=1,false
https://news.google.com/articles/CBMib2h0dHBzOi8vd3d3LnJldmlld2pvdXJuYWwuY29tL3Nwb3J0cy9ib3hpbmcvbWFubnktcGFjcXVpYW8tYW1hemluZ2x5LWhvbGRzLWhpcy1vd24tYWdhaW5zdC1mYXRoZXItdGltZS0yNDI0Mzc5L9IBc2h0dHBzOi8vd3d3LnJldmlld2pvdXJuYWwuY29tL3Nwb3J0cy9ib3hpbmcvbWFubnktcGFjcXVpYW8tYW1hemluZ2x5LWhvbGRzLWhpcy1vd24tYWdhaW5zdC1mYXRoZXItdGltZS0yNDI0Mzc5L2FtcC8?hl=en-US&gl=US&ceid=US%3Aen,Manny Pacquiao amazingly holds his own against Father Time,The 42-year-old Manny Pacquiao will fight at least once more on Saturday. This time at T-Mobile Arena against WBA welterweight champion Yordenis Ugas.,,['Las Vegas Review-Journal'],2021-08-21 00:18:11+00:00,2021-08-21T03:14:03+00:00,https://www.reviewjournal.com/sports/boxing/manny-pacquiao-amazingly-holds-his-own-against-father-time-2424379/,https://www.reviewjournal.com/wp-content/uploads/2021/08/BOX-PACQUIAO_081921ev_002.jpg,
https://news.google.com/articles/CBMigQFodHRwczovL3d3dy5jYnNzcG9ydHMuY29tL2JveGluZy9uZXdzL21hbm55LXBhY3F1aWFvLXZzLXlvcmRlbmlzLXVnYXMtZmlnaHQtcHJlZGljdGlvbnMtb2Rkcy11bmRlcmNhcmQtZXhwZXJ0LXBpY2tzLWRhdGUtcHJldmlldy_SAYUBaHR0cHM6Ly93d3cuY2Jzc3BvcnRzLmNvbS9ib3hpbmcvbmV3cy9tYW5ueS1wYWNxdWlhby12cy15b3JkZW5pcy11Z2FzLWZpZ2h0LXByZWRpY3Rpb25zLW9kZHMtdW5kZXJjYXJkLWV4cGVydC1waWNrcy1kYXRlLXByZXZpZXcvYW1wLw?hl=en-US&gl=US&ceid=US%3Aen,"Manny Pacquiao vs. Yordenis Ugas fight predictions, odds, undercard, expert picks, date, preview",A WBA unification bout headlines the PPV attraction on Saturday night in Las Vegas when the Filipino legend returns,,"['Brian Campbell', 'Min Read', 'Brent Brookhouse', 'Brandon Wise', 'Pete Blackburn']",,,https://www.cbssports.com/boxing/news/manny-pacquiao-vs-yordenis-ugas-fight-predictions-odds-undercard-expert-picks-date-preview/,https://sportshub.cbsistatic.com/i/r/2021/08/20/09515852-68ba-4d23-be77-00db30b4a1b9/thumbnail/1200x675/44f3d183fc43eb524874e201a3c61c81/pacquiao-ugas.jpg,false
https://news.google.com/articles/CBMiggFodHRwczovL3d3dy5jYnNzcG9ydHMuY29tL25mbC9uZXdzL2JlYXJzLXZzLWJpbGxzLW5mbC1wcmVzZWFzb24td2Vlay0yLXNjb3JlLWxhdGVzdC11cGRhdGVzLXR2LWNoYW5uZWwtbGl2ZS1zdHJlYW0tdGltZS1vZGRzL2xpdmUv0gEA?hl=en-US&gl=US&ceid=US%3Aen,"Bears vs. Bills NFL preseason Week 2 score: Latest updates, TV channel, live stream, time, odds",Mitchell Trubisky returns to Chicago as the Bears get a look at both Andy Dalton and Justin Fields,,"['Tyler Sullivan', 'Min Read']",,,https://www.cbssports.com/nfl/news/bears-vs-bills-nfl-preseason-week-2-score-latest-updates-tv-channel-live-stream-time-odds/live/,https://sportshub.cbsistatic.com/i/r/2021/08/21/72615972-4fdc-4316-8649-a50b1cc7b72f/thumbnail/1200x675/a122de234175fe0bcfa828b54ddee248/fields88.jpg,
https://news.google.com/articles/CBMiRmh0dHBzOi8vc3BvcnRzLnlhaG9vLmNvbS90YXJpay1jb2hlbi1tZXNzYWdlLWJlYXJzLWZhbnMtMTcyOTA5NTAwLmh0bWzSAU5odHRwczovL3Nwb3J0cy55YWhvby5jb20vYW1waHRtbC90YXJpay1jb2hlbi1tZXNzYWdlLWJlYXJzLWZhbnMtMTcyOTA5NTAwLmh0bWw?hl=en-US&gl=US&ceid=US%3Aen,Tarik Cohen has a message for Bears fans who plan to boo Mitch Trubisky in return to Soldier Field,"Instead of booing Mitch Trubisky in his return to Soldier Field, maybe try cheering for Justin Fields, who is the Bears' future.",,['Alyssa Barbieri'],,,https://bearswire.usatoday.com/2021/08/20/chicago-bears-news-tarik-cohen-mitch-trubisky-fan-reaction/,https://s.yimg.com/ny/api/res/1.2/fy_RtTjyLYANboQM1pRpKg--/YXBwaWQ9aGlnaGxhbmRlcjt3PTIwMDA7aD0xMzMz/https://s.yimg.com/uu/api/res/1.2/SyyvVKoF19vfkT1GOUMZdA--~B/aD0xNzA2O3c9MjU2MDthcHBpZD15dGFjaHlvbg--/https://media.zenfs.com/en/chicago_bears_wire_usa_today_sports_articles_533/88ee82283b475a46d099908c006c2c58,
https://news.google.com/articles/CAIiEHcUX8bPNFeu80hGzvptbJgqFwgEKg4IACoGCAowlPVUMLXBDDD0ocAD?hl=en-US&gl=US&ceid=US%3Aen,"Andy Dalton will get more snaps — how much progress can he make? 5 things to watch for when the Chicago Bears host the Buffalo Bills, including Mitch Trubisky’s return.",Chicago Bears coach Matt Nagy’s plan is to have Andy Dalton play deep into the second quarter Saturday with hopes that much of the first-unit offense can work through three or four possessions to build the momentum they couldn’t generate a week ago.,"Chicago Bears, Sports, Breaking Sports","['Dan Wiederer', 'Colleen Kane']",,,https://www.chicagotribune.com/sports/bears/ct-cb-chicago-bears-andy-dalton-mitch-trubisky-buffalo-bills-20210820-uxemvcssgbddrjxiqddijdcf5m-story.html,https://www.chicagotribune.com/resizer/SqYWMRA4EjqGEXEPdGBXoYHIrBc=/1200x0/left/top/cloudfront-us-east-1.images.arcpublishing.com/tronc/QJIF6DAPOFAIPN56VBHVYEEBEI.jpg,false
https://news.google.com/articles/CAIiEP2AgXNv-Ul1Zplwnx3TpbQqGQgEKhAIACoHCAowzNiACzDjgY0DMJS6-wU?hl=en-US&gl=US&ceid=US%3Aen,Bears vs Bills: 6 things to watch for,"The Chicago Bears and Buffalo Bills will be facing off in preseason game number two tomorrow at noon (CT), and there will be several things I’ll be watching for in the game. 
Here are six of...",,"['Lester A. Wiltfong Jr.', 'Aug']",2021-08-20 15:00:00-05:00,2021-08-20T15:00:00-05:00,https://www.windycitygridiron.com/2021/8/20/22634426/chicago-bears-vs-buffalo-bills-5-things-to-watch-for-andy-dalton-justin-fields-trubisky-larry-borom,https://cdn.vox-cdn.com/thumbor/HlfqiZhrUGT6zoNehHyX9zZUIJ4=/0x0:3505x1835/fit-in/1200x630/cdn.vox-cdn.com/uploads/chorus_asset/file/22795527/usa_today_16563502.jpg,
https://news.google.com/articles/CAIiEFlw7sHnkaoh4MgfUAvEm1cqGQgEKhAIACoHCAowkOudCzCh9bUDMPro6AY?hl=en-US&gl=US&ceid=US%3Aen,Chicago Bears Who Need A Big Game The Most Vs. Buffalo,Several Chicago Bears face the prospect of losing their roster spots with a bad performance this weekend. Who should be getting nervous?,,"['Educated To Be A Writer At The Prestigious Columbia College In Chicago', 'Erik Has Spent The Past Years Covering The Bears.']",2021-08-21 03:02:47+00:00,,https://www.sportsmockery.com/chicago-bears/chicago-bears-who-need-a-big-game-the-most-vs-buffalo/,https://c3n7e3u2.stackpathcdn.com/wp-content/uploads/2021/08/Desmond-Trufant.jpg,
https://news.google.com/articles/CAIiEEr6nbqcx1ZZFwXIlKI45VQqGQgEKhAIACoHCAowurmECzCOhIEDMMrtggY?hl=en-US&gl=US&ceid=US%3Aen,UFC Vegas 34’s Kelvin Gastelum discusses USADA’s new marijuana policy: ‘It’s one less worry that I need to have’,Middleweight contender Kelvin Gastelum discusses USADA’s new policy on marijuana use ahead of his clash with Jared Cannonier this weekend at UFC Vegas 34 live on ESPN.,,"['Dan Hiergesell', 'Aug']",2021-08-21 09:57:55-04:00,2021-08-21T09:57:55-04:00,https://www.mmamania.com/2021/8/21/22634887/ufc-vegas-34s-kelvin-gastelum-discusses-usadas-new-marijuana-stance-mma-espn-cannonier,https://cdn.vox-cdn.com/thumbor/vbaksmvJb22crM415_I101kUrqc=/0x0:3000x1571/fit-in/1200x630/cdn.vox-cdn.com/uploads/chorus_asset/file/22796929/1234751389.jpg,
https://news.google.com/articles/CCAiC2xaeHBPcjM4MzBNmAEB?hl=en-US&gl=US&ceid=US%3Aen,UFC Vegas 34: Cannonier vs Gastelum Weigh-in,"Subscribe to get all the latest UFC content: http://bit.ly/2uJRzRRExperience UFC live with UFC FIGHT PASS, the digital subscription service of the UFC. Visit...",,[],,,https://www.youtube.com/watch?v=lZxpOr3830M,https://i.ytimg.com/vi/lZxpOr3830M/maxresdefault.jpg,
https://news.google.com/articles/CBMikwFodHRwczovL3d3dy5tbWFmaWdodGluZy5jb20vMjAyMS84LzIwLzIyNjM0Mjg1L3VmYy12ZWdhcy0zNC13ZWlnaC1pbi1yZXN1bHRzLWtlbHZpbi1nYXN0ZWx1bS1uZWVkcy1hZGRpdGlvbmFsLWhvdXItbWFrZS13ZWlnaHQtaGl0cy1tYXJrLW1haW4tZXZlbnTSAaABaHR0cHM6Ly93d3cubW1hZmlnaHRpbmcuY29tL3BsYXRmb3JtL2FtcC8yMDIxLzgvMjAvMjI2MzQyODUvdWZjLXZlZ2FzLTM0LXdlaWdoLWluLXJlc3VsdHMta2VsdmluLWdhc3RlbHVtLW5lZWRzLWFkZGl0aW9uYWwtaG91ci1tYWtlLXdlaWdodC1oaXRzLW1hcmstbWFpbi1ldmVudA?hl=en-US&gl=US&ceid=US%3Aen,"UFC Vegas 34 weigh-in results: Kelvin Gastelum needs additional time to make weight, hits mark for main event",Kelvin Gastelum needed extra time to make weight for his main event bout opposite Jared Cannonier at UFC Vegas 34.,,"['Alexander K. Lee', 'Aug']",2021-08-20 14:28:49-04:00,2021-08-20T14:28:49-04:00,https://www.mmafighting.com/2021/8/20/22634285/ufc-vegas-34-weigh-in-results-kelvin-gastelum-needs-additional-hour-make-weight-hits-mark-main-event,https://cdn.vox-cdn.com/thumbor/J-bK8DRmjLGFg1NUq6whd_kNT5E=/0x0:6614x3463/fit-in/1200x630/cdn.vox-cdn.com/uploads/chorus_asset/file/22795535/1335276570.jpg,
https://news.google.com/articles/CCAiCzNhQ2JwRDV4R2hjmAEB?hl=en-US&gl=US&ceid=US%3Aen,Kelvin Gastelum Believes A Win Over Cannonier Would Put Him Back In Title Contention | TMZ Sports,We talked to 29-year-old Gastelum -- the #9 ranked middleweight (doesn't agree with his ranking) -- and he also believes a win of Cannonier would put him rig...,,[],,,https://www.youtube.com/watch?v=3aCbpD5xGhc,https://i.ytimg.com/vi/3aCbpD5xGhc/maxresdefault.jpg,
