article_url,article_title,meta_description,section,authors,publish_date,modified_date,canonical_link,top_image,is_opinion
https://news.google.com/articles/CBMiUmh0dHBzOi8vd3d3LmZveG5ld3MuY29tL21lZGlhL2Nubi1tYXRoZXctZG93ZC1iaWRlbi1leHRyZW1lbHktZ29vZC1qb2ItYWZnaGFuaXN0YW7SAVZodHRwczovL3d3dy5mb3huZXdzLmNvbS9tZWRpYS9jbm4tbWF0aGV3LWRvd2QtYmlkZW4tZXh0cmVtZWx5LWdvb2Qtam9iLWFmZ2hhbmlzdGFuLmFtcA?hl=en-US&gl=US&ceid=US%3Aen,CNN guest says Biden has done an 'extremely good job' on Afghanistan amid chaos: He 'should be congratulated',"Political commentator Matthew Dowd went above and beyond with his gushing over President Biden, making the case during his CNN appearance that he should be praised for his handling of the turbulent military withdrawal from Afghanistan.",,"['Joseph Wulfsohn', 'Joseph A. Wulfsohn Is A Media Reporter For Fox News. Follow Him On Twitter']",,2021-08-25T09:43:46-04:00,https://www.foxnews.com/media/cnn-mathew-dowd-biden-extremely-good-job-afghanistan,https://static.foxnews.com/foxnews.com/content/uploads/2021/08/Matthew-Dowd-GETTY-2.jpg,false
https://news.google.com/articles/CCAiCzNUN1VuaVlQbWE4mAEB?hl=en-US&gl=US&ceid=US%3Aen,'It was so scary': American describes getting to Kabul airport after Taliban takeover,"Salma Kazemi, an American who was in Kabul, Afghanistan, visiting family, describes the chaos she experienced as she escaped the besieged city. #CNN #News",,[],,,https://www.youtube.com/watch?v=3T7UniYPma8,https://i.ytimg.com/vi/3T7UniYPma8/maxresdefault.jpg,
https://news.google.com/articles/CAIiEBEmsCQIFOgpDIOyMx6vcU0qGQgEKhAIACoHCAowwL2ICzCckocDMMaPqQY?hl=en-US&gl=US&ceid=US%3Aen,"With Biden poll numbers plunging, Democrats worry Afghan exit may impact next year's elections",The rushed U.S. evacuation in Afghanistan appears to be a key contributing factor in the plunge in President Biden's approval rating in new polls. Some Democrats are worried the political fallout could impair their prospects in the 2022 midterms.,,"['Paul Steinhauser', 'Paul Steinhauser Is A Politics Reporter Based In New Hampshire.']",,2021-08-25T11:24:57-04:00,https://www.foxnews.com/politics/biden-poll-numbers-plunging-democrats-worry-afghanistan-midterms,https://static.foxnews.com/foxnews.com/content/uploads/2021/02/Biden3.jpg,false
https://news.google.com/articles/CAIiEM4L8BefYVL3xBw7OZVVtvkqGAgEKg8IACoHCAowjuuKAzCWrzwworyzBg?hl=en-US&gl=US&ceid=US%3Aen,The Afghan Army Collapsed Against the Taliban. Here’s Why. - The New York Times,It pains me to see President Biden and other Western officials blame the Afghan Army for collapsing but not mention why that happened.,Opinion,['Sami Sadat'],2021-08-25 09:34:49+00:00,2021-08-25T18:17:50.605Z,https://www.nytimes.com/2021/08/25/opinion/afghanistan-taliban-army.html,https://static01.nyt.com/images/2021/08/25/opinion/25sadat/merlin_192574980_6b307b17-5f9b-4641-a7db-32d7984ffed5-facebookJumbo.jpg,true
https://news.google.com/articles/CBMifWh0dHBzOi8vd3d3LmJhbHRpbW9yZXN1bi5jb20vbWFyeWxhbmQvY2Fycm9sbC9vcGluaW9uL2NjLW9wLXJvZW1lci1hZmdoYW5pc3Rhbi0yMDIxMDgyNS03ZnloNG5rYWhiZTJ2aHJlamp6eTN2bTVqYS1zdG9yeS5odG1s0gEA?hl=en-US&gl=US&ceid=US%3Aen,Chris Roemer: Nothing can mask Biden’s Afghanistan blunders | COMMENTARY,"President Joe Biden’s allies were caught flat-footed by events in Afghanistan. What was happening was a catastrophe, and there was just no way to defend the utter incompetence so clearly on display for the world to see.",Carroll County Times Opinion,['Chris Roemer'],,,https://www.baltimoresun.com/maryland/carroll/opinion/cc-op-roemer-afghanistan-20210825-7fyh4nkahbe2vhrejjzy3vm5ja-story.html,https://www.baltimoresun.com/resizer/yavhYKh7sdcgecaN7xSSVei7wps=/1200x0/top/cloudfront-us-east-1.images.arcpublishing.com/tronc/KUHKYUFOVNQD6RWUONEJUL4GEU.jpg,false
https://news.google.com/articles/CAIiEPcCrkB0tsNkUAiPbs6Yv50qGAgEKg8IACoHCAowjtSUCjC30XQwzqe5AQ?hl=en-US&gl=US&ceid=US%3Aen,More than half of Florida’s students now go to schools mandating masks in defiance of DeSantis,"There are now 10 school districts, including two in counties that supported President Donald Trump in 2020, that have voted for mask mandates, defying a decree by the governor.",The Answer Sheet,[],2021-08-25 09:00:51.645000+00:00,2021-08-25T16:09:08.621Z,https://www.washingtonpost.com/education/2021/08/25/florida-mask-mandate-revolt-grows/,https://www.washingtonpost.com/wp-apps/imrs.php?src=https://arc-anglerfish-washpost-prod-washpost.s3.amazonaws.com/public/NANKMYAEYUI6ZM6EYRRLD3OPZA.jpg&w=1440,false
https://news.google.com/articles/CAIiENhr_iY4274dQH_w8VFi4OIqGQgEKhAIACoHCAownvOTCzCHjqkDMLa6lAc?hl=en-US&gl=US&ceid=US%3Aen,Florida is the only state where more people are dying of COVID now than ever before. What went wrong?,"Ron DeSantis is the first (and so far only) governor in the U.S. whose state is now recording more COVID-19 deaths each day — long after free, safe and effective vaccines became widely available to all Americans age 12 or older — than during any previous wave of the virus.",,[],,,https://news.yahoo.com/florida-is-the-only-state-where-more-people-are-dying-of-covid-now-than-ever-before-what-went-wrong-090001893.html,https://s.yimg.com/ny/api/res/1.2/a7DRwYGP9iMuqi.P_JQRtg--/YXBwaWQ9aGlnaGxhbmRlcjt3PTEyMDA7aD02NzU-/https://s.yimg.com/os/creatr-uploaded-images/2021-08/c11cbd90-050e-11ec-aefb-1791be9167ca,
https://news.google.com/articles/CCAiC3ZRR2pfRFNXU3Q4mAEB?hl=en-US&gl=US&ceid=US%3Aen,Judge To Rule On Mask Mandate Lawsuit Involving Gov. Ron DeSantis,"The hearing comes after several school districts, including Broward and Miami-Dade, implemented mask mandates for the new school year, going against the gove...",,[],,,https://www.youtube.com/watch?v=vQGj_DSWSt8,https://i.ytimg.com/vi/vQGj_DSWSt8/maxresdefault.jpg,
https://news.google.com/articles/CBMiXWh0dHBzOi8vd3d3LnVzbmV3cy5jb20vbmV3cy9iZXN0LXN0YXRlcy9mbG9yaWRhL2FydGljbGVzLzIwMjEtMDgtMjUvZWRpdG9yaWFsLXJvdW5kdXAtZmxvcmlkYdIBAA?hl=en-US&gl=US&ceid=US%3Aen,Editorial Roundup: Florida,"Miami Herald. August 20, 2021.",,"['Associated Press', 'Aug.', 'At A.M.']",,,https://www.usnews.com/news/best-states/florida/articles/2021-08-25/editorial-roundup-florida,https://news.google.com/static/images/favicon.ico,
https://news.google.com/articles/CAIiEN_9Oi134xqONlumZO00rEsqGAgEKg8IACoHCAowjtSUCjC30XQwzqe5AQ?hl=en-US&gl=US&ceid=US%3Aen,Opinion : Ron DeSantis’s anti-mask mania is deeply unpopular. Democrats must jump on that.,Large majorities are rejecting just about every one of the Florida governor's covid-19 stances.,The Plum Line,[],2021-08-24 20:42:01.496000+00:00,2021-08-24T21:01:22.442Z,https://www.washingtonpost.com/opinions/2021/08/24/ron-desantis-anti-mask-mania-is-deeply-unpopular-democrats-must-jump-that/,https://www.washingtonpost.com/wp-apps/imrs.php?src=https://arc-anglerfish-washpost-prod-washpost.s3.amazonaws.com/public/KVQFSHQB4MI6ZB7APYD33HHCOA.jpg&w=1440,true
https://news.google.com/articles/CAIiEHuz-52atGysmZOvueFyEoUqGQgEKhAIACoHCAowyNj6CjDyiPICMKb_xAU?hl=en-US&gl=US&ceid=US%3Aen,2 congressmen secretly visited Kabul during evacuation efforts,"Representatives Seth Moulton and Peter Meijer, both Iraq War veterans, made a stealth visit to the Hamid Karzai International Airport as the U.S. evacuates Americans and Afghan allies.",,['Caitlin Yilek'],,,https://www.cbsnews.com/news/congressmen-seth-moulton-peter-meijer-visit-kabul-afghanistan-airport/,https://cbsnews2.cbsistatic.com/hub/i/r/2021/08/25/e35fd53d-2b6f-41a7-8c89-6b11765cf2c1/thumbnail/1200x630/6717d70b932afcac763858b6d9bd5847/gettyimages-1234774395.jpg,false
https://news.google.com/articles/CAIiEGOtIcDDdSe34eBVMnYW0JoqGAgEKg8IACoHCAowjtSUCjC30XQw36e5AQ?hl=en-US&gl=US&ceid=US%3Aen,Two Congress members make unauthorized trip to Kabul amid evacuation efforts,"Reps. Seth Moulton (D-Mass.) and Peter Meijer (R-Mich.), who both served in Iraq before being elected to Congress, returned home via a U.S. military flight used for evacuating U.S. citizens, allies and vulnerable Afghans.",Politics,[],2021-08-24 23:50:37+00:00,2021-08-25T14:22:48.623Z,https://www.washingtonpost.com/politics/congress-kabul-trip-evacuation/2021/08/24/77f7673a-0501-11ec-a266-7c7fe02fa374_story.html,https://www.washingtonpost.com/wp-apps/imrs.php?src=https://arc-anglerfish-washpost-prod-washpost.s3.amazonaws.com/public/XEXVIDUYMMI6TDIKL3OX4IBFWE.jpg&w=1440,false
https://news.google.com/articles/CBMiiwFodHRwczovL3d3dy5ib3N0b25nbG9iZS5jb20vMjAyMS8wOC8yNS9uYXRpb24vc2V0aC1tb3VsdG9uLWFub3RoZXItbGF3bWFrZXItZmxldy1rYWJ1bC1hbWlkLWNoYW90aWMtZXZhY3VhdGlvbi1zdHVubmluZy11cy1vZmZpY2lhbHMtdGhlcmUv0gGaAWh0dHBzOi8vd3d3LmJvc3Rvbmdsb2JlLmNvbS8yMDIxLzA4LzI1L25hdGlvbi9zZXRoLW1vdWx0b24tYW5vdGhlci1sYXdtYWtlci1mbGV3LWthYnVsLWFtaWQtY2hhb3RpYy1ldmFjdWF0aW9uLXN0dW5uaW5nLXVzLW9mZmljaWFscy10aGVyZS8_b3V0cHV0VHlwZT1hbXA?hl=en-US&gl=US&ceid=US%3Aen,"Seth Moulton and another lawmaker flew to Kabul amid the chaotic evacuation, stunning US officials there","Representatives Seth Moulton and Peter Meijer flew unannounced into Kabul’s airport in the middle of the ongoing chaotic evacuation Tuesday, stunning US military personnel who had to divert resources to provide security for them.",Politics,[],,,https://www.bostonglobe.com/2021/08/25/nation/seth-moulton-another-lawmaker-flew-kabul-amid-chaotic-evacuation-stunning-us-officials-there/,https://bostonglobe-prod.cdn.arcpublishing.com/resizer/i1D5ZUXPONVaLYOrmnn8rSoo3VE=/506x0/cloudfront-us-east-1.images.arcpublishing.com/bostonglobe/6BSITQRLXX7BXOYLRCDBCQZ74M.jpg,false
https://news.google.com/articles/CAIiEDUugMdMm7Oc0lf2BYpVC4AqGQgEKhAIACoHCAowocv1CjCSptoCMPrTpgU?hl=en-US&gl=US&ceid=US%3Aen,Two congressmen traveled to Afghanistan amid frantic evacuation efforts,"Two US congressmen on Tuesday made an unannounced visit to Afghanistan as the US races to evacuate as many people as possible from the country in the remaining days of the US military presence there, taking Democratic leadership by surprise and drawing swift criticism.",politics,"['Devan Cole', 'Ryan Nobles', 'Zachary Cohen', 'Oren Liebermann']",,2021-08-25T03:36:12Z,https://www.cnn.com/2021/08/24/politics/seth-moulton-peter-meijer-afghanistan-trip/index.html,https://cdn.cnn.com/cnnnext/dam/assets/210824211811-restricted-split-seth-moulton-peter-meijer-super-tease.jpg,false
https://news.google.com/articles/CAIiEMjWm-TmTCXHc8eQK--YD5sqLQgEKiUIACIbd3d3LmJ1c2luZXNzaW5zaWRlci5jb20vc2FpKgQICjAMMJD-CQ?hl=en-US&gl=US&ceid=US%3Aen,"US officials were furious when they found out 2 lawmakers secretly traveled to Kabul, report says","Democratic Rep. Seth Moulton and GOP Rep. Peter Meijer went to Kabul airport in secret, saying they were conducting ""oversight"" on evacuations.",,['Sinéad Baker'],2021-08-25 00:00:00,2021-08-25T13:33:36Z,https://www.businessinsider.com/us-officials-furious-lawmakers-secret-kabul-trip-reports-2021-8,https://i.insider.com/6125fed9de5f560019e89b21?width=1200&format=jpeg,false
https://news.google.com/articles/CBMiY2h0dHBzOi8vd3d3LnRoZWd1YXJkaWFuLmNvbS91cy1uZXdzLzIwMjEvYXVnLzI1L2NhbGlmb3JuaWEtZ292ZXJub3ItcmVjYWxsLWdhdmluLW5ld3NvbS1sYXJyeS1lbGRlctIBY2h0dHBzOi8vYW1wLnRoZWd1YXJkaWFuLmNvbS91cy1uZXdzLzIwMjEvYXVnLzI1L2NhbGlmb3JuaWEtZ292ZXJub3ItcmVjYWxsLWdhdmluLW5ld3NvbS1sYXJyeS1lbGRlcg?hl=en-US&gl=US&ceid=US%3Aen,Apathetic voters could hand California recall to Republicans: ‘Folks seem unaware’,Gavin Newsom remains popular but Democrats appear far less likely than Republicans to vote in the election,US news,['Maanvi Singh'],2021-08-25 10:00:16+00:00,2021-08-25T16:22:59.000Z,http://www.theguardian.com/us-news/2021/aug/25/california-governor-recall-gavin-newsom-larry-elder,https://i.guim.co.uk/img/media/96a9d683e1165ec7d49ac4cd8f8f38743225aafd/0_102_6720_4032/master/6720.jpg?width=1200&height=630&quality=85&auto=format&fit=crop&overlay-align=bottom%2Cleft&overlay-width=100p&overlay-base64=L2ltZy9zdGF0aWMvb3ZlcmxheXMvdGctZGVmYXVsdC5wbmc&enable=upscale&s=7e821c447a9d4d444a65ad79d4590a2b,
https://news.google.com/articles/CCAiC3dPSUViUHFzelBnmAEB?hl=en-US&gl=US&ceid=US%3Aen,The California Recall and You: A guide to voting,The recall election asking voters if they want to replace Gov. Gavin Newsom will take place on Sept. 14. Nearly four dozen candidates will appear on the ball...,,[],,,https://www.youtube.com/watch?v=wOIEbPqszPg,https://i.ytimg.com/vi/wOIEbPqszPg/hqdefault.jpg,
https://news.google.com/articles/CAIiEMbZRrT9VI8mac4DZwRAiVIqGQgEKhAIACoHCAowwL2ICzCckocDMMaPqQY?hl=en-US&gl=US&ceid=US%3Aen,Former California Democratic Senate leader endorses Larry Elder in campaign against Gov. Newsom,"The former California Senate majority leader, Democrat Gloria Romero, endorsed Republican gubernatorial candidate Larry Elder in a campaign video.",,['Emma Colton'],,2021-08-25T12:36:28-04:00,https://www.foxnews.com/politics/former-democratic-california-leader-endorses-larry-elder-recall,https://static.foxnews.com/foxnews.com/content/uploads/2021/07/Larry-Elder.jpeg,false
https://news.google.com/articles/CAIiEDglOIQBpy8j2wTywFnGOO4qGAgEKg8IACoHCAowjuuKAzCWrzwworyzBg?hl=en-US&gl=US&ceid=US%3Aen,Opinion | Brace Yourself for the Man Who Could Become California’s Governor,An election to recall Gavin Newsom is suddenly no longer a sideshow.,Opinion,['Farhad Manjoo'],2021-08-25 09:00:15+00:00,2021-08-25T14:07:58.832Z,https://www.nytimes.com/2021/08/25/opinion/california-recall-newsom-larry-elder.html,https://static01.nyt.com/images/2021/08/27/opinion/25manjoo-lead/25manjoo-lead-facebookJumbo.jpg,true
https://news.google.com/articles/CAIiEG3g2qkXQppFnP6t8O3lIkwqFwgEKg8IACoHCAowjuuKAzCWrzwwt4QY?hl=en-US&gl=US&ceid=US%3Aen,Budding Resistance to the Taliban Faces Long Odds,"For now, the fighters have merely two assets: a narrow valley with a history of repelling invaders and the legacy of a storied mujahedeen commander.",World,"['Carlotta Gall', 'Adam Nossiter']",2021-08-25 07:00:10+00:00,2021-08-25T07:00:09.000Z,https://www.nytimes.com/2021/08/25/world/asia/panjshir-valley-ahmad-massoud.html,https://static01.nyt.com/images/2021/08/24/world/24AFGHANISTAN-MASSOUD-RESISTANCE02/24AFGHANISTAN-MASSOUD-RESISTANCE02-facebookJumbo-v2.jpg,false
https://news.google.com/articles/CCAiC1llb3lDWFFuNTgwmAEB?hl=en-US&gl=US&ceid=US%3Aen,"Panjshir: A Nightmare For Invaders, Faceoff Over The Only Free Province Of Afghanistan Continues",Resistance fighters in Panjshir valley are gearing up to fight the Taliban in what could very well turn out to be the battle for the only province in Afghani...,,[],,,https://www.youtube.com/watch?v=YeoyCXQn580,https://i.ytimg.com/vi/YeoyCXQn580/maxresdefault.jpg,
https://news.google.com/articles/CBMiZ2h0dHBzOi8vd3d3LmRhaWx5c2FiYWguY29tL3dvcmxkL2FzaWEtcGFjaWZpYy9hZmdoYW4tcmVzaXN0YW5jZS1sZWFkZXItbWFzc291ZC1wbGVkZ2VzLXRvLWZpZ2h0LXRhbGliYW7SAWtodHRwczovL3d3dy5kYWlseXNhYmFoLmNvbS93b3JsZC9hc2lhLXBhY2lmaWMvYWZnaGFuLXJlc2lzdGFuY2UtbGVhZGVyLW1hc3NvdWQtcGxlZGdlcy10by1maWdodC10YWxpYmFuL2FtcA?hl=en-US&gl=US&ceid=US%3Aen,Afghan resistance leader Massoud pledges to fight Taliban,"The leader of the resistance movement in Afghanistan against the Taliban has pledged to never surrender but is open to negotiations with them, according to...",Asia Pacific,['French Press Agency - Afp'],2021-08-25 12:35:00+03:00,,https://www.dailysabah.com/world/asia-pacific/afghan-resistance-leader-massoud-pledges-to-fight-taliban,https://idsb.tmgrup.com.tr/ly/uploads/images/2021/08/25/thumbs/800x531/139150.jpg,
https://news.google.com/articles/CCAiC0tSMS1LdFpldE00mAEB?hl=en-US&gl=US&ceid=US%3Aen,Amrullah Saleh Speaks To CNN News18 | World Exclusive | Pakistan's Role In The Taliban Takeover?,"Amrullah Saleh Speaks To CNN News18 In A Mega Exclusive Conversation With Anand NarasimhanAmrullah Saleh, Acting President, Afghanistan: Taliban used Pakista...",,[],,,https://www.youtube.com/watch?v=KR1-KtZetM4,https://i.ytimg.com/vi/KR1-KtZetM4/maxresdefault.jpg,
https://news.google.com/articles/CBMiYWh0dHBzOi8vYXBuZXdzLmNvbS9hcnRpY2xlL3BvbGljZS1sb3Vpc2lhbmEtbW9ucm9lLXJvbmFsZC1ncmVlbmUtNmM1NmVmNmY1ZjNiYzQxM2QxNTA3MzdiZjcwNWU5NDTSAQA?hl=en-US&gl=US&ceid=US%3Aen,‘Pain compliance’: Video shows trooper pummeling Black man,"MONROE, La. (AP) — Graphic body camera video kept secret for more than two years shows a Louisiana State Police trooper pummeling a Black motorist 18 times with a flashlight — an attack the trooper defended as “pain compliance.”",AP Investigations,"['Jake Bleiberg', 'Jim Mustian']",2021-08-25 10:00:21+00:00,2021-08-25T14:57:44Z,https://apnews.com/article/police-louisiana-monroe-ronald-greene-6c56ef6f5f3bc413d150737bf705e944,https://storage.googleapis.com/afs-prod/media/3ae6e9931cb04d029c309b7b2903f7d9/3000.jpeg,
https://news.google.com/articles/CBMiTWh0dHBzOi8vd3d3LnlhaG9vLmNvbS9uZXdzL3BhaW4tY29tcGxpYW5jZS12aWRlby1zaG93cy10cm9vcGVyLTEwMDAwODEzNy5odG1s0gFWaHR0cHM6Ly9uZXdzLnlhaG9vLmNvbS9hbXBodG1sL25ld3MvcGFpbi1jb21wbGlhbmNlLXZpZGVvLXNob3dzLXRyb29wZXItMTAwMDA4MTM3Lmh0bWw?hl=en-US&gl=US&ceid=US%3Aen,'Pain compliance': Video shows trooper pummeling Black man,"Graphic body camera video kept secret for more than two years shows a Louisiana State Police trooper pummeling a Black motorist 18 times with a flashlight — an attack the trooper defended as “pain compliance.”  Bowman's encounter near his Monroe home came less than three weeks after troopers from the same embattled agency punched, stunned and dragged another Black motorist, Ronald Greene, before he died in police custody on a rural roadside in northeast Louisiana.  Federal prosecutors are examining both cases in a widening investigation into police brutality and potential cover-ups involving both troopers and state police brass.",,"['Jake Bleiberg', 'Jim Mustian']",,,https://news.yahoo.com/pain-compliance-video-shows-trooper-100008137.html,https://s.yimg.com/ny/api/res/1.2/HXj7z5ThudRFQtnabvL19w--/YXBwaWQ9aGlnaGxhbmRlcjt3PTEyMDA7aD04MDA-/https://s.yimg.com/uu/api/res/1.2/KK3faXTZ1n0ptNX2y0DUXQ--~B/aD00MDAwO3c9NjAwMDthcHBpZD15dGFjaHlvbg--/https://media.zenfs.com/en/ap.org/01e6bc5f63da553066d05b2482ce9662,
https://news.google.com/articles/CAIiEJ1jmPo3uArZRYoq4NS3TI0qGQgEKhAIACoHCAowzuOICzCZ4ocDMO7xqQY?hl=en-US&gl=US&ceid=US%3Aen,Video showing white cop beat black man 18 times released after footage kept secret for TWO YEARS,"After 2 years, officials have released body cam video showing Louisiana trooper Jacob Brown, who is white, strike a Black man, Aaron Bowman, with a flashlight 18 times following a traffic stop.",News,"['Natasha Anderson', 'Natasha Anderson For Dailymail.Com', 'Associated Press']",2021-08-25 11:04:47+01:00,2021-08-25T15:42:22+0100,https://www.dailymail.co.uk/news/article-9925403/Pain-compliance-Video-shows-trooper-pummeling-Black-man.html,https://i.dailymail.co.uk/1s/2021/08/25/14/47086933-0-image-a-23_1629899602293.jpg,false
https://news.google.com/articles/CBMidGh0dHBzOi8vd3d3LndhZmIuY29tLzIwMjEvMDgvMjUvcGFpbi1jb21wbGlhbmNlLXZpZGVvLXNob3dzLWxvdWlzaWFuYS1zdGF0ZS1wb2xpY2UtdHJvb3Blci1wdW1tZWxpbmctYmxhY2stbW90b3Jpc3Qv0gEA?hl=en-US&gl=US&ceid=US%3Aen,‘Pain compliance’: Video shows Louisiana State Police trooper pummeling Black motorist,"A May 2019 traffic stop in Monroe left Aaron Larry Bowman with a broken jaw, broken ribs and other injuries.",,"['Jake Bleiberg', 'Jim Mustian']",,,https://www.wafb.com/2021/08/25/pain-compliance-video-shows-louisiana-state-police-trooper-pummeling-black-motorist/,https://gray-wafb-prod.cdn.arcpublishing.com/resizer/X8ofawNdG48VcUZevC-ZPBI6AW4=/980x0/smart/filters:quality(85)/cloudfront-us-east-1.images.arcpublishing.com/gray/JXZNZPREJNETBA3SPA5OVSBPWQ.jpg,
https://news.google.com/articles/CBMiiwFodHRwczovL3d3dy5ib3N0b25nbG9iZS5jb20vMjAyMS8wOC8yNS9uYXRpb24vc2V0aC1tb3VsdG9uLWFub3RoZXItbGF3bWFrZXItZmxldy1rYWJ1bC1hbWlkLWNoYW90aWMtZXZhY3VhdGlvbi1zdHVubmluZy11cy1vZmZpY2lhbHMtdGhlcmUv0gGaAWh0dHBzOi8vd3d3LmJvc3Rvbmdsb2JlLmNvbS8yMDIxLzA4LzI1L25hdGlvbi9zZXRoLW1vdWx0b24tYW5vdGhlci1sYXdtYWtlci1mbGV3LWthYnVsLWFtaWQtY2hhb3RpYy1ldmFjdWF0aW9uLXN0dW5uaW5nLXVzLW9mZmljaWFscy10aGVyZS8_b3V0cHV0VHlwZT1hbXA?hl=en-US&gl=US&ceid=US%3Aen,"Seth Moulton and another lawmaker flew to Kabul amid the chaotic evacuation, stunning US officials there","Representatives Seth Moulton and Peter Meijer flew unannounced into Kabul’s airport in the middle of the ongoing chaotic evacuation Tuesday, stunning US military personnel who had to divert resources to provide security for them.",Politics,[],,,https://www.bostonglobe.com/2021/08/25/nation/seth-moulton-another-lawmaker-flew-kabul-amid-chaotic-evacuation-stunning-us-officials-there/,https://bostonglobe-prod.cdn.arcpublishing.com/resizer/i1D5ZUXPONVaLYOrmnn8rSoo3VE=/506x0/cloudfront-us-east-1.images.arcpublishing.com/bostonglobe/6BSITQRLXX7BXOYLRCDBCQZ74M.jpg,false
https://news.google.com/articles/CAIiEGOtIcDDdSe34eBVMnYW0JoqGAgEKg8IACoHCAowjtSUCjC30XQw36e5AQ?hl=en-US&gl=US&ceid=US%3Aen,Two Congress members make unauthorized trip to Kabul amid evacuation efforts,"Reps. Seth Moulton (D-Mass.) and Peter Meijer (R-Mich.), who both served in Iraq before being elected to Congress, returned home via a U.S. military flight used for evacuating U.S. citizens, allies and vulnerable Afghans.",Politics,[],2021-08-24 23:50:37+00:00,2021-08-25T14:22:48.623Z,https://www.washingtonpost.com/politics/congress-kabul-trip-evacuation/2021/08/24/77f7673a-0501-11ec-a266-7c7fe02fa374_story.html,https://www.washingtonpost.com/wp-apps/imrs.php?src=https://arc-anglerfish-washpost-prod-washpost.s3.amazonaws.com/public/XEXVIDUYMMI6TDIKL3OX4IBFWE.jpg&w=1440,false
https://news.google.com/articles/CBMidWh0dHBzOi8vd3d3LnBvbGl0aWNvLmNvbS9uZXdzbGV0dGVycy9odWRkbGUvMjAyMS8wOC8yNS9tb3VsdG9uLWFuZC1tZWlqZXItZ28tcm9ndWUtc2VwdGVtYmVyLWRlYWRsaW5lcy1waWxlLXVwLTQ5NDEyMtIBAA?hl=en-US&gl=US&ceid=US%3Aen,"Moulton and Meijer go rogue, September deadlines pile up",,,[],2021-08-25 07:25:04,,https://www.politico.com/newsletters/huddle/2021/08/25/moulton-and-meijer-go-rogue-september-deadlines-pile-up-494122,https://static.politico.com/da/f5/44342c424c68b675719324b1106b/politico.jpg,
https://news.google.com/articles/CAIiEDUugMdMm7Oc0lf2BYpVC4AqGQgEKhAIACoHCAowocv1CjCSptoCMPrTpgU?hl=en-US&gl=US&ceid=US%3Aen,Two congressmen traveled to Afghanistan amid frantic evacuation efforts,"Two US congressmen on Tuesday made an unannounced visit to Afghanistan as the US races to evacuate as many people as possible from the country in the remaining days of the US military presence there, taking Democratic leadership by surprise and drawing swift criticism.",politics,"['Devan Cole', 'Ryan Nobles', 'Zachary Cohen', 'Oren Liebermann']",,2021-08-25T03:36:12Z,https://www.cnn.com/2021/08/24/politics/seth-moulton-peter-meijer-afghanistan-trip/index.html,https://cdn.cnn.com/cnnnext/dam/assets/210824211811-restricted-split-seth-moulton-peter-meijer-super-tease.jpg,false
https://news.google.com/articles/CAIiEMjWm-TmTCXHc8eQK--YD5sqLQgEKiUIACIbd3d3LmJ1c2luZXNzaW5zaWRlci5jb20vc2FpKgQICjAMMJD-CQ?hl=en-US&gl=US&ceid=US%3Aen,"US officials were furious when they found out 2 lawmakers secretly traveled to Kabul, report says","Democratic Rep. Seth Moulton and GOP Rep. Peter Meijer went to Kabul airport in secret, saying they were conducting ""oversight"" on evacuations.",,['Sinéad Baker'],2021-08-25 00:00:00,2021-08-25T13:33:36Z,https://www.businessinsider.com/us-officials-furious-lawmakers-secret-kabul-trip-reports-2021-8,https://i.insider.com/6125fed9de5f560019e89b21?width=1200&format=jpeg,false
https://news.google.com/articles/CAIiEMbZRrT9VI8mac4DZwRAiVIqGQgEKhAIACoHCAowwL2ICzCckocDMMaPqQY?hl=en-US&gl=US&ceid=US%3Aen,Former California Democratic Senate leader endorses Larry Elder in campaign against Gov. Newsom,"The former California Senate majority leader, Democrat Gloria Romero, endorsed Republican gubernatorial candidate Larry Elder in a campaign video.",,['Emma Colton'],,2021-08-25T12:36:28-04:00,https://www.foxnews.com/politics/former-democratic-california-leader-endorses-larry-elder-recall,https://static.foxnews.com/foxnews.com/content/uploads/2021/07/Larry-Elder.jpeg,false
https://news.google.com/articles/CCAiC3dPSUViUHFzelBnmAEB?hl=en-US&gl=US&ceid=US%3Aen,The California Recall and You: A guide to voting,The recall election asking voters if they want to replace Gov. Gavin Newsom will take place on Sept. 14. Nearly four dozen candidates will appear on the ball...,,[],,,https://www.youtube.com/watch?v=wOIEbPqszPg,https://i.ytimg.com/vi/wOIEbPqszPg/hqdefault.jpg,
https://news.google.com/articles/CBMiY2h0dHBzOi8vd3d3LnRoZWd1YXJkaWFuLmNvbS91cy1uZXdzLzIwMjEvYXVnLzI1L2NhbGlmb3JuaWEtZ292ZXJub3ItcmVjYWxsLWdhdmluLW5ld3NvbS1sYXJyeS1lbGRlctIBY2h0dHBzOi8vYW1wLnRoZWd1YXJkaWFuLmNvbS91cy1uZXdzLzIwMjEvYXVnLzI1L2NhbGlmb3JuaWEtZ292ZXJub3ItcmVjYWxsLWdhdmluLW5ld3NvbS1sYXJyeS1lbGRlcg?hl=en-US&gl=US&ceid=US%3Aen,Apathetic voters could hand California recall to Republicans: ‘Folks seem unaware’,Gavin Newsom remains popular but Democrats appear far less likely than Republicans to vote in the election,US news,['Maanvi Singh'],2021-08-25 10:00:16+00:00,2021-08-25T16:22:59.000Z,http://www.theguardian.com/us-news/2021/aug/25/california-governor-recall-gavin-newsom-larry-elder,https://i.guim.co.uk/img/media/96a9d683e1165ec7d49ac4cd8f8f38743225aafd/0_102_6720_4032/master/6720.jpg?width=1200&height=630&quality=85&auto=format&fit=crop&overlay-align=bottom%2Cleft&overlay-width=100p&overlay-base64=L2ltZy9zdGF0aWMvb3ZlcmxheXMvdGctZGVmYXVsdC5wbmc&enable=upscale&s=7e821c447a9d4d444a65ad79d4590a2b,
https://news.google.com/articles/CAIiEDglOIQBpy8j2wTywFnGOO4qGAgEKg8IACoHCAowjuuKAzCWrzwworyzBg?hl=en-US&gl=US&ceid=US%3Aen,Opinion | Brace Yourself for the Man Who Could Become California’s Governor,An election to recall Gavin Newsom is suddenly no longer a sideshow.,Opinion,['Farhad Manjoo'],2021-08-25 09:00:15+00:00,2021-08-25T14:07:58.832Z,https://www.nytimes.com/2021/08/25/opinion/california-recall-newsom-larry-elder.html,https://static01.nyt.com/images/2021/08/27/opinion/25manjoo-lead/25manjoo-lead-facebookJumbo.jpg,true
