article_url,article_title,meta_description,section,authors,publish_date,modified_date,canonical_link,top_image,is_opinion
https://news.google.com/articles/CAIiEK9dZ_dKaLHuI7-YkCFeflIqFwgEKg8IACoHCAowjuuKAzCWrzwwloEY?hl=en-US&gl=US&ceid=US%3Aen,"The utility PG&E says its equipment may have led to a 30,000-acre wildfire.","Blown fuses on a utility pole may have sparked a fire that has burned through 30,000 acres in Northern California, the utility said.",U.S.,['Adeel Hassan'],2021-07-19 21:04:05+00:00,2021-08-06T17:33:45.567Z,https://www.nytimes.com/2021/07/19/us/pge-dixie-fire.html,https://static01.nyt.com/images/2021/07/19/us/19weather-climate-briefing-utility-pole-1/19weather-climate-briefing-utility-pole-1-facebookJumbo.jpg,false
https://news.google.com/articles/CBMiMWh0dHBzOi8vd3d3LmJiYy5jb20vbmV3cy93b3JsZC11cy1jYW5hZGEtNTc4OTA5MzXSATVodHRwczovL3d3dy5iYmMuY29tL25ld3Mvd29ybGQtdXMtY2FuYWRhLTU3ODkwOTM1LmFtcA?hl=en-US&gl=US&ceid=US%3Aen,"Oregon Bootleg Fire: Evacuations as largest US fire burns 364,000 acres",The nation's largest active wildfire forces thousands to evacuate in the state of Oregon.,US & Canada,[],,,https://www.bbc.com/news/world-us-canada-57890935,https://ichef.bbci.co.uk/news/1024/branded_news/10E31/production/_119496196_hi068690236.jpg,
https://news.google.com/articles/CBMibGh0dHBzOi8vd3d3LnNmZ2F0ZS5jb20vY2FsaWZvcm5pYS13aWxkZmlyZXMvYXJ0aWNsZS9EaXhpZS1GaXJlLXB5cm9jdW11bG91cy1jbG91ZHMtdmlkZW8tUGx1bWFzLTE2MzIzOTg1LnBocNIBaGh0dHBzOi8vd3d3LnNmZ2F0ZS5jb20vY2FsaWZvcm5pYS13aWxkZmlyZXMvYW1wL0RpeGllLUZpcmUtcHlyb2N1bXVsb3VzLWNsb3Vkcy12aWRlby1QbHVtYXMtMTYzMjM5ODUucGhw?hl=en-US&gl=US&ceid=US%3Aen,"California's Dixie Fire explodes to more than 40,000 acres, triggers more evacuations",The footage showed a massive smoke plume over Plumas County.,California Wildfires,"['Amy Graff', 'Written By']",2021-07-19 14:36:00,2021-07-20 14:45:15,https://www.sfgate.com/california-wildfires/article/Dixie-Fire-pyrocumulous-clouds-video-Plumas-16323985.php,https://s.hdnux.com/photos/01/21/04/52/21252791/3/rawImage.png,
https://news.google.com/articles/CAIiEA9h5lz-9d7r3cff_GXPAcEqGQgEKhAIACoHCAowzrL9CjDC7vQCMOXc1gU?hl=en-US&gl=US&ceid=US%3Aen,"Oregon Wildfire: Wildfire in Oregon burns over 300,000 acres","US News:  The Bootleg fire in the US state of Oregon has burned more than 300,00 acres of land since it erupted on July 6, fire officials said on Monday. As of",,['Ians'],,,https://timesofindia.indiatimes.com/world/us/wildfire-in-oregon-burns-over-300000-acres/articleshow/84548149.cms,"https://static.toiimg.com/thumb/msid-84548196,width-1070,height-580,imgsize-315175,resizemode-75,overlay-toi_sw,pt-32,y_pad-40/photo.jpg",
https://news.google.com/articles/CAIiEL_G2fYT0AIEHHBXaxKudrsqGQgEKhAIACoHCAowwL2ICzCckocDMMaPqQY?hl=en-US&gl=US&ceid=US%3Aen,"VP Kamala Harris tested negative for COVID-19 after meeting with Texas Democrats, Psaki says","Vice President Kamala Harris tested negative for COVID-19 after meeting with several Texas House Democratic lawmakers who recently contracted the virus, White House Press Secretary Jen Psaki confirmed on Monday.",,['Thomas Barrabi'],,2021-07-19T17:39:18-04:00,https://www.foxnews.com/politics/vp-harris-tested-negative-covid-19-meeting-texas-democrats,https://static.foxnews.com/foxnews.com/content/uploads/2021/04/Kamala-Harris-.jpg,false
https://news.google.com/articles/CBMiZmh0dHBzOi8vd3d3Lmt4YW4uY29tL25ld3MvcG9saXRpY2FsLW5ld3MvbnVtYmVyLW9mLWluZmVjdGVkLXRleGFzLWxhd21ha2Vycy13aG8tZmxlZC1zdGF0ZS1yaXNlcy10by01L9IBamh0dHBzOi8vd3d3Lmt4YW4uY29tL25ld3MvcG9saXRpY2FsLW5ld3MvbnVtYmVyLW9mLWluZmVjdGVkLXRleGFzLWxhd21ha2Vycy13aG8tZmxlZC1zdGF0ZS1yaXNlcy10by01L2FtcC8?hl=en-US&gl=US&ceid=US%3Aen,Number of infected Texas lawmakers who fled state rises to 5,"WASHINGTON (AP) — Two more Texas lawmakers who left their state to hobble efforts to pass new voting restrictions have tested positive for the coronavirus, raising to five the number of infected people in the delegation. State Rep. Trey Martinez Fischer of San Antonio said in a statement Sunday that he had tested positive. “I […]",,"['Douglass K. Daniel', 'Associated Press', 'David Brandt', 'Amanda Dugan']",2021-07-19 02:28:22+00:00,2021-07-19T03:02:21+00:00,https://www.kxan.com/news/political-news/number-of-infected-texas-lawmakers-who-fled-state-rises-to-5/,https://www.kxan.com/wp-content/uploads/sites/40/2021/07/ad41c02131574cecb92af01e67805d98.jpg?w=1280,
https://news.google.com/articles/CBMidWh0dHBzOi8vdGhlaGlsbC5jb20vaG9tZW5ld3MvYWRtaW5pc3RyYXRpb24vNTYzNzkyLXdoaXRlLWhvdXNlLWNvbmZpcm1zLWthbWFsYS1oYXJyaXMtZ290LWNvdmlkLTE5LXRlc3QtYWZ0ZXItbWVldGluZ9IBeWh0dHBzOi8vdGhlaGlsbC5jb20vaG9tZW5ld3MvYWRtaW5pc3RyYXRpb24vNTYzNzkyLXdoaXRlLWhvdXNlLWNvbmZpcm1zLWthbWFsYS1oYXJyaXMtZ290LWNvdmlkLTE5LXRlc3QtYWZ0ZXItbWVldGluZz9hbXA?hl=en-US&gl=US&ceid=US%3Aen,White House confirms Harris got COVID-19 test after meeting with Texas Democrats,"White House press secretary Jen Psaki confirmed Monday that Vice President Harris has tested negative for COVID-19 following her meeting with Democratic Texas lawmakers, five of whom have tested positive since leaving the state.",,[],2021-07-19 19:24:12-04:00,2021-07-20T15:49:50-04:00,https://thehill.com/homenews/administration/563792-white-house-confirms-kamala-harris-got-covid-19-test-after-meeting,https://thehill.com/sites/default/files/article_images/kamalaharris_border.jpeg,
https://news.google.com/articles/CBMiSGh0dHBzOi8vbmV3cy55YWhvby5jb20vbWFqb3JpdHktdGhpbmtzLXNlY29uZC1saW5lLWhhcnJpcy0xNzI2MDA3ODcuaHRtbNIBUGh0dHBzOi8vbmV3cy55YWhvby5jb20vYW1waHRtbC9tYWpvcml0eS10aGlua3Mtc2Vjb25kLWxpbmUtaGFycmlzLTE3MjYwMDc4Ny5odG1s?hl=en-US&gl=US&ceid=US%3Aen,Majority thinks second-in-line Harris unprepared to be president: Poll,"A majority of likely voters lack confidence in Vice President Kamala Harris's readiness to be president, according to a new poll.",,['Jeremy Beaman'],,,https://news.yahoo.com/majority-thinks-second-line-harris-172600787.html,https://s.yimg.com/uu/api/res/1.2/trOA7xmdEm6iU0RXgIMIgw--~B/aD05NDA7dz0xNTQwO2FwcGlkPXl0YWNoeW9u/https://media.zenfs.com/en/washington_examiner_articles_265/7908d99aa83d61c9240c9912a977f414,
https://news.google.com/articles/CAIiEAWNmHaWUt_dbzbF-Iz8lZgqFwgEKg4IACoGCAow9vBNMK3UCDClvJYH?hl=en-US&gl=US&ceid=US%3Aen,GOP Leader McCarthy Taps 5 Republicans To Serve On Jan. 6 Select Committee,The list of five Republicans includes three lawmakers who voted against certifying the election results after the attack.,,['Alana Wise'],,,https://www.npr.org/2021/07/19/1018136264/gop-leader-mccarthy-taps-5-republicans-to-serve-on-jan-6-select-committee,https://media.npr.org/assets/img/2021/07/19/gettyimages-1232441752_wide-59cdd64bd5d6362323bf4de5b1f1d3c99be841fd.jpg?s=1400,false
https://news.google.com/articles/CAIiEIdwtWAV-E5cGQ_3IoZTvzYqGAgEKg8IACoHCAowjtSUCjC30XQwzqe5AQ?hl=en-US&gl=US&ceid=US%3Aen,"Jim Jordan, four other Republicans chosen by House Minority Leader Kevin McCarthy to serve on panel investigating Jan. 6 riot","The lawmakers include Jordan, Jim Banks (Ind.), Rodney Davis (Ill.), Kelly Armstrong (N.D.) and Troy E. Nehls (Tex.).",Politics,[],2021-07-19 23:07:53+00:00,2021-07-20T15:00:48.361Z,https://www.washingtonpost.com/politics/jim-jordan-four-other-republicans-chosen-by-house-minority-leader-kevin-mccarthy-to-serve-on-panel-investigating-jan-6-riots/2021/07/19/85c6b534-e8df-11eb-8950-d73b3e93ff7f_story.html,https://www.washingtonpost.com/wp-apps/imrs.php?src=https://arc-anglerfish-washpost-prod-washpost.s3.amazonaws.com/public/67YQE6TAEQI6XL56TII2CJ6RIY.jpg&w=1440,false
https://news.google.com/articles/CBMiWGh0dHBzOi8vdGhlaGlsbC5jb20vaG9tZW5ld3MvaG91c2UvNTYzNzg5LWppbS1qb3JkYW4tdG9wcy1tY2NhcnRoeS1waWNrcy1mb3ItamFuLTYtcGFuZWzSAVxodHRwczovL3RoZWhpbGwuY29tL2hvbWVuZXdzL2hvdXNlLzU2Mzc4OS1qaW0tam9yZGFuLXRvcHMtbWNjYXJ0aHktcGlja3MtZm9yLWphbi02LXBhbmVsP2FtcA?hl=en-US&gl=US&ceid=US%3Aen,Jim Jordan among McCarthy picks for Jan. 6 panel,House Minority Leader Kevin McCarthy (R-Calif.) on Monday is expected to pick five Republicans to serve on the special House committee created to investigate the Jan. 6 attack on the Capitol.,,[],2021-07-19 18:47:07-04:00,2021-07-19T19:54:54-04:00,https://thehill.com/homenews/house/563789-jim-jordan-tops-mccarthy-picks-for-jan-6-panel,https://thehill.com/sites/default/files/jordanjim_012420gn_lead.jpg,
https://news.google.com/articles/CAIiEJPXGEXlC79OMRHDDArIPJIqGQgEKhAIACoHCAow4Zn5CjCu8uACMNSiwQU?hl=en-US&gl=US&ceid=US%3Aen,McCarthy makes his 5 GOP picks for Jan. 6 select committee,,,[],,,https://www.politico.com/news/2021/07/19/mccarthy-zeroes-in-on-five-gop-members-for-jan-6-select-committee-500201,https://static.politico.com/39/6b/98f2936b424d951481531db8ccb1/210623-jim-banks-ap-773.jpg,false
https://news.google.com/articles/CAIiEEr3o5_KdwfYnxd2jNie4X8qGQgEKhAIACoHCAowjsP7CjCSpPQCMLmw0wU?hl=en-US&gl=US&ceid=US%3Aen,"'Do not travel': CDC, State Department raise UK travel alert after spike in COVID cases","The travel warnings come as the U.K. recorded more than 50,000 new coronavirus cases in a day for the first time in six months.",,[],,,https://www.usatoday.com/story/travel/news/2021/07/19/uk-travel-cdc-state-department-do-not-travel-covid-cases/8018731002/,"https://www.gannett-cdn.com/presto/2021/07/19/USAT/4208d74a-0b82-47da-9fba-91ee6f62ae9b-AFP_AFP_9E89KN.jpg?crop=3426,1927,x0,y0&width=3200&height=1800&format=pjpg&auto=webp",false
https://news.google.com/articles/CAIiEKmp7GQRWn4Slvf9dOV3sZcqGQgEKhAIACoHCAow2Nb3CjDivdcCMJ_5ngY?hl=en-US&gl=US&ceid=US%3Aen,"State Department, CDC says to avoid travel to the UK as Covid cases rise",The CDC told travelers to avoid traveling to the UK as the delta variant of Covid-19 continues to spread.,Airlines,['Leslie Josephs'],2021-07-19 18:57:07+00:00,2021-07-20T12:21:24+0000,https://www.cnbc.com/2021/07/19/cdc-tells-individuals-to-avoid-travel-to-the-uk-as-covid-cases-rise.html,https://image.cnbcfm.com/api/v1/image/106814315-1608560359176-2020-03-13T210526Z_1759236100_RC29JF9CACE9_RTRMADP_3_HEALTH-CORONAVIRUS-BRITAIN.JPG?v=1608560420,false
https://news.google.com/articles/CBMic2h0dHBzOi8vdGhlaGlsbC5jb20vY2hhbmdpbmctYW1lcmljYS93ZWxsLWJlaW5nL3ByZXZlbnRpb24tY3VyZXMvNTYzNzcyLWNkYy1wdXRzLXRoZS11ay1vbi1sZXZlbC00LWNvdmlkLTE5LXdhcm5pbmfSAXdodHRwczovL3RoZWhpbGwuY29tL2NoYW5naW5nLWFtZXJpY2Evd2VsbC1iZWluZy9wcmV2ZW50aW9uLWN1cmVzLzU2Mzc3Mi1jZGMtcHV0cy10aGUtdWstb24tbGV2ZWwtNC1jb3ZpZC0xOS13YXJuaW5nP2FtcA?hl=en-US&gl=US&ceid=US%3Aen,CDC puts the UK on Level 4 COVID-19 warning. Here's what that means,The health agency lists the country as having a high transmission rate.,,[],2021-07-19 17:20:38-04:00,2021-07-19T17:20:38-04:00,https://thehill.com/changing-america/well-being/prevention-cures/563772-cdc-puts-the-uk-on-level-4-covid-19-warning,https://thehill.com/sites/default/files/ca_cdclogo_012420getty_16.jpg,
https://news.google.com/articles/CAIiEPqEJND0VoiKueHSlpF3H9cqGQgEKhAIACoHCAow4uzwCjCF3bsCMIrOrwM?hl=en-US&gl=US&ceid=US%3Aen,Are you a robot?,,,[],,,,,
https://news.google.com/articles/CAIiEPSP8i-BtsqaX7QZ5BcERGQqLQgEKiUIACIbd3d3LmJ1c2luZXNzaW5zaWRlci5jb20vc2FpKgQICjAMMJD-CQ?hl=en-US&gl=US&ceid=US%3Aen,Psaki shoots down idea that Republicans aren't getting vaccinated because Trump isn't getting enough credit for vaccines,Psaki said data suggests misinformation — including the conspiracy theory that microchips are in the vaccine — is what's behind the ongoing hesitancy.,,['John Haltiwanger'],2021-07-19 00:00:00,2021-07-19T18:51:54Z,https://www.businessinsider.com/psaki-shoots-down-giving-trump-more-credit-increase-vaccine-rate-2021-7,https://i.insider.com/60f5c279bc757c001904bb65?width=1200&format=jpeg,false
https://news.google.com/articles/CAIiEDY761lZoPbRkwbbP7vwlBsqGQgEKhAIACoHCAow2Nb3CjDivdcCMKuvhQY?hl=en-US&gl=US&ceid=US%3Aen,'Facebook isn't killing people' — Biden walks back attack over vaccine lies,"Biden said he hopes Facebook will do more to fight misinformation about coronavirus vaccines being spread on its platform ""instead of taking it personally.""",Politics,['Kevin Breuninger'],2021-07-19 16:31:23+00:00,2021-07-19T20:34:39+0000,https://www.cnbc.com/2021/07/19/facebook-isnt-killing-people-biden-says-as-he-walks-back-attack-over-vaccine-lies.html,https://image.cnbcfm.com/api/v1/image/106912937-16267104762021-07-19t155950z_26304357_rc2rno99jcut_rtrmadp_0_usa-biden.jpeg?v=1626710508,false
https://news.google.com/articles/CBMiPmh0dHBzOi8vbmV3cy55YWhvby5jb20vd2VyZS1ub3Qtd2FyLXdoaXRlLWhvdXNlLTE4MDYwMDY4MS5odG1s0gFGaHR0cHM6Ly9uZXdzLnlhaG9vLmNvbS9hbXBodG1sL3dlcmUtbm90LXdhci13aGl0ZS1ob3VzZS0xODA2MDA2ODEuaHRtbA?hl=en-US&gl=US&ceid=US%3Aen,'We're not in a war': White House tamps down tensions with Facebook over virus misinformation,President Joe Biden and his administration are trying to soften their expressions of frustration with social media platforms over the spread of coronavirus misinformation online.,,['Naomi Lim'],,,https://news.yahoo.com/were-not-war-white-house-180600681.html,https://s.yimg.com/uu/api/res/1.2/8ksrzRlAipX2cFa3yfGWjA--~B/aD05NDA7dz0xNTQwO2FwcGlkPXl0YWNoeW9u/https://media.zenfs.com/en/washington_examiner_articles_265/581baf9338b37af7531b78c7fc65aae4,
https://news.google.com/articles/CAIiEPHwzy9J8R8Lr9bet-koPksqGQgEKhAIACoHCAowwL2ICzCckocDMKuUqQY?hl=en-US&gl=US&ceid=US%3Aen,Michael Goodwin: Biden's Big Tech blunder – here's how admin's actions threatening First Amendment,"The White House and the DNC are going to monitor and ""dispel misinformation"" on social media and private text messages? And work with congenitally-corrupt ""fact checkers""?",,"['Michael Goodwin', 'Michael Goodwin Is A Fox News Contributor', 'New York Post Columnist.']",,2021-07-18T10:07:38-04:00,https://www.foxnews.com/opinion/biden-big-tech-blunder-threaten-first-amendment-michael-goodwin,https://cf-images.us-east-1.prod.boltdns.net/v1/static/694940094001/8b393bd8-fbeb-4840-b3c4-7da65aacc054/62f2d334-76cf-4c26-b801-87f6fb9c9b60/1280x720/match/image.jpg,true
https://news.google.com/articles/CBMibmh0dHBzOi8vdGhlaGlsbC5jb20vb3Bpbmlvbi93aGl0ZS1ob3VzZS81NjM1NDctaHlwb2NyaXRpY2FsLXBzYWtpLWxlYWRzLWNoaWxsaW5nLWVmZm9ydC10by1mbGFnLW1pc2luZm9ybWF0aW9u0gFyaHR0cHM6Ly90aGVoaWxsLmNvbS9vcGluaW9uL3doaXRlLWhvdXNlLzU2MzU0Ny1oeXBvY3JpdGljYWwtcHNha2ktbGVhZHMtY2hpbGxpbmctZWZmb3J0LXRvLWZsYWctbWlzaW5mb3JtYXRpb24_YW1w?hl=en-US&gl=US&ceid=US%3Aen,Hypocritical Psaki leads chilling effort to flag 'misinformation',"In poll after poll, a solid majority of Americans supports breaking up Big Tech companies such as Facebook.",,[],2021-07-18 08:00:13-04:00,2021-07-18T14:10:26-04:00,https://thehill.com/opinion/white-house/563547-hypocritical-psaki-leads-chilling-effort-to-flag-misinformation,https://thehill.com/sites/default/files/article_images/psakijen_60421_gettyimages.jpg,
https://news.google.com/articles/CAIiEK4r8-yVMpY2lIoIZSvfeQsqGQgEKhAIACoHCAowwL2ICzCckocDMMaPqQY?hl=en-US&gl=US&ceid=US%3Aen,Trump ally Jim Jordan among Republicans tapped for Jan. 6 select committee,"Rep. Jim Jordan, R-Ohio, a prominent ally of former President Donald Trump, is one of a handful of GOP lawmakers set to be appointed to House Speaker Nancy Pelosi’s select committee to investigate the Jan. 6 Capitol riot.",,['Thomas Barrabi'],,2021-07-19T19:52:22-04:00,https://www.foxnews.com/politics/jim-jordan-republicans-jan-6-select-committee,https://static.foxnews.com/foxnews.com/content/uploads/2020/07/jim-jordan-.jpg,false
https://news.google.com/articles/CAIiEIdwtWAV-E5cGQ_3IoZTvzYqGAgEKg8IACoHCAowjtSUCjC30XQwzqe5AQ?hl=en-US&gl=US&ceid=US%3Aen,"Jim Jordan, four other Republicans chosen by House Minority Leader Kevin McCarthy to serve on panel investigating Jan. 6 riot","The lawmakers include Jordan, Jim Banks (Ind.), Rodney Davis (Ill.), Kelly Armstrong (N.D.) and Troy E. Nehls (Tex.).",Politics,[],2021-07-19 23:07:53+00:00,2021-07-20T15:00:48.361Z,https://www.washingtonpost.com/politics/jim-jordan-four-other-republicans-chosen-by-house-minority-leader-kevin-mccarthy-to-serve-on-panel-investigating-jan-6-riots/2021/07/19/85c6b534-e8df-11eb-8950-d73b3e93ff7f_story.html,https://www.washingtonpost.com/wp-apps/imrs.php?src=https://arc-anglerfish-washpost-prod-washpost.s3.amazonaws.com/public/67YQE6TAEQI6XL56TII2CJ6RIY.jpg&w=1440,false
https://news.google.com/articles/CAIiEJPXGEXlC79OMRHDDArIPJIqGQgEKhAIACoHCAow4Zn5CjCu8uACMNSiwQU?hl=en-US&gl=US&ceid=US%3Aen,McCarthy makes his 5 GOP picks for Jan. 6 select committee,,,[],,,https://www.politico.com/news/2021/07/19/mccarthy-zeroes-in-on-five-gop-members-for-jan-6-select-committee-500201,https://static.politico.com/39/6b/98f2936b424d951481531db8ccb1/210623-jim-banks-ap-773.jpg,false
https://news.google.com/articles/CBMiWGh0dHBzOi8vdGhlaGlsbC5jb20vaG9tZW5ld3MvaG91c2UvNTYzNzg5LWppbS1qb3JkYW4tdG9wcy1tY2NhcnRoeS1waWNrcy1mb3ItamFuLTYtcGFuZWzSAVxodHRwczovL3RoZWhpbGwuY29tL2hvbWVuZXdzL2hvdXNlLzU2Mzc4OS1qaW0tam9yZGFuLXRvcHMtbWNjYXJ0aHktcGlja3MtZm9yLWphbi02LXBhbmVsP2FtcA?hl=en-US&gl=US&ceid=US%3Aen,Jim Jordan among McCarthy picks for Jan. 6 panel,House Minority Leader Kevin McCarthy (R-Calif.) on Monday is expected to pick five Republicans to serve on the special House committee created to investigate the Jan. 6 attack on the Capitol.,,[],2021-07-19 18:47:07-04:00,2021-07-19T19:54:54-04:00,https://thehill.com/homenews/house/563789-jim-jordan-tops-mccarthy-picks-for-jan-6-panel,https://thehill.com/sites/default/files/jordanjim_012420gn_lead.jpg,
https://news.google.com/articles/CAIiEPomMbE8QioJ6uv0lX-PhQoqGAgEKg8IACoHCAowhK-LAjD4ySww-9S0BQ?hl=en-US&gl=US&ceid=US%3Aen,Denver doctor calls for indoor mask mandates over COVID breakthrough cases,"Dr. Comilla Sasson said it was clear that the ""data is changing,"" with the Delta variant now accounting in the state for around 90% of cases.",,['Social Links For Jackie Salo'],2021-07-19 21:35:20+00:00,2021-07-20T12:38:55+00:00,https://nypost.com/2021/07/19/denver-doctor-calls-for-indoor-mask-mandates-over-breakthrough-cases/,https://nypost.com/wp-content/uploads/sites/2/2021/07/comilla-sasson-002.jpg?quality=90&strip=all&w=1024,false
https://news.google.com/articles/CBMiWWh0dHBzOi8vYWJjbmV3cy5nby5jb20vSGVhbHRoL3N0YXRpc3RpY3Mtc2hvdy1yaXNrcy12YWNjaW5hdGVkLWNvdmlkLTE5L3N0b3J5P2lkPTc4ODQ1NjI30gFdaHR0cHM6Ly9hYmNuZXdzLmdvLmNvbS9hbXAvSGVhbHRoL3N0YXRpc3RpY3Mtc2hvdy1yaXNrcy12YWNjaW5hdGVkLWNvdmlkLTE5L3N0b3J5P2lkPTc4ODQ1NjI3?hl=en-US&gl=US&ceid=US%3Aen,Statistics show the stark risks of not getting vaccinated against COVID-19,Recent figures from states and cities throughout the United States reveal the extent to which the virus is impacting people who are not fully vaccinated.,,"['Abc News', 'Meredith Deliso', 'July']",,,https://abcnews.go.com/Health/statistics-show-risks-vaccinated-covid-19/story?id=78845627,https://s.abcnews.com/images/Health/covid-testing-new-york-ap-jt-210716_1626476257456_hpMain_16x9_992.jpg,false
https://news.google.com/articles/CAIiEBO-SRBoEfqXUClBJXTb3pgqGQgEKhAIACoHCAowtv3_CjCSposDMLX54gU?hl=en-US&gl=US&ceid=US%3Aen,Was President Joe Biden right to call anti-vaccine proponents killers? (Hint: Hell yes),President Joe Biden is right to say anti-vaxxers are 'killing people.' Nearly all of recent COVID-19 deaths come from those who are not vaccinated.,,[],,,https://www.azcentral.com/story/opinion/op-ed/ej-montini/2021/07/19/president-joe-biden-right-say-anti-vaccine-proponents-killing-people/8009522002/,"https://www.gannett-cdn.com/presto/2021/07/07/NSJR/8c3decdd-be57-4832-a9d0-900fe759df8f-AP21187707238712.jpg?crop=5875,3305,x0,y298&width=3200&height=1801&format=pjpg&auto=webp",true
https://news.google.com/articles/CAIiEA7TNPDNo00QZLWT7f8GNk4qFwgEKg4IACoGCAow9vBNMK3UCDCovJYH?hl=en-US&gl=US&ceid=US%3Aen,"Indiana University's Vaccine Requirement Should Stand, Federal Judge Rules","A group of students challenged the college's policy, saying it violated their rights to reject medical treatment, among other things.",,['Clare Lombardo'],,,https://www.npr.org/2021/07/19/1018010489/indiana-universitys-vaccine-requirement-should-stand-federal-judge-rules,https://media.npr.org/assets/img/2021/07/19/iu-protest_wide-71696b0498c49e33145c8e238784df2c72cc3f4d.jpg?s=1400,false
https://news.google.com/articles/CCAiC3dsMFRLQzAzdE1rmAEB?hl=en-US&gl=US&ceid=US%3Aen,Federal judge affirms Indiana University vaccine requirement,A federal judge is allowing Indiana University to continue with its COVID-19 vaccine requirement for all students and employees. A ruling from a judge in Sou...,,[],,,https://www.youtube.com/watch?v=wl0TKC03tMk,https://i.ytimg.com/vi/wl0TKC03tMk/maxresdefault.jpg,
https://news.google.com/articles/CBMieGh0dHBzOi8vd3d3LndhbmUuY29tL25ld3MvbG9jYWwtbmV3cy9hdHRvcm5leS1mb3Itbm9ibGUtY291bnR5LXN0dWRlbnQtcmVzcG9uZHMtYWZ0ZXItanVkZ2UtYWZmaXJtcy1pdXMtdmFjY2luZS1tYW5kYXRlL9IBfGh0dHBzOi8vd3d3LndhbmUuY29tL25ld3MvbG9jYWwtbmV3cy9hdHRvcm5leS1mb3Itbm9ibGUtY291bnR5LXN0dWRlbnQtcmVzcG9uZHMtYWZ0ZXItanVkZ2UtYWZmaXJtcy1pdXMtdmFjY2luZS1tYW5kYXRlL2FtcC8?hl=en-US&gl=US&ceid=US%3Aen,Attorney for Noble County student responds after judge affirms IU’s vaccine mandate,"The attorney representing a Noble County student, as well as several others, has responded to a move by a federal judge after he ruled in favor of Indiana University's vaccine mandate.",,"['Chris Darby', 'The Associated Press']",2021-07-19 17:48:18+00:00,2021-07-19T22:26:19+00:00,https://www.wane.com/news/local-news/attorney-for-noble-county-student-responds-after-judge-affirms-ius-vaccine-mandate/,https://www.wane.com/wp-content/uploads/sites/21/2021/06/indiana-university-iu-1.jpeg?w=1280,
https://news.google.com/articles/CBMiS2h0dHBzOi8vd3d3Lm55dGltZXMuY29tL2xpdmUvMjAyMS8wNy8xOS93b3JsZC9jb3ZpZC12YXJpYW50LXZhY2NpbmUtdXBkYXRlc9IBVGh0dHBzOi8vd3d3Lm55dGltZXMuY29tL2xpdmUvMjAyMS8wNy8xOS93b3JsZC9jb3ZpZC12YXJpYW50LXZhY2NpbmUtdXBkYXRlcy5hbXAuaHRtbA?hl=en-US&gl=US&ceid=US%3Aen,Covid News: Canada Will Reopen Border With U.S.,"A federal judge affirmed Indiana University’s student vaccination requirement, a ruling that could have a broad impact for the many colleges that have issued mandates.",World,"['Vjosa Isai', 'Emily Anthes', 'Yu Young Jin']",2021-07-19 08:57:29+00:00,2021-08-13T11:13:42.107Z,https://www.nytimes.com/live/2021/07/19/world/covid-variant-vaccine-updates,https://static01.nyt.com/images/2021/07/19/us/19virus-briefing-canada-SWAP/19virus-briefing-canada-SWAP-facebookJumbo.jpg,false
https://news.google.com/articles/CBMiaGh0dHBzOi8vdGhlaGlsbC5jb20vaG9tZW5ld3Mvc3RhdGUtd2F0Y2gvNTYzNzg3LWNoaWNhZ28tcG9saWNlLWFubm91bmNlLW5ldy1hbnRpLWd1bi12aW9sZW5jZS1pbml0aWF0aXZl0gFsaHR0cHM6Ly90aGVoaWxsLmNvbS9ob21lbmV3cy9zdGF0ZS13YXRjaC81NjM3ODctY2hpY2Fnby1wb2xpY2UtYW5ub3VuY2UtbmV3LWFudGktZ3VuLXZpb2xlbmNlLWluaXRpYXRpdmU_YW1w?hl=en-US&gl=US&ceid=US%3Aen,Chicago police announce new anti-gun violence initiative,"The Chicago Police Department on Monday announced a new anti-gun violence initiative following another violent weekend, during which more than 50 people were shot in the city and 11 died.",,[],2021-07-19 18:54:21-04:00,2021-07-19T18:54:20-04:00,https://thehill.com/homenews/state-watch/563787-chicago-police-announce-new-anti-gun-violence-initiative,https://thehill.com/sites/default/files/blogs/chicagopolice08516getty.jpg,
https://news.google.com/articles/CAIiELn56dPFjZjIc85vzP-srk0qGQgEKhAIACoHCAowwL2ICzCckocDMP2lqQY?hl=en-US&gl=US&ceid=US%3Aen,"Chicago police target gun trafficking following bloody weekend, ahead of Biden strike force",The Chicago Police Department on Monday announced the creation of a special investigations team to stem the flow of illegal guns into the city amid a summer of increasing violence and following a bloody weekend in which 56 people were shot and 11 others were killed.,,['Louis Casiano'],,2021-07-19T15:53:15-04:00,https://www.foxnews.com/us/chicago-team-gun-trafficking-biden,https://static.foxnews.com/foxnews.com/content/uploads/2021/03/Chicago-1.jpg,false
https://news.google.com/articles/CBMiTGh0dHBzOi8vbmV3cy55YWhvby5jb20vc2l4LWNoaWNhZ28tY2hpbGRyZW4taW5qdXJlZC1zaG9vdGluZ3MtMjE0MzAwMzA1Lmh0bWzSAVRodHRwczovL25ld3MueWFob28uY29tL2FtcGh0bWwvc2l4LWNoaWNhZ28tY2hpbGRyZW4taW5qdXJlZC1zaG9vdGluZ3MtMjE0MzAwMzA1Lmh0bWw?hl=en-US&gl=US&ceid=US%3Aen,Six Chicago children injured by shootings in nine hours as city gun crime ramps up,Six children were injured by gunshots within nine hours in Chicago over the weekend.,,['Matt Miller'],,,https://news.yahoo.com/six-chicago-children-injured-shootings-214300305.html,https://s.yimg.com/uu/api/res/1.2/2cfxkaw8h11EmPp2LNIFug--~B/aD05NDA7dz0xNTQwO2FwcGlkPXl0YWNoeW9u/https://media.zenfs.com/en/washington_examiner_articles_265/cf55ee5e17e18407adbfcd3f3987a83a,
https://news.google.com/articles/CAIiEDYPiepYFxNv1UqLpWylVp4qFwgEKg4IACoGCAowlPVUMLXBDDCo488G?hl=en-US&gl=US&ceid=US%3Aen,Chicago police announce new team to take guns off the street ahead of planned federal effort,"Chicago police Superintendent David Brown on Monday announced the department has expanded its firearm investigation efforts, separate from a federal strategy unveiled by President Joe Biden’s administration.","Criminal Justice, News, Breaking News",['Jeremy Gorner'],,,https://www.chicagotribune.com/news/criminal-justice/ct-chicago-police-new-gun-team-20210719-feqruwuqrrdtlpupypjkpdm62e-story.html,https://www.chicagotribune.com/resizer/5JiL9HqkvWiF08OOrQnYHncUzZc=/1200x0/center/bottom/cloudfront-us-east-1.images.arcpublishing.com/tronc/3KQ2YFDHCJGKDHOWXRHVU52QU4.jpg,false
