article_url,article_title,meta_description,section,authors,publish_date,modified_date,canonical_link,top_image,is_opinion
https://news.google.com/articles/CCAiC24zeDA5TTV4aUZRmAEB?hl=en-US&gl=US&ceid=US%3Aen,Patriots Week One Recap: Dolphins Defeat Patriots 17-16,The Patriots began their 2021 campaign with a 17-16 loss to the Dolphins. George Balekji spoke with Zack Cox after the game to recap the season opener. https...,,[],,,https://www.youtube.com/watch?v=n3x09M5xiFQ,https://i.ytimg.com/vi/n3x09M5xiFQ/hqdefault.jpg,
https://news.google.com/articles/CBMiSWh0dHBzOi8vc3BvcnRzLnlhaG9vLmNvbS9wYXRyaW90cy1mYW5zLW1peGVkLWZlZWxpbmdzLXNraXAtMDAzNTAwMDA4Lmh0bWzSAVFodHRwczovL3Nwb3J0cy55YWhvby5jb20vYW1waHRtbC9wYXRyaW90cy1mYW5zLW1peGVkLWZlZWxpbmdzLXNraXAtMDAzNTAwMDA4Lmh0bWw?hl=en-US&gl=US&ceid=US%3Aen,Patriots fans will have mixed feelings about Skip Bayless’ tweet after loss to Dolphins,"By sending this tweet, it's plausible to assume Skip Bayless didn't watch the game.",,['Isaiah Houde'],,,https://patriotswire.usatoday.com/2021/09/12/patriots-fans-will-have-mixed-feelings-about-skip-bayless-tweet-after-loss-to-dolphins/,https://s.yimg.com/ny/api/res/1.2/c6b_VbjifXBd4zRASBtkaA--/YXBwaWQ9aGlnaGxhbmRlcjt3PTEyMDA7aD03MDk-/https://s.yimg.com/uu/api/res/1.2/l2Fz6Davo0cJWMK1EWxnjg--~B/aD0xNTEyO3c9MjU2MDthcHBpZD15dGFjaHlvbg--/https://media.zenfs.com/en/new_england_patriots_wire_usa_today_sports_articles_330/0818e2b1abaf126fdaa48346f8dd0203,
https://news.google.com/articles/CAIiEAflR-nvuedp7CiRckwAgRYqGQgEKhAIACoHCAowquOVCzDNha0DMKvA6wY?hl=en-US&gl=US&ceid=US%3Aen,"QB Report Card: Tua Tagovailoa is good, not great, in season opening win","While the Dolphins offense looked to be a bit off in their win against New England, Tua Tagovailoa looked better than his stat line indicates.",,"['Alejandro Vargas', 'Jeremy Klump']",2021-09-13 07:00:26+00:00,,https://phinphanatic.com/2021/09/13/qb-report-card-tua-tagovailoa-good-not-great-season-opening-win/,"https://images2.minutemediacdn.com/image/fetch/w_2000,h_2000,c_fit/https%3A%2F%2Fphinphanatic.com%2Fwp-content%2Fuploads%2Fimagn-images%2F2017%2F07%2F16741006.jpeg",
https://news.google.com/articles/CAIiEPYqtV31IdM5DAdEs-eEp7QqGQgEKhAIACoHCAowtv3_CjCSposDMOX54gU?hl=en-US&gl=US&ceid=US%3Aen,NFL power rankings: Arizona Cardinals make big leap after Week 1 win over Tennessee Titans,The Arizona Cardinals are on the rise in NFL power rankings after a dominant 38-13 win over the Tennessee Titans in Week 1.,,[],,,https://www.azcentral.com/story/sports/nfl/cardinals/2021/09/13/nfl-power-rankings-arizona-cardinals-week-1-win-tennessee-titans/8318949002/,"https://www.gannett-cdn.com/presto/2021/09/13/USAT/02b0edaf-0649-4981-b3a3-51c2e74bcf1f-USATSI_16740741.jpg?crop=2312,1301,x0,y67&width=2312&height=1301&format=pjpg&auto=webp",false
https://news.google.com/articles/CBMiaWh0dHBzOi8vd3d3Lm5mbC5jb20vbmV3cy9qdWxpby1qb25lcy1kdW1iLWV4cGxldGl2ZS1wZW5hbHR5LWVuY2Fwc3VsYXRlcy10aXRhbnMtdGVycmlibGUtZGF5LXZzLWNhcmRpbmFsc9IBaWh0dHBzOi8vd3d3Lm5mbC5jb20vX2FtcC9qdWxpby1qb25lcy1kdW1iLWV4cGxldGl2ZS1wZW5hbHR5LWVuY2Fwc3VsYXRlcy10aXRhbnMtdGVycmlibGUtZGF5LXZzLWNhcmRpbmFscw?hl=en-US&gl=US&ceid=US%3Aen,Julio Jones' 'dumb (expletive)' penalty encapsulates Titans' terrible day vs. Cardinals,"Tennessee's acquisition of ﻿Julio Jones﻿ was hailed as a move that could push the Titans toward legitimate Super Bowl contention. In Week 1, it didn't do much more than set them back, at least on one regrettable snap.",,['Nick Shook'],,,https://www.nfl.com/news/julio-jones-dumb-expletive-penalty-encapsulates-titans-terrible-day-vs-cardinals,https://static.www.nfl.com/image/private/t_editorial_landscape_12_desktop/league/icbdviq0mydavmacl18o,
https://news.google.com/articles/CBMiVGh0dHBzOi8vd3d3LmZveG5ld3MuY29tL3Nwb3J0cy90aXRhbnMtdGF5bG9yLWxld2FuLWNhcmRpbmFscy1jaGFuZGxlci1qb25lcy1leHBvc2luZ9IBWGh0dHBzOi8vd3d3LmZveG5ld3MuY29tL3Nwb3J0cy90aXRhbnMtdGF5bG9yLWxld2FuLWNhcmRpbmFscy1jaGFuZGxlci1qb25lcy1leHBvc2luZy5hbXA?hl=en-US&gl=US&ceid=US%3Aen,Titans' Taylor Lewan thanks Cardinals' Chandler Jones for 'exposing' him in blowout loss,"Titans offensive tackle Taylor Lewan tweeted his thanks to Cardinals' linebacker Chandler Jones for ""exposing"" him in an ugly 38-13 loss.",,['Paulina Dedaj'],,2021-09-13T13:11:41-04:00,https://www.foxnews.com/sports/titans-taylor-lewan-cardinals-chandler-jones-exposing,https://static.foxnews.com/foxnews.com/content/uploads/2021/09/Chandler-Jones.jpg,false
https://news.google.com/articles/CAIiEDZzHDFQeN4kmXAb5A8QgscqMwgEKioIACIQIN056GXkgVlPCUZLnErCgyoUCAoiECDdOehl5IFZTwlGS5xKwoMwlNSaBw?hl=en-US&gl=US&ceid=US%3Aen,"Cardinals RT Kelvin Beachum day-to-day with rib injury, per Kingsbury","Arizona Cardinals starting right tackle Kelvin Beachum is day-to-day with a rib injury, head coach Kliff Kingsbury told reporters Monday.",,['Arizona Sports'],2021-09-13 21:25:35+00:00,,https://arizonasports.com/story/2815537/cardinals-rt-kelvin-beachum-day-day-rib-injury-per-kingsbury/,http://arizonasports.com/wp-content/uploads/2021/06/hopbeach1-scaled-e1631567758157.jpg,
https://news.google.com/articles/CBMiZGh0dHBzOi8vd3d3LmZhbnRhc3lwcm9zLmNvbS9uZmwvbmV3cy8zMjIyMTkvamFtZXMtY29ubmVyLWhlbGQtdG8tNTMteWFyZHMtd2Vlay0xLXdpbi1vdmVyLXRpdGFucy5waHDSAWhodHRwczovL3d3dy5mYW50YXN5cHJvcy5jb20vbmZsL25ld3MvMzIyMjE5L2phbWVzLWNvbm5lci1oZWxkLXRvLTUzLXlhcmRzLXdlZWstMS13aW4tb3Zlci10aXRhbnMucGhwP2FtcA?hl=en-US&gl=US&ceid=US%3Aen,James Conner held to 53 yards in Week 1 win over Titans,"Conner signed a one-year deal with the Cardinals during free agency. Sunday he split backfield touches, with Chase Edmonds, as expected. However, Conner was not as efficient on the ground and was not targeted in the passing game. He's could potentially lose touches to Edmonds if this trend were to carry into Week 2.",,[],2021-09-13 18:04:43+00:00,,https://www.fantasypros.com/nfl/news/322219/james-conner-held-to-53-yards-week-1-win-over-titans.php,https://images.fantasypros.com/images/players/nfl/16447/headshot/210x210.png,
https://news.google.com/articles/CAIiEHNV3w1-Hr-f-oXUee8C_b8qEwgEKgwIACoFCAow4GowoAgwkRo?hl=en-US&gl=US&ceid=US%3Aen,Woolly mammoths could walk the Earth again by 2027 if CRISPR startup succeeds,Colossal lands $15 million to restore the woolly mammoth to the Arctic by genetically modifying their Asian elephant cousins.,,['Stephen Shankland'],,,https://www.cnet.com/news/woolly-mammoths-could-walk-the-earth-again-by-2027-if-crispr-startup-succeeds/,https://www.cnet.com/a/img/4Vqmuozj7hKrs8_Gr2NwLxi8awo=/1200x630/2021/09/08/3ec47182-3258-4ddf-907a-a2db3af15399/woolly-mammoth-getty-images-1192609757.jpg,false
https://news.google.com/articles/CAIiECw4fcQjiO61BV86btO9DVgqFwgEKg8IACoHCAowjuuKAzCWrzwwt4QY?hl=en-US&gl=US&ceid=US%3Aen,A New Company With a Wild Mission: Bring Back the Woolly Mammoth,"With $15 million in private funding, Colossal aims to bring thousands of woolly mammoths back to Siberia. Some scientists are deeply skeptical that will happen.",Science,['Carl Zimmer'],2021-09-13 14:00:11+00:00,2021-09-30T13:37:00.456Z,https://www.nytimes.com/2021/09/13/science/colossal-woolly-mammoth-DNA.html,https://static01.nyt.com/images/2021/09/13/science/13SCI-mammoth-3/13SCI-mammoth-3-facebookJumbo.jpg,false
https://news.google.com/articles/CAIiEB7AnAsb9YJxXltc9NU7s-QqGQgEKhAIACoHCAowocv1CjCSptoCMPvTpgU?hl=en-US&gl=US&ceid=US%3Aen,Scientists want to resurrect the woolly mammoth. They just got $15 million to make it happen,An ambitious project to resurrect the woolly mammoth led by Harvard geneticist George Church has secured a financial shot in the arm.,world,['Katie Hunt'],,2021-09-13T20:50:59Z,https://www.cnn.com/2021/09/13/world/woolly-mammoth-resurrect-deextinction-scn/index.html,https://cdn.cnn.com/cnnnext/dam/assets/210913135400-woolly-mammoth-replica-file-super-tease.jpg,false
https://news.google.com/articles/CAIiENkAwzcTf-1T6jm7awcZueIqFQgEKgwIACoFCAow8HIw0Awwy7WNAg?hl=en-US&gl=US&ceid=US%3Aen,"This New Company Says It's Bringing Back the Woolly Mammoth, As A Way to Fight Climate Change","""We've found a way to harness CRISPR's power for species de-extinction.""","This New Company Says It's Bringing Back the Woolly Mammoth, As A Way to Fight Climate Change",['Liz Brody'],,2021-09-13 15:38:09,https://www.entrepreneur.com/article/384478,https://assets.entrepreneur.com/content/3x2/2000/1631193227-bengeorge.jpg,
https://news.google.com/articles/CAIiEAC_G_s2Qc6oP8GweHkI5ggqGQgEKhAIACoHCAow2Nb3CjDivdcCMP3ungY?hl=en-US&gl=US&ceid=US%3Aen,Lab-grown woolly mammoths could walk the Earth in six years if geneticist's new start-up succeeds,Tech entrepreneur Ben Lamm is helping fund a project by Harvard geneticist George Church to revive the woolly mammoth by genetically engineering Asian elephants.,Technology,"['Catherine Clifford', 'In Catclifford']",2021-09-13 14:00:01+00:00,2021-09-15T00:30:28+0000,https://www.cnbc.com/2021/09/13/geneticist-george-church-gets-funding-for-lab-grown-woolly-mammoths.html,https://image.cnbcfm.com/api/v1/image/106940061-1631287233154-bengeorge_002.jpg?v=1631287782,false
https://news.google.com/articles/CBMicWh0dHBzOi8vc2NpdGVjaGRhaWx5LmNvbS9zdXBlcm5vdmEtcmVxdWllbS1yZXJ1bi1vZi1tYXNzaXZlLWJsYXN0LWZyb20tZXhwbG9kaW5nLXN0YXItZXhwZWN0ZWQtdG8tYXBwZWFyLWluLTIwMzcv0gF1aHR0cHM6Ly9zY2l0ZWNoZGFpbHkuY29tL3N1cGVybm92YS1yZXF1aWVtLXJlcnVuLW9mLW1hc3NpdmUtYmxhc3QtZnJvbS1leHBsb2Rpbmctc3Rhci1leHBlY3RlZC10by1hcHBlYXItaW4tMjAzNy9hbXAv?hl=en-US&gl=US&ceid=US%3Aen,Supernova Requiem: Rerun of Massive Blast From Exploding Star Expected To Appear in 2037,,Space,"[""Mike O'Neill"", 'Space Telescope Science Institute']",2021-09-13 12:22:23-07:00,2021-09-15T20:50:11-07:00,https://scitechdaily.com/supernova-requiem-rerun-of-massive-blast-from-exploding-star-expected-to-appear-in-2037/,https://scitechdaily.com/images/Galaxy-Cluster-MACSJ-0138.gif,
https://news.google.com/articles/CBMiXWh0dHBzOi8vd3d3Lm5hc2EuZ292L2ZlYXR1cmUvZ29kZGFyZC8yMDIxL3JlcnVuLW9mLXN1cGVybm92YS1ibGFzdC1leHBlY3RlZC10by1hcHBlYXItaW4tMjAzN9IBAA?hl=en-US&gl=US&ceid=US%3Aen,Rerun of Supernova Blast Expected to Appear in 2037,"Astronomers have added a solid prediction of an event happening deep in intergalactic space: an image of an exploding star, dubbed Supernova Requiem, which will appear around the year 2037. Although this rebroadcast will not be visible to the naked eye, some future telescopes should be able to spot it.",,['Lynn Jenner'],,,https://news.google.com/feature/goddard/2021/rerun-of-supernova-blast-expected-to-appear-in-2037,http://www.nasa.gov/sites/default/files/thumbnails/image/stsci-01f9kzxfka9h4tpegp0mrqcpgp.png,
https://news.google.com/articles/CBMiQGh0dHBzOi8vaHViYmxlc2l0ZS5vcmcvY29udGVudHMvbmV3cy1yZWxlYXNlcy8yMDIxL25ld3MtMjAyMS0wMzDSAQA?hl=en-US&gl=US&ceid=US%3Aen,Rerun of Supernova Blast Is Expected to Appear in 2037,,,[],,,http://hubblesite.org/contents/news-releases/2021/news-2021-030,https://stsci-opo.org/STScI-01F9KZW8FJA2TP9MJJWGZ5BN33.png,
https://news.google.com/articles/CAIiEMWmnUXJIL4e_gGTUdzIy_YqFggEKg4IACoGCAow3O8nMMqOBjD38Ak?hl=en-US&gl=US&ceid=US%3Aen,SpaceX is about to send its first crew of private citizens to space,"A physician assistant, a doctor, a data engineer, and a billionaire entrepreneur will launch to space for three days on September 15th as SpaceX’s first all-civilian crew.",,"['Joey Roulette', 'Sep']",2021-09-13 17:17:27-04:00,2021-09-13T17:17:27-04:00,https://www.theverge.com/2021/9/13/22667339/spacex-inspiration4-first-all-civilian-crew-dragon,https://cdn.vox-cdn.com/thumbor/1Ya4pKr3s-q_6war80DPFIBP5K4=/0x275:3840x2285/fit-in/1200x630/cdn.vox-cdn.com/uploads/chorus_asset/file/22846129/E_I1GNOUcAY2E4x.jpg,
https://news.google.com/articles/CBMiU2h0dHBzOi8vd3d3LnlhaG9vLmNvbS9saWZlc3R5bGUvc3BhY2V4LWxhdW5jaC1oaXN0b3JpYy1tYW5uZWQtcm9ja2V0LTE1MDAwMDQwOS5odG1s0gFbaHR0cHM6Ly93d3cueWFob28uY29tL2FtcGh0bWwvbGlmZXN0eWxlL3NwYWNleC1sYXVuY2gtaGlzdG9yaWMtbWFubmVkLXJvY2tldC0xNTAwMDA0MDkuaHRtbA?hl=en-US&gl=US&ceid=US%3Aen,SpaceX Is About to Launch an Historic Manned Rocket That Will Orbit the Earth for 3 Days,Inspiration4's orbital mission will be one for the record books because nobody in the all-civilian crew is a professional astronaut.,,['Michael Verdon'],,,https://www.yahoo.com/lifestyle/spacex-launch-historic-manned-rocket-150000409.html,https://s.yimg.com/uu/api/res/1.2/pnKpMo8AsnK3aeufTzkuYQ--~B/aD01NjM7dz0xMDAwO2FwcGlkPXl0YWNoeW9u/https://media.zenfs.com/en/robb_report_967/14233eb1f7b838a3872026423cbf7dd4,
https://news.google.com/articles/CAIiEETJZhWkB7CQPsE3OeRwSmQqGAgEKg8IACoHCAowjtSUCjC30XQw78SzBg?hl=en-US&gl=US&ceid=US%3Aen,"They ‘could be our neighbors,’ and they’re going to space. SpaceX gets ready to fly the Inspiration4 crew.",None of the crew has been to space before.,Space,[],2021-09-13 11:00:30.281000+00:00,2021-09-15T23:39:51.610Z,https://www.washingtonpost.com/technology/2021/09/13/inspiration4-spacex-civlian-space-flight/,https://www.washingtonpost.com/wp-apps/imrs.php?src=https://arc-anglerfish-washpost-prod-washpost.s3.amazonaws.com/public/43DYW7QBC4I6ZB7APYD33HHCOA.jpg&w=1440,
https://news.google.com/articles/CBMiX2h0dHBzOi8vd3d3LmtzbC5jb20vYXJ0aWNsZS81MDIzOTg4Ni9zcGFjZXgtcHJlcGFyZXMtdG8tc2VuZC1maXJzdC1hbGwtY2l2aWxpYW4tY3Jldy1pbnRvLW9yYml00gEA?hl=en-US&gl=US&ceid=US%3Aen,SpaceX prepares to send first all-civilian crew into orbit,"Yet another billionaire entrepreneur is set to ride into space this week, strapped inside the capsule of a SpaceX rocketship as part of an astro-tourist team poised to make history as the first all-civilian crew launched into Earth orbit.",,['Deseret Digital Media'],,,https://www.ksl.com/article/50239886/spacex-prepares-to-send-first-all-civilian-crew-into-orbit,https://img.ksl.com/slc/2840/284099/28409972.JPG?filter=ksl/responsive_story_lg,
https://news.google.com/articles/CAIiEA-oJm2G_2ui-dofcjGip7MqGQgEKhAIACoHCAowjsP_CjD2kPkCMOvt5wU?hl=en-US&gl=US&ceid=US%3Aen,"SpaceX targeting Wednesday night for all-civilian, private mission launch",Four private citizens will be orbit the Earth for 3 days. It's the first time an all-civilian crew has done so. The launch is slated for Wednesday.,,[],,,https://www.floridatoday.com/story/tech/science/space/2021/09/13/spacex-targeting-wednesday-night-private-mission-launch/8313458002/,"https://www.gannett-cdn.com/presto/2021/09/13/PBRE/8377261e-2632-4276-a76d-6dddb95a4a82-Inspo4_Crew_Rehearsal.jpg?crop=2047,1152,x0,y0&width=2047&height=1152&format=pjpg&auto=webp",false
https://news.google.com/articles/CBMiKGh0dHBzOi8vd3d3LmJiYy5jb20vbmV3cy9oZWFsdGgtNTg1MTYyMDfSASxodHRwczovL3d3dy5iYmMuY29tL25ld3MvaGVhbHRoLTU4NTE2MjA3LmFtcA?hl=en-US&gl=US&ceid=US%3Aen,Covid: Which countries are vaccinating children and why?,Millions of children around the world are being offered a Covid vaccine.,Health,[],,,https://www.bbc.com/news/health-58516207,https://ichef.bbci.co.uk/news/1024/branded_news/9294/production/_120542573_cc1200-gettyimages-1235237857.jpg,
https://news.google.com/articles/CCAiCzNUeV9rR21vcUVBmAEB?hl=en-US&gl=US&ceid=US%3Aen,Children aged 12-15 can receive COVID vaccine - UK's Chief Medical Officers,The UK's Chief Medical Officers have decided children aged 12 to 15 will be offered a COVID vaccine.Read here for more on this story:https://news.sky.com/sto...,,[],,,https://www.youtube.com/watch?v=3Ty_kGmoqEA,https://i.ytimg.com/vi/3Ty_kGmoqEA/maxresdefault.jpg,
https://news.google.com/articles/CAIiEOR4VOellBj2SDOpPOm2P3wqMwgEKioIACIQcjJaSOXDHqsfBBX2KL7ggyoUCAoiEHIyWkjlwx6rHwQV9ii-4IMw-8XbBg?hl=en-US&gl=US&ceid=US%3Aen,UK greenlights coronavirus jabs for kids aged 12 and over,Decision comes after top doctors backed vaccinations to prevent ‘educational disruption.’,health-care,['More ...'],2021-09-13 14:44:16+00:00,2021-09-13T20:23:39+00:00,https://www.politico.eu/article/uk-doctors-recommend-coronavirus-vaccine-kids/,https://www.politico.eu/wp-content/uploads/2021/09/13/GettyImages-1339242638-1200x628.jpg,
https://news.google.com/articles/CCAiC3MyaFJ0dEhaMThjmAEB?hl=en-US&gl=US&ceid=US%3Aen,"Vaccinations for teenagers 'not a silver bullet', says Chris Whitty","Professor Chris Whitty has said while vaccinating those aged between 12 and 15 will ""reduce education disruption"" it is not a ""panacea"" or a ""silver bullet""....",,[],,,https://www.youtube.com/watch?v=s2hRttHZ18c,https://i.ytimg.com/vi/s2hRttHZ18c/maxresdefault.jpg,
https://news.google.com/articles/CBMinAFodHRwczovL3d3dy50aGVoaW5kdS5jb20vbmV3cy9pbnRlcm5hdGlvbmFsL3ZhY2NpbmUtcGFzc3BvcnRzLWFyZS1jb21pbmctdG8tYXVzdHJhbGlhLWhvdy13aWxsLXRoZXktd29yay1hbmQtd2hhdC13aWxsLXlvdS1uZWVkLXRoZW0tZm9yL2FydGljbGUzNjQyNjUwMS5lY2XSAaEBaHR0cHM6Ly93d3cudGhlaGluZHUuY29tL25ld3MvaW50ZXJuYXRpb25hbC92YWNjaW5lLXBhc3Nwb3J0cy1hcmUtY29taW5nLXRvLWF1c3RyYWxpYS1ob3ctd2lsbC10aGV5LXdvcmstYW5kLXdoYXQtd2lsbC15b3UtbmVlZC10aGVtLWZvci9hcnRpY2xlMzY0MjY1MDEuZWNlL2FtcC8?hl=en-US&gl=US&ceid=US%3Aen,Vaccine passports are coming to Australia. How will they work and what will you need them for?,Australia also suggested that some freedoms will be only available to people who are fully vaccinated,International,"['India Has Exported Over Million Vaccine Doses To Nearly Countries Through Grants', 'Commercial Shipments', 'The Covax Facility', 'Economic Woes To China', 'A Host Of Challenges Are Awaiting The New Leader']",,,https://www.thehindu.com/news/international/vaccine-passports-are-coming-to-australia-how-will-they-work-and-what-will-you-need-them-for/article36426501.ece,https://www.thehindu.com/news/international/wjoun3/article36426500.ece/ALTERNATES/LANDSCAPE_615/NSW-Premier-Gladys-Berejiklian-Gives-COVID-19-Update,
https://news.google.com/articles/CAIiEJoKcLidnojUxxF3mRWayDcqGQgEKhAIACoHCAowwL2ICzCckocDMMWEqQY?hl=en-US&gl=US&ceid=US%3Aen,"COVID-19 vaccine boosters unnecessary for most, say FDA advisers reportedly resigning over issue","Available evidence doesn’t yet indicate a need for COVID-19 vaccine booster shots among the general population, an international group of scientists said Monday, including two senior FDA officials reportedly stepping down from their posts over a disagreement with the White House on the administration of booster shots.",,"['Kayla Rivas', 'Kayla Rivas Is A Health Reporter', 'Joined Fox News In April']",,2021-09-13T12:53:01-04:00,https://www.foxnews.com/health/covid-19-vaccine-booster-unnecessary-fda-resigning,https://static.foxnews.com/foxnews.com/content/uploads/2021/07/Johnson-and-Johnson.png,false
https://news.google.com/articles/CCAiCzJUQ1AxRzQzNjk0mAEB?hl=en-US&gl=US&ceid=US%3Aen,FDA warning on kids and vaccines as COVID-19 cases hit new high l GMA,"Parents await the agency's approval for kids ages 5-11 as record cases are reported in children.LEARN MORE: As COVID-19 cases in kids surge, a pediatrician s...",,[],,,https://www.youtube.com/watch?v=2TCP1G43694,https://i.ytimg.com/vi/2TCP1G43694/maxresdefault.jpg,
https://news.google.com/articles/CAIiECAOQFJzAcoZNZnrElehCJAqMwgEKioIACIQddKeXuXzkc_CYc77W_FUlSoUCAoiEHXSnl7l85HPwmHO-1vxVJUwlIHqBg?hl=en-US&gl=US&ceid=US%3Aen,New Paper in Lancet : Most Don't Need Boosters,A new international review of COVID cases reaches a clear recommendation: Hold off on booster shots for the general population. The new paper in the   Lancet   medical journal...,,['John Johnson'],2021-09-13 17:42:58-05:00,,https://www.newser.com/story/310981/new-paper-in-lancet-most-dont-need-boosters.html,https://img2-azrcdn.newser.com/image/1376055-12-20210913125313.jpeg,
https://news.google.com/articles/CBMiWWh0dHBzOi8vd3d3LmNhcGVjb2QuY29tL25ld3NjZW50ZXIvZmRhLWV4cGVydHMtYW1vbmctZ3JvdXAtb3Bwb3NpbmctdXMtYm9vc3Rlci1zaG90LXBsYW4v0gEA?hl=en-US&gl=US&ceid=US%3Aen,FDA Experts Among Group Opposing US Booster Shot Plan,,,[],2021-09-13 17:15:44+00:00,2021-09-13T17:15:44+00:00,https://www.capecod.com/newscenter/fda-experts-among-group-opposing-us-booster-shot-plan/,https://www.capecod.com/wp-content/uploads/nws_COVID-19-by-Center-for-Disease-Control_GC01292021.jpg,
https://news.google.com/articles/CAIiENcUvnP9dWVJHI0jFbh5uMwqGQgEKhAIACoHCAow2Nb3CjDivdcCMJ_5ngY?hl=en-US&gl=US&ceid=US%3Aen,"Data shows Covid booster shots are 'not appropriate' at this time, U.S. and international scientists conclude","An expert review of data concludes Covid vaccine boosters are not needed at this time for the general public, a group of U.S. and international scientists said.",Health & Science,['Berkeley Lovelace Jr.'],2021-09-13 13:00:17+00:00,2021-09-13T15:26:56+0000,https://www.cnbc.com/2021/09/13/covid-booster-shots-data-shows-third-shots-not-appropriate-at-this-time-scientists-conclude.html,https://image.cnbcfm.com/api/v1/image/106929747-1629295956971-gettyimages-1234733598-VIRUS_VACCINE_US.jpeg?v=1629995681,false
https://news.google.com/articles/CAIiEFjC1ksEP5h4coAxWndEp3EqGQgEKhAIACoHCAowjsP7CjCSpPQCMLmw0wU?hl=en-US&gl=US&ceid=US%3Aen,"Hold off on that flight to the Caribbean: CDC raises travel alert level for Belize, Saint Kitts and Nevis","The CDC raised both Saint Kitts and Nevis and Belize a level 4, which signifies ""very high'' COVID levels and means tourists should avoid travel.",,[],,,https://www.usatoday.com/story/travel/news/2021/09/13/belize-saint-kitts-and-nevis-flights-travel-cdc-alert/8324472002/,"https://www.gannett-cdn.com/presto/2019/12/04/USAT/fffb2a90-ed2b-4a10-ba62-0730a98b1cf5-10-belize.jpg?crop=2115,1190,x0,y227&width=2115&height=1190&format=pjpg&auto=webp",false
https://news.google.com/articles/CCAiC0YzZkstRnZTeXlZmAEB?hl=en-US&gl=US&ceid=US%3Aen,Unvaccinated people 11 times more likely to die of COVID-19: U.S. CDC,"미 CDC ""코로나 백신 미접종자 사망률, 접종자의 11배""A study has revealed that people who haven't been vaccinated against COVID-19 are eleven times more likely to die from the v...",,[],,,https://www.youtube.com/watch?v=F3fK-FvSyyY,https://i.ytimg.com/vi/F3fK-FvSyyY/maxresdefault.jpg,
https://news.google.com/articles/CBMicWh0dHBzOi8vd3d3LmNubi5jb20vdXMvbGl2ZS1uZXdzL2Nvcm9uYXZpcnVzLXBhbmRlbWljLXZhY2NpbmUtdXBkYXRlcy0wOS0xMy0yMS9oX2UwYjU1YjJhZjg5M2VmNDIzZWVmODRhOGU3ZDA3MDRh0gFdaHR0cHM6Ly9hbXAuY25uLmNvbS9jbm4vdXMvbGl2ZS1uZXdzL2Nvcm9uYXZpcnVzLXBhbmRlbWljLXZhY2NpbmUtdXBkYXRlcy0wOS0xMy0yMS9pbmRleC5odG1s?hl=en-US&gl=US&ceid=US%3Aen,CDC director says agencies are working “with urgency” on Covid-19 vaccine for younger children,"US Centers for Disease Control and Prevention Director Dr. Rochelle Walensky said Monday that her agency is working urgently on a Covid-19 vaccine for younger children, with the hope that younger children will be vaccinated by the end of the year.",us,"['Melissa Macaya', 'Melissa Mahtani', 'Mike Hayes', 'Veronica Rocha', 'Meg Wagner']",2021-09-13 13:08:15+00:00,2021-09-13T13:08:15Z,https://www.cnn.com/us/live-news/coronavirus-pandemic-vaccine-updates-09-13-21/index.html,https://cdn.cnn.com/cnnnext/dam/assets/200213175739-03-coronavirus-0213-super-tease.jpg,false
https://news.google.com/articles/CCAiC0ZOUjd5ZnVyMXJjmAEB?hl=en-US&gl=US&ceid=US%3Aen,When can kids 12 and under get the shot?,"Sam Amesquita is dad to two younger kids. He's fully vaccinated. But admits, he's unsure about his young ones.“I guess I have mixed feelings about it,"" he sa...",,[],,,https://www.youtube.com/watch?v=FNR7yfur1rc,https://i.ytimg.com/vi/FNR7yfur1rc/maxresdefault.jpg,
https://news.google.com/articles/CBMiY2h0dHBzOi8vd3d3LmNydWlzZWhpdmUuY29tL2Fub3RoZXItdGhyZWUtY3J1aXNlLWRlc3RpbmF0aW9ucy1hZGRlZC10by1jZGMtbGV2ZWwtNC10cmF2ZWwtbGlzdC81NjM0NdIBAA?hl=en-US&gl=US&ceid=US%3Aen,Another Three Cruise Destinations Added to CDC Level 4 Travel List,"CDC elevates its travel notice fir another three Caribbean cruise destinations including St. Kitts and Nevis, Belize and Grenada.",,['Emrys Thakkar'],2021-09-13 22:54:08+00:00,2021-09-13T22:54:10+00:00,https://www.cruisehive.com/another-three-cruise-destinations-added-to-cdc-level-4-travel-list/56345,https://www.cruisehive.com/wp-content/uploads/2021/09/cdc9.jpg,
https://news.google.com/articles/CAIiEHEJwL0qQLFhM2hVzofaBv0qFwgEKg4IACoGCAowzdp7ML-3CTDp4OwG?hl=en-US&gl=US&ceid=US%3Aen,Five children orphaned after both parents die of Covid,"Popular maths teacher and nurse both pass away from disease as GoFundMe campaign raises $200,000 to support bereaved family",News,[],2021-09-13 17:52:42+00:00,2021-09-13T17:52:42.000Z,https://www.independent.co.uk/news/world/americas/california-parents-covid-children-orphaned-b1919087.html,https://static.independent.co.uk/2021/09/13/12/newFile-5.jpg?width=1200&auto=webp&quality=75,
https://news.google.com/articles/CAIiEMnnwYtWhLiCpMM-3f8N7AIqGAgEKg8IACoHCAowjtSUCjC30XQwzqe5AQ?hl=en-US&gl=US&ceid=US%3Aen,"California couple die of covid, leaving five kids behind. Their newborn is 3 weeks old.",A mother and father died before they were able to name their newborn baby.,Morning Mix,[],2021-09-13 10:42:17.728000+00:00,2021-09-13T13:38:04.455Z,https://www.washingtonpost.com/nation/2021/09/13/davy-daniel-macias-covid-19/,https://www.washingtonpost.com/wp-apps/imrs.php?src=https://arc-anglerfish-washpost-prod-washpost.s3.amazonaws.com/public/6KPYXI5H5JCRBA45IW5ZRDKAEU.JPG&w=1440,
