article_url,article_title,meta_description,section,authors,publish_date,modified_date,canonical_link,top_image,is_opinion
https://news.google.com/articles/CAIiEGkV8w71ErxRf2pTG-VjUoEqFggEKg0IACoGCAows4UBMMAaMNPRtQY?hl=en-US&gl=US&ceid=US%3Aen,Apple releases watchOS 7.6.1 with ‘important security updates’ for Apple Watch,"One week after seeding watchOS 7.6, Apple is now releasing watchOS 7.6.1. With this version, the company addresses an important security fix.",,[],2021-07-29 17:28:17+00:00,2021-07-29T17:32:10+00:00,https://9to5mac.com/2021/07/29/apple-releases-watchos-7-6-1/,https://i1.wp.com/9to5mac.com/wp-content/uploads/sites/6/2021/05/watchOS-7-hero.jpg?resize=1200%2C628&quality=82&strip=all&ssl=1,
https://news.google.com/articles/CBMiUGh0dHBzOi8vd3d3LmZvb2wuY29tL2ludmVzdGluZy8yMDIxLzA3LzI5LzQtdGFrZWF3YXlzLWZyb20tYXBwbGVzLWVhcm5pbmdzLWNhbGwv0gFUaHR0cHM6Ly93d3cuZm9vbC5jb20vYW1wL2ludmVzdGluZy8yMDIxLzA3LzI5LzQtdGFrZWF3YXlzLWZyb20tYXBwbGVzLWVhcm5pbmdzLWNhbGwv?hl=en-US&gl=US&ceid=US%3Aen,4 Takeaways From Apple's Earnings Call,Here's what the Mac maker's executives want investors to know.,investing,"['Evan Niu', 'Tmfnewcow', 'Evan Is A Senior Technology Analyst At The Motley Fool. He Was Previously A Senior Trading Specialist At Charles Schwab', 'Worked Briefly At Tesla. Evan Graduated The University Of Texas At Austin', 'Is A Cfa Charterholder.', 'This Article Represents The Opinion Of The Writer', 'Who May Disagree With The', 'Official', 'Recommendation Position Of A Motley Fool Premium Advisory Service. We Re Motley', 'Questioning An Investing Thesis -- Even One Of Our Own -- Helps Us All Think Critically About Investing']",2021-07-29 09:15:00-04:00,,https://www.fool.com/investing/2021/07/29/4-takeaways-from-apples-earnings-call/,https://g.foolcdn.com/editorial/images/635618/apple_tower-theatre-now-open-in-downtown-la-ceo-tim-cook-and-svp-deirdre-obrien_062421.jpg,
https://news.google.com/articles/CBMiTmh0dHBzOi8vd3d3LnlhaG9vLmNvbS9lbnRlcnRhaW5tZW50L2FwcGxlLXdhcm5zLWlwaG9uZS1pcGFkLW1hYy0xNjI3NDM4MjcuaHRtbNIBVmh0dHBzOi8vd3d3LnlhaG9vLmNvbS9hbXBodG1sL2VudGVydGFpbm1lbnQvYXBwbGUtd2FybnMtaXBob25lLWlwYWQtbWFjLTE2Mjc0MzgyNy5odG1s?hl=en-US&gl=US&ceid=US%3Aen,"Apple’s warns iPhone, iPad, and Mac users to update their software now – here’s why","Apple released iOS 14.7.1, iPadOS 14.7.1, and macOS Big Sur 11.5.1 earlier this week. As the numbering suggests, these were not the most substantial updates for the iPhone, iPad, or Mac. Nevertheless, if you haven’t already, you should update all of your Apple devices. Not only do these updates fix a few bugs — they … The post Apple’s warns iPhone, iPad, and Mac users to update their software now – here’s why appeared first on BGR.",,['Jacob Siegal'],,,https://www.yahoo.com/entertainment/apple-warns-iphone-ipad-mac-162743827.html,https://s.yimg.com/ny/api/res/1.2/8ZcrCsjy_eZXUvZUKNMPpg--/YXBwaWQ9aGlnaGxhbmRlcjt3PTIwMDA7aD0xMTc5/https://s.yimg.com/uu/api/res/1.2/Ydv9mtXtH9GjMTvUo1EELA--~B/aD0xMjU3O3c9MjEzMzthcHBpZD15dGFjaHlvbg--/https://media.zenfs.com/en/bgr_208/7e545f82d96071761fcb27192e024c99,
https://news.google.com/articles/CAIiELMJ1MoThl2RPTyxsT9GLyMqGQgEKhAIACoHCAowpY6kCzDomLwDMN29jAc?hl=en-US&gl=US&ceid=US%3Aen,Everything Apple is planning to launch in August 2021,"We don't expect any new hardware until September, but software and services march on in August.",,[],,,https://www.macworld.com/article/351956/apple-august-2021-new-releases-ios-15-macos-monterey-watchos-8-services-apple-tv-plus.html,https://www.macworld.com/wp-content/uploads/2021/08/apple-august-2021-releases-4.jpg?quality=50&strip=all&w=1024,
https://news.google.com/articles/CBMiQ2h0dHBzOi8vd3d3LnhkYS1kZXZlbG9wZXJzLmNvbS9wczUtdXBkYXRlLXN0b3JhZ2UtZXhwYW5zaW9uLW0yLXNzZC_SAUdodHRwczovL3d3dy54ZGEtZGV2ZWxvcGVycy5jb20vcHM1LXVwZGF0ZS1zdG9yYWdlLWV4cGFuc2lvbi1tMi1zc2QvYW1wLw?hl=en-US&gl=US&ceid=US%3Aen,"PS5 beta update enables M.2 SSD storage expansion, but there's a catch","The latest beta software update for the PS5 finally lets players expand the console's storage with an M.2 SSD, though there are caveats.",,['Rachel Kaser'],2021-07-29 20:05:03+00:00,,https://www.xda-developers.com/ps5-update-storage-expansion-m2-ssd/,https://www.xda-developers.com/files/2021/07/PS5-SSD-M2-Storage-Bay.jpg,
https://news.google.com/articles/CAIiEHMU_nwaabBUYT_kAxwC50kqFQgEKg0IACoGCAow9YACMKFMMLOpHg?hl=en-US&gl=US&ceid=US%3Aen,PS5’s Storage Expansion Update Is More Complicated Than It Needs To Be,"For Xbox Series X/S, SSD expansions require...plugging something in",,[],,,https://kotaku.com/ps5-s-storage-expansion-update-is-more-complicated-than-1847386799,"https://i.kinja-img.com/gawker-media/image/upload/c_fill,f_auto,fl_progressive,g_center,h_675,pg_1,q_80,w_1200/513e6544189761a69842ea2e9521869c.jpg",
https://news.google.com/articles/CAIiEFUpKTw9c7OWvmJKRwmEnf4qFwgEKg4IACoGCAow3O8nMMqOBjCN2ugF?hl=en-US&gl=US&ceid=US%3Aen,Sony’s first PS5 software beta arrives with M.2 SSD support,"Sony’s first PS5 beta is rolling out, and it includes the long-awaited M.2 SSD support. Sony is also improving its PS5 UX to better differentiate PS4 and PS5 versions of games.",,"['Tom Warren', 'Jul']",2021-07-29 06:45:38-04:00,2021-07-29T06:45:38-04:00,https://www.theverge.com/2021/7/29/22599593/sony-ps5-m2-ssd-support-beta-features,https://cdn.vox-cdn.com/thumbor/n2eBods-9BT1eR2uWaWEc_iegiQ=/0x146:2040x1214/fit-in/1200x630/cdn.vox-cdn.com/uploads/chorus_asset/file/22015306/vpavic_4278_20201030_0292.jpg,
https://news.google.com/articles/CAIiEML9Nx5i9MIxKysTDzj9I5wqGAgEKg8IACoHCAowp_LsCTCAxCYw5_WvAQ?hl=en-US&gl=US&ceid=US%3Aen,Here are the free games available to PS Plus subscribers in August 2021,"PS Plus subscribers can grab a new batch of free games for August 2021, but there's no PlayStation 5 exclusive title this month.",,['Rachel Kaser'],2021-07-29 13:30:50+00:00,2021-07-29T00:47:13+00:00,https://www.xda-developers.com/free-games-ps-plus-august-2021/,https://www.xda-developers.com/files/2021/07/PS-Plus-Free-August-2021.jpg,
https://news.google.com/articles/CBMiVGh0dHBzOi8vYXJzdGVjaG5pY2EuY29tL2dhbWluZy8yMDIxLzA3L3B1dHRpbmctdGhlLXBzNXMtMTAtbWlsbGlvbi1zYWxlcy1pbi1jb250ZXh0L9IBWmh0dHBzOi8vYXJzdGVjaG5pY2EuY29tL2dhbWluZy8yMDIxLzA3L3B1dHRpbmctdGhlLXBzNXMtMTAtbWlsbGlvbi1zYWxlcy1pbi1jb250ZXh0Lz9hbXA9MQ?hl=en-US&gl=US&ceid=US%3Aen,Putting the PS5’s 10 million sales in context,"In consoles' ""race to 10 million,"" PS5's 248 days is second only to the Wii.",,['Kyle Orland'],,,https://arstechnica.com/gaming/2021/07/putting-the-ps5s-10-million-sales-in-context/,https://cdn.arstechnica.net/wp-content/uploads/2020/10/ps5-18-new-760x380.jpg,
https://news.google.com/articles/CAIiEOQEkojPh05lSgRz_MqDxzQqGQgEKhAIACoHCAowp-aeCzDD8LYDMN2C7QY?hl=en-US&gl=US&ceid=US%3Aen,"AMD AM5 CPU Socket For Next-Gen Ryzen Desktop CPUs Pictured In Latest Renders, LGA 1718 Pin Design",The renders of AMD's next-generation AM5 CPU socket which will support upcoming 2022's Ryzen Desktop CPUs have been unveiled.,,['Hassan Mujtaba'],2021-07-29 18:13:25+00:00,2021-07-29T18:27:03+00:00,https://wccftech.com/amd-am5-lga-1718-cpu-socket-pictured-support-next-gen-ryzen-desktop-cpus/,https://cdn.wccftech.com/wp-content/uploads/2021/07/AMD-AM5-LGA-1718-Socket-For-Next-Gen-AMD-Ryzen-Desktop-CPUs-Render-_2.jpg,
https://news.google.com/articles/CBMiWmh0dHBzOi8vd3d3LmRpZ2l0YWx0cmVuZHMuY29tL2NvbXB1dGluZy9ldmVyeXRoaW5nLWFtZC1uZXctYW01LXNvY2tldC1yZXZlYWxzLWFib3V0LXplbi00L9IBXmh0dHBzOi8vd3d3LmRpZ2l0YWx0cmVuZHMuY29tL2NvbXB1dGluZy9ldmVyeXRoaW5nLWFtZC1uZXctYW01LXNvY2tldC1yZXZlYWxzLWFib3V0LXplbi00Lz9hbXA?hl=en-US&gl=US&ceid=US%3Aen,Everything AMD’s new AM5 socket reveals about Zen 4,Renders of the upcoming next generation of AMD processors have been revealed. The images show a retention socket that resembles Intel's mainstream LGA.,Computing,"['Monica J. White', 'July']",2021-07-29 23:46:54+00:00,,https://www.digitaltrends.com/computing/everything-amd-new-am5-socket-reveals-about-zen-4/,https://icdn.digitaltrends.com/image/digitaltrends/amd-ryzen-3950x-render.jpg,
https://news.google.com/articles/CAIiEB9Bxkc6h6zofEx4aa4TpFsqFwgEKg8IACoHCAowraj2AjC5-iIwzItb?hl=en-US&gl=US&ceid=US%3Aen,"Disney Fires Back at Scarlett Johansson, Calls ‘Black Widow’ Lawsuit ‘Sad and Distressing’","The Walt Disney slammed Scarlett Johansson over 'Black Widow' lawsuit, saying it shows 'callous disregard' for effects of pandemic.",,['Brent Lang'],2021-07-29 21:16:24+00:00,2021-07-30T15:11:23+00:00,https://variety.com/2021/film/news/disney-scarlett-johansson-black-widow-lawsuit-response-pandemic-1235030837/,https://variety.com/wp-content/uploads/2021/07/NYA2960_comp_v013.1090_R.jpg?w=1024,
https://news.google.com/articles/CCAiC2FFTXRjbVFsLVk0mAEB?hl=en-US&gl=US&ceid=US%3Aen,Scarlett Johansson Sues Disney Over 'Black Widow' Streaming Release | THR News,"In a dramatic turn with implications for major Hollywood studios, Scarlett Johansson filed a lawsuit against the Walt Disney Co. on Thursday alleging that he...",,[],,,https://www.youtube.com/watch?v=aEMtcmQl-Y4,https://i.ytimg.com/vi/aEMtcmQl-Y4/maxresdefault.jpg,
https://news.google.com/articles/CAIiEDfI2uVJlWPlx9Ca9QovUKsqGQgEKhAIACoHCAow4bOVCzDCl6sDMPaglQc?hl=en-US&gl=US&ceid=US%3Aen,Scarlett Johansson sues Disney for releasing ‘Black Widow’ in theaters and on Disney+,"Actress says Marvel and Disney breached her contract, had promised to release ""Black Widow"" exclusively in theaters before home in a lawsuit that could have major repercussions through Hollywood.",,[],,,https://www.yahoo.com/entertainment/scarlett-johansson-sues-disney-black-widow-release-theaters-disney-plus-marvel-cinematic-universe-breach-of-contract-184307567.html,https://s.yimg.com/ny/api/res/1.2/NOP.nq0OY.UALjuLxzcKGg--/YXBwaWQ9aGlnaGxhbmRlcjt3PTIwMDA7aD0xMzMx/https://s.yimg.com/os/creatr-uploaded-images/2021-07/415eca90-e032-11eb-bff5-1a736c3a00cf,
https://news.google.com/articles/CBMifGh0dHBzOi8vd3d3LmJsb29tYmVyZy5jb20vb3Bpbmlvbi9hcnRpY2xlcy8yMDIxLTA3LTI5L3NjYXJsZXR0LWpvaGFuc3Nvbi1sYXdzdWl0LS1kaXNuZXkta25vd3Mtbm90LXRvLWJhdHRsZS10aGUtYmxhY2std2lkb3fSAQA?hl=en-US&gl=US&ceid=US%3Aen,Are you a robot?,,,[],,,,,
https://news.google.com/articles/CAIiEM9LIOd-VyLUOZ2nMfoIiVAqGQgEKhAIACoHCAowocv1CjCSptoCMPrTpgU?hl=en-US&gl=US&ceid=US%3Aen,Scarlett Johansson is suing Disney over ‘Black Widow’ Disney+ release,One of Marvel's biggest stars is suing Disney.,,['Frank Pallotta'],2021-07-29 20:17:08+00:00,2021-07-30T10:57:55Z,https://www.cnn.com/2021/07/29/media/scarlett-johansson-disney-lawsuit/index.html,https://cdn.cnn.com/cnnnext/dam/assets/210701123605-02-black-widow-movie-super-169.jpg,
https://news.google.com/articles/CAIiEFTbQpNF-rLynmeK_Y1gNWgqGQgEKhAIACoHCAowjsX7CjCSqvQCMOq1jwc?hl=en-US&gl=US&ceid=US%3Aen,Update: Jared Leto looks utterly bizarre in the first House Of Gucci trailer,Leto's appearance in the trailer for Ridley Scott's House Of Gucci is a firm reminder that no one hates Jared Leto's face more than Jared Leto,,[],,,https://www.avclub.com/jared-leto-done-goofed-his-face-up-again-folks-1847390942,"https://i.kinja-img.com/gawker-media/image/upload/c_fill,f_auto,fl_progressive,g_center,h_675,pg_1,q_80,w_1200/962011fe277779f3e502aeaeba2e6876.jpg",
https://news.google.com/articles/CAIiEOMkX0iyugavEgHTP_GI2xEqGQgEKhAIACoHCAow4bOVCzDCl6sDMPaglQc?hl=en-US&gl=US&ceid=US%3Aen,"Is that you, Jared Leto? The actor is unrecognizable in 'House of Gucci'",Leto is known for disappearing into his roles.,,[],,,https://www.yahoo.com/entertainment/jared-leto-unrecognizable-house-of-gucci-movie-poster-192028803.html,https://s.yimg.com/os/creatr-uploaded-images/2021-07/0c95c3e0-f09f-11eb-bffe-44c142520f30,
https://news.google.com/articles/CAIiEJoz621R1VzqMIyycfeUnBYqGAgEKg8IACoHCAowmKPyCTCo8nIwlLrsBQ?hl=en-US&gl=US&ceid=US%3Aen,Dressed to Kill: Watch the Trailer for House of Gucci,"Lady Gaga, Adam Driver, an unrecognizable Jared Leto, and Al Pacino headline Ridley Scott’s true crime fashion saga.",tags,"['Condé Nast', 'Anthony Breznica']",2021-07-29 00:00:00,,https://www.vanityfair.com/hollywood/2021/07/house-of-gucci-trailer,"https://media.vanityfair.com/photos/610357053326e9e8e59be1cc/16:9/w_1280,c_limit/Screen%2520Shot%25202021-07-29%2520at%25206.32.48%2520PM.png",false
https://news.google.com/articles/CAIiEKzgQldBvM8NL4kQLk2XEQAqGAgEKg8IACoHCAowhK-LAjD4ySww-9S0BQ?hl=en-US&gl=US&ceid=US%3Aen,New film posters for ‘House of Gucci’ show a shocking Jared Leto,"Jared Leto looks unrecognizable in shocking film posters for ""House of Gucci,"" alongside Lady Gaga and Adam Driver.",,"['Social Links For Juliet Norman', 'Contact The Author']",2021-07-29 18:09:31+00:00,2021-07-29T18:10:07+00:00,https://nypost.com/2021/07/29/new-house-of-gucci-film-posters-show-a-shocking-jared-leto/,https://nypost.com/wp-content/uploads/sites/2/2021/07/house-gucci-31.jpeg?quality=90&strip=all&w=1024,false
https://news.google.com/articles/CBMiUmh0dHBzOi8vd3d3LnlhaG9vLmNvbS9saWZlc3R5bGUvaG91c2UtZ3VjY2ktcmVsZWFzZXMtYW1hemluZy1pbWFnZXMtMTg1NzM5NDI0Lmh0bWzSAVpodHRwczovL3d3dy55YWhvby5jb20vYW1waHRtbC9saWZlc3R5bGUvaG91c2UtZ3VjY2ktcmVsZWFzZXMtYW1hemluZy1pbWFnZXMtMTg1NzM5NDI0Lmh0bWw?hl=en-US&gl=US&ceid=US%3Aen,HOUSE OF GUCCI Releases Amazing Images of the Cast,"See the amazing cast images of Adam Driver, Jared Leto, Lady Gaga, Al Pacino, and Jeremy Irons from Ridley Scott's upcoming House of Gucci movie. The post HOUSE OF GUCCI Releases Amazing Images of the Cast appeared first on Nerdist.",,['Yolanda Machado'],,,https://www.yahoo.com/lifestyle/house-gucci-releases-amazing-images-185739424.html,https://s.yimg.com/uu/api/res/1.2/39pjsNP_hxj6tqdnEGTfLA--~B/aD0xMDgwO3c9MTA4MDthcHBpZD15dGFjaHlvbg--/https://media.zenfs.com/en/nerdist_761/76ff05ae0e1ff97ef565abfd4a927173,
https://news.google.com/articles/CAIiEGmi7_9mFaiXV3sob_EorK0qGQgEKhAIACoHCAow9MSGCzCKpYQDMK-o7wY?hl=en-US&gl=US&ceid=US%3Aen,DaBaby Disappears From U.K. Festival Lineup After Homophobic Remarks,"Music, Film, TV and Political News Coverage",,"['Claire Shaffer', 'Staff Writer', ""Claire Shaffer'S Most Recent Stories"", 'St. Vincent Takes Control Of Her Narrative In', 'The Nowhere Inn', 'Frank Ocean Launches New Luxury Company Homer', 'Jennifer Hudson Brings Soul To Aretha Franklin S', 'Ain T No Way', 'View All']",2021-07-29 19:42:20+00:00,2021-07-29T20:59:53+00:00,https://www.rollingstone.com/music/music-news/dababy-parklife-festival-homophobic-remarks-1204531/,https://www.rollingstone.com/wp-content/uploads/2021/07/dababy-park-life.jpg,
https://news.google.com/articles/CBMiVGh0dHBzOi8vd3d3LnlhaG9vLmNvbS9lbnRlcnRhaW5tZW50L2VsdG9uLWpvaG4tY29uZGVtbnMtcmFwcGVyLWRhYmFieS0xMzU1MjY2NDQuaHRtbNIBXGh0dHBzOi8vd3d3LnlhaG9vLmNvbS9hbXBodG1sL2VudGVydGFpbm1lbnQvZWx0b24tam9obi1jb25kZW1ucy1yYXBwZXItZGFiYWJ5LTEzNTUyNjY0NC5odG1s?hl=en-US&gl=US&ceid=US%3Aen,Elton John condemns rapper DaBaby for comments 'fuelling' HIV stigma,"Singer Elton John has condemned American rapper DaBaby for comments he made at a concert about people living with HIV, saying such statements fuel ""stigma and discrimination"".  DaBaby has drawn widespread criticism for telling the audience at a weekend gig in Miami to ""put your cell phone light up"" except for those who were HIV-positive, ""(had) any of them deadly sexually transmitted diseases that’ll make you die in two or three weeks,"" or gay men who performed sex acts in car parks.",,[],,,https://news.yahoo.com/elton-john-condemns-rapper-dababy-135526644.html,https://s.yimg.com/uu/api/res/1.2/B5fUmcy0ybx5wTQ71FeLig--~B/aD01MzM7dz04MDA7YXBwaWQ9eXRhY2h5b24-/https://media.zenfs.com/en/reuters.com/63581fbfd5a18257dc282ee6f78b6ec2,
https://news.google.com/articles/CAIiEOCXC2YOrZU2tNkRuq5JYDYqFggEKg0IACoGCAowuLUIMNFnMMyu7QU?hl=en-US&gl=US&ceid=US%3Aen,Every Twist and Turn of This Week’s DaBaby Saga,A live experiment in whether it's possible to dig a hole deep enough to come out the other side.,,['Allegra Frank'],2021-07-29 23:32:40.677000+00:00,,https://slate.com/culture/2021/07/dababy-rolling-loud-homophobic-comments-backlash.html,https://compote.slate.com/images/e58587fe-1178-429c-9d37-7630e691e939.jpeg?width=780&height=520&rect=3600x2400&offset=0x0,
https://news.google.com/articles/CBMiVGh0dHBzOi8vd3d3LmhpdnBsdXNtYWcuY29tL25ld3MvMjAyMS83LzI5L2VsdG9uLWpvaG4tcmVzcG9uZHMtZGFiYWJ5cy1oaXYtbGllcy1mYWN0c9IBAA?hl=en-US&gl=US&ceid=US%3Aen,Elton John Responds to DaBaby's HIV Lies with Facts,The rock icon posted HIV facts on Twitter while calling for the end of stigma.,,[],2021-07-29 13:29:09-04:00,2021-07-29T13:29:09-04:00,https://www.hivplusmag.com/news/2021/7/29/elton-john-responds-dababys-hiv-lies-facts,https://www.hivplusmag.com/sites/default/files/1/dababy_elton_john_750x422_.png,
https://news.google.com/articles/CAIiEOeCWD1bRIXLEZd-G6K6_7AqGAgEKg8IACoHCAow2KLyCTDI8XIwxbjsBQ?hl=en-US&gl=US&ceid=US%3Aen,How DaBaby's Homophobic Comments at Rolling Loud Set Off a Firestorm,The rapper's remarks during his performance last weekend are still reverberating.,tags,"['Condé Nast', 'Grant Rindne']",2021-07-29 00:00:00,,https://www.gq.com/story/dababy-rolling-loud-controversy-explained,"https://media.gq.com/photos/61032b1892f256cef5e4a2af/16:9/w_1280,c_limit/1330939333",false
https://news.google.com/articles/CAIiEJaN7urzD9eNY3DNyQG0XG4qGQgEKhAIACoHCAowwL2ICzCckocDMOOUqQY?hl=en-US&gl=US&ceid=US%3Aen,"Jennifer Lopez, Ben Affleck relax on $130M super yacht in Italy",The couple explored the coastal Meditterran town of Nerano.,,['Jessica Napoli'],,2021-07-29T14:18:31-04:00,https://www.foxnews.com/entertainment/jennifer-lopez-bikini-yacht-italy,https://static.foxnews.com/foxnews.com/content/uploads/2021/07/benjenitaly.jpg,false
https://news.google.com/articles/CBMiUGh0dHBzOi8vd3d3LnlhaG9vLmNvbS9saWZlc3R5bGUvamVubmlmZXItbG9wZXoteWFjaHQtY2hpYy1zdHJpcGVkLTEyNDA0ODI4Ni5odG1s0gFYaHR0cHM6Ly93d3cueWFob28uY29tL2FtcGh0bWwvbGlmZXN0eWxlL2plbm5pZmVyLWxvcGV6LXlhY2h0LWNoaWMtc3RyaXBlZC0xMjQwNDgyODYuaHRtbA?hl=en-US&gl=US&ceid=US%3Aen,"Jennifer Lopez Is Yacht-Chic in a Striped Bandeau, Flowing Pants & Cherry Red Wedges With Ben Affleck",Her bold heels measured close to 6 inches in height.,,['Claudia Miller'],,,https://www.yahoo.com/lifestyle/jennifer-lopez-yacht-chic-striped-124048286.html,https://s.yimg.com/uu/api/res/1.2/iRYiRr3x6BwhHKL1T7xSsA--~B/aD02ODM7dz0xMDI0O2FwcGlkPXl0YWNoeW9u/https://media.zenfs.com/en/footwear_news_642/665afcf7be459692843a2e504b0b99fa,
https://news.google.com/articles/CCAiC21lUUpNeUU4MGlFmAEB?hl=en-US&gl=US&ceid=US%3Aen,"Matt Damon Jokingly Wishes Ben Affleck & Jennifer Lopez ""Nothing But Hardship""",Actor Matt Damon weighs in on the romantic reunion of Ben Affleck and Jennifer Lopez.Hear more from Stars on our app! Click here for your trial subscription:...,,[],,,https://www.youtube.com/watch?v=meQJMyE80iE,https://i.ytimg.com/vi/meQJMyE80iE/maxresdefault.jpg,
https://news.google.com/articles/CAIiEN1-W5RMUPNL1jJjUaJOcd4qGAgEKg8IACoHCAowztTBATCMkBQwyM3XBQ?hl=en-US&gl=US&ceid=US%3Aen,Alex Rodriguez Poses Shirtless After European Birthday Party,"Alex Rodriguez celebrated his 46th birthday in almost the same place his ex-fiancee, Jennifer Lopez, spent her 52nd — get the details",,['Meredith Nardino'],2021-07-29 23:40:02+00:00,,https://www.usmagazine.com/celebrity-body/news/alex-rodriguez-poses-shirtless-after-european-birthday-party/,https://i0.wp.com/www.usmagazine.com/wp-content/uploads/2021/07/Looking-Good-A-Rod-Poses-Shirtless-After-St-Tropez-Birthday-Bash-001.jpg?crop=0px%2C284px%2C1200px%2C631px&resize=1200%2C630&ssl=1&quality=86&strip=all,
https://news.google.com/articles/CBMiRWh0dHBzOi8vd3d3LnlhaG9vLmNvbS9saWZlc3R5bGUvYmVuLWdhdmUtai1sby1mYW5jaWVzdC0xMTUxMDAzNDkuaHRtbNIBTWh0dHBzOi8vd3d3LnlhaG9vLmNvbS9hbXBodG1sL2xpZmVzdHlsZS9iZW4tZ2F2ZS1qLWxvLWZhbmNpZXN0LTExNTEwMDM0OS5odG1s?hl=en-US&gl=US&ceid=US%3Aen,"Ben Gave J.Lo the Fanciest B-Day Necklace That Represents Being ""Wild, Abundant, and Untamed""",He dropped some serious $$$.,,['Mehera'],,,https://www.cosmopolitan.com/entertainment/celebs/a37166048/ben-affleck-birthday-gift-necklace-jennifer-lopez/,https://s.yimg.com/uu/api/res/1.2/nP1w4zoU.LBw3t6CWMviJw--~B/aD0yMDk7dz00MTc7YXBwaWQ9eXRhY2h5b24-/https://media.zenfs.com/en/cosmopolitan_438/687d44faa32f0e55b480f2136a2aebd3,
https://news.google.com/articles/CCAiC3JHSFo0UnkzeEVnmAEB?hl=en-US&gl=US&ceid=US%3Aen,Scottie Barnes Selected No. 4 Overall by the Toronto Raptors | 2021 NBA Draft | CBS Sports HQ,Our NBA Draft crew breaks down the Raptors selecting Scottie Barnes!SUBSCRIBE TO OUR CHANNEL:https://www.youtube.com/user/CBSSportsHQ FOLLOW US ON:Facebook -...,,[],,,https://www.youtube.com/watch?v=rGHZ4Ry3xEg,https://i.ytimg.com/vi/rGHZ4Ry3xEg/maxresdefault.jpg,
https://news.google.com/articles/CCAiC1p2M2FZeE9ramU0mAEB?hl=en-US&gl=US&ceid=US%3Aen,NBA Draft 2021 LIVE,"2021 NBA Draft live coverage of every single pick, trade, rumor, or move that happens throughout Round 1 and Round 2 on Thursday July 29, 2021. Who will be t...",,[],,,https://www.youtube.com/watch?v=Zv3aYxOkje4,https://i.ytimg.com/vi/Zv3aYxOkje4/maxresdefault.jpg,
https://news.google.com/articles/CBMifmh0dHBzOi8vd3d3LmVzcG4uY29tL25iYS9zdG9yeS9fL2lkLzMxOTEyODY3L3NvdXJjZXMtZGV0cm9pdC1waXN0b25zLXNlbGVjdC1va2xhaG9tYS1zdGF0ZS1jYWRlLWN1bm5pbmdoYW0tbm8tMS1waWNrLW5iYS1kcmFmdNIBiwFodHRwczovL3d3dy5lc3BuLmNvbS9uYmEvc3RvcnkvXy9pZC8zMTkxMjg2Ny9zb3VyY2VzLWRldHJvaXQtcGlzdG9ucy1zZWxlY3Qtb2tsYWhvbWEtc3RhdGUtY2FkZS1jdW5uaW5naGFtLW5vLTEtcGljay1uYmEtZHJhZnQ_cGxhdGZvcm09YW1w?hl=en-US&gl=US&ceid=US%3Aen,Sources -- Detroit Pistons to select Oklahoma State's Cade Cunningham with No. 1 pick in NBA draft,"The Detroit Pistons have landed on a decision to select Oklahoma State's Cade Cunningham with the No. 1 pick in Thursday night's NBA draft, sources told ESPN's Adrian Wojnarowski.",,"['Nba Insiders', 'Ohm Youngmisuk', 'Myron Medcalf', 'Malika Andrews', 'Ericka Goodman-Hughey', 'Anthony Olivieri', 'Nick Depaula', 'Mike Schmitz']",,,https://www.espn.com/nba/story/_/id/31912867/sources-detroit-pistons-select-oklahoma-state-cade-cunningham-no-1-pick-nba-draft,https://a3.espncdn.com/combiner/i?img=%2Fphoto%2F2021%2F0107%2Fr798522_2_1296x729_16%2D9.jpg,false
https://news.google.com/articles/CBMikwFodHRwczovL3d3dy5mcmVlcC5jb20vc3Rvcnkvc3BvcnRzL2NvbHVtbmlzdHMvc2hhd24td2luZHNvci8yMDIxLzA3LzI5L2RldHJvaXQtcGlzdG9ucy1jYWRlLWN1bm5pbmdoYW0tbmJhLWRyYWZ0LXRyb3ktd2VhdmVyLWxhcnJ5LWJpcmQvNTQyNDM0NDAwMS_SASRodHRwczovL2FtcC5mcmVlcC5jb20vYW1wLzU0MjQzNDQwMDE?hl=en-US&gl=US&ceid=US%3Aen,Detroit Free Press,,,[],,,,https://www.gannett-cdn.com/sites/freep/images/favicon.png,
https://news.google.com/articles/CBMiUmh0dHBzOi8vd3d3Lmhvb3BzcnVtb3JzLmNvbS8yMDIxLzA3L3JvY2tldHMtdG8tYWNxdWlyZS0xNnRoLXBpY2stZnJvbS10aHVuZGVyLmh0bWzSAQA?hl=en-US&gl=US&ceid=US%3Aen,Rockets Acquire No. 16 Pick Alperen Sengun From Thunder,"Turkish center Alperen Sengun was drafted by Oklahoma City, but will be a Rocket.",,[],,,https://www.hoopsrumors.com/2021/07/rockets-to-acquire-16th-pick-from-thunder.html,https://cdn.hoopsrumors.com/files/2016/06/USATSI_8914511-610x437.jpg,
https://news.google.com/articles/CBMinAFodHRwczovL3d3dy5lc3BuLmNvbS9uYmEvc3RvcnkvXy9pZC8zMTkxMzkzNS9zb3VyY2VzLWxvcy1hbmdlbGVzLWxha2Vycy1uZWFyaW5nLWRlYWwtYWNxdWlyZS1ydXNzZWxsLXdlc3Ricm9vay1zZW5kLTMtcGxheWVyLXBhY2thZ2UtcGljay13YXNoaW5ndG9uLXdpemFyZHPSAakBaHR0cHM6Ly93d3cuZXNwbi5jb20vbmJhL3N0b3J5L18vaWQvMzE5MTM5MzUvc291cmNlcy1sb3MtYW5nZWxlcy1sYWtlcnMtbmVhcmluZy1kZWFsLWFjcXVpcmUtcnVzc2VsbC13ZXN0YnJvb2stc2VuZC0zLXBsYXllci1wYWNrYWdlLXBpY2std2FzaGluZ3Rvbi13aXphcmRzP3BsYXRmb3JtPWFtcA?hl=en-US&gl=US&ceid=US%3Aen,"Los Angeles Lakers reach deal to acquire Russell Westbrook, sending 3-player package and pick to Washington Wizards","The Lakers have agreed to a deal with the Wizards to acquire Russell Westbrook in exchange for Kyle Kuzma, Montrezl Harrell, Kentavious Caldwell-Pope and the No. 22 pick Thursday night, sources told ESPN's Adrian Wojnarowski.",,"['Nba Insiders', 'Ohm Youngmisuk', 'Myron Medcalf', 'Malika Andrews', 'Ericka Goodman-Hughey', 'Anthony Olivieri', 'Kevin Pelton', 'André Snellings']",,,https://www.espn.com/nba/story/_/id/31913935/sources-los-angeles-lakers-nearing-deal-acquire-russell-westbrook-send-3-player-package-pick-washington-wizards,https://a4.espncdn.com/combiner/i?img=%2Fphoto%2F2021%2F0521%2Fr856997_1296x729_16%2D9.jpg,false
https://news.google.com/articles/CBMiZ2h0dHBzOi8vd3d3Lmhvb3BzcnVtb3JzLmNvbS8yMDIxLzA3L3BvdGVudGlhbC13ZXN0YnJvb2stZGVhbC1ub3Qtdmlld2VkLWFzLXByZWN1cnNvci10by1iZWFsLXRyYWRlLmh0bWzSAQA?hl=en-US&gl=US&ceid=US%3Aen,Potential Westbrook Deal Not Viewed As Precursor To Beal Trade,"If the Wizards trade Russell Westbrook, that doesn't mean Bradley Beal will be on the move too.",,[],,,https://www.hoopsrumors.com/2021/07/potential-westbrook-deal-not-viewed-as-precursor-to-beal-trade.html,https://cdn.hoopsrumors.com/files/2020/12/bradley-beal-russell-westbrook-e1608484835449-900x633.jpg,
https://news.google.com/articles/CBMieWh0dHBzOi8vYmxlYWNoZXJyZXBvcnQuY29tL2FydGljbGVzLzEwMDA5MDgxLXJ1c3NlbGwtd2VzdGJyb29rLXRyYWRlLXJ1bW9ycy1sYWtlcnMtd2l6YXJkcy1uZWFyaW5nLWRlYWwta3V6bWEtbW9yZS1saW5rZWTSAYkBaHR0cHM6Ly9zeW5kaWNhdGlvbi5ibGVhY2hlcnJlcG9ydC5jb20vYW1wLzEwMDA5MDgxLXJ1c3NlbGwtd2VzdGJyb29rLXRyYWRlLXJ1bW9ycy1sYWtlcnMtd2l6YXJkcy1uZWFyaW5nLWRlYWwta3V6bWEtbW9yZS1saW5rZWQuYW1wLmh0bWw?hl=en-US&gl=US&ceid=US%3Aen,"Russell Westbrook Trade Rumors: Lakers, Wizards Nearing Deal; Kuzma, More Linked","After a first-round playoff exit, the Los Angeles Lakers are reportedly looking to make a huge splash in the trade market leading up to the draft. ...",,['Adam Wells'],,,https://bleacherreport.com/articles/10009081-russell-westbrook-trade-rumors-lakers-wizards-nearing-deal-kuzma-more-linked,https://media.bleacherreport.com/image/upload/v1627593412/j6qzvf232kl2qwtsyki8.jpg,
