article_url,article_title,meta_description,section,authors,publish_date,modified_date,canonical_link,top_image,is_opinion
https://www.msn.com/en-us/news/politics/pence-says-he-s-spoken-to-trump-about-a-dozen-times-since-inauguration/ar-AAP0y9Z?ocid=Peregrine,Pence says he's spoken to Trump 'about a dozen times' since inauguration,"Former Vice President Mike Pence said on a conservative podcast Thursday that he has spoken to former President Trump ""about a dozen times"" since President Biden was sworn into office in January.",,[],2021-09-30 13:48:49-04:00,2021-09-30T14:28:40-04:00,https://thehill.com/homenews/administration/574728-pence-says-hes-spoken-to-trump-about-a-dozen-times-since-inauguration,https://thehill.com/sites/default/files/article_images/pencemike_042921getty.jpeg,
https://www.msn.com/en-us/news/politics/governor-slams-disgusting-lie-she-was-involved-with-trump-aide-as-separate-woman-accuses-him-of-harassment/ar-AAP0FmV?ocid=Peregrine,Kristi Noem Slams 'Disgusting Lie' of Corey Lewandowski Affair,"South Dakota Gov. Kristi Noem called rumors of an affair with Republican political operative Corey Lewandowski ""total garbage"" on Wednesday",,"['Virginia Chamlee', 'September']",,,https://people.com/politics/gov-noem-denies-relationship-with-corey-lewandowski/,https://imagesvc.meredithcorp.io/v3/mm/image?q=85&c=sc&rect=2%2C35%2C1500%2C784&poi=face&w=1500&h=750&url=https%3A%2F%2Fstatic.onecms.io%2Fwp-content%2Fuploads%2Fsites%2F20%2F2021%2F09%2F30%2FKristi-Noem-and-Corey-Lewandowski-.jpg,false
https://trace.mediago.io/api/bidder/track?tn=9220dd482c2a49631b4e66cca9f5f0ee&price=2j2XLg7w9hEG5BYai6RHomf_YDseQKnsfauG_qnhA9I&evt=102&rid=32df724bb669c06e7e51cd6a9d42557c&campaignid=1025040&impid=vlp-infopane-3&offerid=1913215&test=0&time=1633024587&cp=zqO8ru70dQ0nPUp1BLoBuGR4hIcVSPYO7Kcblpyt1b0&clickid=21_32df724bb669c06e7e51cd6a9d42557c_vlp-infopane-3&acid=536&trackingid=b1bb10ac262fd5f3128f599139b2816b&uid=0CBF3AA22D9467B91DE22A602CFB6680&jt=2&url=NoOnKxydq86bQcKEU-5wCqMdYPnLxrRO0jwEvY2veD4tTsn2E_FrOdyRQqCcqFOlxdgKuNmH8AUYxOO4sDDuP_fwOx3jckbLA0m_FBPTsAbxnALufbgtXOo4QTjx6IcLTV2irLXQlZ_JgAsQuIjbpkAhWYdhWvwqstSsrzpzJguB2z6TTJgqsflzRCl-Rn8AItg6kXdZzqhJV_7aLyKLTwC6-deSO-6u31vG5gcT_mttInPll0qoPTaDSlv_co1PJzKhXiHrf_BJp_6RycOJeCxvtDuY3vCYw16Aq9fZ-Bbzde1UdaVXl5f5V6SXDqkR5dQi7fZoA_glCVcw9ma4lZkkJsJQ11jdxPrneUHswM6KrvEhWp-dKxfGfyp8I4V4b4yFXFuZIgDT08s3i3kVbjNgmSK4Ugwv_gZwyrs5NUVjXMXyoGWatq0Sp0PjrAtjCbpxfWZXaLjDdnd0C8XBRMlYodkLABqA3pViFupAV6F1cgtSG3HeQFO1y6gl-9p_q1xPo2nAb89OiiGtXIZ1Kw&bm=5&la=en&cn=us&cid=1055176&info=W7F8hWpeVQ08ry5LRKYfjPPQ57EQ2atnxdOXX4x3rQEHCP6R4eKh1PXR69R5bCiP,,,,[],,,,,
https://www.msn.com/en-us/news/us/us-coronavirus-for-the-first-time-since-june-the-number-of-projected-covid-19-deaths-in-the-us-is-decreasing/ar-AAOYGgU?ocid=Peregrine,Some US governors say Covid hospitalizations are going down but warn of what could come next if more people don't get vaccinated,"Some governors are beginning to report encouraging signs in their state's Covid-19 numbers, but warn of what could come next if more people don't get vaccinated.",health,"['Madeline Holcombe', 'Christina Maxouris']",2021-09-30 00:00:00,2021-10-01T08:24:39Z,https://www.cnn.com/2021/09/30/health/us-coronavirus-thursday/index.html,https://cdn.cnn.com/cnnnext/dam/assets/210929235401-houston-covid-19-0824-super-tease.jpg,false
https://www.msn.com/en-us/news/us/the-epic-covid-19-memorial-on-the-national-mall-in-one-stunning-photo/ar-AAP0xdO?ocid=Peregrine,"The epic COVID-19 memorial on the National Mall, in one stunning photo","4,882 photos taken over 30 hours. More than 670,000 flags representing American lives lost. An incalculable measure of grief.",Culture,"['Rachel Hartigan', 'Published September']",,09-30-2021,https://www.nationalgeographic.com/culture/article/epic-covid-19-memorial-national-mall-one-stunning-photo,https://i.natgeofe.com/n/b245b54a-1508-455d-a30d-d744b99f3464/D2N_DC_FLAGS_10__16x9.jpg?w=1200,
https://trace.mediago.io/api/bidder/track?tn=9220dd482c2a49631b4e66cca9f5f0ee&price=Sf3BALlBl-8jkN8HSJYvMBv5Rwty1JV17EdzEMVTm44&evt=102&rid=32df724bb669c06e7e51cd6a9d42557c&campaignid=1050336&impid=vlp-infopane-6&offerid=2903026&test=0&time=1633024587&cp=vchMNLfFM06rJSuGogBUqwuUunxip2cX6Fvc6XXPm-8&clickid=21_32df724bb669c06e7e51cd6a9d42557c_vlp-infopane-6&acid=332&trackingid=c9ccda502c21c812d15b07f6b53a1ccf&uid=0CBF3AA22D9467B91DE22A602CFB6680&jt=2&url=bmTcHXZY_SE8Rna_XkVyPnh_nYOY8pm7t9ST_kT9mstAXUOIBDIuYmO_BVmXa4Vh7rkToyOsV_E5Ho3oSjEVlxZMGULjYw5Yf9nuS9WuC7G18MhbHVN4MGh1eoQI2NQCnD-OuZPVMEHGRgPGfU7b-dNWvArjQn1TWhQxJg4dRwTaISht0DfkZdm-SAlKekprUFMczGumb_63ozMrtozMVg2jqOxJO7hG-XykfA8wLVlkOLImOf_CeKMOV58iQfSlCHSIqDf3m2-W9H4zLGpGfSLxN7-1mnm_2Z7RSHFZwo3-w9rOsUuaw_b1VSHmEjDXoM7a0tgkLgmmx5FUb2atgHCb5GX68TFKCAx2TpmlH5jMyyna3KX52HIW3XiqpwmlzaE8ikckP7Y2MLyHU4C4Bw&bm=5&la=en&cn=us&cid=1102103&info=VAWN9Pn2AV5oeeOCHLPBTr7IVOnEz6CV9PigNrIJx9CG1HVBC-h_lHXr-KRy8sY8,,,,[],,,,,
https://www.msn.com/en-us/news/politics/manchin-says-he-s-never-been-a-liberal-in-any-way-shape-or-form-as-he-calls-for-2-trillion-in-cuts-to-reconciliation-bill/ar-AAP0Aoc?ocid=Peregrine,"Manchin says he's 'never been a liberal in any way, shape, or form' as he calls for $2 trillion in cuts to reconciliation bill","""Elect more liberals,"" Manchin told reporters on Thursday, explaining that he doesn't agree with spending $3.5 trillion on the reconciliation effort.",,['Bryan Metzger'],2021-09-30 00:00:00,2021-09-30T17:42:43Z,https://www.businessinsider.com/joe-manchin-never-been-liberal-2-trillion-cuts-reconciliation-bill-2021-9,https://i.insider.com/6155f673b414c100186322aa?width=1200&format=jpeg,false
https://www.msn.com/en-us/news/politics/top-republicans-rub-shoulders-with-extremists-in-secretive-rightwing-group-leak-reveals/ar-AAOZgrD?ocid=Peregrine,"Top Republicans rub shoulders with extremists in secretive rightwing group, leak reveals",Wealthy entrepreneurs and media moguls also named on membership list for influential Council for National Policy,US news,['Jason Wilson'],2021-09-30 00:00:00,2021-10-04T17:30:34.000Z,https://www.theguardian.com/us-news/2021/sep/30/revealed-council-national-policy-republicans-extremists,https://i.guim.co.uk/img/media/f6822d68cfac588568a23eecbf52d987561b94f9/0_189_5679_3407/master/5679.jpg?width=1200&height=630&quality=85&auto=format&fit=crop&overlay-align=bottom%2Cleft&overlay-width=100p&overlay-base64=L2ltZy9zdGF0aWMvb3ZlcmxheXMvdGctZGVmYXVsdC5wbmc&enable=upscale&s=013aa4a2860810ffbc4b10da192ba8be,
https://www.msn.com/en-us/news/politics/south-dakota-gov-kristi-noem-won-t-use-trump-ally-corey-lewandowski-as-advisor-after-reports-of-affair-sexual-harassment/ar-AAP0AoJ?ocid=Peregrine,"South Dakota Gov. Kristi Noem won't use Trump ally Corey Lewandowski as advisor after reports of affair, sexual harassment",Corey Lewandowski at one point managed the 2016 campaign of Donald Trump. He now has been booted as an unpaid advisor to South Dakota Gov. Kristi Noem.,Politics,['Dan Mangan'],2021-09-30 00:00:00,2021-09-30T20:10:34+0000,https://www.cnbc.com/2021/09/30/south-dakota-gov-kristi-noem-wont-use-corey-lewandowski-as-advisor.html,https://image.cnbcfm.com/api/v1/image/106950306-1633019688241-gettyimages-1231428911-CPAC.jpeg?v=1633019761,false
https://www.msn.com/en-us/news/politics/supreme-court-takes-up-sen-cruz-s-campaign-finance-challenge-dispute-over-christian-flag-in-boston/ar-AAP0tbO?ocid=Peregrine,"Supreme Court takes up Sen. Cruz's campaign finance challenge, dispute over Christian flag in Boston",The Supreme Court will hear a campaign finance challenge from Ted Cruz and a dispute over Boston's refusal to allow a Christian-oriented flag on a city pole.,,"['Pete Williams', 'Pete Williams Is An Nbc News Correspondent Who Covers The Justice Department', 'The Supreme Court', 'Based In Washington.']",2021-09-30 17:38:00+00:00,Fri Oct 01 2021 16:17:57 GMT+0000 (UTC),https://www.nbcnews.com/politics/supreme-court/supreme-court-takes-sen-cruz-s-challenge-campaign-finance-law-n1280486,"https://media-cldnry.s-nbcnews.com/image/upload/t_nbcnews-fp-1200-630,f_auto,q_auto:best/newscms/2021_36/3504323/210908-supreme-court-se-1032a.jpg",false
https://www.msn.com/en-us/news/us/mom-blames-black-student-for-insanely-racist-homecoming-proposal/ar-AAP0Aqp?ocid=Peregrine,Mom Blames Black Student for Insanely Racist Homecoming Proposal,"“If I was Black, I would be picking cotton, but I’m white so I’m picking you,” read the sign her daughter can be seen holding up in a photo.",us-news,['Brooke Leigh Howard'],2021-09-30 17:32:34.785000+00:00,2021-09-30T17:32:34.785Z,https://www.thedailybeast.com/mom-blames-black-student-for-insanely-racist-homecoming-proposal,"https://img.thedailybeast.com/image/upload/c_crop,d_placeholder_euli9k,h_358,w_636,x_0,y_0/dpr_2.0/c_limit,w_740/fl_lossy,q_auto/v1633021756/OHh55vlr_jimjyo",
https://www.msn.com/en-us/news/technology/facebook-grilled-by-lawmakers-over-mental-health-impact-on-children/ar-AAOX33Y?ocid=Peregrine,Facebook exec grilled by lawmakers over mental health impact on children,"Senators say Facebook's platforms, particularly Instagram, are failing children and families.",,['Queenie Wong'],,,https://www.cnet.com/news/facebook-exec-grilled-by-lawmakers-over-mental-health-impact-on-children/,https://www.cnet.com/a/img/VMmB9h_ojQMjOtjhiF-G-xVdbzo=/1200x630/2020/07/25/b5df83d6-ef50-435c-aa00-e0062e6469e3/instagram-facebook-logo-phone-united-states-flag-4544.jpg,false
https://www.msn.com/en-us/news/politics/house-gop-aide-targeted-in-latest-subpoenas-from-jan-6-select-committee/ar-AAP045j?ocid=Peregrine,House GOP aide targeted in latest subpoenas from Jan. 6 select committee,,,[],2021-09-30 00:00:00,,https://www.politico.com/news/2021/09/30/house-gop-aide-targeted-in-latest-subpoenas-from-jan-6-select-committee-514814,https://static.politico.com/fb/9d/1048149a498da96cea3a17ba6060/gettyimages-1230728545-1.jpg,false
https://www.msn.com/en-us/news/crime/sister-of-poway-synagogue-shooting-victim-to-gunman-you-are-an-animal/ar-AAP09NG?ocid=Peregrine,Poway synagogue shooting survivors address gunman at sentencing,"The survivors of a deadly shooting at a Poway, California, synagogue gave powerful victim impact statements Thursday.",,"['Abc News', 'Emily Shapiro', 'September']",,,https://abcnews.go.com/US/victim-impact-statements-begin-poway-synagogue-shooting-sentencing/story?id=80323961,https://s.abcnews.com/images/US/synagogue-shooting-file-ap-ml-210930_1633004356195_hpMain_16x9_992.jpg,false
https://www.msn.com/en-us/news/politics/pelosi-says-house-to-vote-on-infrastructure-despite-dissent/ar-AAP038T?ocid=Peregrine,Are you a robot?,,,[],2021-09-30 00:00:00,,,,
https://www.msn.com/en-us/news/politics/biden-nominates-aclu-voting-rights-head-to-federal-judgeship-in-new-york-progressives-praise-choice-of-democracy-s-lawyer/ar-AAP0A2e?ocid=Peregrine,Biden Nominates ACLU Voting Rights Head to Federal Judgeship in New York; Progressives Praise Choice of ‘Democracy’s Lawyer’,Ho has personally argued two cases before the Supreme Court–both of which were high-profile legal battles against the former administration of Donald Trump and his conservative political allies.,,[],2021-09-30 17:10:00+00:00,2021-09-30T20:30:12+00:00,https://lawandcrime.com/judiciary/biden-nominates-aclu-voting-rights-head-to-federal-judgeship-in-new-york-progressives-praise-choice-of-democracys-lawyer/,https://lawandcrime.com/wp-content/uploads/2021/09/GettyImages-1138924482-1.jpeg,
https://www.msn.com/en-us/news/world/turkey-interested-in-russian-fighter-jets-and-submarines-despite-nato-ties/ar-AAP0vQB?ocid=Peregrine,"Turkey interested in Russian fighter jets and submarines, despite NATO ties","Turkish President Recep Tayyip Erdogan is considering major acquisitions of defense and nuclear technology from Russia, raising the specter of an unprecedented divorce within the NATO alliance.",US Military & Defense Policy News,[],2021-09-30 17:07:50.437000,2021-09-30T17:08:49.322,https://www.washingtonexaminer.com/policy/defense-national-security/turkey-russia-fighter-jets-submarines-nato-ties,https://mediadc.brightspotcdn.com/dims4/default/5afe0f3/2147483647/strip/true/crop/2281x1198+0+62/resize/1200x630!/quality/90/?url=http%3A%2F%2Fmediadc-brightspot.s3.amazonaws.com%2F9e%2Fbf%2Fd041c5724325919b3451ed7dc197%2Fputinerdogan.jpg,
https://www.msn.com/en-us/health/medical/biden-officials-split-on-covid-19-boosters-as-they-plot-course-for-winter/ar-AAOZqY5,Biden team’s booster divide deepens as risk of winter virus surge looms,,,['Maya Parthasarathy'],2021-09-30 00:00:00,,https://www.politico.com/news/2021/09/30/biden-officials-covid-boosters-disagreement-514766,https://static.politico.com/98/bd/cd0c1a1e43569433935eb3010ed0/ap21201578268703-1.jpg,false
https://www.msn.com/en-us/money/markets/singapore-central-bank-seen-on-hold-as-covid-19-pandemic-drags-on-reuters-poll/ar-AAOYRqu,Singapore c.bank seen on hold as COVID-19 pandemic drags on,"Singapore's central bank is expected to leave monetary policy on hold at its October review, analysts say, as highly transmissible coronavirus variants spread locally and across the world, threatening the pace of economic recovery.",Asia Pacific,['Chen Lin'],2021-09-30 03:42:02+00:00,2021-09-30T03:44:24.430Z,https://www.reuters.com/world/asia-pacific/singapore-cbank-seen-hold-covid-19-pandemic-drags-2021-09-30/,https://www.reuters.com/pf/resources/images/reuters/reuters-default.png?d=53,
https://www.msn.com/en-us/news/other/singapore-s-reopening-resolve-tested-as-covid-deaths-hit-record/ar-AAOZ1gH,Are you a robot?,,,[],2021-09-30 00:00:00,,,,
https://www.msn.com/en-us/news/us/americans-way-off-on-number-of-latinos-they-think-are-undocumented-poll-finds/ar-AAP0xqZ,"Americans way off on number of Latinos they think are undocumented, poll finds","About 13 percent of U.S. Latinos are undocumented, but Americans think the number is about a third of even four-in-ten Hispanics, a new survey found.",,['Suzanne Gamboa Is A National Reporter For Nbc Latino'],2021-09-30 17:27:43+00:00,Thu Sep 30 2021 17:27:43 GMT+0000 (UTC),https://www.nbcnews.com/news/latino/americans-way-number-latinos-think-are-undocumented-poll-finds-rcna2464,"https://media-cldnry.s-nbcnews.com/image/upload/t_nbcnews-fp-1200-630,f_auto,q_auto:best/rockcms/2021-09/210929-naturalization-ceremony-se-653p-b703a1.jpg",false
https://www.msn.com/en-us/news/us/more-than-2-million-u-s-school-kids-report-using-e-cigarettes-this-year-cdc-study/ar-AAP0t7A,More than 2 mln U.S. school kids report using e-cigarettes this year - CDC study,"An estimated 2.06 million U.S. middle and high school students are using electronic-cigarettes with Puff Bar, Vuse and Juul among the most popular products, according to data from a 2021 survey analyzed by health officials.",United States,['Manojna Maddipatla'],2021-09-30 18:57:19+00:00,2021-09-30T18:59:35.176Z,https://www.reuters.com/world/us/more-than-2-mln-us-school-kids-report-using-e-cigarettes-this-year-cdc-study-2021-09-30/,https://www.reuters.com/resizer/ZVcweayGBN5Zpff5PwxhpZe55sE=/1200x628/smart/filters:quality(80)/cloudfront-us-east-2.images.arcpublishing.com/reuters/G77TYASW4BLBBOU3LEVTCGHSQ4.jpg,
https://www.msn.com/en-us/news/us/memphis-school-shooting-1-student-shot-by-another-at-an-elementary-school-suspect-in-custody/ar-AAP0jCC,Teen suspect to be charged in Memphis elementary school shooting,"A 13-year-old student is in custody following a shooting at Cummings K-8 Elementary School in Memphis, Tennessee, Thursday morning, assistant chief of the Memphis Police Department, Don Crowe, said in an update Thursday evening",us,['Rebekah Riess'],2021-09-30 00:00:00,2021-09-30T23:43:21Z,https://www.cnn.com/2021/09/30/us/school-shooting-memphis/index.html,https://cdn.cnn.com/cnnnext/dam/assets/210930124103-01-memphis-school-shooting-0930-super-tease.jpg,false
https://www.msn.com/en-us/news/us/lack-of-covid-tests-could-jeopardize-school-safety-e-cigarette-use-remains-high-during-pandemic-today-s-updates/ar-AAOZhx1,Lack of COVID tests could jeopardize school safety; Americans getting vaccinated at low rates: Today's updates,Americans are getting vaccinated at the lowest rates yet this year. Unemployment claims rose for the third straight week. Latest COVID updates.,,[],2021-09-30 00:00:00,,https://www.usatoday.com/story/news/health/2021/09/30/covid-pandemic-vaccine-mandate-health-care-workers/5923049001/,https://www.gannett-cdn.com/-mm-/9e1f6e2ee20f44aa1f3be4f71e9f3e52b6ae2c7e/c=0-110-2121-1303/local/-/media/2021/09/28/USATODAY/usatsports/covid-vaccine-female-healthcare-professional.jpg?width=2121&height=1193&fit=crop&format=pjpg&auto=webp,false
https://www.msn.com/en-us/news/world/private-groups-aiding-thousands-in-afghanistan-worry-about-dwindling-funds/ar-AAP0q9o,Private groups aiding thousands in Afghanistan worry about dwindling funds,"Stacia George hired buses to take hundreds of Afghans, including many who worked for the U.S. government, to the northern city of Mazar-i-Sharif after the Taliban seized Kabul. She planned for charter jets to whisk them to new lives outside Afghanistan.",Asia Pacific,['Jonathan Landay'],2021-09-30 17:12:53+00:00,2021-09-30T17:18:13.350Z,https://www.reuters.com/world/asia-pacific/private-groups-aiding-thousands-afghanistan-worry-about-dwindling-funds-2021-09-30/,https://www.reuters.com/resizer/KNhmsUQv8npnza3NLeVgKwk3T8g=/1200x628/smart/filters:quality(80)/cloudfront-us-east-2.images.arcpublishing.com/reuters/JCY4WBNBM5K7BJYNOIKBWGR4YI.jpg,
https://www.msn.com/en-us/news/world/boris-johnson-handed-a-life-peerage-and-ministerial-job-to-a-tory-donor-who-gave-the-party-122-500/ar-AAP0uIv,"Boris Johnson handed a life peerage and ministerial job to a Tory donor who gave the party £122,500","Boris Johnson has appointed Malcolm Offord as a junior minister in the Scotland Office, making him a lord for life in order to do so.",,['Henry Dyer'],2021-09-30 00:00:00,2021-09-30T16:17:24Z,https://www.businessinsider.com/johnson-makes-malcolm-offord-minister-lord-after-122500-donations-2021-9,https://i.insider.com/6155d8e0b414c100186316a5?width=1200&format=jpeg,false
https://www.msn.com/en-us/news/crime/13-year-old-boy-shot-at-school-student-in-custody-police/ar-AAP03D3,"13-year-old boy shot at Memphis school, suspect to be charged with attempted murder: Police","The boy allegedly responsible for shooting a fellow student at a Memphis school Thursday morning will be charged with attempted murder, police said.",,"['Abc News', 'Emily Shapiro', 'Meredith Deliso', 'September']",,,https://abcnews.go.com/US/boy-shot-memphis-school-critical-condition-suspect-large/story?id=80328357,https://s.abcnews.com/images/US/cummings-school-memphis-shooting-scene-02-ap-jef-210930_1633021029269_hpMain_16x9_992.jpg,false
https://www.msn.com/en-us/news/crime/woman-suspected-of-having-intimate-relationship-with-barry-morphew-allegedly-got-caught-carrying-mysterious-cardboard-box-away-from-his-former-home/ar-AAP0msI,Woman Suspected of Having ‘Intimate’ Relationship with Barry Morphew Allegedly Got Caught Carrying Mysterious Cardboard Box Away from His Former Home,"A woman suspected of having a relationship with Barry Morphew, the Colorado man accused of murdering his wife Suzanne Morphew, has been arrested for allegedly trespassing on property near Maysville, Colo., which formerly belonged to the alleged murderer.",,"['Aaron Keller Holds A Juris Doctor Degree The University Of New Hampshire School Of Law', 'A Broadcast Journalism Degree Syracuse University.', 'He Is A Former Anchor', 'Executive Producer For The Law Crime Network', 'Is Now A Senior Editor For The Law Crime Website.', 'Disclaimer', 'This Website Is For General Informational Purposes Only.', 'You Should Not Rely On It For Legal Advice.', 'Reading This Site Or Interacting With The Author Via This Site Does Not Create An Attorney-Client Relationship.', 'This Website Is Not A Substitute For The Advice Of An Attorney.']",2021-09-30 16:58:27+00:00,2021-10-01T14:06:43+00:00,https://lawandcrime.com/crime/woman-suspected-of-having-intimate-relationship-with-barry-morphew-allegedly-got-caught-carrying-mysterious-cardboard-box-away-from-his-former-home/,https://lawandcrime.com/wp-content/uploads/2021/09/Shoshona-Darke-and-Barry-Morphew-Mugshots.jpg,
https://www.msn.com/en-us/news/politics/protesters-block-golden-gate-bridge-to-mark-20-years-of-failed-promises-on-immigration-reform/ar-AAP0Fjd,Protesters block Golden Gate Bridge to mark '20 years of failed promises' on immigration reform,"A group of protesters temporarily blocked traffic along San Francisco’s Golden Gate Bridge to bring attention to what they called “20 years of failed promises” on immigration reform, including the lack of providing",,[],2021-09-30 13:40:56-04:00,2021-09-30T14:43:44-04:00,https://thehill.com/homenews/state-watch/574730-protesters-block-golden-gate-bridge-to-mark-20-years-of-failed-promises,https://thehill.com/sites/default/files/goldengatebridge.jpg,
https://www.msn.com/en-us/news/politics/13-year-old-shot-at-memphis-school/ar-AAP0Fdv,13-year-old shot at Memphis school,"A 13-year-old student was shot at Cummings Elementary School in Memphis, Tenn., on Thursday.",,[],2021-09-30 13:35:50-04:00,2021-09-30T14:33:33-04:00,https://thehill.com/homenews/state-watch/574729-13-year-old-shot-at-memphis-school,https://thehill.com/sites/default/files/policelinetape11032017getty_0_2.jpg,
https://www.msn.com/en-us/news/politics/analysis-corey-lewandowski-a-real-estate-license-and-why-2024-came-early-for-kristi-noem/ar-AAP0qpL,2024 came early for Kristi Noem. And not in a good way.,With great power comes great responsibility. And a whole lot of scrutiny.,politics,"['Analysis Chris Cillizza', 'Cnn Editor-At-Large']",2021-09-30 00:00:00,2021-09-30T17:30:58Z,https://www.cnn.com/2021/09/30/politics/corey-lewandowski-kristi-noem-2024/index.html,https://cdn.cnn.com/cnnnext/dam/assets/210227195703-cpac-kristi-noem-0227-super-tease.jpg,false
https://www.msn.com/en-us/news/politics/durham-issues-fresh-round-of-subpoenas-in-his-continuing-probe-of-fbi-investigation-into-trump-russia/ar-AAP0CwJ,"Durham issues fresh round of subpoenas in his continuing probe of FBI investigation into Trump, Russia","Special Counsel John Durham has issued a new set of subpoenas, including to a law firm with close ties to Hillary Clinton's 2016 campaign, an indication that Durham could be trying to build a broader criminal case, according to people briefed on the matter. So far, Durham's two-year probe into the FBI's Russia investigation hasn't brought about the cases Republicans hoped it would.",politics,"['Evan Perez', 'Katelyn Polantz']",2021-09-30 00:00:00,2021-09-30T23:41:21Z,https://www.cnn.com/2021/09/30/politics/durham-subpoenas-probe-russia-fbi-sussman/index.html,https://cdn.cnn.com/cnnnext/dam/assets/190514172200-us-attorney-john-durham-super-tease.jpg,false
https://www.msn.com/en-us/news/politics/kristi-noem-daughter-and-state-labor-and-regulation-employees-meeting-to-be-reviewed-by-state-authorities/ar-AAP099u,"Meeting involving South Dakota Gov. Kristi Noem, her daughter, and state labor and regulation employees to be reviewed by state authorities","A July 2020 meeting between Republican South Dakota Gov. Kristi Noem, her daughter and state labor and regulation employees will be reviewed by state authorities following a report that the meeting was called at the same time Noem's daughter was seeking a state certification as a real estate appraiser.",politics,"['Jennifer Henderson', 'Claudia Dominguez']",2021-09-30 00:00:00,2021-09-30T17:20:28Z,https://www.cnn.com/2021/09/30/politics/kristi-noem-south-dakota-investigation/index.html,https://cdn.cnn.com/cnnnext/dam/assets/210711152015-kristi-noem-cpac-2021-0711-super-tease.jpg,false
