article_headline,article_url,article_topic,source_name,source_url,article_datetime,article_position,article_isopinion,article_isad
"Just a rope and balance: Tightrope walker completes 2,198-foot walk from Eiffel Tower",https://www.msn.com/en-us/news/world/just-a-rope-and-balance-tightrope-walker-completes-2-198-foot-walk-from-eiffel-tower/ar-AAOFLl9?ocid=Peregrine,Top Stories,USA TODAY,Unavailable,,1.0,False,False
"Apple, long a champion of consumer privacy, now sits at a crossroads",https://www.msn.com/en-us/news/technology/apple-long-a-champion-of-consumer-privacy-now-sits-at-a-crossroads/ar-AAOEVec?ocid=Peregrine,Top Stories,CNET,Unavailable,,1.1,False,False
If You Are Troubled By Not Being Able To Buy Buitable Shoes. Try It,https://trace.mediago.io/api/bidder/track?tn=9220dd482c2a49631b4e66cca9f5f0ee&price=V-THXlxTezK-fuyiXgKON1aRuZBG0XKsUGEU3WFIXWU&evt=102&rid=36852b0be9511bf48407cb5e21f70922&campaignid=1048204&impid=vlp-infopane-3&offerid=2814298&test=0&time=1632247256&cp=CLJh2GWBA9mHcLQzGKlWZmHOayqwm8fCe_5RGXbUxd0&clickid=21_36852b0be9511bf48407cb5e21f70922_vlp-infopane-3&acid=717&trackingid=8b848d70a04852f2dc56cb2caf38df62&uid=30A7FB5E90A8696400EEEBE7916A685F&jt=2&url=qkPQzaXLXz5WQVu5WpAYB8rFN0SWCKlH26S8NWHDQO8MYPIvY11b5A5_-0cEbpNGDEvbSyZYgv6C8HjHlvjtibWXyc0s1-Cw3cERnLU549ss3wlc9NTVbCjt4iA-hnA0Abr5O81WuKtdPNNVazLepHGskKGcHGd2_6_2ZEc-rS8TBh-C_T1AQnCgCjGKU1DQ1ScHY1g25ssP4qwtEagKSUjBA24cjX8yhy7PJUlCRnOTbi7gX2zkcdkJQLIhcK-kryzSH_2Qg1Bvq767tkIhYH35R1tZP7Lcqft94avLMJa6UH1eStJMW0DOyuenI17_ONtaiK0C9XpDlEvQyVhIiTN64GqyWUrSJ69iDxyX6XQ&bm=2&la=en&cn=us&cid=1097796&info=ln8Vf3ZONr0fwxGmdeXfxvCxhiOH_sJWhYVjQFzw_stkTNbvPe02VXdt3pyqDBYO,Top Stories,AdGmdjd.com,Unavailable,,1.2,False,True
Psaki says 'horrific' footage of Border Patrol agents whipping at Haitian migrants are 'not who we are',https://www.msn.com/en-us/news/world/psaki-says-horrific-footage-of-border-patrol-agents-whipping-at-haitian-migrants-are-not-who-we-are/ar-AAOFHUT?ocid=Peregrine,Top Stories,Business Insider,Unavailable,,1.3,False,False
Head of Homeland Security says images from US border ‘horrified’ him,https://www.msn.com/en-us/news/world/head-of-homeland-security-says-images-from-us-border-horrified-him/ar-AAOFFkE?ocid=Peregrine,Top Stories,New York Daily News,Unavailable,,1.4,False,False
Want To Sweat Quickly?  Put On This Sauna Vest & Go For Run,https://trace.mediago.io/api/bidder/track?tn=9220dd482c2a49631b4e66cca9f5f0ee&price=wuPenFTLrsHS9r1JUSpELDsXmsRBFGTX5KMsMIg3sZk&evt=102&rid=36852b0be9511bf48407cb5e21f70922&campaignid=1046340&impid=vlp-infopane-6&offerid=2735113&test=0&time=1632247256&cp=GE1KrCLrK6r958dK0rLeuoEwCw34fp2bsrUl-ioM2ig&clickid=21_36852b0be9511bf48407cb5e21f70922_vlp-infopane-6&acid=200&trackingid=8640fdbef1e33a5191a17e47c1a059fb&uid=30A7FB5E90A8696400EEEBE7916A685F&jt=2&url=_TJ2_9g95gYmB-fmMOnIZBvpNWfehViJRU8DBHWmc2onCvjsX7CXg3Va1rQcVa1ZtGzVKGSk9r6xnoMRktGjM6tHPCCcs8vPXOWLNIelriEPkezagMrBVAL_pei5Nw20jbyoCeFPmXtuvJw-DDrHd0NNrcwqUv38OuLXV17TW4jNEPweJP8XV9Ztk0sHUBEg1mQ21YTPwfCn3Nq2vnYFfdiuPCu_TzJ8yD3jV1yKvqaICm__h49nx5JsAWS-KdMxy5-w8TOzx0HOwTVnSXTSN4Jq9I0b_4Jj0877ew7ejuFrWXDxEFG8v4QaKebY9M6ikC9rfyoOzn_Ef7idO0AMNBu-QvFzswMgfnP3cuBtcS07wpMj-5L6RoAjCQvoH2nSzdJ_sJg98JZg8FYm5-WJUg&bm=5&la=en&cn=us&cid=1093997&info=ugU5LznPkJjnxND09njZ6kHnL5pwwmexvkuCx8owAtWfDXy4m8ecTkyUpMBBJGLA,Top Stories,AdLovehots.com,Unavailable,,1.5,False,True
Biden declares ‘new era’ of U.S. diplomacy in U.N. speech,https://www.msn.com/en-us/news/world/biden-declares-new-era-of-u-s-diplomacy-in-u-n-speech/ar-AAOFi9V?ocid=Peregrine,Top Stories,POLITICO,Unavailable,,1.6,False,False
"Demanding U.N. action, a man's hunger strike focuses attention on Cuba",https://www.msn.com/en-us/news/world/demanding-u-n-action-a-man-s-hunger-strike-focuses-attention-on-cuba/ar-AAOFHN1?ocid=Peregrine,Top Stories,NBC News,Unavailable,,1.7,False,False
"Idaho Nurse Who Fell into Vaccine 'Misinformation' Dies of COVID, Leaving Behind 10-Year-Old Twins",https://www.msn.com/en-us/news/us/idaho-nurse-who-fell-into-vaccine-misinformation-dies-of-covid-leaving-behind-10-year-old-twins/ar-AAOFTXx?ocid=Peregrine,Top Stories,People,Unavailable,,1.8,False,False
Border Patrol agents confronting Haitian refugees in viral footage horrifies Biden administration,https://www.msn.com/en-us/news/us/border-patrol-agents-confronting-haitian-refugees-in-viral-footage-horrifies-biden-administration/ar-AAOFauy?ocid=Peregrine,Top Stories,CNN,Unavailable,,1.9,False,False
Election reform in the states is not all doom and gloom,https://www.msn.com/en-us/news/politics/election-reform-in-the-states-is-not-all-doom-and-gloom/ar-AAOFNa2?ocid=Peregrine,Top Stories,The Hill,Unavailable,,1.10,False,False
"426,000 affected by flooding in South Sudan: UN",https://www.msn.com/en-us/news/world/426-000-affected-by-flooding-in-south-sudan-un/ar-AAOFTQi?ocid=Peregrine,Top Stories,AFP,Unavailable,,1.11,False,False
Where is #TheResistance now? Democrats should fear their base now more than ever,https://www.msn.com/en-us/news/politics/where-is-theresistance-now-democrats-should-fear-their-base-now-more-than-ever/ar-AAOFNb1?ocid=Peregrine,Top Stories,Salon,Unavailable,,2.0,False,False
Female-hosted ‘Face the Nation’ features fewest women on Sundays,https://www.msn.com/en-us/news/politics/female-hosted-face-the-nation-features-fewest-women-on-sundays/ar-AAOFFff?ocid=Peregrine,Top Stories,Washington Examiner,Unavailable,,3.0,False,False
'Extremely Disturbing': Allegations of Child Sex Abuse Prompt Arrest of Calif. Deputy,https://www.msn.com/en-us/news/crime/extremely-disturbing-allegations-of-child-sex-abuse-prompt-arrest-of-calif-deputy/ar-AAOFDa3?ocid=Peregrine,Top Stories,Newsweek,Unavailable,,4.0,False,False
Search for Brian Laundrie resumes in 'gator and snake infested' swamp: Live updates,https://www.msn.com/en-us/news/crime/search-for-brian-laundrie-resumes-in-gator-and-snake-infested-swamp-live-updates/ar-AAODwxA?ocid=Peregrine,Top Stories,ABC News,Unavailable,,5.0,False,False
U.S. lawmakers move urgently to recognize survivors of the first atomic bomb test,https://www.msn.com/en-us/news/us/u-s-lawmakers-move-urgently-to-recognize-survivors-of-the-first-atomic-bomb-test/ar-AAOFOcg?ocid=Peregrine,Top Stories,National Geographic,Unavailable,,6.0,False,False
Missing cat returns home after 12 years,https://www.msn.com/en-us/news/world/missing-cat-returns-home-after-12-years/ar-AAOFRt3?ocid=Peregrine,Top Stories,BBC News,Unavailable,,7.0,False,False
Biden: U.N. address marks 'the first time in 20 years' U.S. is not at war,https://www.msn.com/en-us/news/world/biden-u-n-address-marks-the-first-time-in-20-years-u-s-is-not-at-war/ar-AAOFHG4?ocid=Peregrine,Top Stories,Yahoo! News,Unavailable,,8.0,False,False
Biden bets on rapid COVID tests but they can be hard to find,https://www.msn.com/en-us/news/us/biden-bets-on-rapid-covid-tests-but-they-can-be-hard-to-find/ar-AAOFqLH,Coronavirus,Associated Press,Unavailable,,9.0,False,False
J&J: Booster shot increases protection against coronavirus,https://www.msn.com/en-us/news/us/j-j-booster-shot-increases-protection-against-coronavirus/ar-AAOFwKb,Coronavirus,U.S. News & World Report,Unavailable,,11.0,False,False
COVID death toll in US eclipses 1918 influenza pandemic estimates,https://www.msn.com/en-us/health/medical/covid-death-toll-in-us-eclipses-1918-influenza-pandemic-estimates/ar-AAOE3va,Coronavirus,ABC News,Unavailable,,12.0,False,False
U.S. domestic terrorism investigations have more than doubled -FBI director,https://www.msn.com/en-us/news/us/u-s-domestic-terrorism-investigations-have-more-than-doubled-fbi-director/ar-AAOFDly,US,Reuters,Unavailable,,13.0,False,False
"2 doses of J&J vaccine provide 94% protection, study says; US reaches death toll of Spanish flu: COVID-19 updates",https://www.msn.com/en-us/news/us/2-doses-of-j-j-vaccine-provide-94-protection-study-says-us-reaches-death-toll-of-spanish-flu-covid-19-updates/ar-AAOF4MY,US,USA TODAY,Unavailable,,14.0,False,False
Texas couple asked to leave restaurant for wearing face masks to protect their immunocompromised infant,https://www.msn.com/en-us/news/us/texas-couple-asked-to-leave-restaurant-for-wearing-face-masks-to-protect-their-immunocompromised-infant/ar-AAOFEf9,US,CNN,Unavailable,,15.0,False,False
Everyone agrees on the cause of New Orleans' trash problem. Solutions are harder to find.,https://www.msn.com/en-us/news/us/everyone-agrees-on-the-cause-of-new-orleans-trash-problem-solutions-are-harder-to-find/ar-AAOFu3t,US,NBC News,Unavailable,,16.0,False,False
White House calls video of US border agents chasing migrants 'horrific',https://www.msn.com/en-us/news/us/white-house-calls-video-of-border-agents-chasing-haitian-migrants-horrific-dhs-promises-to-investigate/ar-AAOE2Mm,US,USA TODAY,Unavailable,,17.0,False,False
Horse show to celebrate Queen Elizabeth's 70th anniversary,https://www.msn.com/en-us/news/world/horse-show-to-celebrate-queen-elizabeth-s-70th-anniversary/ar-AAOFTZA,World,Reuters,Unavailable,,18.0,False,False
A coup in Africa is another quiet embarrassment for the US military's most idealistic mission,https://www.msn.com/en-us/news/world/a-coup-in-africa-is-another-quiet-embarrassment-for-the-us-military-s-most-idealistic-mission/ar-AAOFD8o,World,Business Insider,Unavailable,,19.0,False,False
Abba star aims to fix £500m music royalty problem,https://www.msn.com/en-us/news/other/abba-star-aims-to-fix-500m-music-royalty-problem/ar-AAOFD89,World,BBC News,Unavailable,,20.0,False,False
Russia Accuses U.K. of 'Anti-Russian Sentiment' as Third Man Charged in Ex-Spy's Poisoning,https://www.msn.com/en-us/news/world/russia-accuses-u-k-of-anti-russian-sentiment-as-third-man-charged-in-ex-spy-s-poisoning/ar-AAOFDab,World,Newsweek,Unavailable,,21.0,False,False
UK data breach jeopardizes contact information of Afghan interpreters,https://www.msn.com/en-us/news/world/uk-data-breach-jeopardizes-contact-information-of-afghan-interpreters/ar-AAOFHSV,World,Washington Examiner,Unavailable,,22.0,False,False
Biden's economic agenda in 'significant danger' of collapse. The worst-case scenario for the 2022 midterms is inching closer.,https://www.msn.com/en-us/news/politics/biden-s-economic-agenda-in-significant-danger-of-collapse-the-worst-case-scenario-for-the-2022-midterms-is-inching-closer/ar-AAOFDhx,Politics,Business Insider,Unavailable,,23.0,False,False
Opinion: How we can repair the damage of the Trump presidency,https://www.msn.com/en-us/news/politics/opinion-how-we-can-repair-the-damage-of-the-trump-presidency/ar-AAOFHUR,Politics,CNN,Unavailable,,24.0,False,False
Conservative group's poll shows McAuliffe with narrow lead in Virginia,https://www.msn.com/en-us/news/politics/conservative-group-s-poll-shows-mcauliffe-with-narrow-lead-in-virginia/ar-AAOFJDG,Politics,POLITICO,Unavailable,,25.0,False,False
Cryptocurrency exchange sanctioned by Biden administration in effort to cut off revenue to ransomware groups,https://www.msn.com/en-us/news/politics/cryptocurrency-exchange-sanctioned-by-biden-administration-in-effort-to-cut-off-revenue-to-ransomware-groups/ar-AAOFq6G,Politics,CNN,Unavailable,,26.0,False,False
Here's why Amazon is lobbying the government to legalize marijuana,https://www.msn.com/en-us/news/politics/here-s-why-amazon-is-lobbying-the-government-to-legalize-marijuana/ar-AAOFF6H,Politics,The Hill,Unavailable,,27.0,False,False
"Ill. Graduate Student, 25, Who Wants to be a Doctor, Is Missing as Family Pleads for Public's Help",https://www.msn.com/en-us/news/crime/ill-graduate-student-25-who-wants-to-be-a-doctor-is-missing-as-family-pleads-for-public-s-help/ar-AAOFDdd,Crime,People,Unavailable,,28.0,False,False
Oakland Police Department investigating 100th homicide of 2021,https://www.msn.com/en-us/news/crime/oakland-police-department-investigating-100th-homicide-of-2021/ar-AAOFHzu,Crime,ABC News,Unavailable,,29.0,False,False
Arkansas Man Who Evaded Police for More Than a Year Gets Two Life Sentences for Murders of Girlfriend and Her 4-Year-Old Son,https://www.msn.com/en-us/news/crime/arkansas-man-who-evaded-police-for-more-than-a-year-gets-two-life-sentences-for-murders-of-girlfriend-and-her-4-year-old-son/ar-AAOFEIP,Crime,Law & Crime,Unavailable,,30.0,False,False
Trial Date Set for Former Police Officer Who Shot and Killed Texas Woman Atatiana Jefferson,https://www.msn.com/en-us/news/crime/trial-date-set-for-former-police-officer-who-shot-and-killed-texas-woman-atatiana-jefferson/ar-AAOFGVG,Crime,Law & Crime,Unavailable,,31.0,False,False
Sheriff: No charges after twin boys die from heat in car,https://www.msn.com/en-us/news/crime/sheriff-no-charges-after-twin-boys-die-from-heat-in-car/ar-AAOFLNj,Crime,Associated Press,Unavailable,,32.0,False,False
Scientists say Mars may simply be too small to host life,https://www.msn.com/en-us/news/technology/scientists-say-mars-may-simply-be-too-small-to-host-life/ar-AAOFHVY,Science and Technology,CNET,Unavailable,,33.0,False,False
Amazon boosts Kindle Paperwhite screen size and battery life in first major upgrade in 3 years,https://www.msn.com/en-us/news/technology/amazon-boosts-kindle-paperwhite-screen-size-and-battery-life-in-first-major-upgrade-in-3-years/ar-AAOFEQl,Science and Technology,Geekwire,Unavailable,,34.0,False,False
"Johnson & Johnson's vaccine is highly effective with extra dose, company says. What that means for boosters",https://www.msn.com/en-us/news/technology/johnson-johnson-s-vaccine-is-highly-effective-with-extra-dose-company-says-what-that-means-for-boosters/ar-AAOyHgY,Science and Technology,CNET,Unavailable,,35.0,False,False
Here's What the Air Force's Next-Gen Flying 'Jeep' Could Look Like,https://www.msn.com/en-us/news/technology/here-s-what-the-air-force-s-next-gen-flying-jeep-could-look-like/ar-AAOFMK3,Science and Technology,Popular Mechanics,Unavailable,,36.0,False,False
NASA will pay $400m to companies to build their own space stations,https://www.msn.com/en-us/news/technology/nasa-will-pay-400m-to-companies-to-build-their-own-space-stations/ar-AAOFRvs,Science and Technology,Daily Mail,Unavailable,,37.0,False,False
