article_headline,article_url,article_topic,source_name,source_url,article_datetime,article_position,article_isopinion,article_isad
US fighter jet intercepts Cessna flying into restricted airspace over NYC,https://www.msn.com/en-us/news/us/us-fighter-jet-intercepts-cessna-flying-into-restricted-airspace-over-nyc/ar-AAOG8lp?ocid=Peregrine,Top Stories,New York Daily News,Unavailable,,1.0,False,False
South Carolina Dad Whose Twins Died After He Forgot Them in the Car Won't Face Charges,https://www.msn.com/en-us/news/crime/south-carolina-dad-whose-twins-died-after-he-forgot-them-in-the-car-won-t-face-charges/ar-AAOGhU0?ocid=Peregrine,Top Stories,People,Unavailable,,1.1,False,False
7 Retirement Income Strategies Once Your Portfolio Reaches $500k,https://trace.mediago.io/api/bidder/track?tn=9220dd482c2a49631b4e66cca9f5f0ee&price=-mLFXCldN3p0F7cB27B4publc-O02C3JMe1i95u7TcI&evt=102&rid=6d6e714a7317dca37ecfaba81a2c627c&campaignid=1027913&impid=vlp-infopane-3&offerid=2019249&test=0&time=1632271626&cp=hdVVVvhhuAP1fEnu_Zx3yKLSHiX_q0Bzblhc9l_z6rg&clickid=21_6d6e714a7317dca37ecfaba81a2c627c_vlp-infopane-3&acid=305&trackingid=dc9e707bc56c6a1459c827904d4fd805&uid=0C6FCAE9CC826AF90D4ADA53CD356B71&jt=2&url=JviuM9TDfDb3hL8SnsJ0aY1pFSu8naghQ2JJoPhmSqWaBBUhGX44k6lLiqNhsugJuBZkUzzKAGo8_mv7OJFeE1SpjM1HGyOYbs30KWQ-RiNUbT_QeVLWQB8BvoVPHV2bks4hdVGN7s-kPZVjjaX9oRpPz-i0PUGTTPP26AyXXetlpcIoCE9y04HpX0JxN2V8RUegGO601ZEJEtpQOp1jhTZI_wmI7YEZyqE20Ut2HBphuaeQE7A007RnC3ZpKOuKpsRQBbd6PKceGg1vnPrPge-m6752fnb3I0Rb3n3ItBM&bm=2&la=en&cn=us&cid=1060163&info=ZHn4NtJl0fo4syZ8lmNDWRKH4y7w3YXg1ImJg2Icfa6mB8i_jvtUpnnW8nUZ_Rfg,Top Stories,AdFisher Investments,Unavailable,,1.2,False,True
US Education Department investigating Texas' ban on school mask mandates,https://www.msn.com/en-us/news/us/us-education-department-investigating-texas-ban-on-school-mask-mandates/ar-AAOGcmY?ocid=Peregrine,Top Stories,CNN,Unavailable,,1.3,False,False
Instagram Is Doing Grave Harm to Our Generation. We Need Help to Stop It,https://www.msn.com/en-us/news/technology/instagram-is-doing-grave-harm-to-our-generation-we-need-help-to-stop-it/ar-AAOGhVs?ocid=Peregrine,Top Stories,Time,Unavailable,,1.4,False,False
If You Are Troubled By Not Being Able To Buy Buitable Shoes. Try It,https://trace.mediago.io/api/bidder/track?tn=9220dd482c2a49631b4e66cca9f5f0ee&price=AfYcQljrlumm76Id5xUgNEN_CUtOW8xWyn_gFmSzb28&evt=102&rid=6d6e714a7317dca37ecfaba81a2c627c&campaignid=1048204&impid=vlp-infopane-6&offerid=2814298&test=0&time=1632271626&cp=eMplWvzR0wGbl7R3Ph8pcIVwexWiw-NYIi5KOBEh_Mk&clickid=21_6d6e714a7317dca37ecfaba81a2c627c_vlp-infopane-6&acid=717&trackingid=06e2bddd806561a8ec3cc081c5debcf3&uid=0C6FCAE9CC826AF90D4ADA53CD356B71&jt=2&url=KGdnXb20-PtB1UZSj1AlS57VStKMX27vB8MnSndfFSf9Bmf-8qa9IojgSPGrohdtuV-AU-rDE9eIlCATwCrMkaxNV1crQUFYGlxb8zh-0ck-O05MY9Whc7exDKkoRAOjorcRTxkXay5HqEmQWUPCgl8ePIhayf7fNA4NxpO13MZPP1jLcfk_W3fnGkzs-rnuKIN236XybxND_O0Dbz0ItoPPCcZjlC9kRUCMVcq8-2BRZVcu5tHyTCmZ7kMDGBi010yq45_3i1K48d5zgGtevuJ0J_zbdbIMbaeoNVX8ngWakyxJg66zUl09rW-RWoQw6DEibXwVgC_I0RNlIFsGKIuh7roVfA4YGMUZgdw6DXE&bm=2&la=en&cn=us&cid=1097796&info=ixeGwtecy0RDHTnpq7-TIW1YFntEDWtbs-Ld91Wn-PbchnfWfoihRL6N_snt3TPW,Top Stories,AdGmdjd.com,Unavailable,,1.5,False,True
2 disbarred attorneys outside Texas sue abortion doctor under SB8,https://www.msn.com/en-us/news/us/2-disbarred-attorneys-outside-texas-sue-abortion-doctor-under-sb8/ar-AAOGe40?ocid=Peregrine,Top Stories,ABC News,Unavailable,,1.6,False,False
Overnight Defense & National Security — Presented by AM General — Afghan evacuation still frustrates,https://www.msn.com/en-us/news/politics/overnight-defense-national-security-presented-by-am-general-afghan-evacuation-still-frustrates/ar-AAOGjOl?ocid=Peregrine,Top Stories,The Hill,Unavailable,,1.7,False,False
"Internet freedom on the decline in US and globally, study finds",https://www.msn.com/en-us/news/world/internet-freedom-on-the-decline-in-us-and-globally-study-finds/ar-AAOGmbq?ocid=Peregrine,Top Stories,The Guardian,Unavailable,,1.8,False,False
Teen pleads guilty in 2019 fatal stabbing of Barnard College student Tessa Majors,https://www.msn.com/en-us/news/crime/teen-pleads-guilty-in-2019-fatal-stabbing-of-barnard-college-student-tessa-majors/ar-AAOGjHH?ocid=Peregrine,Top Stories,NBC News,Unavailable,,1.9,False,False
US: Taliban request to speak this week won't be approved,https://www.msn.com/en-us/news/world/us-taliban-request-to-speak-this-week-won-t-be-approved/ar-AAOG8j6?ocid=Peregrine,Top Stories,Washington Examiner,Unavailable,,1.10,False,False
Facebook is reportedly using News Feed to improve its image,https://www.msn.com/en-us/news/technology/facebook-is-reportedly-using-news-feed-to-improve-its-image/ar-AAOGhdV?ocid=Peregrine,Top Stories,CNET,Unavailable,,1.11,False,False
Here's why the first official figures on Latinos in the media look better than some expected,https://www.msn.com/en-us/news/us/here-s-why-the-first-official-figures-on-latinos-in-the-media-look-better-than-some-expected/ar-AAOG2TQ?ocid=Peregrine,Top Stories,The LA Times,Unavailable,,2.0,False,False
Pumpkin patches and Halloween parties: Experts weigh in on COVID-19 risks at fall gatherings,https://www.msn.com/en-us/news/us/pumpkin-patches-and-halloween-parties-experts-weigh-in-on-covid-19-risks-at-fall-gatherings/ar-AAOkqMi?ocid=Peregrine,Top Stories,USA TODAY,Unavailable,,3.0,False,False
US says Blinken expects to speak to France,https://www.msn.com/en-us/news/world/us-says-blinken-expects-to-speak-to-france/ar-AAOGaie?ocid=Peregrine,Top Stories,AFP,Unavailable,,4.0,False,False
Taliban ask to speak at UN General Assembly,https://www.msn.com/en-us/news/world/taliban-ask-to-speak-at-un-general-assembly/ar-AAOGaf1?ocid=Peregrine,Top Stories,BBC News,Unavailable,,5.0,False,False
"Charges: Man ""snapped,"" killed 4, then left bodies in field",https://www.msn.com/en-us/news/crime/charges-man-snapped-killed-4-then-left-bodies-in-field/ar-AAOGaa8?ocid=Peregrine,Top Stories,Associated Press,Unavailable,,6.0,False,False
"Former Florida Private School Teacher Charged with Driving Student to Beach, Engaging in Sex Acts",https://www.msn.com/en-us/news/crime/former-florida-private-school-teacher-charged-with-driving-student-to-beach-engaging-in-sex-acts/ar-AAOGeDF?ocid=Peregrine,Top Stories,Law & Crime,Unavailable,,7.0,False,False
"Mark Zuckerberg personally approved a project that pushed pro-Facebook stories into the news feeds of the platform's users, report says",https://www.msn.com/en-us/news/technology/mark-zuckerberg-personally-approved-a-project-that-pushed-pro-facebook-stories-into-the-news-feeds-of-the-platform-s-users-report-says/ar-AAOGjha?ocid=Peregrine,Top Stories,Business Insider,Unavailable,,8.0,False,False
J&J: Booster shot increases protection against coronavirus,https://www.msn.com/en-us/news/us/j-j-booster-shot-increases-protection-against-coronavirus/ar-AAOFwKb,Coronavirus,U.S. News & World Report,Unavailable,,9.0,False,False
Biden bets on rapid COVID tests but they can be hard to find,https://www.msn.com/en-us/news/us/biden-bets-on-rapid-covid-tests-but-they-can-be-hard-to-find/ar-AAOFqLH,Coronavirus,Associated Press,Unavailable,,11.0,False,False
COVID death toll in US eclipses 1918 influenza pandemic estimates,https://www.msn.com/en-us/health/medical/covid-death-toll-in-us-eclipses-1918-influenza-pandemic-estimates/ar-AAOE3va,Coronavirus,ABC News,Unavailable,,12.0,False,False
An outrage at America's border (opinion),https://www.msn.com/en-us/news/us/an-outrage-at-america-s-border-opinion/ar-AAOGh2f,US,CNN,Unavailable,,13.0,False,False
Search for Brian Laundrie resumes in Florida reserve a day after authorities called it off,https://www.msn.com/en-us/news/us/search-for-brian-laundrie-resumes-in-florida-reserve-a-day-after-authorities-called-it-off/ar-AAOFtGt,US,NBC News,Unavailable,,14.0,False,False
'Appalled': Border Patrol agents' treatment of Haitian migrants criticized by former officials,https://www.msn.com/en-us/news/us/appalled-border-patrol-agents-treatment-of-haitian-migrants-criticized-by-former-officials/ar-AAOG5Wx,US,USA TODAY,Unavailable,,15.0,False,False
"Gabby Petito update: Autopsy confirms remains found in Wyoming are Gabby Petito's, FBI says",https://www.msn.com/en-us/news/us/gabby-petito-update-autopsy-confirms-remains-found-in-wyoming-are-gabby-petito-s-fbi-says/ar-AAOEJlT,US,CNN,Unavailable,,16.0,False,False
"San Jose State must pay $1.6 million after trainer abused women athletes, DOJ finds",https://www.msn.com/en-us/news/us/san-jose-state-must-pay-1-6-million-after-trainer-abused-women-athletes-doj-finds/ar-AAOFUyQ,US,USA TODAY,Unavailable,,17.0,False,False
U.S. says meeting with European partners including France canceled due to scheduling issues,https://www.msn.com/en-us/news/world/u-s-says-meeting-with-european-partners-including-france-canceled-due-to-scheduling-issues/ar-AAOGhOb,World,Reuters,Unavailable,,18.0,False,False
"Malaysia, Thailand and Vietnam are leaving behind zero-Covid but they aren't ready to open up, experts warn",https://www.msn.com/en-us/news/world/malaysia-thailand-and-vietnam-are-leaving-behind-zero-covid-but-they-aren-t-ready-to-open-up-experts-warn/ar-AAOGaHO,World,CNN,Unavailable,,19.0,False,False
Melbourne earthquake: Magnitude 6.0 temblor strikes Australia,https://www.msn.com/en-us/news/world/melbourne-earthquake-magnitude-6-0-temblor-strikes-australia/ar-AAOGcit,World,CNN,Unavailable,,20.0,False,False
Biden UN speech: President makes the case for using 'relentless diplomacy' instead of military might to solve global crises,https://www.msn.com/en-us/news/world/biden-un-speech-president-makes-the-case-for-using-relentless-diplomacy-instead-of-military-might-to-solve-global-crises/ar-AAOEWcR,World,CNN,Unavailable,,21.0,False,False
Major record labels could face competition inquiry,https://www.msn.com/en-us/news/other/major-record-labels-could-face-competition-inquiry/ar-AAOG87S,World,BBC News,Unavailable,,22.0,False,False
"Gabby Petito's remains confirmed, and manner of death was homicide, coroner determines",https://www.msn.com/en-us/news/crime/gabby-petito-s-remains-confirmed-and-manner-of-death-was-homicide-coroner-determines/ar-AAOG5jN,Crime,NBC News,Unavailable,,23.0,False,False
Police Suspend Search for Missing 6-Year-Old Girl in Hawaii,https://www.msn.com/en-us/news/crime/police-suspend-search-for-missing-6-year-old-girl-in-hawaii/ar-AAOGgPH,Crime,People,Unavailable,,24.0,False,False
"Teen Pleads Guilty to Tessa Majors Murder, But Says Co-Defendant Committed the Actual Stabbing",https://www.msn.com/en-us/news/crime/teen-pleads-guilty-to-tessa-majors-murder-but-says-co-defendant-committed-the-actual-stabbing/ar-AAOG7tW,Crime,Law & Crime,Unavailable,,25.0,False,False
"Body found near Grand Teton confirmed to be Gabby Petito, death ruled a homicide",https://www.msn.com/en-us/news/crime/body-found-near-grand-teton-confirmed-to-be-gabby-petito-death-ruled-a-homicide/ar-AAOFZTM,Crime,ABC News,Unavailable,,26.0,False,False
"Ex-Mayor, Elected at 23, Gets 6 Years in Corruption Case After Prosecutors Asked for 11",https://www.msn.com/en-us/news/crime/ex-mayor-elected-at-23-gets-6-years-in-corruption-case-after-prosecutors-asked-for-11/ar-AAOGbIk,Crime,Newsweek,Unavailable,,27.0,False,False
Fact-checking Trump's letter to Georgia secretary of state,https://www.msn.com/en-us/news/politics/fact-checking-trump-s-letter-to-georgia-secretary-of-state/ar-AAOGaqH,Politics,CNN,Unavailable,,28.0,False,False
Senate advances Biden consumer bureau pick after panel logjam,https://www.msn.com/en-us/news/politics/senate-advances-biden-consumer-bureau-pick-after-panel-logjam/ar-AAOGc2D,Politics,The Hill,Unavailable,,29.0,False,False
House passes bill to compensate 'Havana syndrome' victims,https://www.msn.com/en-us/news/politics/house-passes-bill-to-compensate-havana-syndrome-victims/ar-AAOGh1g,Politics,The Hill,Unavailable,,30.0,False,False
Wray warns Taliban takeover in Afghanistan could inspire US-based extremists,https://www.msn.com/en-us/news/politics/wray-warns-taliban-takeover-in-afghanistan-could-inspire-us-based-extremists/ar-AAOG2AQ,Politics,The Hill,Unavailable,,31.0,False,False
House prepares to vote on bill to avert shutdown and suspend debt limit,https://www.msn.com/en-us/news/politics/house-prepares-to-vote-on-bill-to-avert-shutdown-and-suspend-debt-limit/ar-AAOFOra,Politics,CNN,Unavailable,,32.0,False,False
