article_headline,article_url,article_topic,source_name,source_url,article_datetime,article_position,article_isopinion,article_isad
Texas anti-mask ‘Freedom Defender’ Caleb Wallace dies at 30,https://www.msn.com/en-us/news/us/texas-anti-mask-freedom-defender-caleb-wallace-dies-at-30/ar-AANQYtG?ocid=Peregrine,Top Stories,New York Daily News,Unavailable,,1.0,False,False
War-weary Libyans yearn for end to daily blackouts,https://www.msn.com/en-us/news/world/war-weary-libyans-yearn-for-end-to-daily-blackouts/ar-AANQYug?ocid=Peregrine,Top Stories,AFP,Unavailable,,1.1,False,False
"7 Retirement Income Strategies Once Your Portfolio Reaches $500,000",https://trace.mediago.io/api/bidder/track?tn=9220dd482c2a49631b4e66cca9f5f0ee&price=j1f2btxfXv2ZsOQ6gAa-9NE9VLh-zp2Enbqcfp-Kni8&evt=102&rid=3d3eea16f0c3ede92ab299732d7fb34e&campaignid=1040022&impid=vlp-infopane-3&offerid=2476690&test=0&time=1630201472&cp=qXbvzhgIy5PnCMZjrHCIiwav9z4qAWqDijO2QvxxF40&clickid=21_3d3eea16f0c3ede92ab299732d7fb34e_vlp-infopane-3&acid=305&trackingid=f885f9564c8a2a1a56517f13ca971d14&uid=009278B98F016FE11550681B8E066ED4&jt=2&url=EQpNDFiDF7_7bbNHLfg8KoT0QH4g_0Gj0O22m-MbqXYMDZ_0Z7AnXmhKys3QuK_936HW-cN8bQH_vnu9ChYLLGsj7lGLy1w0NVwPEbg0TuOqcG2y5pBFw83Y5LGH6_JrRncUkW8HtaTfuj_qZMoI10rcYhYxRa7KDwQUA1hyw-PBhkRXzpDodV8vM02_ebeDzUkoAhKAdkfV2vsKiPZaegn_Uzx1z33vFwp3jbs-gqITfAldRKIifHD0i3T3G_bguPelYdwjfZPVvpUXthT_jodFWmwJK1mcQzVI9D0jyow&bm=2&la=en&cn=us&cid=1081622&info=0HgaZAtdd-r9ve_25z03hKWZQhXOLNopwkMf8-Xw8XsLEPgiwVR3oZT5uPjfyZL20s4SaWoQG7mp9XyzvuChUA,Top Stories,AdFisher Investments,Unavailable,,1.2,False,True
Afghanistan live updates: US warns Americans to leave Kabul airport 'immediately'; Biden says another Kabul attack 'highly likely',https://www.msn.com/en-us/news/world/afghanistan-live-updates-us-warns-americans-to-leave-kabul-airport-immediately-biden-says-another-kabul-attack-highly-likely/ar-AANQe4p?ocid=Peregrine,Top Stories,USA TODAY,Unavailable,,1.3,False,False
Mexico is suing US gunmakers for thousands of guns trafficked across the border each year. Can they win?,https://www.msn.com/en-us/news/us/mexico-is-suing-us-gunmakers-for-thousands-of-guns-trafficked-across-the-border-each-year-can-they-win/ar-AANQvkM?ocid=Peregrine,Top Stories,CNN,Unavailable,,1.4,False,False
Top Doctors: These Men's Shoes Can Reduce Foot Pain And Improve Posture,https://trace.mediago.io/api/bidder/track?tn=9220dd482c2a49631b4e66cca9f5f0ee&price=K_NhugsR6mODo9RuNInRWu5BcyUVhQcKgwnuRswu9Ow&evt=102&rid=3d3eea16f0c3ede92ab299732d7fb34e&campaignid=1042270&impid=vlp-infopane-6&offerid=2570632&test=0&time=1630201472&cp=rmt48jN65g38sS1ECJg4V6rOOOlxtH5GgkBVSZZRe1Q&clickid=21_3d3eea16f0c3ede92ab299732d7fb34e_vlp-infopane-6&acid=201&trackingid=3fa3a58a914aa9478b1e50d66ea5985b&uid=009278B98F016FE11550681B8E066ED4&jt=2&url=Hm8fKuaMO6LtcOJJzo_wMtmjJntZUA4c5LJLBWKxL3T35zloOIvloFF9v6LOCwCl1ZJRGwiIUWypY-JbQoRmkRoxnMomW5DfLkIjPs3i4dzH8dG546SKqZPz5KhctmQZ6OMgAhRrWpV_7qZRdWvdDbIfzAVjSwDsWfyZkWpZOr1eaM3ZnPRnekiGmkDeJPWhyOivxjdzHFdF9Y9XYmbmFeV7w20tdDopPr5x8hLm29Q9UzgePbX7fbT9urn8m233qOwMVScAD0xVydO8fE2MMXYMRH45Z_4hboewEVrL2wz10FxwfJzeR1nYtXFXQnGe4yn9PeTlsfH5LdX8IwVoY32CUKfgF9XziQ1e4d3ATf4C96t-kGNmip2vPeLa-rNONK4cUb0dmjK13a2efNBDXg&bm=2&la=en&cn=us&cid=1086024&info=uWmTftTCODsDaJ-6gQBMztQaH-BKrKvn_D8hH2mQEi_ORloyw3z3oDWEb4OSbn5mL62naHB30q_mNpPch3GMEw,Top Stories,AdLovehots.com,Unavailable,,1.5,False,True
Afghanistan updates: Taliban warns US withdrawal deadline is 'a red line',https://www.msn.com/en-us/news/world/afghanistan-updates-us-warns-of-specific-credible-threat-at-airport/ar-AANnZjQ?ocid=Peregrine,Top Stories,ABC News,Unavailable,,1.6,False,False
"US tells Americans to leave Kabul airport 'immediately,' citing 'credible' threat",https://www.msn.com/en-us/news/politics/us-tells-americans-to-leave-kabul-airport-immediately-citing-credible-threat/ar-AANR88x?ocid=Peregrine,Top Stories,The Hill,Unavailable,,1.7,False,False
Louisiana governor says Hurricane Ida will be one of the strongest since the 1850s,https://www.msn.com/en-us/news/us/louisiana-governor-says-hurricane-ida-will-be-one-of-the-strongest-since-the-1850s/ar-AANQBua?ocid=Peregrine,Top Stories,NBC News,Unavailable,,1.8,False,False
The Caldor fire is moving in on Strawberry. Can its historic lodge be saved?,https://www.msn.com/en-us/news/us/the-caldor-fire-is-moving-in-on-strawberry-can-its-historic-lodge-be-saved/ar-AANQVj1?ocid=Peregrine,Top Stories,The LA Times,Unavailable,,1.9,False,False
Taliban guard airport as most NATO troops leave Afghanistan,https://www.msn.com/en-us/news/world/taliban-guard-airport-as-most-nato-troops-leave-afghanistan/ar-AANPVhp?ocid=Peregrine,Top Stories,Associated Press,Unavailable,,1.10,False,False
"At trial, Elizabeth Holmes may claim Theranos partner and onetime beau abused her",https://www.msn.com/en-us/news/technology/at-trial-elizabeth-holmes-may-claim-theranos-partner-and-onetime-beau-abused-her/ar-AANQQuA?ocid=Peregrine,Top Stories,CNET,Unavailable,,1.11,False,False
A pastor from National Religious Broadcasters was fired for promoting the COVID-19 vaccine on TV,https://www.msn.com/en-us/news/us/a-pastor-from-national-religious-broadcasters-was-fired-for-promoting-the-covid-19-vaccine-on-tv/ar-AANR58U?ocid=Peregrine,Top Stories,Business Insider,Unavailable,,2.0,False,False
Theranos CEO Elizabeth Holmes Will ‘Likely’ Take the Stand to Accuse Ex-Boyfriend and Co-Executive of ‘Intimate Partner Abuse’: Court Documents,https://www.msn.com/en-us/news/crime/theranos-ceo-elizabeth-holmes-will-likely-take-the-stand-to-accuse-ex-boyfriend-and-co-executive-of-intimate-partner-abuse-court-documents/ar-AANQV3B?ocid=Peregrine,Top Stories,Law & Crime,Unavailable,,3.0,False,False
"Florida Man Shoots Grandmother, Claims to Have 'Killed the Devil'",https://www.msn.com/en-us/news/crime/florida-man-shoots-grandmother-claims-to-have-killed-the-devil/ar-AANQTua?ocid=Peregrine,Top Stories,Newsweek,Unavailable,,4.0,False,False
Black Hawks and Humvees: Military kit now with the Taliban,https://www.msn.com/en-us/news/world/black-hawks-and-humvees-military-kit-now-with-the-taliban/ar-AANR4Q6?ocid=Peregrine,Top Stories,BBC News,Unavailable,,5.0,False,False
Bolsonaro says outcomes at elections include victory or death,https://www.msn.com/en-us/news/world/bolsonaro-says-outcomes-at-elections-include-victory-or-death/ar-AANQOg4?ocid=Peregrine,Top Stories,Bloomberg,Unavailable,,6.0,False,False
"North Sea oil was battered by Covid, but now faces much deadlier waves",https://www.msn.com/en-us/news/world/north-sea-oil-was-battered-by-covid-but-now-faces-much-deadlier-waves/ar-AANQSYU?ocid=Peregrine,Top Stories,The Guardian,Unavailable,,7.0,False,False
"Biden vows to continue drone strikes in Afghanistan following airport attack: ""Make them pay""",https://www.msn.com/en-us/news/world/biden-vows-to-continue-drone-strikes-in-afghanistan-following-airport-attack-make-them-pay/ar-AANR4PX?ocid=Peregrine,Top Stories,Salon,Unavailable,,8.0,False,False
Oregon counties join rush for COVID morgue trucks as Delta variant rages,https://www.msn.com/en-us/news/us/oregon-counties-join-rush-for-covid-morgue-trucks-as-delta-variant-rages/ar-AANQR9y,Coronavirus,Newsweek,Unavailable,,9.0,False,False
"Unvaccinated, unmasked teacher spreads Covid-19 to half of her class, CDC reports",https://www.msn.com/en-us/news/us/unvaccinated-unmasked-teacher-spreads-covid-19-to-half-of-her-class-cdc-reports/ar-AANQCKh,Coronavirus,NBC News,Unavailable,,11.0,False,False
Howard Dean calls DeSantis a 'lunatic' over handling of COVID-19,https://www.msn.com/en-us/news/politics/howard-dean-calls-desantis-a-lunatic-over-handling-of-covid-19/ar-AANQuoH,Coronavirus,The Hill,Unavailable,,12.0,False,False
"US Coronavirus: 'There is no room to put these bodies,' Alabama health official says, as Covid-19 deaths climb",https://www.msn.com/en-us/news/us/us-coronavirus-there-is-no-room-to-put-these-bodies-alabama-health-official-says-as-covid-19-deaths-climb/ar-AANPOEO,US,CNN,Unavailable,,13.0,False,False
Hurricane Ida: Gulf Coast braces for Sunday arrival of potential Category 4 storm,https://www.msn.com/en-us/news/us/hurricane-ida-gulf-coast-braces-for-sunday-arrival-of-potential-category-4-storm/ar-AANQ5WL,US,CNN,Unavailable,,14.0,False,False
Thousands march across the US in push for voting-rights legislation,https://www.msn.com/en-us/news/us/old-battles-have-become-new-again-thousands-march-in-washington-dc-and-across-the-us-in-push-for-voting-rights-legislation/ar-AANR2rp,US,Business Insider,Unavailable,,15.0,False,False
Cesar Chavez's grandson Alejandro Chavez on his grandfather's legacy and why brown votes matter,https://www.msn.com/en-us/news/us/cesar-chavez-s-grandson-alejandro-chavez-on-his-grandfather-s-legacy-and-why-brown-votes-matter/ar-AANQgI4,US,CNN,Unavailable,,16.0,False,False
"California Marine Kareem Nikoui, 20, killed in Kabul airport bombing: 'His memory will live on forever'",https://www.msn.com/en-us/news/us/california-marine-kareem-nikoui-20-killed-in-kabul-airport-bombing-his-memory-will-live-on-forever/ar-AANOVLM,US,USA TODAY,Unavailable,,17.0,False,False
'A piece of flying Italy around the world': The rise and fall of Alitalia,https://www.msn.com/en-us/news/world/a-piece-of-flying-italy-around-the-world-the-rise-and-fall-of-alitalia/ar-AANPTag,World,CNN,Unavailable,,18.0,False,False
"Britain, France to propose Kabul safe zone for people trying to flee Afghanistan",https://www.msn.com/en-us/news/world/britain-france-to-propose-kabul-safe-zone-for-people-trying-to-flee-afghanistan/ar-AANQOFb,World,The Hill,Unavailable,,19.0,False,False
"Biden: Another attack likely, pledges more strikes on IS",https://www.msn.com/en-us/news/world/biden-another-attack-likely-pledges-more-strikes-on-is/ar-AANPD1a,World,Associated Press,Unavailable,,20.0,False,False
"Youth in China, Japan and South Korea are 'lying flat' because they're exhausted and without hope",https://www.msn.com/en-us/news/world/youth-in-china-japan-and-south-korea-are-lying-flat-because-they-re-exhausted-and-without-hope/ar-AANQZZD,World,CNN,Unavailable,,21.0,False,False
Biden says drone strike on ISIS-K won't be last as Taliban condemn action,https://www.msn.com/en-us/news/world/biden-says-drone-strike-on-isis-k-won-t-be-last-as-taliban-condemn-action/ar-AANQXiW,World,Newsweek,Unavailable,,22.0,False,False
Child actor found dead near his Pennsylvania college campus,https://www.msn.com/en-us/news/politics/child-actor-found-dead-near-his-pennsylvania-college-campus/ar-AANR4Ms,Politics,The Hill,Unavailable,,23.0,False,False
Pollsters confront tough survey landscape after 2020 flubs,https://www.msn.com/en-us/news/politics/pollsters-confront-tough-survey-landscape-after-2020-flubs/ar-AANQMlY,Politics,The Hill,Unavailable,,24.0,False,False
Opinion: California's women face a big problem with Larry Elder,https://www.msn.com/en-us/news/politics/opinion-california-s-women-face-a-big-problem-with-larry-elder/ar-AANR2qK,Politics,CNN,Unavailable,,25.0,False,False
Biden’s devastating month stokes midterm fears among Democrats,https://www.msn.com/en-us/news/politics/the-storms-of-august-biden-s-devastating-month-stokes-midterm-fears-among-democrats/ar-AANQCJ7,Politics,The Washington Post,Unavailable,,26.0,False,False
Louisiana governor warns hurricane Ida is 'one of the strongest' since 1850s,https://www.msn.com/en-us/news/politics/louisiana-governor-warns-hurricane-ida-is-one-of-the-strongest-since-1850s/ar-AANQM4u,Politics,The Hill,Unavailable,,27.0,False,False
"T-Mobile CEO calls latest data breach ‘humbling,’ claims it’s committed to security",https://www.msn.com/en-us/news/technology/t-mobile-ceo-calls-latest-data-breach-humbling-claims-it-s-committed-to-security/ar-AANR7Mu,Science and Technology,The Verge,Unavailable,,28.0,False,False
Police raid unearths prehistoric flying reptile in remarkable condition,https://www.msn.com/en-us/news/technology/police-raid-unearths-prehistoric-flying-reptile-in-remarkable-condition/ar-AANK4PA,Science and Technology,CNET,Unavailable,,29.0,False,False
"Google Play app store revenue hit $11.2 billion in 2019, lawsuit says",https://www.msn.com/en-us/news/technology/google-play-app-store-revenue-hit-11-2-billion-in-2019-lawsuit-says/ar-AANQKJv,Science and Technology,Reuters,Unavailable,,30.0,False,False
NASA's next-generation James Webb Space Telescope finally ready to ship,https://www.msn.com/en-us/news/technology/nasa-s-next-generation-james-webb-space-telescope-finally-ready-to-ship/ar-AANMyUg,Science and Technology,CNET,Unavailable,,31.0,False,False
Female hummingbirds dressed in male plumage get harassed less,https://www.msn.com/en-us/news/technology/female-hummingbirds-dressed-in-male-plumage-get-harassed-less/ar-AANP98p,Science and Technology,CNET,Unavailable,,32.0,False,False
