article_url,article_title,meta_description,section,authors,publish_date,modified_date,canonical_link,top_image,is_opinion
https://www.msn.com/en-us/news/politics/biden-s-new-eviction-ban-survives-initial-court-challenge/ar-AANhY6f?ocid=Peregrine,Biden's new eviction ban survives initial court challenge,,,[],2021-08-13 00:00:00,,https://www.politico.com/news/2021/08/13/biden-eviction-ban-survives-initial-court-challenge-504415,https://static.politico.com/40/99/4793f7c7413585b384ff270145fb/7-30-21-evictions1-ap-773.jpg,false
https://www.msn.com/en-us/news/technology/senate-passes-1-trillion-infrastructure-bill-here-s-what-that-means-for-you/ar-BB1fT5L5?ocid=Peregrine,Senate passes $1 trillion infrastructure bill. Here's what that means for you,The bipartisan infrastructure deal and a broader spending package still have additional obstacles to work through. Here's what's in the bill.,,"['Clifford Colby', 'Laura Michelle Davis']",,,https://www.cnet.com/personal-finance/senate-passes-1-trillion-infrastructure-bill-heres-what-that-means-for-you/,https://www.cnet.com/a/img/JmuDc8lOh9SHltcWSd20tN5icko=/1200x630/2020/06/09/37886f71-d78b-466b-a8ff-99770e50a997/034-money-us-dollar-bills-roll-stack-cash.jpg,false
https://trace.mediago.io/api/bidder/track?tn=9220dd482c2a49631b4e66cca9f5f0ee&price=QmKxsZCxX1tc_dWLU-iHXSbuIf-EdgotQR5Ljp-d1wU&evt=102&rid=6d16bce8d5266567c5dd7276d66de329&campaignid=1039974&impid=vlp-infopane-3&offerid=2474475&test=0&time=1628874836&cp=XZoaWwF_VSEurGChEn87eXUAJvKjqoYmaWisoCKhywU&clickid=21_6d16bce8d5266567c5dd7276d66de329_vlp-infopane-3&acid=680&trackingid=da8c097ccc217805563a2bbf861ba953&uid=10785E7982246B8C31454EEB83936A39&jt=2&url=sQ4wr12qc7oEhhIKXzM3RE-PweBQjChEyhPGEhkXHkABIcFdsdXagx6-wBu3jGQzcjnFvhDoepZ7EtrRAq25Pj5PBPMkmND-7yFmx39BIHK0bbzBOs3uUipK6FOGENVyQY0Tueeg0WGYhEmggM2PB8oseNXlWCD48B5BPr5GQx-nJAONdPvsy6kOVBeBlT_ILhLEEtFlLrvYGn97dYeGR3Hf-Od1v9UVpj7mF7dMXA4P0Y_yKQkiMFPC1TMLG0Yv6BbNjwCmQqwPCQGS5IMKjRq1UjbP0TCN7e0kuzpMZm9hg18ztCZuFvw779MXejTsJmOH1nohMimEDZQxoDeT-q93kFOrwuC33-_I38NZaErrgDyB10rNNp0kjruHVzFISFHci9WvXbq8S5P45-pfwyztRCoxqu5apheg1e17_XJDGbSoFOOO3FHZuUwRpiiY&bm=5&la=en&cn=us&cid=1081505&info=wl8_xaje9OdSt1uyP-uf_s3MKYTc2IGlcXgGkYM9n0YnFQyOK2SScAOwaEk7KvehKL58URg60AErXNfVWwqPtA,,,,[],,,,,
https://www.msn.com/en-us/news/world/travel-to-turkey-during-covid-19-what-you-need-to-know-before-you-go/ar-AAMLjtE?ocid=Peregrine,Travel to Turkey during Covid-19: What you need to know before you go,"If you're planning to travel to Turkey, here's what you'll need to know and expect if you want to visit during the Covid-19 pandemic",travel,['Cnn Staff'],,2021-08-13T16:59:44Z,https://www.cnn.com/travel/article/turkey-travel-covid-19/index.html,https://cdn.cnn.com/cnnnext/dam/assets/200528213158-destinations-reopening---oludeniz-turkey----getty-images-super-tease.jpg,
https://trace.mediago.io/api/bidder/track?tn=9220dd482c2a49631b4e66cca9f5f0ee&price=zrBsUS4_wMqMfkHxByoC0TQAWDenr9HiBOPBj6A56no&evt=102&rid=6d16bce8d5266567c5dd7276d66de329&campaignid=1039974&impid=vlp-infopane-6&offerid=2474493&test=0&time=1628874836&cp=XZoaWwF_VSEurGChEn87eXUAJvKjqoYmaWisoCKhywU&clickid=21_6d16bce8d5266567c5dd7276d66de329_vlp-infopane-6&acid=680&trackingid=44a70226db730c0a1050e345d46e3594&uid=10785E7982246B8C31454EEB83936A39&jt=2&url=YT0rbyzdbd_dzvocA4jKDpjNcwob_mD0V0yhbqcWk-3Jjv73yJckmP1Ex2L0NQMcIashZP7sk7gnM9oTVsI3YCuQHbcuyDt5TUMUtZRfLERIv7dmtaNL_OhcuUGPnsUdJjv-2ji0wsBig13WIOotK-bI1Nzn9ubNXmmAAzI_0qd6XqEyXu1gGFPZMIwamGkiERbhPf_VcW5BiUnIfHNs8QrnsVOMKu_7POdKz6z2-gR2wpF2MHbrJt_V7Evvx5xI9ouIVLL1RmryEESYngWUUJCufwGkHiTW27A6i3mAwf6HGejyKjfDm-E1V6n6qBJw3OpwN3QYNQYmTj17q444WnFuIhlNVMfJktzTqLZ9CoclqrPJcRU0IfhWKo9BaQFTcsahSIUv-KedPXrwuLJ6f53-CctM9cJG7TeR-ieKVQXOV5Jf2pZh5z9euM5mWPke&bm=5&la=en&cn=us&cid=1081506&info=iyf5VyP7CSUGgk1vmYUY7UNuMU00PyE-gOuZpb6zl_SX5LLgvxIGB1Azi7_XK94W-88DVevcVacu3cXAYb5iJA,,,,[],,,,,
https://www.msn.com/en-us/news/world/trudeau-powers-into-canada-vote-with-high-marks-on-covid-19/ar-AANfGyV?ocid=Peregrine,Are you a robot?,,,[],2021-08-12 00:00:00,,,,
https://www.msn.com/en-us/news/us/texas-and-florida-accounted-for-nearly-40-of-us-covid-hospitalizations-last-week/ar-AANhZ2G?ocid=Peregrine,Texas and Florida accounted for nearly 40% of US Covid hospitalizations last week,"Seven states, including Alabama, Arkansas and Missouri, make up half of hospitalizations despite being a quarter of the population",US news,['Oliver Laughland'],2021-08-13 00:00:00,2021-08-13T16:50:41.000Z,http://www.theguardian.com/us-news/2021/aug/13/texas-florida-covid-coronavirus-us-hospitalizations,https://i.guim.co.uk/img/media/90c87878d9493eeba7a81abda5ae81af7c431d49/0_90_2516_1511/master/2516.jpg?width=1200&height=630&quality=85&auto=format&fit=crop&overlay-align=bottom%2Cleft&overlay-width=100p&overlay-base64=L2ltZy9zdGF0aWMvb3ZlcmxheXMvdGctZGVmYXVsdC5wbmc&enable=upscale&s=b29237e8d154fe01a315d176f2de1d76,
https://www.msn.com/en-us/news/politics/david-sirota-seven-democrats-who-voted-against-fracking-ban-trying-to-secure-future-elections/ar-AANi8RY?ocid=Peregrine,David Sirota: Seven Democrats who voted against fracking ban trying to secure future elections,"According to The Daily Poster journalist David Sirota, the seven Senate Democrats who joined Republicans in voting to block the government from banning fracking did so in order to benefit their future political campaigns.",,[],2021-08-13 12:52:25-04:00,2021-08-13T12:52:24-04:00,https://thehill.com/hilltv/rising/567653-david-sirota-seven-democrats-who-voted-fracking-ban-likely-trying-to-secure,https://thehill.com/sites/default/files/fracking_012016getty_lead.jpg,
https://www.msn.com/en-us/news/politics/editorial-almost-gov-hochul-some-advice-for-the-lieutenant-governor-as-she-prepares-to-take-the-reins/ar-AANh1S9?ocid=Peregrine,Almost-Gov. Hochul: Some advice for the lieutenant governor as she prepares to take the reins,"Kathy Hochul says she’s ready to lead the state. Her leap into the deep end from the fairly low-stress role of lieutenant governor, where I-am-the-government Andrew Cuomo kept her beyond arm’s length, will quickly offer some high-stakes tests.",Opinion,['Daily News Editorial Board'],2021-08-12 00:00:00,,https://www.nydailynews.com/opinion/ny-edit-almost-gov-hochul-20210812-vtvyrx4fazcl5a3eknv7acd6x4-story.html,https://www.nydailynews.com/resizer/PbvqughNwR6h_CJJJhUOmnnmT2M=/1200x0/center/top/cloudfront-us-east-1.images.arcpublishing.com/tronc/LENJFKXPLT5YC5AIDCGRXXUWTY.jpg,true
https://www.msn.com/en-us/news/world/new-mhks-must-prioritise-education-funding/ar-AANhW86?ocid=Peregrine,"New MHKs must prioritise education funding, union says","Investment in ""hugely underfunded"" Manx schools must be an electoral priority, a union says.",Isle Of Man / Ellan Vannin,[],,,https://www.bbc.com/news/world-europe-isle-of-man-58204192,https://ichef.bbci.co.uk/news/1024/branded_news/1195D/production/_113192027_teachingbbc.jpg,
https://www.msn.com/en-us/news/crime/17-years-after-mo-man-was-found-dead-in-his-driveway-his-girlfriend-is-charged-with-murder/ar-AANicYc?ocid=Peregrine,"17 Years After Mo. Man Was Found Dead in His Driveway, His Girlfriend Is Charged with Murder","Alice Weiss, now 65, is accused of killing her boyfriend with a .22 caliber handgun in 2004, though she continues to maintain her innocence",,['Kyler Alvord'],,,https://people.com/crime/woman-charged-boyfriends-unsolved-missouri-murder-17-years-later/,https://imagesvc.meredithcorp.io/v3/mm/image?q=85&c=sc&poi=%5B305%2C266%5D&w=624&h=312&url=https%3A%2F%2Fstatic.onecms.io%2Fwp-content%2Fuploads%2Fsites%2F20%2F2021%2F08%2F13%2Falice-weiss.jpg,false
https://www.msn.com/en-us/news/us/justice-barrett-rejects-indiana-university-students-covid-vaccine-mandate-appeal/ar-AAMp8zx?ocid=Peregrine,Justice Barrett rejects Indiana University students' vaccine mandate appeal,Supreme Court Justice Amy Coney Barrett denied a bid by Indiana University students to stop their school from requiring all students to be vaccinated against COVID-19.,,"['Abc News', 'Erin Schumaker', 'August']",,,https://abcnews.go.com/Health/indiana-universitys-vaccination-ruling-means-colleges/story?id=78943583,https://s.abcnews.com/images/US/barrett-scotus-portrait-gty-ps-210423_1619202756543_hpMain_2_16x9_992.jpg,false
https://www.msn.com/en-us/news/us/11-year-old-girl-missing-in-washington-dc/ar-AANi3QF?ocid=Peregrine,"11-year-old girl missing in Washington, DC","Metropolitan Police Department officers are asking for the public's help to locate an 11-year-old girl missing in Washington, D.C.",News,[],2021-08-13 16:45:46.480000,2021-08-13T16:45:46.48,https://www.washingtonexaminer.com/news/missing-girl-washington-11-year-old,https://mediadc.brightspotcdn.com/dims4/default/7a54c09/2147483647/strip/true/crop/2290x1202+0+17/resize/1200x630!/quality/90/?url=http%3A%2F%2Fmediadc-brightspot.s3.amazonaws.com%2F2a%2F65%2F3e0fcc514f27bc48d1c2b0ac6748%2Fistock-501233302.jpg,
https://www.msn.com/en-us/news/us/a-lawyer-for-the-new-york-times-accidentally-emailed-a-confidential-internal-document-to-a-union-official/ar-AANhVZz?ocid=Peregrine,A lawyer for The New York Times accidentally emailed a confidential internal document to a union official,"The document offered ""a range of options"" for the paper to respond to tech workers' unionization efforts and was ""sent accidentally,"" The Times said.",,['Kate Duffy'],2021-08-13 00:00:00,2021-08-13T17:03:16Z,https://www.businessinsider.com/new-york-times-lawyer-accidentally-emailed-confidential-document-union-2021-8,https://i.insider.com/611657623dd01000199d8463?width=1200&format=jpeg,false
https://www.msn.com/en-us/news/politics/the-court-s-hands-are-tied-in-win-for-biden-trump-appointed-judge-who-blocked-last-eviction-moratorium-reluctantly-allows-the-cdc-s-extension/ar-AANhYU3?ocid=Peregrine,"‘The Court’s Hands Are Tied’: In Win for Biden, Trump-Appointed Judge Who Blocked Last Eviction Moratorium Reluctantly Allows the CDC’s Extension","In a win for the Biden administration, the same federal judge who blocked a pandemic-related eviction moratorium allowed its extension to continue because an appellate court stayed the prior injunction.",,"[""Law Crime'S Senior Investigative Reporter"", 'Editor Adam Klasfeld Has Spent More Than A Decade On The Legal Beat. Previously A Reporter For Courthouse News', 'He Has Appeared As A Guest On Msnbc', 'Bbc', 'Npr', 'Pbs', 'Sky News', 'Other Networks.']",2021-08-13 16:27:43+00:00,2021-08-13T18:48:48Z,https://lawandcrime.com/high-profile/the-courts-hands-are-tied-in-win-for-biden-trump-appointed-judge-who-blocked-last-eviction-moratorium-reluctantly-allows-the-cdcs-extension/,https://lawandcrime.com/wp-content/uploads/2021/08/Cori-Bush.jpg,
https://www.msn.com/en-us/news/us/driven-by-the-delta-variant-the-fourth-wave-of-covid-19-in-the-u-s-could-be-worse-than-the-third-in-some-states-it-already-is/ar-AANhYH8?ocid=Peregrine,"Driven by the Delta Variant, the Fourth Wave of COVID-19 in the U.S. Could Be Worse Than the Third. In Some States, It Already Is","In four states—Hawaii, Louisiana, Mississippi and Florida—a fourth wave of COVID-19 has become worse than the third wave. Many others are close.",,['Chris Wilson'],,,https://time.com/6090218/fourth-wave-surpassed-third-in-some-states/,https://api.time.com/wp-content/uploads/2021/08/covid-testing-florida-airport.jpg?quality=85&w=1024&h=594&crop=1,false
https://www.msn.com/en-us/news/us/u-s-judge-will-not-block-cdc-s-new-covid-19-residential-eviction-ban/ar-AANiauO,U.S. judge leaves CDC COVID-19 eviction moratorium in place,"A U.S. judge on Friday rejected a bid to block a residential eviction moratorium put in place last week by the Centers for Disease Control and Prevention (CDC), despite raising questions about the new order's legality.",United States,['David Shepardson'],2021-08-13 19:39:11+00:00,2021-08-13T19:39:57.482Z,https://www.reuters.com/world/us/us-judge-will-not-block-cdcs-new-covid-19-residential-eviction-ban-2021-08-13/,https://www.reuters.com/resizer/59ZYHWzUBemviriV8kBHWbtXshM=/1200x628/smart/filters:quality(80)/cloudfront-us-east-2.images.arcpublishing.com/reuters/BOXWMCCVTFNWNIDZJWCH4VQV4A.jpg,
https://www.msn.com/en-us/news/us/supreme-court-declines-request-by-indiana-university-students-to-block-covid-19-vaccine-mandate/ar-AANfXS6,Supreme Court declines request by Indiana University students to block COVID-19 vaccine mandate,The decision clears the way for school officials at Indiana's public university to require students and faculty to be vaccinated to attend in-person classes.,,[],2021-08-12 00:00:00,,https://www.usatoday.com/story/news/politics/2021/08/12/covid-19-vaccine-scotus-declines-indiana-university-vaccine-challenge/8115997002/,"https://www.gannett-cdn.com/presto/2021/08/06/USAT/7898a469-e96d-43c5-b62c-7a588ae229ae-wide_thumb.png?crop=1911,1075,x9,y0&width=1911&height=1075&format=pjpg&auto=webp",false
https://www.msn.com/en-us/news/politics/union-four-teachers-from-florida-county-died-from-covid-19-in-last-two-days/ar-AANhwOY,UPDATED: Union says three teachers from Florida county died from COVID-19 in past two days,"Three teachers in Broward County, Fla. died of COVID-19 within 24 hours this week, the head of the teacher’s union clarified Friday.",,[],2021-08-13 09:25:38-04:00,2021-08-13T15:51:54-04:00,https://thehill.com/blogs/blog-briefing-room/news/567721-teachers-union-four-teachers-from-florida-county-died-from,https://thehill.com/sites/default/files/classroom_coronavirus_getty.jpg,
https://www.msn.com/en-us/news/us/addressing-vaccine-fears-as-latinos-fall-behind-in-covid-19-vaccinations/ar-AANi8OP,Addressing vaccine fears as Latinos fall behind in COVID-19 vaccinations,"A lack of access to the vaccine, culturally competent resources and outreach is hindering the vaccination rates of Latino communities across the U.S.",,"['Abc News', 'Kiara Alfonseca', 'August']",,,https://abcnews.go.com/Health/addressing-vaccine-fears-latinos-fall-covid-19-vaccinations/story?id=79401073,https://s.abcnews.com/images/US/covid-vaccine-file-01-ap-jef-210812_1628800395890_hpMain_16x9_992.jpg,false
https://www.msn.com/en-us/news/us/vaccine-mandates-for-workers-could-become-the-new-normal/ar-AANhUQB,Vaccine mandates for workers are just getting started,A growing number of major companies are exploring vaccine mandates for their employees as the Delta variant continues to spread through America and around the world.,business,"['Matt Egan', 'Cnn Business']",2021-08-13 00:00:00,2021-08-13T16:27:19Z,https://www.cnn.com/2021/08/13/business/vaccine-mandate-business/index.html,https://cdn.cnn.com/cnnnext/dam/assets/210813093347-restricted-us-vaccine-dose-0803-super-tease.jpg,false
https://www.msn.com/en-us/news/us/two-hawaii-visitors-arrested-for-falsifying-vaccination-cards-governor-says/ar-AANff3r,"Two Hawaii visitors arrested for falsifying vaccination cards, governor says","Two visitors to Hawaii from the United States mainland were arrested Sunday for falsifying vaccination cards, the governor posted on social media Wednesday afternoon.",news,['Kay Jones'],,2021-08-13T16:20:19Z,https://www.cnn.com/travel/article/hawaii-visitors-arrested-false-vaccination-cards/index.html,https://cdn.cnn.com/cnnnext/dam/assets/210812113216-hawaii-honolulu-waikiki-super-tease.jpg,
https://www.msn.com/en-us/news/world/reluctant-french-get-covid-vaccination-as-health-pass-closes-doors/ar-AANidbL,Reluctant French get Covid vaccination as health pass closes doors,"Reluctant French people lined up to get vaccinated as authorities were set to get tougher on the mandatory health pass for entering restaurants, trains and public places.",,"['Yiming Woo', 'Antony Paone']",2021-08-13 17:02:09+00:00,,https://www.reuters.com/article/us-health-coronavirus-france-idUSKBN2FE1PN,https://static.reuters.com/resources/r/?m=02&d=20210813&t=2&i=1571851128&r=LYNXMPEH7C0YK&w=800,
https://www.msn.com/en-us/news/world/traveling-to-greece-during-covid-19-what-you-need-to-know-before-you-go/ar-BB1clqZ2,Traveling to Greece during Covid-19: What you need to know before you go,"If you're planning a trip to Greece, here's what you'll need to know and expect if you want to visit during the global coronavirus pandemic.",travel,['Cnn Staff'],,2021-08-13T16:55:07Z,https://www.cnn.com/travel/article/greece-travel-covid-19/index.html,https://cdn.cnn.com/cnnnext/dam/assets/181203151046-10-europe-best-places-to-visit-super-tease.jpg,
https://www.msn.com/en-us/news/world/canada-to-require-vaccines-for-all-federal-public-servants/ar-AANi5Xc,Canada to require COVID-19 vaccines for federal government workers,"Canada on Friday said it will soon require all federal public servants and many other workers to be vaccinated against COVID-19, as it looks to boost its already world-leading inoculation rate amid a Delta-driven surge in new infections.",,"['Julie Gordon', 'Steve Scherer']",2021-08-13 16:46:12+00:00,,https://www.reuters.com/article/us-health-coronavirus-canada-idUSKBN2FE1O8,https://static.reuters.com/resources/r/?m=02&d=20210813&t=2&i=1571849944&r=LYNXMPEH7C0XV&w=800,
https://www.msn.com/en-us/news/world/uk-defense-secretary-says-trump-s-deal-with-the-taliban-was-rotten-and-that-the-international-community-will-pay-the-consequences/ar-AANi5KA,UK defense secretary says that Trump's deal with the Taliban was 'rotten' and that the international community will likely 'pay the consequences',"In the rare criticism of US strategic decision-making, Ben Wallace called the US's deal with the Taliban a ""mistake.""",,['Ryan Pickrell'],2021-08-13 00:00:00,2021-08-13T20:52:50Z,https://www.businessinsider.com/uk-defense-secretary-world-will-pay-trump-deal-with-taliban-2021-8,https://i.insider.com/61169a333dd01000199d97ce?width=1200&format=jpeg,false
https://www.msn.com/en-us/news/politics/covid-19-cases-linked-to-wisconsin-tribal-event/ar-AANi3NQ,COVID-19 cases linked to Wisconsin tribal event,Tribal officials in Wisconsin are warning of COVID-19 infections linked to a recently held community event.,,[],2021-08-13 12:49:53-04:00,2021-08-13T12:58:57-04:00,https://thehill.com/blogs/blog-briefing-room/news/567761-covid-19-cases-linked-to-wisconsin-tribal-event,https://thehill.com/sites/default/files/ca_nyctesting_070120getty.jpg,
https://www.msn.com/en-us/news/politics/man-linked-to-oath-keepers-militia-pleads-not-guilty-to-u-s-capitol-riot-charge/ar-AANi8E2,Man linked to Oath Keepers militia pleads not guilty to U.S. Capitol riot charge,An 18th person with links to the far right Oath Keepers militia accused of taking part in the Jan. 6 U.S. Capitol riot has been added to an indictment and pleaded not guilty on Friday.,United States,['Mark Hosenball'],2021-08-13 19:48:08+00:00,2021-08-13T20:04:09.240Z,https://www.reuters.com/world/us/man-linked-oath-keepers-militia-pleads-not-guilty-us-capitol-riot-charge-2021-08-13/,https://www.reuters.com/resizer/u0-EYt1qgBd3GF_ogCvjN0pOYZA=/1200x628/smart/filters:quality(80)/cloudfront-us-east-2.images.arcpublishing.com/reuters/WTUS24NR2FJ4PP3BYZXFD7BDSE.jpg,
https://www.msn.com/en-us/news/politics/pelosi-extends-proxy-voting-to-october/ar-AANhUyo,Pelosi extends proxy voting to October,"House members can continue to vote by proxy during the COVID-19 pandemic through at least Oct. 1, Speaker Nancy Pelosi (D-Calif.) announced Friday.",,[],2021-08-13 12:36:27-04:00,2021-08-13T12:50:03-04:00,https://thehill.com/homenews/house/567764-pelosi-extends-proxy-voting-to-october,https://thehill.com/sites/default/files/pelosinancy_072121gn7_lead.jpg,
https://www.msn.com/en-us/news/politics/california-recall-governor-race-has-democrats-nervous-about-feinstein-seat/ar-AANhUGz,Volatile California governor recall has Democrats nervous about Feinstein seat,"It's the Democrats' doomsday scenario: California Gov. Gavin Newsom loses his recall race this fall, and a Senate vacancy is later filled by a GOP governor.",politics,"['Manu Raju', 'Alex Rogers']",2021-08-13 00:00:00,2021-08-13T16:36:04Z,https://www.cnn.com/2021/08/13/politics/gavin-newsom-recall-dianne-feinstein/index.html,https://cdn.cnn.com/cnnnext/dam/assets/210813113227-newsom-feinstein-split-super-tease.jpg,false
https://www.msn.com/en-us/news/politics/9-dems-threaten-mutiny-over-pelosi-s-budget-plan/ar-AANhr8T,9 Dems threaten mutiny over Pelosi’s budget plan,,,[],2021-08-13 00:00:00,,https://www.politico.com/news/2021/08/13/9-dems-threaten-mutiny-over-pelosis-budget-plan-504408,https://static.politico.com/3f/40/115dae234fdda9146f0fa789c399/210813-gottheimer-ap-773.jpg,false
https://www.msn.com/en-us/news/technology/perseid-meteor-shower-2021-is-still-blazing-how-to-watch-the-show/ar-AAM7n9r,Perseid meteor shower 2021 is still blazing: How to watch the show,The best time to see the Perseids 2021 is this week. Here's how to view the meteors as they paint the night sky with shooting stars.,,['Amanda Kooser'],,,https://www.cnet.com/how-to/perseid-meteor-shower-2021-still-blazing-how-to-watch-the-stunning-show/,https://www.cnet.com/a/img/NuY9N9ycXyWqM91rmWa-wsRQkYo=/1200x630/2021/07/13/dd167c0d-8d80-4b5f-bb47-9bb936a9f3cb/nasaingallsperseid2016.jpg,false
https://www.msn.com/en-us/news/technology/go-read-this-report-about-a-snopes-editor-who-plagiarized-other-news-sites/ar-AANhUF3,Go read this report about a Snopes editor who plagiarized other news sites,BuzzFeed News reports in a new investigation that the co-founder of fact-checking site Snopes had plagiarized dozens of articles between 2015 and 2019.,,"['Kim Lyons', 'Aug']",2021-08-13 00:00:00,2021-08-13T12:34:39-04:00,https://www.theverge.com/2021/8/13/22623442/buzzfeed-snopes-plagiarism-fact-check-report,https://cdn.vox-cdn.com/thumbor/vhcA7sRDp5syoIUtG0nHYoEZ4ME=/23x0:1001x512/fit-in/1200x630/cdn.vox-cdn.com/uploads/chorus_asset/file/19828503/snopeslogocard.png,
https://www.msn.com/en-us/news/technology/scientists-map-an-ancient-woolly-mammoth-s-sad-fate-through-its-tusks/ar-AANfyAD,Scientists map an ancient woolly mammoth's sad fate through its tusks,"One 17,000-year-old male mammoth was quite the vagabond.",,['Eric Mack'],,,https://www.cnet.com/news/scientists-map-an-ancient-woolly-mammoths-sad-fate-through-its-tusks/,https://www.cnet.com/a/img/LLTi-JUC8iHHwrhmPAyjMM5vgC8=/1200x630/2021/08/12/b6b407de-7358-42bd-8b5d-997827abe476/twitter-mammoth.jpg,false
https://www.msn.com/en-us/weather/topstories/massive-iceberg-the-size-of-london-brushes-coast-of-antarctica/ar-AANi0CI,Massive iceberg the size of LONDON brushes coast of Antarctica,"Between August 9 and August 11 the iceberg made a very light contact with the Antarctic coast, scraping along the edge of the western Brunt ice shelf, experts at the British Antarctic Survey said.",Science,"['Ryan Morrison', 'Ryan Morrison For Mailonline']",2021-08-13 16:39:36+01:00,2021-08-13T21:01:24+0100,https://www.dailymail.co.uk/sciencetech/article-9890983/Massive-iceberg-size-LONDON-brushes-coast-Antarctica.html,https://i.dailymail.co.uk/1s/2021/08/13/16/46643145-0-image-a-6_1628867241074.jpg,false
https://www.msn.com/en-us/news/technology/good-luck-to-the-judge-who-sealed-a-ballot-machine-vulnerability-report-in-georgia/ar-AANhRXs,Good Luck to the Judge Who Sealed a Ballot Machine Vulnerability Report in Georgia,The hidden report is a wet dream for election conspiracy theorists.,,[],,,https://gizmodo.com/good-luck-to-the-judge-who-sealed-a-ballot-machine-vuln-1847481421,"https://i.kinja-img.com/gawker-media/image/upload/c_fill,f_auto,fl_progressive,g_center,h_675,pg_1,q_80,w_1200/efc8e3f6ba5bc8a718dcce17217d435e.jpg",
