article_headline,article_url,article_topic,source_name,source_url,article_datetime,article_position,article_isopinion,article_isad
South Carolina Dad Whose Twins Died After He Forgot Them in the Car Won't Face Charges,https://www.msn.com/en-us/news/crime/south-carolina-dad-whose-twins-died-after-he-forgot-them-in-the-car-won-t-face-charges/ar-AAOGhU0?ocid=Peregrine,Top Stories,People,Unavailable,,1.0,False,False
2 disbarred attorneys outside Texas sue abortion doctor under SB8,https://www.msn.com/en-us/news/us/2-disbarred-attorneys-outside-texas-sue-abortion-doctor-under-sb8/ar-AAOGe40?ocid=Peregrine,Top Stories,ABC News,Unavailable,,1.1,False,False
7 Retirement Income Strategies Once Your Portfolio Reaches $500k,https://trace.mediago.io/api/bidder/track?tn=9220dd482c2a49631b4e66cca9f5f0ee&price=KAOcUb36W6NQILZUY3LdbmQbRgOaYx6v75hB0kld5tM&evt=102&rid=5e844fbf0e2357d6f445a43d47be462f&campaignid=1027913&impid=vlp-infopane-3&offerid=2019249&test=0&time=1632270922&cp=zhWYF0CN-V3o8W3TDMXzPT9LRhAu-63hT5CvLes_5mQ&clickid=21_5e844fbf0e2357d6f445a43d47be462f_vlp-infopane-3&acid=305&trackingid=244334b853a9314e9efe73159c7f36d3&uid=382768C2C5C46B903B9C7878C4966A79&jt=2&url=txBkQI0ZivG3bWIAJCoU53saEw9e7FJQaEs7lpLb0ZHUTUSI8TCPNxxo9g9RJHXQg6uiNo6T5vUQdAUDO0P0uEZVzXSQp8SussgwliUiJeeU4L_kFcWNfpAhJazf-vWsEh8aRlaWtksUg2asmrEkB4z4Bo7PE616_CGNMgj6dLxGouI7S4VJYP7ndpy6FYW9lzSPb3kTPFt624Z6iKteyZ7k2vCPSZSJ_qcGMlWx5jJ9g0IVrRqIns79DA35jy1GcPIEBpAcqlngi_5faz37IF1NjbyKrEAb22RgcJ_04WQ&bm=2&la=en&cn=us&cid=1060163&info=-mrEDmrXM1_nrh9kODQtqxJYUhFDNRe9eYwY9dWyI1a5ddmM6d0g1kDJnYTl5_Xf,Top Stories,AdFisher Investments,Unavailable,,1.2,False,True
Melbourne earthquake: Magnitude 6.0 temblor strikes Australia,https://www.msn.com/en-us/news/world/melbourne-earthquake-magnitude-6-0-temblor-strikes-australia/ar-AAOGcit?ocid=Peregrine,Top Stories,CNN,Unavailable,,1.3,False,False
Overnight Defense & National Security — Presented by AM General — Afghan evacuation still frustrates,https://www.msn.com/en-us/news/politics/overnight-defense-national-security-presented-by-am-general-afghan-evacuation-still-frustrates/ar-AAOGjOl?ocid=Peregrine,Top Stories,The Hill,Unavailable,,1.4,False,False
These Men's Footwear Can Help You Relieve Foot Pain(50% Off Today),https://trace.mediago.io/api/bidder/track?tn=9220dd482c2a49631b4e66cca9f5f0ee&price=TqcU2VhwQkXmN6B50z7UA0spNJ1IbeIuB72QtouFrbE&evt=102&rid=5e844fbf0e2357d6f445a43d47be462f&campaignid=1043374&impid=vlp-infopane-6&offerid=2614273&test=0&time=1632270922&cp=-FxZ4c2QjMYfJAdmI3cNWm3PwSuKLTlDoN69vtM6SHU&clickid=21_5e844fbf0e2357d6f445a43d47be462f_vlp-infopane-6&acid=717&trackingid=4050a63ce33080a7ba031dff03386c2d&uid=382768C2C5C46B903B9C7878C4966A79&jt=2&url=KtNodFBtrburri1sApKG3MkjBCs6skjYD967cXKiStSZABfDI77YbHjtu8fJUux6PZ_t8G0h8O4NZbWO9yXjFxon3If0kNmTWcbO8OBRRqspu2cHjGRMRi3qbNBEprbBNHYWvflryj-vGJ9X71WaXNLTJJ5-PxQIOBr4BFoOIP93IVGPLoRoNZAoP8pOxTjdScEJqayLwaml9FMCMSqoSxUlTKziIXpag31aYJRw9k_8P_7DSQ7alvYDgJ1VRQO3DaHtChK3DSLBvYfSMrbmuWvfJJAXfk006rvutxzT790H98hv0zeT1bvr8RHNh3tMJ0EfoR_bX0cQJ3e3w1cRVhUILBiDfjNnJVNp8NvvFsVvzKn4K5OeEWZZHZq1yPo1&bm=2&la=en&cn=us&cid=1088216&info=bIYqSbe19guKFS495SJJ1BIUhljVxB7GY0ujRXDDrqXkgcxoNHwwQnMUO3OejGUb,Top Stories,AdGmdjd.com,Unavailable,,1.5,False,True
"Internet freedom on the decline in US and globally, study finds",https://www.msn.com/en-us/news/world/internet-freedom-on-the-decline-in-us-and-globally-study-finds/ar-AAOGmbq?ocid=Peregrine,Top Stories,The Guardian,Unavailable,,1.6,False,False
AOC calls for release of all Rikers inmates amid ‘inhumane’ jail conditions,https://www.msn.com/en-us/news/crime/aoc-calls-for-release-of-all-rikers-inmates-amid-inhumane-jail-conditions/ar-AAOGbMf?ocid=Peregrine,Top Stories,New York Daily News,Unavailable,,1.7,False,False
Teen pleads guilty in 2019 fatal stabbing of Barnard College student Tessa Majors,https://www.msn.com/en-us/news/crime/teen-pleads-guilty-in-2019-fatal-stabbing-of-barnard-college-student-tessa-majors/ar-AAOGjHH?ocid=Peregrine,Top Stories,NBC News,Unavailable,,1.8,False,False
US: Taliban request to speak this week won't be approved,https://www.msn.com/en-us/news/world/us-taliban-request-to-speak-this-week-won-t-be-approved/ar-AAOG8j6?ocid=Peregrine,Top Stories,Washington Examiner,Unavailable,,1.9,False,False
Facebook is reportedly using News Feed to improve its image,https://www.msn.com/en-us/news/technology/facebook-is-reportedly-using-news-feed-to-improve-its-image/ar-AAOGhdV?ocid=Peregrine,Top Stories,CNET,Unavailable,,1.10,False,False
Here's why the first official figures on Latinos in the media look better than some expected,https://www.msn.com/en-us/news/us/here-s-why-the-first-official-figures-on-latinos-in-the-media-look-better-than-some-expected/ar-AAOG2TQ?ocid=Peregrine,Top Stories,The LA Times,Unavailable,,1.11,False,False
Pumpkin patches and Halloween parties: Experts weigh in on COVID-19 risks at fall gatherings,https://www.msn.com/en-us/news/us/pumpkin-patches-and-halloween-parties-experts-weigh-in-on-covid-19-risks-at-fall-gatherings/ar-AAOkqMi?ocid=Peregrine,Top Stories,USA TODAY,Unavailable,,2.0,False,False
US says Blinken expects to speak to France,https://www.msn.com/en-us/news/world/us-says-blinken-expects-to-speak-to-france/ar-AAOGaie?ocid=Peregrine,Top Stories,AFP,Unavailable,,3.0,False,False
Taliban ask to speak at UN General Assembly,https://www.msn.com/en-us/news/world/taliban-ask-to-speak-at-un-general-assembly/ar-AAOGaf1?ocid=Peregrine,Top Stories,BBC News,Unavailable,,4.0,False,False
"Charges: Man ""snapped,"" killed 4, then left bodies in field",https://www.msn.com/en-us/news/crime/charges-man-snapped-killed-4-then-left-bodies-in-field/ar-AAOGaa8?ocid=Peregrine,Top Stories,Associated Press,Unavailable,,5.0,False,False
"Former Florida Private School Teacher Charged with Driving Student to Beach, Engaging in Sex Acts",https://www.msn.com/en-us/news/crime/former-florida-private-school-teacher-charged-with-driving-student-to-beach-engaging-in-sex-acts/ar-AAOGeDF?ocid=Peregrine,Top Stories,Law & Crime,Unavailable,,6.0,False,False
"Mark Zuckerberg personally approved a project that pushed pro-Facebook stories into the news feeds of the platform's users, report says",https://www.msn.com/en-us/news/technology/mark-zuckerberg-personally-approved-a-project-that-pushed-pro-facebook-stories-into-the-news-feeds-of-the-platform-s-users-report-says/ar-AAOGjha?ocid=Peregrine,Top Stories,Business Insider,Unavailable,,7.0,False,False
Climate and Covid Dominate UN as Biden and Xi Up Their Promises,https://www.msn.com/en-us/news/world/climate-and-covid-dominate-un-as-biden-and-xi-up-their-promises/ar-AAOFyt7?ocid=Peregrine,Top Stories,Bloomberg,Unavailable,,8.0,False,False
J&J: Booster shot increases protection against coronavirus,https://www.msn.com/en-us/news/us/j-j-booster-shot-increases-protection-against-coronavirus/ar-AAOFwKb,Coronavirus,U.S. News & World Report,Unavailable,,9.0,False,False
Biden bets on rapid COVID tests but they can be hard to find,https://www.msn.com/en-us/news/us/biden-bets-on-rapid-covid-tests-but-they-can-be-hard-to-find/ar-AAOFqLH,Coronavirus,Associated Press,Unavailable,,11.0,False,False
COVID death toll in US eclipses 1918 influenza pandemic estimates,https://www.msn.com/en-us/health/medical/covid-death-toll-in-us-eclipses-1918-influenza-pandemic-estimates/ar-AAOE3va,Coronavirus,ABC News,Unavailable,,12.0,False,False
Search for Brian Laundrie resumes in Florida reserve a day after authorities called it off,https://www.msn.com/en-us/news/us/search-for-brian-laundrie-resumes-in-florida-reserve-a-day-after-authorities-called-it-off/ar-AAOFtGt,US,NBC News,Unavailable,,13.0,False,False
'Appalled': Border Patrol agents' treatment of Haitian migrants criticized by former officials,https://www.msn.com/en-us/news/us/appalled-border-patrol-agents-treatment-of-haitian-migrants-criticized-by-former-officials/ar-AAOG5Wx,US,USA TODAY,Unavailable,,14.0,False,False
"Gabby Petito update: Autopsy confirms remains found in Wyoming are Gabby Petito's, FBI says",https://www.msn.com/en-us/news/us/gabby-petito-update-autopsy-confirms-remains-found-in-wyoming-are-gabby-petito-s-fbi-says/ar-AAOEJlT,US,CNN,Unavailable,,15.0,False,False
"San Jose State must pay $1.6 million after trainer abused women athletes, DOJ finds",https://www.msn.com/en-us/news/us/san-jose-state-must-pay-1-6-million-after-trainer-abused-women-athletes-doj-finds/ar-AAOFUyQ,US,USA TODAY,Unavailable,,16.0,False,False
California now has nation's lowest virus transmission rate,https://www.msn.com/en-us/news/us/california-now-has-nation-s-lowest-virus-transmission-rate/ar-AAOG7Ts,US,Associated Press,Unavailable,,17.0,False,False
U.S. says meeting with European partners including France canceled due to scheduling issues,https://www.msn.com/en-us/news/world/u-s-says-meeting-with-european-partners-including-france-canceled-due-to-scheduling-issues/ar-AAOGhOb,World,Reuters,Unavailable,,18.0,False,False
Biden UN speech: President makes the case for using 'relentless diplomacy' instead of military might to solve global crises,https://www.msn.com/en-us/news/world/biden-un-speech-president-makes-the-case-for-using-relentless-diplomacy-instead-of-military-might-to-solve-global-crises/ar-AAOEWcR,World,CNN,Unavailable,,19.0,False,False
Major record labels could face competition inquiry,https://www.msn.com/en-us/news/other/major-record-labels-could-face-competition-inquiry/ar-AAOG87S,World,BBC News,Unavailable,,20.0,False,False
"Taliban request representation at the United Nations, kicking off credentials battle",https://www.msn.com/en-us/news/world/taliban-request-representation-at-the-united-nations-kicking-off-credentials-battle/ar-AAOG5QY,World,CNN,Unavailable,,21.0,False,False
Biden non-committal on US-UK free trade deal,https://www.msn.com/en-us/news/world/biden-non-committal-on-us-uk-free-trade-deal/ar-AAOG7TD,World,AFP,Unavailable,,22.0,False,False
Fact-checking Trump's letter to Georgia secretary of state,https://www.msn.com/en-us/news/politics/fact-checking-trump-s-letter-to-georgia-secretary-of-state/ar-AAOGaqH,Politics,CNN,Unavailable,,23.0,False,False
Senate advances Biden consumer bureau pick after panel logjam,https://www.msn.com/en-us/news/politics/senate-advances-biden-consumer-bureau-pick-after-panel-logjam/ar-AAOGc2D,Politics,The Hill,Unavailable,,24.0,False,False
House passes bill to compensate 'Havana syndrome' victims,https://www.msn.com/en-us/news/politics/house-passes-bill-to-compensate-havana-syndrome-victims/ar-AAOGh1g,Politics,The Hill,Unavailable,,25.0,False,False
Wray warns Taliban takeover in Afghanistan could inspire US-based extremists,https://www.msn.com/en-us/news/politics/wray-warns-taliban-takeover-in-afghanistan-could-inspire-us-based-extremists/ar-AAOG2AQ,Politics,The Hill,Unavailable,,26.0,False,False
House prepares to vote on bill to avert shutdown and suspend debt limit,https://www.msn.com/en-us/news/politics/house-prepares-to-vote-on-bill-to-avert-shutdown-and-suspend-debt-limit/ar-AAOFOra,Politics,CNN,Unavailable,,27.0,False,False
Retro 51 rolls out space shuttle Enterprise limited edition Tornado pen,https://www.msn.com/en-us/news/technology/retro-51-rolls-out-space-shuttle-enterprise-limited-edition-tornado-pen/ar-AAOG2W7,Science and Technology,Space,Unavailable,,28.0,False,False
Asteroid three times the size of the Statue of Liberty will zoom past Earth on fall equinox,https://www.msn.com/en-us/news/technology/asteroid-three-times-the-size-of-the-statue-of-liberty-will-zoom-past-earth-on-fall-equinox/ar-AAOGjON,Science and Technology,Live Science,Unavailable,,29.0,False,False
Marvel's Shang-Chi will stream 'free' on Disney Plus Nov. 12,https://www.msn.com/en-us/news/technology/marvel-s-shang-chi-will-stream-free-on-disney-plus-nov-12/ar-AAOG4Cz,Science and Technology,CNET,Unavailable,,30.0,False,False
8 Best Trail Cams for Capturing Nature,https://www.msn.com/en-us/news/technology/8-best-trail-cams-for-capturing-nature/ss-AAOFWRH,Science and Technology,Popular Mechanics,Unavailable,,31.0,False,False
"Watch comedian Demi Adejuyigbe's lively Sept. 21 tribute to Earth, Wind & Fire",https://www.msn.com/en-us/news/technology/watch-comedian-demi-adejuyigbe-s-lively-sept-21-tribute-to-earth-wind-fire/ar-AAOFUXr,Science and Technology,CNET,Unavailable,,32.0,False,False
