article_headline,article_url,article_topic,source_name,source_url,article_datetime,article_position,article_isopinion,article_isad
"Instagram for kids launch paused amid uproar from parents, lawmakers",https://www.msn.com/en-us/news/technology/instagram-for-kids-launch-paused-amid-uproar-from-parents-lawmakers/ar-AAOSc8Y?ocid=Peregrine,Top Stories,USA TODAY,Unavailable,,1.0,False,False
"Infrastructure, Social Spending and Debt Ceiling: A Guide to Congress’ Pivotal Week",https://www.msn.com/en-us/news/politics/infrastructure-social-spending-and-debt-ceiling-a-guide-to-congress-pivotal-week/ar-AAOSvJ7?ocid=Peregrine,Top Stories,Time,Unavailable,,1.1,False,False
Skip Hours Researching Your Next Trip And Go Here,https://trace.mediago.io/api/bidder/track?tn=9220dd482c2a49631b4e66cca9f5f0ee&price=rwtjOiNgCyGpRl8hQyASUNk1c-B77qkL9bxuTTwccx8&evt=102&rid=5a30d1a50db459e392433ad9a63c5e4d&campaignid=1046477&impid=vlp-infopane-3&offerid=2741929&test=0&time=1632762080&cp=ukZ9ifKP55wEFidSPTLcD7xvokoWJ7MXcaudZQbSSoo&clickid=21_5a30d1a50db459e392433ad9a63c5e4d_vlp-infopane-3&acid=174&trackingid=4ad87c1c9f10b2db44d26e1c0099d889&uid=030E76F053FA616A126C664F520760BA&jt=2&url=Ci9d9kWkhfRIhSybpeACoryk2UfE4S0CygFg750T2IiBegCmaelHsHIuwC8Jl4jBIKRfB6qzp1O_VB6jOdCqHzxQztL7fuk95blVt0D87XLjfr9qTxa3sobI2pD26XLc0jkOWSzbXVlX20ayd4lotPyQKugiY0WcS2lAgEP7HRKPHUgyYwFLX2rxB2JS2vam0lMePTcxCti-WihrFIjcxDbHQZdDAZDJ9T-ewCTIqyzVkPSpUIIGWQgEIgstdEBA_Z2UY0AMUgJq1PO5N3NBRvDPLBnNOcK6-sogx_B2lQwbuSnOvRqEsNlDfFKIQgVg&bm=0&la=en&cn=us&cid=1094275&info=43iJLKprbkjXSqlv79CxcEe9o0R6XfBQT05fg__0Y_s,Top Stories,AdMoneypail,Unavailable,,1.2,False,True
French President Emmanuel Macron hit by egg thrown from crowd in Lyon,https://www.msn.com/en-us/news/world/french-president-emmanuel-macron-hit-by-egg-thrown-from-crowd-in-lyon/ar-AAOS4U7?ocid=Peregrine,Top Stories,CNN,Unavailable,,1.3,False,False
UN General Assembly ending without remarks from Afghanistan,https://www.msn.com/en-us/news/world/un-general-assembly-ending-without-remarks-from-afghanistan/ar-AAOSvK3?ocid=Peregrine,Top Stories,The Hill,Unavailable,,1.4,False,False
Other Countries Have Figured It Out But Not The US,https://trace.mediago.io/api/bidder/track?tn=9220dd482c2a49631b4e66cca9f5f0ee&price=Acve35tYlsMSDMLh55M5CDr-w4rGWBVgZHP5TWVvKX4&evt=102&rid=5a30d1a50db459e392433ad9a63c5e4d&campaignid=1047118&impid=vlp-infopane-6&offerid=2766831&test=0&time=1632762080&cp=DCigpcBKLBt6jeilQDkwCUJ1Mxlg0gXUHnL6hJiGlzc&clickid=21_5a30d1a50db459e392433ad9a63c5e4d_vlp-infopane-6&acid=174&trackingid=409d04e57a1781d346e23de35b6bb056&uid=030E76F053FA616A126C664F520760BA&jt=2&url=mfMnpz9eIHMyojnaGgIS9QgAjfLOk3ZM6x3XuPn2pScL1fL1hNdG45nT4qlWSlIZ9pSq5JZsDUWFa7rQeIc-tbh_zY3qQA9iQIGBugzsdTNfL4IzLyh_zr7jdbiD5EkUFThqym94lk_hCC1Bt-h8FK3BkFoOFNvSjWMWg2JdKanJopbACFB2r5zw95uKyZnoXxlOavJuuT2atMrLCD21azYZul5pgnVOTYqCBRWR8XptZzLd1ns_drYsslwV-_061A3u3sY6SUBnPI2ELJU7KCyQBojbEIl8Op6tyNiMUXwzQW4AHk7sJkuBgTuX3pot&bm=0&la=en&cn=us&cid=1095482&info=IAvGsM93roPC8PAsvenIj9t_fRymSFFOle3wf4xr-dU,Top Stories,AdMoneyPail,Unavailable,,1.5,False,True
Ex-Catalan leader back in Brussels after Italy arrest,https://www.msn.com/en-us/news/world/ex-catalan-leader-back-in-brussels-after-italy-arrest/ar-AAOSqT5?ocid=Peregrine,Top Stories,AFP,Unavailable,,1.6,False,False
COVID Booster Live Updates: Joe Biden to Receive His Third Shot at White House,https://www.msn.com/en-us/news/politics/covid-booster-live-updates-joe-biden-to-receive-his-third-shot-at-white-house/ar-AAOSoeM?ocid=Peregrine,Top Stories,Newsweek,Unavailable,,1.7,False,False
It was a cemetery for freed slaves. Now it's a parking lot at the center of a legal battle.,https://www.msn.com/en-us/news/us/it-was-a-cemetery-for-freed-slaves-now-it-s-a-parking-lot-at-the-center-of-a-legal-battle/ar-AAOLTMC?ocid=Peregrine,Top Stories,NBC News,Unavailable,,1.8,False,False
Netflix sets up shop in Brooklyn neighborhood with massive new production studio,https://www.msn.com/en-us/news/us/netflix-sets-up-shop-in-brooklyn-neighborhood-with-massive-new-production-studio/ar-AAOSnT6?ocid=Peregrine,Top Stories,New York Daily News,Unavailable,,1.9,False,False
"The NYC subway is so desperate for more train operators that it's reportedly offering retired conductors up to $35,000 for 90 days of work",https://www.msn.com/en-us/news/us/the-nyc-subway-is-so-desperate-for-more-train-operators-that-it-s-reportedly-offering-retired-conductors-up-to-35-000-for-90-days-of-work/ar-AAOSxMi?ocid=Peregrine,Top Stories,Business Insider,Unavailable,,1.10,False,False
NATO-led mission increases patrols on Kosovo-Serbia border,https://www.msn.com/en-us/news/world/nato-led-mission-increases-patrols-on-kosovo-serbia-border/ar-AAOSxJu?ocid=Peregrine,Top Stories,Associated Press,Unavailable,,1.11,False,False
Federal Judge Says Multi-Million Dollar Murdaugh Insurance Policy Doesn’t Cover Boat Crash That Killed Mallory Beach,https://www.msn.com/en-us/news/crime/federal-judge-says-multi-million-dollar-murdaugh-insurance-policy-doesn-t-cover-boat-crash-that-killed-mallory-beach/ar-AAOSxOm?ocid=Peregrine,Top Stories,Law & Crime,Unavailable,,2.0,False,False
Beirut blast probe suspended for second time,https://www.msn.com/en-us/news/world/beirut-blast-probe-suspended-for-second-time/ar-AAOSo5J?ocid=Peregrine,Top Stories,BBC News,Unavailable,,3.0,False,False
Spending Spree: Biden legacy at stake,https://www.msn.com/en-us/news/politics/spending-spree-biden-legacy-at-stake/ar-AAOSyO8?ocid=Peregrine,Top Stories,Washington Examiner,Unavailable,,4.0,False,False
The Pandemic Has Been a Crash Course in Consent,https://www.msn.com/en-us/news/us/the-pandemic-has-been-a-crash-course-in-consent/ar-AAOSldy?ocid=Peregrine,Top Stories,The Atlantic,Unavailable,,5.0,False,False
Judge orders 'unconditional release' for Reagan shooter Hinckley,https://www.msn.com/en-us/news/crime/judge-orders-unconditional-release-for-reagan-shooter-hinckley/ar-AAOSxzS?ocid=Peregrine,Top Stories,POLITICO,Unavailable,,6.0,False,False
Nintendo Switch OLED hands-on: The best upgrade may not be the screen,https://www.msn.com/en-us/news/technology/nintendo-switch-oled-hands-on-the-best-upgrade-may-not-be-the-screen/ar-AAOSh3R?ocid=Peregrine,Top Stories,CNET,Unavailable,,7.0,False,False
"Pfizer CEO: ‘Days, Not Weeks’ For Submitting COVID-19 Vaccine Data on Children",https://www.msn.com/en-us/news/us/pfizer-ceo-days-not-weeks-for-submitting-covid-19-vaccine-data-on-children/ar-AAOSuUJ?ocid=Peregrine,Top Stories,U.S. News & World Report,Unavailable,,8.0,False,False
Singapore is seeing daily record Covid cases. Here's why it may not be a bad thing,https://www.msn.com/en-us/money/other/singapore-is-seeing-daily-record-covid-cases-here-s-why-it-may-not-be-a-bad-thing/ar-AAORjta,Coronavirus,CNBC,Unavailable,,9.0,False,False
COVID-19 cuts two years off the life expectancy of US men,https://www.msn.com/en-us/money/other/covid-cuts-two-years-off-the-life-expectancy-of-u-s-men/ar-AAOR8PW,Coronavirus,Bloomberg,Unavailable,,11.0,False,False
Cheryl Burke tests positive for COVID before 'DWTS' taping,https://www.msn.com/en-us/music/celebrity/cheryl-burke-tests-positive-for-breakthrough-covid-before-dwts-taping-i-feel-so-bad-for-cody/ar-AAORdx7,Coronavirus,People,Unavailable,,12.0,False,False
U.S. President Reagan's shooter John Hinckley wins unconditional release,https://www.msn.com/en-us/news/us/u-s-president-reagan-s-shooter-john-hinckley-wins-unconditional-release/ar-AAOSqAb,US,Reuters,Unavailable,,13.0,False,False
Florida sheriff's deputies searching for missing college student Miya Marcano,https://www.msn.com/en-us/news/us/florida-sheriff-s-deputies-searching-for-missing-college-student-miya-marcano/ar-AAOSxxg,US,NBC News,Unavailable,,14.0,False,False
"Possible Spill from U.S. Steel Plant Forces Beaches, Water Treatment Plant to Close",https://www.msn.com/en-us/news/us/possible-spill-from-u-s-steel-plant-forces-beaches-water-treatment-plant-to-close/ar-AAOSqOv,US,Newsweek,Unavailable,,15.0,False,False
"Brian Laundrie update: Police ask for personal items of Gabby Petito's fiancé for DNA matching, attorney says",https://www.msn.com/en-us/news/us/brian-laundrie-update-police-ask-for-personal-items-of-gabby-petito-s-fianc%C3%A9-for-dna-matching-attorney-says/ar-AAORhBU,US,CNN,Unavailable,,16.0,False,False
"Unvaccinated NY State Nurse Defies Mandate, Will Work Until Escorted Out",https://www.msn.com/en-us/news/us/unvaccinated-ny-state-nurse-defies-mandate-will-work-until-escorted-out/ar-AAOSnTy,US,Newsweek,Unavailable,,17.0,False,False
4th stimulus check? WH doesn't rule out another round of payments in 2021,https://www.msn.com/en-us/news/technology/some-states-are-sending-more-stimulus-money-here-s-who-is-getting-payments/ar-BB1eMn3O,Science and Technology,CNET,Unavailable,,18.0,False,False
Football field sized asteroid NASA missed would have been detected,https://www.msn.com/en-us/news/technology/football-field-sized-asteroid-nasa-missed-would-have-been-detected/ar-AAOSwV7,Science and Technology,Daily Mail,Unavailable,,19.0,False,False
Trucking in America: 5 fascinating truths about how your stuff gets to you,https://www.msn.com/en-us/news/technology/trucking-in-america-5-fascinating-truths-about-how-your-stuff-gets-to-you/ar-AAORNvB,Science and Technology,CNET,Unavailable,,20.0,False,False
India antitrust body accepts Google's confidentiality request - judge,https://www.msn.com/en-us/news/technology/india-antitrust-body-accepts-google-s-confidentiality-request-judge/ar-AAOSijU,Science and Technology,Reuters,Unavailable,,21.0,False,False
Samsung Showed Off an OLED Display That Stretches Like Rubber,https://www.msn.com/en-us/news/technology/samsung-showed-off-an-oled-display-that-stretches-like-rubber/ar-AAOS4T4,Science and Technology,Gizmodo,Unavailable,,22.0,False,False
"Canada's Green Party chief resigns, calling it 'worst period' of her life",https://www.msn.com/en-us/news/world/canada-s-green-party-chief-resigns-calling-it-worst-period-of-her-life/ar-AAOSyPv,World,Reuters,Unavailable,,23.0,False,False
Anti-Taliban social media users delete accounts,https://www.msn.com/en-us/news/world/anti-taliban-social-media-users-delete-accounts/ar-AAOSvzp,World,BBC News,Unavailable,,24.0,False,False
Macron shellshocked by egg lobbed at his head during Lyon visit,https://www.msn.com/en-us/news/world/macron-shellshocked-by-egg-lobbed-at-his-head-during-lyon-visit/ar-AAOSBlm,World,Washington Examiner,Unavailable,,25.0,False,False
Berliners vote to expropriate big landlords in non-binding referendum,https://www.msn.com/en-us/news/world/berliners-vote-to-expropriate-big-landlords-in-non-binding-referendum/ar-AAOSxFQ,World,CNN,Unavailable,,26.0,False,False
China bans violent or vulgar cartoons and anime as its crackdown on the entertainment industry continues,https://www.msn.com/en-us/news/world/china-bans-violent-or-vulgar-cartoons-and-anime-as-its-crackdown-on-the-entertainment-industry-continues/ar-AAOSxwF,World,Business Insider,Unavailable,,27.0,False,False
Biden focuses energy on Congress in critical week for his agenda,https://www.msn.com/en-us/news/politics/biden-focuses-energy-on-congress-in-critical-week-for-his-agenda/ar-AAOSoad,Politics,The Hill,Unavailable,,28.0,False,False
Watchdog: Penalties meatpackers paid for price-fixing to blame for higher prices,https://www.msn.com/en-us/news/politics/watchdog-penalties-meatpackers-paid-for-price-fixing-to-blame-for-higher-prices/ar-AAOSqM8,Politics,The Hill,Unavailable,,29.0,False,False
"Beto O'Rourke says he's thinking of running for Texas governor, slights poll favorite Matthew McConaughey in new interview",https://www.msn.com/en-us/news/politics/beto-o-rourke-says-he-s-thinking-of-running-for-texas-governor-slights-poll-favorite-matthew-mcconaughey-in-new-interview/ar-AAOSxEC,Politics,Business Insider,Unavailable,,30.0,False,False
"Live updates: Senate to take up bill to avoid government shutdown, House debates infrastructure",https://www.msn.com/en-us/news/politics/live-updates-senate-to-take-up-bill-to-avoid-government-shutdown-house-debates-infrastructure/ar-AAOSvlc,Politics,USA TODAY,Unavailable,,31.0,False,False
"Judge approves full release of Hinckley, who shot Reagan",https://www.msn.com/en-us/news/politics/judge-approves-full-release-of-hinckley-who-shot-reagan/ar-AAOSxzg,Politics,The Hill,Unavailable,,32.0,False,False
