article_url,article_title,meta_description,section,authors,publish_date,modified_date,canonical_link,top_image,is_opinion
https://www.msn.com/en-us/news/us/scripps-national-spelling-bee-names-zaila-avant-garde-as-the-2021-champion-see-the-winning-word/ar-AALWrpC?ocid=Peregrine,2021 National Spelling Bee Champ Zaila Avant-garde Makes History as First Black American Winner,"Eleven finalists competed for glory Thursday at the 2021 Scripps National Spelling Bee, held at Walt Disney World's ESPN Wide World of Sports Complex",,['Jen Juneau'],,,https://people.com/human-interest/scripps-national-spelling-bee-2021-champion-winner-zaila-avant-garde-winning-word/,https://imagesvc.meredithcorp.io/v3/mm/image?q=85&c=sc&poi=%5B735%2C181%5D&w=1500&h=750&url=https%3A%2F%2Fstatic.onecms.io%2Fwp-content%2Fuploads%2Fsites%2F20%2F2021%2F07%2F09%2Fzaila.jpg,false
https://trace.mediago.io/api/bidder/track?tn=9220dd482c2a49631b4e66cca9f5f0ee&price=rxDfO0HjNAarnBuvp6H3cc5Hq2Q1SxVanXx91yTujFk&evt=102&rid=f218dba0a66b858c87cd0398041b593d&campaignid=1016262&impid=vlp-infopane-3&offerid=1594573&test=0&time=1625798559&cp=4PFc4pK4xfQDE04cK00eo9cBPKnWrA2E5xu6HsmCfdM&clickid=21_f218dba0a66b858c87cd0398041b593d_vlp-infopane-3&acid=266&trackingid=a83a9608169e561e6cc37f2a00465b38&uid=1AD3B7A23D126FC33D79A7CD3C166EDE&jt=2&url=lXjUvscAYTAkPRtHSfs51apeiOz37NwbEWm8uavzP57_oO--uaMh2eIEPS9xwr9kfOKeqBaqrGF7755qqP7SBWvEWt12w3w7bVTfhXNyi1bWUR_oVfCWwLgPpsO8GPDBXoLVUzUj20iel_ErliDplnXEhDUl_A8ey1yft4CQoSX8f4vG8kgpEsibn-gfDjIsY2jlr8WYvqacHZfHu9u0Hnj3mJ9qLMzeLt8hdLzfIWZqLUF72tphv6cN-hqRGFwUdp5i8tKbymlXAURCfzbGFLGsRrKc7IsDrpdNIRzPPSCIqAD20rtAQeKVx7GbANGW4bBqcUgcW_BzhzaeKZIPYTM7QbaSurVcC8hJBTns29O-hMi_Xul8NNMNFnFx_jUQcnXf1i5Cw-phyTJFMXOcOQ&bm=2&la=en&cn=us&cid=1038569&info=COV4oseeyX-Lbf-fHWYb_gfAUnnzhhdEoR7Y9bdp6tlndyxmQncJTnmERkeckinA,,,,[],,,,,
https://www.msn.com/en-us/news/us/magnitude-5-9-earthquake-shakes-up-california-nevada-border-regionally-largest-in-almost-two-and-a-half-decades/ar-AALWyrd?ocid=Peregrine,"Magnitude 5.9 earthquake shakes up California-Nevada border, regionally largest 'in almost two and a half decades'","A magnitude 5.9 quake shook the California-Nevada border Thursday, with people reporting feeling a jolt hundreds of miles away, according to the USGS.",,[],2021-07-08 00:00:00,,https://www.usatoday.com/story/news/nation/2021/07/08/5-9-magnitude-earthquake-california-nevada-border/7910048002/,"https://www.gannett-cdn.com/presto/2021/07/08/PREN/e2d9dbb4-3f9f-4a5e-a4c3-45ca509e0fe0-earthquake_map.jpg?crop=612,345,x0,y86&width=612&height=345&format=pjpg&auto=webp",false
https://www.msn.com/en-us/news/crime/teen-sent-to-juvenile-detention-for-not-completing-homework-speaks-on-injustice/ar-AALVONu?ocid=Peregrine,Teen sent to juvenile detention for not completing homework speaks on ‘injustice’,Teen sent to juvenile detention for not completing homework speaks on ‘injustice’,,"['Abc News', 'Ashley Schwartz-Lavares', 'Andrea Amiel', 'Anthony Rivas', 'Linsey Davis', 'Meredith Frost', 'Seni Tienabeso', 'July']",,,https://abcnews.go.com/US/teen-juvenile-detention-completing-homework-speaks-injustice/story?id=78692558,https://s.abcnews.com/images/US/grace-us-er-210628_1624918247460_hpMain_v4x3_16x9_992.jpg,false
https://trace.mediago.io/api/bidder/track?tn=9220dd482c2a49631b4e66cca9f5f0ee&price=YC1ctqti_Y1zlbOclZTI0SogcE9y2Ts7vtNwkiUEuZc&evt=102&rid=f218dba0a66b858c87cd0398041b593d&campaignid=1018328&impid=vlp-infopane-6&offerid=1645877&test=0&time=1625798559&cp=3rkJrQuZz3T4aiN7oVhiZFWn1N9-Z9xTEDtK3jB0Bf4&clickid=21_f218dba0a66b858c87cd0398041b593d_vlp-infopane-6&acid=19&trackingid=e0639c0275a89d290dfc490287ab6279&uid=1AD3B7A23D126FC33D79A7CD3C166EDE&jt=2&url=2MDg6KUQujmWaC2vBPP7n69sYzVbuKarqcJOssxtu4DKQ486_319cXBZ-gQJwLl0E5RLMVA5nmjBBx8sAhqMEYM5iLgC14IWC_CPEjb7eYM7Rqzjeo0v8qWFdVx2-s609ZVVBXQuY1zBDPy6UBc1mi_AMVMTecfQNQqp9m9TcvO_PaFCo511hyDO5fsNYpWYVcKJCRivNCE0u90lqYlSDQNGDA0IhI9E1dp8f4C8mesFhyljqNSW8iszSCDFX1UpFjF0VE7gGLXGla74voZKxO_j8J4wDevmMK2Q9YiZxsxtBe0QPvf5jw5VQfARN1gpWIHJWG-NyhUVYfbwaw3Z3kXuASrebA3jWn5BW4qACOUOYq9duEOwl8RRtuzR_Ii1aV2SOKjeRdt_rw9bzcDvJQ&bm=2&la=en&cn=us&cid=1042281&info=Uv7wN92k3m985Z6SoXAg326T9TPg3vyRH4eF6BCYoBEckKMRMtAxC3NkfOj9h3RB,,,,[],,,,,
https://www.msn.com/en-us/news/us/tucker-carlson-s-extremely-mad-that-journalists-foia-d-his-foia-request-to-nsa/ar-AALWusm?ocid=Peregrine,Tucker Carlson’s Extremely Mad That Journalists FOIA’d His FOIA Request to NSA,The idea that reporters would use basic journalistic tools to verify his claims about the NSA set Carlson off on Thursday night—and he took specific aim at Ken Klippenstein.,media,"['Justin Baragona', 'Contributing Editor']",2021-07-09 02:14:22.944000+00:00,,https://www.thedailybeast.com/tuckers-extremely-mad-that-journalists-foiad-his-foia-request,"https://img.thedailybeast.com/image/upload/c_crop,d_placeholder_euli9k,h_359,w_640,x_0,y_0/dpr_2.0/c_limit,w_740/fl_lossy,q_auto/v1625795984/tucker-carlson-tonight_-_2021-07-08T205735.126_gpfdrr",
https://www.msn.com/en-us/news/crime/greg-ferency-suspect-has-been-charged-after-an-indiana-police-officer-on-the-fbi-task-force-was-killed/ar-AALTQy8?ocid=Peregrine,Suspect has been charged after an Indiana police officer on the FBI Task Force was killed,"FBI Task Force Officer Greg Ferency was shot outside of the FBI Indianapolis Resident Agency in Terre Haute, Indiana.",us,"['Amir Vera', 'Taylor Romine', 'Rob Frehse']",2021-07-08 00:00:00,2021-07-09T02:13:45Z,https://www.cnn.com/2021/07/08/us/indiana-police-officer-fbi-task-force-ambushed/index.html,https://cdn.cnn.com/cnnnext/dam/assets/210707222647-indiana-police-officer-fbi-task-force-ambushed-super-tease.jpg,false
https://www.msn.com/en-us/news/world/tokyo-prepares-for-fan-free-olympics-as-virus-surges/ar-AALViTn?ocid=Peregrine,Are you a robot?,,,[],2021-07-08 00:00:00,,,,
https://www.msn.com/en-us/news/politics/gop-fundraising-arm-sticks-by-harassment-claims-amid-inquiry-into-democratic-counterpart/ar-AALWym1?ocid=Peregrine,GOP fundraising arm sticks by harassment claims amid inquiry into Democratic counterpart,The Republican online fundraising platform WinRed is standing by claims it is the victim of political harassment by a quartet of Democratic state attorneys general despite revelations Democratic counterpart ActBlue is facing a similar legal inquiry.,US Campaign News,[],2021-07-09 01:58:18.765000,2021-07-09T01:58:18.765,https://www.washingtonexaminer.com/news/campaigns/gop-fundraising-arm-sticks-by-harassment-claims-amid-inquiry-into-democratic-counterpart,https://mediadc.brightspotcdn.com/dims4/default/3ac4fa9/2147483647/strip/true/crop/5760x3024+0+408/resize/1200x630!/quality/90/?url=http%3A%2F%2Fmediadc-brightspot.s3.amazonaws.com%2Fa4%2Fa2%2F92d33c0a4cebb0c69c42704530eb%2Fap21021726767759.jpg,
https://www.msn.com/en-us/news/crime/suspect-arrested-in-death-of-pro-golfer-two-others/ar-AALWAJI?ocid=Peregrine,"Suspect arrested in death of pro golfer, two others",Cobb County police said Thursday that a suspect has been arrested in connection to the,,[],2021-07-08 21:56:33-04:00,2021-07-08T22:34:11-04:00,https://thehill.com/blogs/blog-briefing-room/news/562197-suspect-arrested-in-death-of-pro-golfer-two-others,https://thehill.com/sites/default/files/golfclubs_04232018getty.jpg,
https://www.msn.com/en-us/news/technology/marvel-cinematic-universe-phase-4-the-full-list-of-release-dates/ar-BB19Nrta?ocid=Peregrine,Marvel Cinematic Universe Phase 4: The full list of release dates,"Disney Plus reveals when exactly we can see Hawkeye, the new series with Jeremy Renner and Hailee Steinfield.",,['Jennifer Bisset'],,,https://www.cnet.com/news/marvel-cinematic-universe-phase-4-the-full-list-of-release-dates/,https://www.cnet.com/a/img/vMVfLS-lmWtS2N-DXGI4IidXtdw=/0x0:1522x855/1200x630/2021/07/29/cda99bd8-6a14-4be4-830f-95a2bccdb17c/screen-shot-2021-07-30-at-9-39-52-am-copy.png,false
https://www.msn.com/en-us/news/world/u-s-mexico-settle-first-labor-complaint-under-usmca/ar-AALWu2E?ocid=Peregrine,"U.S., Mexico settle first labor complaint under USMCA",,,[],2021-07-08 00:00:00,,https://www.politico.com/news/2021/07/08/us-mexico-labor-usmca-498901,https://static.politico.com/5a/b7/f488ce6d4f81a2980a58532c97b1/tai-ap-773.jpg,false
https://www.msn.com/en-us/news/politics/toyota-to-halt-donations-to-politicians-who-opposed-2020-election-certification/ar-AALWxJO?ocid=Peregrine,Toyota to halt donations to politicians who opposed 2020 election certification,"“This is no longer a fight between two political parties or entrenched interests,” The Lincoln Project said Thursday, pressuring Toyota and other companies to stop donating to certification objectors. “It is no less than a fight to preserve American democracy.”","U.S. Politics, Politics, News",['Jami Ganz'],2021-07-09 00:00:00,,https://www.nydailynews.com/news/politics/us-elections-government/ny-toyota-stopping-election-objector-donations-20210709-bdyjewrqmncaxfbb57tvynzzhi-story.html,https://www.nydailynews.com/resizer/VcyWXzBDSRm9EnfjC7uxUA8NNPQ=/1200x0/center/middle/cloudfront-us-east-1.images.arcpublishing.com/tronc/LHGI5QBJPVGTLFNKVY5IV5LX7Y.jpg,false
https://www.msn.com/en-us/news/politics/aoc-mocked-lawmakers-who-prioritize-the-filibuster-over-the-green-new-deal-by-sharing-videos-of-new-york-city-underwater-amid-a-torrential-downpour/ar-AALWtXw?ocid=Peregrine,AOC mocked lawmakers who prioritize the filibuster over the Green New Deal by sharing videos of New York City underwater amid a torrential downpour,"""I'm so glad the filibuster is here to fix this oh wait,"" Rep. Alexandria Ocasio-Cortez tweeted Thursday along with a video of a flooded road in NYC.",,['Lauren Frias'],2021-07-08 00:00:00,2021-07-09T01:22:22Z,https://www.businessinsider.com/aoc-lawmakers-against-green-new-deal-mocked-filibuster-support-2021-7,https://i.insider.com/5fdde541d366e60018099206?width=1200&format=jpeg,false
https://www.msn.com/en-us/health/coronavirus/booster-shot-likely-to-provide-best-protection-from-covid-19-pfizer-says/ar-AALW7B1,"Study shows booster shot after 6 to 12 months likely to provide best protection from COVID-19, Pfizer says",A study showed antibody titers five to 10 times higher than two doses.,,"['Abc News', 'Mark Osborne', 'Eric M. Strauss', 'July']",,,https://abcnews.go.com/Health/booster-shot-12-months-provide-best-protection-covid/story?id=78741334,https://s.abcnews.com/images/US/health-worker-holds-covid-vaccine-getty-201_hpMain_20201215-042029_16x9_992.jpg,false
https://www.msn.com/en-us/news/us/pfizer-covid-19-booster-shot-extends-strong-protection-company-says-vaccine-being-updated-to-target-delta-variant/ar-AALVYK3,Pfizer's COVID-19 booster shot strongly extends protection but CDC cautions 3rd dose not yet needed,Pfizer and BioNTech say their COVID booster provides extended protection and are updating the vaccine to target the highly contagious Delta variant.,,[],2021-07-08 00:00:00,,https://www.usatoday.com/story/news/health/2021/07/08/pfizer-covid-booster-shot-extends-strong-protection-company-says/7907216002/,"https://www.gannett-cdn.com/presto/2021/06/23/USAT/98fae8f8-6bdf-43c3-9a27-f9ea3eba1bba-AFP_AFP_9CX7WV.jpg?crop=2533,1425,x0,y337&width=2533&height=1425&format=pjpg&auto=webp",false
https://www.msn.com/en-us/news/us/calls-mount-on-fda-to-formally-endorse-covid-vaccines-as-delta-surges/ar-AALWeit,Calls mount on FDA to formally endorse Covid vaccines as Delta surges,,,[],2021-07-08 00:00:00,,https://www.politico.com/news/2021/07/08/calls-for-fda-endorse-covid-vaccine-delta-498886,https://static.politico.com/c7/93/959d108d47f59ab57ff7d773cb2c/gettyimages-1326390933-1.jpg,false
https://www.msn.com/en-us/news/us/2-seattle-police-officers-illegally-trespassed-while-rioters-stormed-the-capitol/ar-AALWAGc,2 Seattle police officers illegally trespassed while rioters stormed the Capitol,"Two Seattle police officers illegally trespassed while rioters stormed the U.S. Capitol, according to a police watchdog.",,[],2021-07-08 21:49:09-04:00,2021-07-08T22:23:32-04:00,https://thehill.com/homenews/state-watch/562196-2-seattle-police-officers-illegally-trespassed-while-rioters-stormed-the,https://thehill.com/sites/default/files/seattlepolice_053020getty.jpg,
https://www.msn.com/en-us/news/us/condo-collapse-death-toll-in-surfside-building-collapse-rises-to-64-after-search-efforts-turn-from-rescue-to-recovery/ar-AALUai8,Death toll in Surfside building collapse rises to 64 after search efforts turn from rescue to recovery,"The death toll in a condo building collapse in Surfside, Florida, has risen to 64, Miami-Dade County Mayor Daniella Levine Cava said, after authorities made the decision to shift the search effort from rescue to recovery.",us,"['Dakin Andone', 'Madeline Holcombe', 'Paul Vercammen', 'Amir Vera']",2021-07-08 00:00:00,2021-07-09T05:29:53Z,https://www.cnn.com/2021/07/08/us/miami-dade-building-collapse-thursday/index.html,https://cdn.cnn.com/cnnnext/dam/assets/210708005545-01-surfside-memorial-0707-super-tease.jpg,false
https://www.msn.com/en-us/news/us/a-federal-covid-19-surge-response-team-has-arrived-in-missouri-here-s-why/ar-AALWxMB,A Missouri couple says they dragged their feet on getting the Covid-19 vaccine. Then they got sick,"Louie Michael and his wife, Pattie Bunch, were both hospitalized last month with Covid-19 in Springfield, Missouri.",us,"['Miguel Marquez', 'Meridith Edwards', 'Ray Sanchez']",2021-07-08 00:00:00,2021-07-09T18:37:12Z,https://www.cnn.com/2021/07/08/us/missouri-covid-surge/index.html,https://cdn.cnn.com/cnnnext/dam/assets/210708212217-patty-and-louie-michael-bunch-super-tease.jpg,false
https://www.msn.com/en-us/news/world/biden-says-military-withdrawal-from-afghanistan-will-conclude-aug-31/ar-AALVN65,Biden says military withdrawal from Afghanistan will conclude Aug. 31,President Joe Biden delivered remarks on the U.S. Afghanistan withdrawal amid increasing instability in the region and Taliban activity.,,"['Abc News', 'Sarah Kolinovsky', 'Conor Finnegan', 'July']",,,https://abcnews.go.com/Politics/biden-military-withdrawal-afghanistan-conclude-aug-31/story?id=78729387,https://s.abcnews.com/images/Politics/biden-1-gty-er-210708_1625768054360_hpMain_16x9_992.jpg,false
https://www.msn.com/en-us/news/politics/four-seasons-total-landscaping-site-of-infamous-giuliani-election-press-conference-to-host-concert/ar-AALWqv0,"Four Seasons Total Landscaping, site of infamous Giuliani election press conference, to host concert",They’re branching out.,"U.S., News",['Joseph Wilkinson'],2021-07-09 00:00:00,,https://www.nydailynews.com/news/national/ny-four-seasons-total-landscaping-concert-giuliani-20210709-yp5xhclhvzh7vh74f2pjfcdari-story.html,https://www.nydailynews.com/resizer/NmF-yiKFfHCQ-Ji_pjWUS6AzFeg=/1200x0/right/middle/cloudfront-us-east-1.images.arcpublishing.com/tronc/FH7745TJRUPWBXHM5WHO6IZLMM.jpg,false
https://www.msn.com/en-us/news/politics/hunter-biden-white-house-helped-form-ethics-agreement-with-art-gallery-that-s-selling-his-paintings-sources-say/ar-AALWcrX,"White House helped form ethics agreement with art gallery that's selling Hunter Biden's paintings, sources say",Hunter Biden's artistic debut is sparking ethics concerns for the White House as some critics raise eyebrows over the high-priced pieces and whether they pose a conflict of interest.,politics,"['Maegan Vazquez', 'Sunlen Serfaty']",2021-07-08 00:00:00,2021-07-09T17:48:09Z,https://www.cnn.com/2021/07/08/politics/hunter-biden-art-work-sale/index.html,https://cdn.cnn.com/cnnnext/dam/assets/210708171703-hunter-biden-0522-super-tease.jpg,false
https://www.msn.com/en-us/news/politics/senate-gop-campaign-arm-to-run-ads-against-warnock-during-mlb-games/ar-AALWv6s,Senate GOP campaign arm to run ads against Warnock during MLB games,The National Republican Senatorial Committee said that it was going to run an ad during two Major League Baseball games aimed at Sen.,,[],2021-07-08 20:29:36-04:00,2021-07-08T22:20:32-04:00,https://thehill.com/homenews/campaign/562192-senate-gop-campaign-arm-to-run-ads-against-warnock-during-mlb-games,https://thehill.com/sites/default/files/warnockraphael_061521gn_lead.jpg,
https://www.msn.com/en-us/news/politics/harris-announces-25-million-dnc-investment-to-aid-voting-access/ar-AALVDC1,Harris announces $25 million DNC investment to aid voting access,Vice President Kamala Harris announced Thursday a $25 million investment by the Democratic National Committee to support efforts to protect voting access ahead of the 2022 midterm elections.,,['Lauren Egan Is A White House Reporter For Nbc News Based In Washington.'],2021-07-09 00:27:40+00:00,Fri Jul 09 2021 00:27:41 GMT+0000 (UTC),https://www.nbcnews.com/politics/white-house/harris-announce-25-million-dnc-investment-aid-voting-access-n1273387,"https://media-cldnry.s-nbcnews.com/image/upload/t_nbcnews-fp-1200-630,f_auto,q_auto:best/newscms/2021_27/3489663/210708-kamala-harris-mb-1718.JPG",false
https://www.msn.com/en-us/news/technology/this-crowdsourced-ransomware-payment-tracker-shows-how-much-cybercriminals-have-heisted/ar-AALWynd,This Crowdsourced Ransomware Payment Tracker Shows How Much Cybercriminals Have Heisted,Ransomwhere keeps a publicly available running tally of ransoms paid out to cybercriminals in bitcoin.,,[],,,https://gizmodo.com/this-crowdsourced-ransomware-payment-tracker-shows-how-1847257004,"https://i.kinja-img.com/gawker-media/image/upload/c_fill,f_auto,fl_progressive,g_center,h_675,pg_1,q_80,w_1200/a2d10dac0cda17c617e8a03b0459f9f8.jpg",
https://www.msn.com/en-us/news/technology/even-teletubbies-are-getting-covid-vaccines/ar-AALW0Lr,Even Teletubbies are getting COVID vaccines,"""This complicates the Teletubby lore immensely.""",,['Meara Isenberg'],,,https://www.cnet.com/news/even-teletubbies-are-getting-covid-vaccines/,https://www.cnet.com/a/img/PGBDnF0MyJDxmkUDCo-VUKG_DjU=/1200x630/2021/07/08/9cfdc805-31c8-4459-8811-577f1a1cfb45/teletubbies-sc.png,false
https://www.msn.com/en-us/news/technology/no-cell-signal-best-ways-to-boost-signal-strength-when-your-calls-won-t-go-through/ar-AALUtiV,No cell signal? Best ways to boost signal strength when your calls won’t go through,A spotty cellphone signal is annoying and can be dangerous when you really need to make a call. Kim Komando has tips to boost your strength.,,[],2021-07-08 00:00:00,,https://www.usatoday.com/story/tech/columnist/komando/2021/07/08/spotty-cell-signal-boosters-and-other-ways-increase-your-strength/7880963002/,https://www.gannett-cdn.com/-mm-/8d9d59d09bf5fc1a7a2049abff4ce4b672196f52/c=235-0-2320-1173/local/-/media/2019/04/25/USATODAY/usatsports/MotleyFool-TMOT-352977b7-f7a5e0f2.jpg?width=2085&height=1173&fit=crop&format=pjpg&auto=webp,false
https://www.msn.com/en-us/news/technology/death-stranding-director-s-cut-has-new-story-missions-and-improved-combat/ar-AALWnoo,Death Stranding: Director’s Cut has new story missions and improved combat,"Death Stranding: Director’s Cut is an enhanced version of Hideo Kojima’s 2019 PS4 epic, which will be launching on the PS5 on September 24th.",,"['Andrew Webster', 'Jul']",2021-07-08 00:00:00,2021-07-08T17:41:12-04:00,https://www.theverge.com/2021/7/8/22569182/death-stranding-directors-cut-new-features-release-date-ps5,https://cdn.vox-cdn.com/thumbor/_SuMvrie_MQuYPqF6tQsFGIGaPg=/0x38:1919x1043/fit-in/1200x630/cdn.vox-cdn.com/uploads/chorus_asset/file/19355035/death_stranding_screen_09_ps4_us_28may19.jpeg,
https://www.msn.com/en-us/news/technology/qualcomm-s-1-500-smartphone-is-for-its-biggest-fans-with-more-money-than-sense/ar-AALW2I1,"Qualcomm’s $1,500 smartphone is for its biggest fans with more money than sense","Qualcomm is partnering with Asus on a smartphone designed for the company’s Snapdragon Insider fan community that promises to show off its tech — but it’s a pricey $1,500 Android phone that doesn’t stand out.",,"['Chaim Gartenberg', 'Jul']",2021-07-08 00:00:00,2021-07-08T17:18:35-04:00,https://www.theverge.com/2021/7/8/22568641/qualcomm-asus-smartphone-snapdragon-insiders-technology,https://cdn.vox-cdn.com/thumbor/JZbuk_WxEaO-ezsTLKo7vSzvUi8=/0x34:1952x1056/fit-in/1200x630/cdn.vox-cdn.com/uploads/chorus_asset/file/22706863/Screen_Shot_2021_07_08_at_4.32.08_PM.png,
