article_headline,article_url,article_topic,source_name,source_url,article_datetime,article_position,article_isopinion,article_isad
"Joe Biden, welcome to the thunderdome",https://www.msn.com/en-us/news/politics/joe-biden-welcome-to-the-thunderdome/ar-AAOQHf0?ocid=Peregrine,Top Stories,POLITICO,Unavailable,,1.0,False,False
Salmonella outbreak more than doubles; CDC identifies potential source,https://www.msn.com/en-us/news/us/salmonella-outbreak-more-than-doubles-cdc-identifies-potential-source/ar-AAOQypz?ocid=Peregrine,Top Stories,USA TODAY,Unavailable,,1.1,False,False
7 Retirement Income Strategies Once Your Portfolio Reaches $500k,https://trace.mediago.io/api/bidder/track?tn=9220dd482c2a49631b4e66cca9f5f0ee&price=FK_d6UwIKSYXWKule63Q2K9zikcHxs9pNV1Vn7j7XXw&evt=102&rid=e6a4a72fd34fea4c575a3b8af36af6bb&campaignid=1027913&impid=vlp-infopane-3&offerid=2019249&test=0&time=1632703791&cp=Qcv2oD1i-IC_ZRIyG_unVH4yMcOIv_vMV8St2hb45u0&clickid=21_e6a4a72fd34fea4c575a3b8af36af6bb_vlp-infopane-3&acid=305&trackingid=a9e1ac644a8d2e8ad164ea766e08ea22&uid=07E0ADC4DD8363E41E3CBD7BDC916233&jt=2&url=_UmCJwigsTKUHicQ2xI0CIo__BO-BhLevo4qICdrkB_81MsDNUszPoXx_ob2JGa5tV3lH6f3zzORsHOPfTBcme7ZJw84M_kAYQgDYJSIgpFQGQUIC_qP4brGC1c_v__FkHMG7Dy_qvW1bVWHJCb99-5kM7QcVmKvHlbUKVgNPV2SvX5HyUms6sn_CYrxTWZZjFzSx_HgdO7RxRSU3UJlBCgC6eoa8XGjUnYVCAWMSuovEsFfqkiO1q1PkNyA0sgGCc_jA6oD-J-imlsyBKy1ACNE5zEKSECGGVDkCFDteRI&bm=2&la=en&cn=us&cid=1060163&info=w5E1lpP3JbhAnxBO0XvwJVpXNAwHnzCue-ovlxepyUpKynbhH_rrdnbbkuXsr8Y2,Top Stories,AdFisher Investments,Unavailable,,1.2,False,True
GOP Rep. Matt Gaetz said Tucker Carlson is correct about white nationalist 'replacement' conspiracy theory and called ADL racist,https://www.msn.com/en-us/news/politics/gop-rep-matt-gaetz-said-tucker-carlson-is-correct-about-white-nationalist-replacement-conspiracy-theory-and-called-adl-racist/ar-AAOQJ1c?ocid=Peregrine,Top Stories,Business Insider,Unavailable,,1.3,False,False
"WWE Extreme Rules 2021: Results, live updates and match ratings",https://www.msn.com/en-us/news/technology/wwe-extreme-rules-2021-results-live-updates-and-match-ratings/ar-AAOQCtJ?ocid=Peregrine,Top Stories,CNET,Unavailable,,1.4,False,False
Top Doctors: These Men's Shoes Can Reduce Foot Pain And Improve Posture,https://trace.mediago.io/api/bidder/track?tn=9220dd482c2a49631b4e66cca9f5f0ee&price=S8kBdM1gN-E7dsFmLBvPFOc9DGo7j8EbUqJm4Fwtk64&evt=102&rid=e6a4a72fd34fea4c575a3b8af36af6bb&campaignid=1042270&impid=vlp-infopane-6&offerid=2570632&test=0&time=1632703791&cp=PkLAq0NFuYN7r8sLnF81Y-Wvu9mARAVvSB0FWteZbeo&clickid=21_e6a4a72fd34fea4c575a3b8af36af6bb_vlp-infopane-6&acid=201&trackingid=75a144cdd39b385b1d961e88926b421f&uid=07E0ADC4DD8363E41E3CBD7BDC916233&jt=2&url=-rhxpEFm08QUme_17fKGYTKQPRA039TsLpeIE630QuoqSl1M3x79OzLxLKVcyRJsl-8lSUbw4VNu1_UKFObx19blFOaR6b9_RBkv4wlb05uEto7ZGn_RepLUSGNqjvWKwmq9inm1D1xKYHT4r-kyAUB1-zdDsGg08b6lYwKxIE6LRxetUzWcoW5gdtEKPZtOQsPZ-1GJ7tnIDrY9H59AqKGCvNSKAAROOTE_5Lp7f5mKtxdRVBZU9yeloey-0xlVR1kDRWXpojLHsyTTSwbnaTGWcaDfrvZmhYXLqbmhVeyohNvt9MHQFm9JFc6kmgDt9yyvD2_LU1YBXjzEHUEWWTMJ8o5jPd-xNLSmTvel-wjqerShCm3KasP0I_d9qLPONmZye8FJv5DE4DZMWdwbuw&bm=2&la=en&cn=us&cid=1086024&info=2vYp3svOV8UYJ1JDkonPIL1HB9w4W0NC6eTOhyXfyW0um65QstxAfR56yDt8nUHd,Top Stories,AdLovehots.com,Unavailable,,1.5,False,True
Infrastructure bill: Democrats concede vote won't happen Monday,https://www.msn.com/en-us/news/politics/infrastructure-bill-democrats-concede-vote-won-t-happen-monday/ar-AAOQdkf?ocid=Peregrine,Top Stories,CNN,Unavailable,,1.6,False,False
Could robots beat the World Cup winners by 2050?,https://www.msn.com/en-us/news/technology/could-robots-beat-the-world-cup-winners-by-2050/ar-AAOQNCN?ocid=Peregrine,Top Stories,BBC News,Unavailable,,1.7,False,False
The VERY unique baby name trend set to be huge in 2022,https://www.msn.com/en-us/news/technology/the-very-unique-baby-name-trend-set-to-be-huge-in-2022/ar-AAOQLkD?ocid=Peregrine,Top Stories,Daily Mail,Unavailable,,1.8,False,False
Pressure grows to cut diplomatic red tape for Afghans left behind,https://www.msn.com/en-us/news/politics/pressure-grows-to-cut-diplomatic-red-tape-for-afghans-left-behind/ar-AAOQQ4P?ocid=Peregrine,Top Stories,The Hill,Unavailable,,1.9,False,False
Long-delayed Tony Awards herald theater’s return,https://www.msn.com/en-us/news/us/long-delayed-tony-awards-herald-theater-s-return/ar-AAOQCnM?ocid=Peregrine,Top Stories,New York Daily News,Unavailable,,1.10,False,False
Cory Booker spars over Tim Scott's claim Democrats wanted to defund police in reform bill,https://www.msn.com/en-us/news/politics/cory-booker-spars-over-tim-scott-s-claim-democrats-wanted-to-defund-police-in-reform-bill/ar-AAOQIxZ?ocid=Peregrine,Top Stories,Washington Examiner,Unavailable,,1.11,False,False
Pfizer CEO Says Low-Income Nations Will Receive 1Bn COVID Vaccine Doses by Year's End,https://www.msn.com/en-us/news/world/pfizer-ceo-says-low-income-nations-will-receive-1bn-covid-vaccine-doses-by-year-s-end/ar-AAOQQle?ocid=Peregrine,Top Stories,Newsweek,Unavailable,,2.0,False,False
Police investigate 'suspicious' death of mother and child at Padres stadium,https://www.msn.com/en-us/news/crime/police-investigate-suspicious-death-of-mother-and-child-at-padres-stadium/ar-AAOQpSe?ocid=Peregrine,Top Stories,ABC News,Unavailable,,3.0,False,False
First Tonys after Broadway's reopening — and reckoning — brings hope to Latino actors,https://www.msn.com/en-us/news/us/first-tonys-after-broadway-s-reopening-and-reckoning-brings-hope-to-latino-actors/ar-AAOPGlu?ocid=Peregrine,Top Stories,NBC News,Unavailable,,4.0,False,False
"Congress’s hectic legislative schedule, briefly explained",https://www.msn.com/en-us/news/politics/congress-s-hectic-legislative-schedule-briefly-explained/ar-AAOQC5D?ocid=Peregrine,Top Stories,Vox.com,Unavailable,,5.0,False,False
Tonys Latest: Stephen Daldry wins his third directing award,https://www.msn.com/en-us/news/us/tonys-latest-stephen-daldry-wins-his-third-directing-award/ar-AAOQzWm?ocid=Peregrine,Top Stories,Associated Press,Unavailable,,6.0,False,False
Maine Woman Called in Bomb Threats Toward Boyfriend’s Workplace to Spend More Time with Him: Police,https://www.msn.com/en-us/news/crime/maine-woman-called-in-bomb-threats-toward-boyfriend-s-workplace-to-spend-more-time-with-him-police/ar-AAOQGiT?ocid=Peregrine,Top Stories,Law & Crime,Unavailable,,7.0,False,False
U.S. Health System Strained; Pfizer Shots for Kids: Virus Update,https://www.msn.com/en-us/news/world/u-s-health-system-strained-pfizer-shots-for-kids-virus-update/ar-AAOP2My?ocid=Peregrine,Top Stories,Bloomberg,Unavailable,,8.0,False,False
Pfizer CEO predicts 'we will able to come back to normal life' within a year even with new variants of the coronavirus,https://www.msn.com/en-us/health/medical/pfizer-ceo-predicts-we-will-able-to-come-back-to-normal-life-within-a-year-even-with-new-variants-of-the-coronavirus/ar-AAOQlzz,Coronavirus,Business Insider,Unavailable,,9.0,False,False
India to export 8 million Covid-19 jabs in October,https://www.msn.com/en-us/news/world/india-to-export-8-million-covid-19-jabs-in-october/ar-AAONRHn,Coronavirus,AFP,Unavailable,,11.0,False,False
Fact check: COVID-19 vaccination has no effect on blood color,https://www.msn.com/en-us/health/medical/fact-check-covid-19-vaccination-has-no-effect-on-blood-color/ar-AAOQuTm,Coronavirus,USA TODAY,Unavailable,,12.0,False,False
Manchin is choosing a problematic past over his state's future (Opinion),https://www.msn.com/en-us/news/us/manchin-is-choosing-a-problematic-past-over-his-state-s-future-opinion/ar-AAOQJ2T,US,CNN,Unavailable,,13.0,False,False
Gabby Petito's loved ones gathered in New York for a memorial as the search for her fiancé continues,https://www.msn.com/en-us/news/us/gabby-petito-s-loved-ones-gathered-in-new-york-for-a-memorial-as-the-search-for-her-fianc%C3%A9-continues/ar-AAOPIME,US,CNN,Unavailable,,14.0,False,False
NYC teachers encouraged to take photos to 'document' student COVID violations,https://www.msn.com/en-us/news/us/nyc-teachers-encouraged-to-take-photos-to-document-student-covid-violations/ar-AAOQGlE,US,FOX News,Unavailable,,15.0,False,False
Texas governor defends upcoming 2020 election audits that Trump demanded,https://www.msn.com/en-us/news/us/texas-governor-defends-upcoming-2020-election-audits-that-trump-demanded/ar-AAOQsha,US,Reuters,Unavailable,,16.0,False,False
3 dead in Amtrak train derailment,https://www.msn.com/en-us/news/us/3-dead-in-amtrak-train-derailment/ar-AAOP5Qg,US,ABC News,Unavailable,,17.0,False,False
German centre-left scents victory in tight vote,https://www.msn.com/en-us/news/world/german-centre-left-scents-victory-in-tight-vote/ar-AAOQIo2,World,BBC News,Unavailable,,18.0,False,False
Taliban bans barbers from shaving beards and playing music in in Helmand Province,https://www.msn.com/en-us/news/world/taliban-bans-barbers-from-shaving-beards-and-playing-music-in-in-helmand-province/ar-AAOQq0X,World,CNN,Unavailable,,19.0,False,False
San Marino votes to legalise abortion in referendum,https://www.msn.com/en-us/news/world/san-marino-votes-to-legalise-abortion-in-referendum/ar-AAOQGgB,World,BBC News,Unavailable,,20.0,False,False
"Image Problem: Taliban Warn Foot Soldiers Against Selfies, Sightseeing, Stylish Clothes",https://www.msn.com/en-us/news/world/image-problem-taliban-warn-foot-soldiers-against-selfies-sightseeing-stylish-clothes/ar-AAOQxnI,World,Newsweek,Unavailable,,21.0,False,False
Sudan military-civilian tensions reach low point in wake of coup attempt,https://www.msn.com/en-us/news/world/sudan-military-civilian-tensions-reach-low-point-in-wake-of-coup-attempt/ar-AAOQpcL,World,Reuters,Unavailable,,22.0,False,False
Cheney says a lot of GOP lawmakers have privately encouraged her fight against Trump,https://www.msn.com/en-us/news/politics/cheney-says-a-lot-of-gop-lawmakers-have-privately-encouraged-her-fight-against-trump/ar-AAOQAqy,Politics,The Hill,Unavailable,,23.0,False,False
Opinion: Donald Trump is 100% right about Stacey Abrams,https://www.msn.com/en-us/news/politics/opinion-donald-trump-is-100-right-about-stacey-abrams/ar-AAOQIs0,Politics,CNN,Unavailable,,24.0,False,False
"Pelosi’s Democrats remain at odds, which is good news for the country",https://www.msn.com/en-us/news/politics/pelosi-s-democrats-remain-at-odds-which-is-good-news-for-the-country/ar-AAOQAhf,Politics,Washington Examiner,Unavailable,,25.0,False,False
Fox News Host Complains of Being Attacked by Trump Fans for Reporting Facts on Arizona Audit,https://www.msn.com/en-us/news/politics/fox-news-host-complains-of-being-attacked-by-trump-fans-for-reporting-facts-on-arizona-audit/ar-AAOQCfA,Politics,Newsweek,Unavailable,,26.0,False,False
Pro-Trump Congressional Candidate Says 'Audit All 50 states' and 'Execute All Involved',https://www.msn.com/en-us/news/politics/pro-trump-congressional-candidate-says-audit-all-50-states-and-execute-all-involved/ar-AAOQGm7,Politics,Newsweek,Unavailable,,27.0,False,False
Sabina Nessa: London police make new arrest in case,https://www.msn.com/en-us/news/crime/sabina-nessa-london-police-make-new-arrest-in-case/ar-AAOPFdX,Crime,CNN,Unavailable,,28.0,False,False
Gabby Petito Memorial Service Draws Hundreds as Search for Brian Laundrie Continues,https://www.msn.com/en-us/news/crime/gabby-petito-memorial-service-draws-hundreds-as-search-for-brian-laundrie-continues/ar-AAOQph9,Crime,Newsweek,Unavailable,,29.0,False,False
Alex Murdaugh's former law firm says he 'lied and he stole from us',https://www.msn.com/en-us/news/crime/alex-murdaugh-s-former-law-firm-says-he-lied-and-he-stole-from-us/ar-AAOPZEk,Crime,CNN,Unavailable,,30.0,False,False
Arrest warrant issued for Brian Laundrie in Wyoming amid search: Live updates,https://www.msn.com/en-us/news/crime/arrest-warrant-issued-for-brian-laundrie-in-wyoming-amid-search-live-updates/ar-AAODwxA,Crime,ABC News,Unavailable,,31.0,False,False
Man Killed in Officer-Involved Shooting at Huntington Beach Near the U.S. Open of Surfing,https://www.msn.com/en-us/news/crime/man-killed-in-officer-involved-shooting-at-huntington-beach-near-the-u-s-open-of-surfing/ar-AAOQo62,Crime,People,Unavailable,,32.0,False,False
