article_url,article_title,meta_description,section,authors,publish_date,modified_date,canonical_link,top_image,is_opinion
https://www.msn.com/en-us/news/world/afghanistan-updates-biden-vows-to-evacuate-americans-and-afghan-allies/ar-AANnZjQ?ocid=Peregrine,"Afghanistan updates: Biden vows to evacuate Americans and Afghan allies, says there may be 'loss'",The Afghan government has crumbled to Taliban rule and the U.S. military is racing to evacuate people from an increasingly chaotic Kabul airport.,,"['Abc News', 'Luis Martinez', 'Conor Finnegan', 'Christine Theodorou', 'Lauren King', 'Morgan Winsor', 'Matt Seyler', 'Marlene Lenthang', 'Last Updated', 'August']",,,https://abcnews.go.com/Politics/live-updates/afghanistan-withdrawal-live-updates/?id=79482353,https://s.abcnews.com/images/Politics/biden-harris-ap-ml-210820_1629482474208_hpMain_16x9_1600.jpg,
https://trace.mediago.io/api/bidder/track?tn=9220dd482c2a49631b4e66cca9f5f0ee&price=oCpzqJ2jn9XzH0A239rNZ6q4OPiRTVMcUNs1XzEwosU&evt=102&rid=4dab8a8eae8f2ef32925e1d747bde8fa&campaignid=1040022&impid=vlp-infopane-3&offerid=2476690&test=0&time=1629486681&cp=QrXu_howVaiGCHh07-ETsTSsPUEMjvkbPXzDfjpqK38&clickid=21_4dab8a8eae8f2ef32925e1d747bde8fa_vlp-infopane-3&acid=305&trackingid=b5eedeb4005c65b6181c486217378fa1&uid=15B88BCF97436D0325A79B5696516C7E&jt=2&url=XKELIXrBBn7S4M2yNYLlV72SHaDi8Z2y0hl5JNY-r11gws7CKmUXds4SKmptwNE3RRq5fNpIx6w4ZGzd3Lm0iw_47HoeHOYPGhP9Ya5hByjtoJPCe6Rd2Lvhoyj0h1g6CoFPp7OnfO3RoqvZvyx0cqdRjBx9Y8QE8nl4LrQglyXM3WQYlIs1dZ6Dvw3r8AHHjny3JSyyHZHaQX3hqlpziB1xTiBeCu0HATrGe8rd8RuQmg_vShqlJdAsOGwE5LDi4c2V1O2cCFu_JiXU3mnRxjD3d0xIn5fKuoKj6TLIwhA&bm=5&la=en&cn=us&cid=1081622&info=EzxU6NdyFfR4Yw-BkToaAPwJbhmBpnIeo6oFutKTfTnWVTnYjLdAhbGiJIu_JsbzFgdOxO8HZgj2OxvmwVVrXQ,,,,[],,,,,
https://www.msn.com/en-us/news/us/biden-focuses-on-getting-this-job-done-as-chaotic-evacuation-from-afghanistan-grows-desperate/ar-AANxKcf?ocid=Peregrine,Biden focuses on 'getting this job done' as chaotic evacuation from Afghanistan grows desperate,President Joe Biden on Friday tried to put an optimistic face on the chaotic evacuations taking place at Kabul's airport as American forces scramble to remove US citizens and vulnerable Afghans from the country.,politics,"['Kate Sullivan', 'Kevin Liptak']",2021-08-20 00:00:00,2021-08-20T19:33:39Z,https://www.cnn.com/2021/08/20/politics/biden-afghanistan-evacuation/index.html,https://cdn.cnn.com/cnnnext/dam/assets/210820140340-04-biden-presser-afghanistan-0820-super-tease.jpg,false
https://www.msn.com/en-us/news/politics/capitol-hill-bomb-threat-defendant-floyd-ray-roseberry-charged-in-federal-court-detained-without-bail/ar-AANy8QT?ocid=Peregrine,Roseberry relative warned authorities of possible violence in DC a day before Capitol Hill bomb threat,Floyd Ray Roseberry addressed President Joe Biden on video during a bomb threat that led to evacuation of the Supreme Court and the Library of Congress.,Politics,"['Dan Mangan Kevin Breuninger', 'Dan Mangan', 'Kevin Breuninger']",2021-08-20 00:00:00,2021-08-20T21:11:49+0000,https://www.cnbc.com/2021/08/20/capitol-hill-bomb-threat-defendant-floyd-ray-roseberry-in-court-.html,https://image.cnbcfm.com/api/v1/image/106930604-1629397292222-106930604-16293972002021-08-19t181425z_1967834262_rc2c8p9uh3bx_rtrmadp_0_usa-washingtondc-security.jpg?v=1629398309,false
https://trace.mediago.io/api/bidder/track?tn=9220dd482c2a49631b4e66cca9f5f0ee&price=IIzRbngbVuJbxASvh099eoes7sHrjN4ovmNL9JM9p3k&evt=102&rid=4dab8a8eae8f2ef32925e1d747bde8fa&campaignid=1041143&impid=vlp-infopane-6&offerid=2522837&test=0&time=1629486681&cp=zYqIi7k6uGfBGW6FpXUHAkAL7g_Ti8fcIJaHio3aEco&clickid=21_4dab8a8eae8f2ef32925e1d747bde8fa_vlp-infopane-6&acid=200&trackingid=8811637fec04b2cda076006437f20675&uid=15B88BCF97436D0325A79B5696516C7E&jt=2&url=SbXlA_aXrFnWJQAFPW6gQKKPgd1dbozvhlehe6P9UVJMuzIdFsmwsU4PvxLQgGRdDK7Gz3x76Ws_rdOM1g2XwQt-fLnTx4X4ZGQ5zJjEcp6rJBeKDtSuE8zsyWsdk6p6R7QS_z7tPDRJ7fUvLV_A-0NeJ8NzZv5fh2hJsDvxDL8us-P8ywpU2PjR7wptoRXR8LKQ4Vc5bsrnmmeGbK8GhUSxY9v7FxVB6-T-zIuQJudEfaiGOn4vC5MkzHKqNtq1fXf_Ty5gB3Y4yx4atrNDGMoJlDPkt9GhcabPVN4VV6vOSnonU8tusrA0YbIY2BJPJtj-ZbeJDyv15rLb4Wtr4YmhVD8f1_u0hy2hfYToxKVzf55XPN1BZcJC1rL8-Bx2CV4kSQdSLMJFByjQlRI6HbF0dR9pjyr56_4QgQBRxPA&bm=5&la=en&cn=us&cid=1083812&info=4tJQFB4UMZxtViKz-WRLjlyanabP9X95J1-E8DeOc8slSJbTfUHc3NJgRvWKLedaLor3LhLHrYYWgwsTQ_39DA,,,,[],,,,,
https://www.msn.com/en-us/news/technology/afghanistan-crisis-how-to-help-refugees-and-their-families/ar-AANxYHs?ocid=Peregrine,Afghanistan crisis: How to help refugees and their families,Afghan citizens are fearing for their lives as the Taliban seize control of the country. Here are some organizations helping out.,,['Katie Teague'],,,https://www.cnet.com/how-to/afghanistan-crisis-how-to-help-refugees-and-their-families/,https://www.cnet.com/a/img/BEMLHF_haLR6kLotdMUQsctNYh8=/1200x630/2021/08/20/7bd7da4e-37bf-492a-820a-81973c1a4a60/gettyimages-1234771075.jpg,false
https://www.msn.com/en-us/news/world/biden-denies-international-criticism-of-afghanistan-withdrawal/ar-AANybfE?ocid=Peregrine,Biden denies international criticism of Afghanistan withdrawal,President Joe Biden has dismissed concerns his handling of the United States's withdrawal from Afghanistan has undermined the country's standing abroad.,News,[],2021-08-20 18:46:01.196000,2021-08-20T19:04:17.569,https://www.washingtonexaminer.com/politics/biden-criticism-afghanistan-withdrawal,https://mediadc.brightspotcdn.com/dims4/default/f744243/2147483647/strip/true/crop/6000x3150+0+425/resize/1200x630!/quality/90/?url=http%3A%2F%2Fmediadc-brightspot.s3.amazonaws.com%2Fdb%2F82%2F308c75124a0eb153ce9c1dd6ff2b%2Fap21232662097240.jpg,
https://www.msn.com/en-us/news/world/we-have-a-mission-to-complete-biden-vows-to-complete-troubled-evacuation-from-kabul-airport-amid-afghanistan-chaos/ar-AANxDJ8?ocid=Peregrine,Biden vows to complete troubled evacuation from Kabul airport amid chaos: ‘We have a mission to complete’,"Flanked by Vice President Kamala Harris and top officials, the commander-in-chief guaranteed the U.S. would rescue any Americans who want to leave.","U.S. Politics, Politics, News",['Dave Goldiner'],2021-08-20 00:00:00,,https://www.nydailynews.com/news/politics/us-elections-government/ny-biden-afghanistan-evacuation-chaos-20210820-jtb5cziqmbbmjg4cysnlpu7guq-story.html,https://www.nydailynews.com/resizer/1x4iVYihy_gRhawXDbI6U4H8I78=/1200x0/top/cloudfront-us-east-1.images.arcpublishing.com/tronc/MPEE4OOCV5EUXM2J2VGARY2D6A.jpg,false
https://www.msn.com/en-us/news/politics/biden-denies-allies-are-questioning-us-credibility-amid-afghanistan-withdrawal/ar-AANyb6l?ocid=Peregrine,Biden denies allies are questioning US credibility amid Afghanistan withdrawal,President Biden on Friday said he has yet to hear any allies question the credibility of the United States amid the chaotic withdrawal of forces from Afghanistan.,,[],2021-08-20 14:43:20-04:00,2021-08-20T15:18:33-04:00,https://thehill.com/homenews/administration/568780-biden-denies-allies-are-questioning-us-credibility-amid-afghanistan,https://thehill.com/sites/default/files/article_images/harriskamala_bidenjoe_08202021getty.jpg,
https://www.msn.com/en-us/news/world/biden-promises-to-evacuate-any-american-who-wants-to-come-home-from-afghanistan-but-questions-remain/ar-AANxWhI?ocid=Peregrine,Biden promises to evacuate 'any American who wants to come home' from Afghanistan,"President Biden pledged Friday to use “every resource necessary” to evacuate “any American who wants to come home” from Afghanistan. But, he warned, “I cannot promise what the final outcome will be.""",,[],,,https://news.yahoo.com/biden-promises-to-evacuate-any-american-who-wants-to-come-home-from-afghanistan-but-questions-remain-183623636.html,https://s.yimg.com/os/creatr-uploaded-images/2021-08/fa4618d0-01e1-11ec-9dfd-43f3da12ebec,
https://www.msn.com/en-us/news/politics/biden-touts-progress-of-afghanistan-airlift-promises-remaining-americans-we-will-get-you-home/ar-AANy8K4?ocid=Peregrine,Biden touts 'progress' of Afghanistan airlift,"President Biden vows to 'provide safe evacuation for our Afghan allies, partners and Afghans who might be targeted' by the Taliban.'",Politics,"['Staff Writer', 'Eli Stokols Is A White House Reporter Based In The Los Angeles Times', 'Washington', 'D.C.']",2021-08-20 00:00:00,,https://www.latimes.com/politics/story/2021-08-20/biden-touts-progress-of-afghanistan-airlift-promises-remaining-americans-we-will-get-you-home,https://ca-times.brightspotcdn.com/dims4/default/79bc0b0/2147483647/strip/true/crop/6000x3150+0+425/resize/1200x630!/quality/90/?url=https%3A%2F%2Fcalifornia-times-brightspot.s3.amazonaws.com%2F28%2Fa6%2F5c61b9be4534b967cde20eaf6a5e%2Fla-photos-1staff-828110-na-pol-0820-biden-afghanistan-kkn-0899.JPG,false
https://www.msn.com/en-us/news/us/vidcon-canceled-again-due-to-covid-19/ar-AANxYUD?ocid=Peregrine,VidCon canceled again because of Covid-19,VidCon has again been canceled because of the Covid-19 pandemic.,,['Elisha Fieldstadt Is A Breaking News Reporter For Nbc News.'],2021-08-20 18:30:00+00:00,Fri Aug 20 2021 19:01:17 GMT+0000 (UTC),https://www.nbcnews.com/news/us-news/vidcon-canceled-again-because-covid-19-n1277332,"https://media-cldnry.s-nbcnews.com/image/upload/t_nbcnews-fp-1200-630,f_auto,q_auto:best/newscms/2021_33/3500544/210820-vidcon-mn-1400.jpg",false
https://www.msn.com/en-us/news/politics/defazio-looks-to-try-again-on-his-progressive-transportation-agenda/ar-AANyeXZ?ocid=Peregrine,DeFazio looks to try again on his progressive transportation agenda,"The House Transportation and Infrastructure chair isn’t giving up on his push to boost transit, electric vehicles and climate-related goals.",,[],2021-08-20 00:00:00,2021-08-20T18:19:07+00:00,https://www.rollcall.com/2021/08/20/defazio-looks-to-try-again-on-his-progressive-transportation-agenda/,https://content.rollcall.com/wp-content/uploads/2021/08/INFRASTRUCTURE_027_05122116x9.jpg,
https://www.msn.com/en-us/news/crime/iowa-woman-who-ran-down-2-children-of-color-with-car-gets-25-years-in-prison-for-racist-attacks/ar-AANy8vz?ocid=Peregrine,Iowa Woman Who Ran Down 2 Children of Color with Car Gets 25 Years in Prison for Racist Attacks,"Nicole Poole Franklin, 43, pleaded guilty to two federal counts of violating the U.S. Hate Crime Act and two state counts of attempted murder",,['Jeff Truesdell'],,,https://people.com/crime/iowa-woman-ran-down-children-of-color-racist-attack-sentenced/,https://imagesvc.meredithcorp.io/v3/mm/image?q=85&c=sc&poi=%5B630%2C570%5D&w=1500&h=750&url=https%3A%2F%2Fstatic.onecms.io%2Fwp-content%2Fuploads%2Fsites%2F20%2F2021%2F04%2F22%2FNicole-Poole-Franklin.jpg,false
https://www.msn.com/en-us/news/us/in-1972-melvin-mcnair-helped-hijack-a-plane-to-join-black-panthers-in-algeria-i-am-at-peace-with-what-i-did/ar-AAMGYrI?ocid=Peregrine,"In 1972, Melvin McNair helped hijack a plane to join Black Panthers in Algeria. ‘I am at peace with what I did.’","In exile in France, McNair has built a life around community service and baseball. He is wanted by authorities in the U.S. for his 50-year-old crime.",,"['Kim Hjelmgaard', 'Usa Today']",2021-07-29 00:00:00,,https://www.usatoday.com/in-depth/news/nation/2021/07/29/melvin-mcnair-black-panthers-hijackers-algeria-1972/7042889002/,"https://www.gannett-cdn.com/presto/2021/07/23/USAT/64a9c590-c692-432c-a85b-c25c525159a6-McNair_promo_image.png?crop=746,420,x101,y242&width=1200",false
https://www.msn.com/en-us/news/world/biden-says-u-s-is-committed-to-evacuating-afghan-refugees/ar-AANy3xQ?ocid=Peregrine,Are you a robot?,,,[],2021-08-20 00:00:00,,,,
https://www.msn.com/en-us/news/world/buoy-replaces-lighthouse-ship-in-english-channel/ar-AANy3lg?ocid=Peregrine,Lighthouse vessel marking shipping English Channel lanes replaced with buoy,"A buoy replaces the Channel Lightvessel, installed after the 1978 Amoco Cadiz oil spill.",Guernsey,[],,,https://www.bbc.com/news/world-europe-guernsey-58284307,https://ichef.bbci.co.uk/news/1024/branded_news/17FC9/production/_120094289_channel-lightvessel-adam-keen.jpg,
https://www.msn.com/en-us/news/us/struggling-to-find-a-covid-test-you-re-not-alone-thanks-to-the-delta-variant/ar-AANx9iZ,USA TODAY,,,[],2021-08-20 00:00:00,,,https://www.gannett-cdn.com/sites/usatoday/images/favicon.png,
https://www.msn.com/en-us/health/medical/outrageous-numbers-louisiana-hospitals-struggle-with-flood-of-covid-patients/ar-AANxm8v,Louisiana doctors struggle as COVID patients flood hospitals,"Across the state of Louisiana more than 3,000 patients are hospitalized with COVID-19.",,"['Abc News', 'Arielle Mitropoulos', 'August']",,,https://abcnews.go.com/Health/louisiana-doctors-struggle-covid-patients-flood-hospitals/story?id=79507144,https://s.abcnews.com/images/US/louisiana-hospital-covid-gty-jt-210810_1628640316351_hpMain_16x9_992.jpg,false
https://www.msn.com/en-us/news/us/working-for-r-kelly-resembled-twilight-zone-ex-manager-says-at-sex-abuse-trial/ar-AANyf2u,"Working for R. Kelly resembled 'twilight zone,' ex-manager says at sex abuse trial","A former manager for R. Kelly said at the R&B singer's sex abuse trial on Friday that working for his former boss was almost like being in a ""twilight zone,"" and sometimes made him uncomfortable.",,['Karen Freifeld'],2021-08-20 18:58:15+00:00,,https://www.reuters.com/article/us-people-rkelly-idUSKBN2FL20Z,https://static.reuters.com/resources/r/?m=02&d=20210820&t=2&i=1572504796&r=LYNXMPEH7J138&w=800,
https://www.msn.com/en-us/news/us/covid-19-live-updates-texas-lt-gov-claims-unvaccinated-black-people-driving-spike/ar-AANnABV,COVID-19 live updates: Texas lt. gov. claims unvaccinated Black people driving spike in cases,The United States is facing a COVID-19 surge this summer as the more contagious delta variant spreads.,,"['Abc News', 'Emily Shapiro', 'Julia Jacobo', 'Morgan Winsor', 'Erin Schumaker', 'Meredith Deliso', 'Last Updated', 'August', 'Pm Et']",,,https://abcnews.go.com/Health/live-updates/covid-delta-variant/?id=79475515,https://s.abcnews.com/images/Health/dan-patrick-file-gty-ml-210820_1629469605210_hpMain_2_16x9_1600.jpg,
https://www.msn.com/en-us/news/world/biden-to-keep-canada-and-mexico-borders-closed-through-at-least-late-september-angering-travel-industry/ar-AANxWkO,"Biden to keep Canada and Mexico borders closed through at least late September, angering travel industry","The Biden administration will continue to bar noncitizens from entering the United States at ports of entry along the Canadian and Mexican borders through Sept. 21, marking the 15th month the travel ban has been renewed.",News,[],2021-08-20 18:36:08.701000,2021-08-20T18:37:18.63,https://www.washingtonexaminer.com/news/us-canada-and-mexico-borders-closed-to-nonessential-travelers-september,https://mediadc.brightspotcdn.com/dims4/default/9452ec9/2147483647/strip/true/crop/2290x1202+0+57/resize/1200x630!/quality/90/?url=http%3A%2F%2Fmediadc-brightspot.s3.amazonaws.com%2Fc4%2Ff7%2F7f34123d4580bad9175597aceda5%2Fap17260818440017.jpg,
https://www.msn.com/en-us/news/world/updates-from-afghanistan-biden-tells-americans-we-will-get-you-home-as-evacuation-flights-resume/ar-AANxvmV,Updates from Afghanistan: Biden tells Americans 'we will get you home' as evacuation flights resume,"Biden said the U.S. evacuated 5,700 people from Afghanistan Thursday.",,[],2021-08-20 00:00:00,,https://www.usatoday.com/story/news/politics/2021/08/20/afghanistan-news-evacuations-biden-taliban-takeover/8208146002/,"https://www.gannett-cdn.com/presto/2021/08/20/USAT/107dff84-cdbe-48cd-b3cc-eac15fa6d9c9-AP_Pakistan_Afghanistan.jpg?crop=3993,2247,x0,y166&width=3200&height=1801&format=pjpg&auto=webp",false
https://www.msn.com/en-us/news/world/uae-to-temporarily-host-5-000-afghans-at-u-s-request/ar-AANy6py,"UAE to temporarily host 5,000 evacuated Afghans en route elsewhere","The United Arab Emirates has agreed to host 5,000 Afghan nationals to be evacuated from their country on their way to third countries, the UAE's embassy in the United States said on Twitter on Friday.",,['Reuters Staff'],2021-08-20 18:31:11+00:00,,https://www.reuters.com/article/afghanistan-conflict-emirates-usa-int-idUSKBN2FL204,https://static.reuters.com/resources/r/?m=02&d=20210820&t=2&i=1572502977&r=LYNXMPEH7J12J&w=800,
https://www.msn.com/en-us/news/world/opinion-world-is-deeply-shaken-by-america-s-retreat/ar-AANxYF4,Opinion: World is deeply shaken by America's retreat,David Andelman writes ​​the international community's belief in America as a steady hand on the global tiller has been deeply shaken by the chaos engulfing Afghanistan.,opinions,['Opinion David A. Andelman'],2021-08-20 00:00:00,2021-08-20T18:17:16Z,https://www.cnn.com/2021/08/20/opinions/afghanistan-united-states-global-consequences-andelman/index.html,https://cdn.cnn.com/cnnnext/dam/assets/210820134115-taliban-fighters-kabul-afghanistan-08-17-2021-super-tease.jpg,true
https://www.msn.com/en-us/news/politics/amy-coney-barrett-denies-bid-to-stop-construction-of-obama-library/ar-AANyb6d,Amy Coney Barrett denies bid to stop construction of Obama library,"Supreme Court Justice Amy Coney Barrett rejected a petition seeking to halt construction of an Obama Foundation library to be built on Chicago's South Side, the latest in a string of judgments by the Trump appointee sure to draw fire from the Right.",News,[],2021-08-20 18:34:48.640000,2021-08-20T18:34:48.64,https://www.washingtonexaminer.com/news/barrett-denies-bid-to-stop-construction-of-obama-library,https://mediadc.brightspotcdn.com/dims4/default/b05e3bf/2147483647/strip/true/crop/2290x1202+0+60/resize/1200x630!/quality/90/?url=http%3A%2F%2Fmediadc-brightspot.s3.amazonaws.com%2F80%2F43%2F8e228f584bd197cce0ef5e8bc3b3%2Famy-coney-barrett-ted-cruz-8.JPG,
https://www.msn.com/en-us/news/politics/biden-vows-to-complete-afghan-evacuation-but-admits-risks/ar-AANy8yE,"Biden vows to complete Afghan evacuation, but admits risks",President Biden on Friday sought to assure the public that his administration would do everything possible to evacuate American citizens and Afghans who assisted U.S.,,[],2021-08-20 14:30:53-04:00,2021-08-20T15:04:16-04:00,https://thehill.com/homenews/administration/568778-biden-vows-to-complete-afghan-evacuation-but-admits-risks,https://thehill.com/sites/default/files/bidenjoe_08202021getty.jpg,
https://www.msn.com/en-us/news/politics/the-intelligence-community-s-silence-is-deafening/ar-AANy6AJ,The intelligence community's silence is deafening,Private intelligence companies will begin to compete for policymakers’ attention and could slowly push aside the government intelligence community.,,[],2021-08-20 14:30:10-04:00,2021-08-20T14:30:02-04:00,https://thehill.com/opinion/national-security/568686-the-intelligence-communitys-silence-is-deafening,https://thehill.com/sites/default/files/article_images/bidenjoe_081221getty_intelligence.jpg,
https://www.msn.com/en-us/news/politics/kentucky-governor-sending-unmasked-unvaccinated-kids-into-class-like-holding-chicken-pox-party/ar-AANy8vv,"Kentucky governor: Sending unmasked, unvaccinated kids into class like holding 'chicken pox party'",Kentucky Gov.,,[],2021-08-20 14:28:52-04:00,2021-08-20T14:35:29-04:00,https://thehill.com/homenews/state-watch/568775-kentucky-governor-sending-unmasked-unvaccinated-kids-into-class-like,https://thehill.com/sites/default/files/article_images/beshearandy_04262021getty.jpg,
https://www.msn.com/en-us/news/crime/r-kelly-trial-physician-kris-mcgrath-testifies-the-singer-had-herpes-since-at-least-2007-as-prosecutors-allege-he-knowingly-infected-people/ar-AANwvTV,R. Kelly's physician testifies the singer had herpes since at least 2007 as prosecutors allege he knowingly infected people,"R. Kelly's personal physician of 25 years took the stand Thursday to testify about his treatment of the singer's genital herpes since at least 2007, after prosecutors allege the singer knowingly infected multiple people with the incurable sexually transmitted disease.",us,['Sonia Moghe'],2021-08-20 00:00:00,2021-08-20T18:01:29Z,https://www.cnn.com/2021/08/20/us/r-kelly-trial-testimony-thursday/index.html,https://cdn.cnn.com/cnnnext/dam/assets/210820131803-booking-photo-r-kelly-super-tease.jpg,false
https://www.msn.com/en-us/news/crime/man-killed-wife-clinging-to-life-after-they-were-struck-in-hit-and-run-while-on-date-night/ar-AANyeKY,"Man Killed, Wife Clinging to Life After They Were Struck in Hit-and-Run While on Date Night",The occupants of the pickup truck fled the scene before police arrived,,['Harriet Sokmensuer'],,,https://people.com/crime/man-killed-wife-critically-hurt-hit-and-run-crash-date-night/,https://imagesvc.meredithcorp.io/v3/mm/image?q=85&c=sc&poi=%5B705%2C580%5D&w=1500&h=750&url=https%3A%2F%2Fstatic.onecms.io%2Fwp-content%2Fuploads%2Fsites%2F20%2F2021%2F08%2F20%2Fkeith-tami-alan.jpg,false
https://www.msn.com/en-us/news/crime/man-suddenly-admits-to-murdering-his-pregnant-19-year-old-wife-nearly-a-year-after-horrified-family-said-everybody-knew-he-was-guilty/ar-AANyceC,Man Suddenly Admits to Murdering His Pregnant 19-Year-Old Wife Nearly a Year After Horrified Family Said ‘Everybody’ Knew He Was ‘Guilty’,An Upstate New York man who originally pleaded not guilty to murdering his pregnant wife changed his plea to guilty on Wednesday.,,"['Aaron Keller Holds A Juris Doctor Degree The University Of New Hampshire School Of Law', 'A Broadcast Journalism Degree Syracuse University.', 'He Is A Former Anchor', 'Executive Producer For The Law Crime Network', 'Is Now A Senior Editor For The Law Crime Website.', 'Disclaimer', 'This Website Is For General Informational Purposes Only.', 'You Should Not Rely On It For Legal Advice.', 'Reading This Site Or Interacting With The Author Via This Site Does Not Create An Attorney-Client Relationship.', 'This Website Is Not A Substitute For The Advice Of An Attorney.']",2021-08-20 17:12:32+00:00,2021-08-20T17:17:26Z,https://lawandcrime.com/crime/man-suddenly-admits-to-murdering-his-pregnant-19-year-old-wife-nearly-a-year-after-horrified-family-said-everybody-knew-he-was-guilty/,https://lawandcrime.com/wp-content/uploads/2021/08/George-McDonald-Jr-Mugshot-Canastota-NY-1.jpg,
https://www.msn.com/en-us/news/crime/parents-and-babysitter-charged-with-neglect-after-11-month-old-baby-found-dead-in-remote-obscure-densely-forested-area/ar-AANxTsX,"Parents and Babysitter Charged with Neglect After 11-Month-Old Baby Found Dead in ‘Remote, Obscure, Densely Forested Area’","A missing infant was found dead in the woods of northern Indiana on Wednesday evening. On Thursday, the baby's parents and last known babysitter were arrested and charged in connection with her death. Mercedes Lain was 11 months old.",,[],2021-08-20 16:45:57+00:00,2021-08-20T16:57:24Z,https://lawandcrime.com/crime/parents-and-babysitter-charged-with-neglect-after-11-month-old-baby-found-dead-in-remote-obscure-densely-forested-area/,https://lawandcrime.com/wp-content/uploads/2021/08/Tiffany-Coburn-Kenneth-Lain-and-Justin-Miller-appear-in-mugshots.jpeg,
