article_url,article_title,meta_description,section,authors,publish_date,modified_date,canonical_link,top_image,is_opinion
https://www.msn.com/en-us/news/us/disaster-of-epic-proportions-migrant-deaths-on-the-rise-border-patrol-increases-rescues/ar-AAOJqVR?ocid=Peregrine,USA TODAY,,,[],2021-09-23 00:00:00,,,https://www.gannett-cdn.com/sites/usatoday/images/favicon.png,
https://www.msn.com/en-us/news/world/texas-sued-by-group-of-big-tech-giants-over-censorship-bill-they-say-would-protect-pro-nazi-speech-and-terrorist-propaganda/ar-AAOKpAY?ocid=Peregrine,Texas sued by group of Big Tech giants over censorship bill they say would protect 'pro-Nazi speech' and 'terrorist propaganda',"Signed by Gov. Greg Abbott earlier this month, HB20 would allow Texas residents banned from social media to sue platforms like Facebook and Twitter.",,"['Hannah Towey', 'Emily Walsh']",2021-09-23 00:00:00,2021-09-23T16:39:15Z,https://www.businessinsider.com/texas-sued-by-facebook-twitter-youtube-trade-group-censorship-bill-2021-9,https://i.insider.com/614ca5ed6b10a600196f0673?width=1200&format=jpeg,false
https://trace.mediago.io/api/bidder/track?tn=9220dd482c2a49631b4e66cca9f5f0ee&price=S5BFUjxR4bYGxgZKUbt1mVIHOMHD0CHzDQDwluDDtrI&evt=102&rid=c46b9ce023bd93a4b5a350fb79aabf96&campaignid=1027913&impid=vlp-infopane-3&offerid=2019249&test=0&time=1632415788&cp=TAGaVudXdOfxSEy3epZ6fk8L128blV49OgLh-DEn0OQ&clickid=21_c46b9ce023bd93a4b5a350fb79aabf96_vlp-infopane-3&acid=305&trackingid=c18117cdf6367da6f2242fe16c067ad7&uid=26367ECC615C65653CEF6E7760EC64F8&jt=2&url=fS11fAUbgXhnaQ-EC0LNziFHdBtbj6-mA2sHuuIS2OmVOU-3IU1ROxPM2uXKXDpJHK5pw4WMzmZ-m-QugSGxQuiLr6xvmlW0dt9i1hBaLQO1tdcdvjvIYUrjDOIMGMGuIj7e16mqo81JsPUM2ISl1y-azBVao7Vj5mDHp92d6F9IpLN0T1DRBJ_ub46iScARLMf16LDNu1dJPlElAOeouN1EZnn6gVbgWHuphMNHGPwaV64veb5Q8iIsETn_bgd7L4MwOsugvJ4n2Q2ugHu9TiPgJElBqLFcNRUqoxfAq54&bm=2&la=en&cn=us&cid=1060163&info=zgdXHU_-pwOmKiwlcJ0whePuPeAeXYqxqCvUPjQY_6CpdlSfKLvuLkjTQ92AW0KJ,,,,[],,,,,
https://www.msn.com/en-us/news/politics/the-u-s-government-won-t-shut-down-sept-30-but-congress-can-t-agree-on-budget-bill/ar-AAOKrcz?ocid=Peregrine,"Democrats put forward new bill to avert government shutdown, leaving out debt ceiling fix","House Speaker Nancy Pelosi said Thursday that the House went back to the drawing board, and would advance a new measure that keeps the government open, but leaves out the debt limit.","U.S. Politics, Politics, News",['Michael Mcauliff'],2021-09-23 00:00:00,,https://www.nydailynews.com/news/politics/us-elections-government/ny-congress-debt-ceiling-20210923-kspr5fbo2rc4bgcsgkmiprbequ-story.html,https://www.nydailynews.com/resizer/JksKWFUJVLE_D0iC3OBDGSG_m_U=/1200x0/left/middle/cloudfront-us-east-1.images.arcpublishing.com/tronc/V3N4SUCUXJDNPGFIJS5WYKYHIQ.jpg,false
https://trace.mediago.io/api/bidder/track?tn=9220dd482c2a49631b4e66cca9f5f0ee&price=ccb-Gb2MLcxoOLa9lpizYSVrBlE9_uRrtILP4HDFStc&evt=102&rid=c46b9ce023bd93a4b5a350fb79aabf96&campaignid=1042270&impid=vlp-infopane-6&offerid=2570632&test=0&time=1632415788&cp=VcwYHdQhasp-2HBuHA1VnzHrOy9XP26Y2e0lSPnpqF0&clickid=21_c46b9ce023bd93a4b5a350fb79aabf96_vlp-infopane-6&acid=201&trackingid=ef5897382f62eba936db4856156607ec&uid=26367ECC615C65653CEF6E7760EC64F8&jt=2&url=8N8MRSXx51BYtpQ5E3LLAOXj8FAUJChSVgvVyhmx2Wrtd8vRk-ZjB1OAw0Dx2wx8Iq77Va1j5gBOdw3KAJVgnyc4UZ_oyUoZCbrqI-AGVpk2WmQZDxx2tCigKN_sWqnOoWDgF9YEndqEDhWaM32X_7Ge-1KDfDDcNEtFBpG5JWf7Ht9ut-ZjILPXiV-OU8Fi6lPWV6RXPjYBv60TKx-37Xe-GQOpb79VPkdhoch8jX0t3gz_dYH1TNCu-hYnW7c-QvABKVqArdVChx1Qffw_KUV4hFhZ0zNEbVU5n033q3xw8ytWCh93VZ78cF2GqOkXHKVIElkFgmq9-ej1sNT6nnKezkvi8htlVevU3ltRn49VCCwB-mOluyg3dkEAcx-YC8AEk1IcAvKaDBGOjeXt7A&bm=2&la=en&cn=us&cid=1086024&info=bGXFcUCyRmrUPl28JlYzAWfO1Jzw-Bp7kDAWSnAAPAVq0Cz766SDEYwphOarkHTD,,,,[],,,,,
https://www.msn.com/en-us/news/politics/bipartisan-push-for-vocational-training-focuses-on-funding-curricula/ar-AAOKr8M?ocid=Peregrine,"Bipartisan push for vocational training focuses on funding, curricula",Democrats and Republicans say they are pushing for more vocational training by seeking federal funding and promoting employment opportunities that don’t require a bachelor’s degree.,,[],2021-09-23 12:31:40-04:00,2021-09-23T14:54:40-04:00,https://thehill.com/homenews/news/573630-bipartisan-push-for-vocational-training-focuses-on-funding-curricula,https://thehill.com/sites/default/files/blogs/vocational.jpg,
https://www.msn.com/en-us/news/us/watch-the-trailer-for-artist-jr-s-new-documentary-paper-glue/ar-AAOKpuz?ocid=Peregrine,Watch the Trailer for Artist JR's New Documentary Paper & Glue,"In his follow-up to ""Faces, Places,"" the photographer and street artist films in Rio, in a California prison and on the U.S.-Mexico border.",,['Andrew R. Chow'],,,https://time.com/6101065/paper-and-glue-trailer-jr/,https://api.time.com/wp-content/uploads/2021/09/GettyImages-1330286182.jpg?quality=85&w=1200&h=628&crop=1,false
https://www.msn.com/en-us/news/us/a-pennsylvania-school-board-reversed-its-ban-on-anti-racist-books-after-weeks-of-student-protests/ar-AAOKpoT?ocid=Peregrine,A Pennsylvania school board reversed its ban on anti-racist books after weeks of student protests,"The school board said the ban was a misunderstanding but originally said it didn't want students indoctrinated by ""any political or social agenda.""",,['Madison Hall'],2021-09-23 00:00:00,2021-09-23T16:28:12Z,https://www.insider.com/central-york-high-school-reverses-book-ban-after-student-protests-2021-9,https://i.insider.com/614ca6bede0e7b00194bfd64?width=1200&format=jpeg,false
https://www.msn.com/en-us/news/us/ft-meade-an-incident-thursday-morning-at-ft-meade-was-a-training-exercise/ar-AAOKbVb?ocid=Peregrine,An incident Thursday morning at Ft. Meade was a training exercise,"An incident at Ft. Meade in Maryland Thursday morning was in fact a drill, according to a public affairs officer.",us,['Liam Reilly'],2021-09-23 00:00:00,2021-09-23T21:36:54Z,https://www.cnn.com/2021/09/23/us/ft-meade-training-exercise/index.html,https://cdn.cnn.com/cnnnext/dam/assets/151001141820-cnn-breaking-news-graphic-super-tease.jpg,false
https://www.msn.com/en-us/news/world/serbian-troops-on-alert-on-kosovo-border-as-tensions-mount/ar-AAOKcpG?ocid=Peregrine,Serbian troops on alert on Kosovo border as tensions mount,"BELGRADE, Serbia (AP) — Serbia has raised its troops' combat readiness on the border with Kosovo amid increasing tensions with its breakaway former province, the Serbian defense minister said Thursday.",Europe,[],2021-09-23 16:26:11+00:00,2021-09-23T16:25:57Z,https://apnews.com/fbe8c09a960981f80d8732d85fc3d3fe,https://storage.googleapis.com/afs-prod/media/09a3910b2d654d4bac0a1b890f8dd50e/3000.jpeg,
https://www.msn.com/en-us/news/politics/democrats-hatch-secret-pay-for-it-plan-in-bid-for-unity-on-spending-dreams/ar-AAOKtSA?ocid=Peregrine,Dem leaders try for unity — and only get more tough questions,,,[],2021-09-23 00:00:00,,https://www.politico.com/news/2021/09/23/democrats-plan-social-spending-513901,https://cf-images.us-east-1.prod.boltdns.net/v1/static/1155968404/234a46f2-9e11-4989-98bd-d38663a55ddc/247fc2b7-61a7-4745-9978-08f5602a91ef/1280x720/match/image.jpg,false
https://www.msn.com/en-us/news/technology/walmart-restock-for-ps5-and-halo-infinite-xbox-series-x-happening-tonight-updated/ar-AANg1in?ocid=Peregrine,Walmart restock for PS5 and Halo Infinite Xbox Series X hits at 9 p.m. ET (Update: Sold out),Time for another chance at a PS5.,,"['Oscar Gonzalez', 'Jenae Sitzes']",,,https://www.cnet.com/tech/computing/walmart-restock-for-ps5-and-halo-infinite-xbox-series-x-hits-at-9-p-m-et/,https://www.cnet.com/a/img/iN3wb-2FEpBeR5t--1rNCW9zApk=/1200x630/2021/03/08/b35f8abb-fcff-4ec6-93e0-bb3c84bbeb83/ps5-playstation-5-sony-hoyle-promo-8.jpg,false
https://www.msn.com/en-us/news/us/dawn-maga-and-antifa-obsessed-dave-from-illinois-arrested-for-entering-the-capitol-on-jan-6-he-compared-it-to-a-stroll-in-a-shopping-mall/ar-AAOKpoi?ocid=Peregrine,‘Dawn Maga’ and Antifa-obsessed ‘Dave’ from Illinois Arrested for Entering the Capitol on Jan. 6. He Compared It to a Stroll in a ‘Shopping Mall.’,"Two Illinois residents have joined the ranks of hundreds of Donald Trump supporters charged for their actions on Jan. 6. The Department of Justice says that Dawn Frankowski, 53, and David Wiersma, 66, were each arrested on Tuesday in the Land of Lincoln, the former in Naperville and the latter in Posen (about a 40-minute drive apart).",,['Matt Naham Is The Editor-In-Chief Of Law Crime.'],2021-09-23 16:15:35+00:00,2021-09-23T16:37:19+00:00,https://lawandcrime.com/u-s-capitol-breach/dawn-maga-and-antifa-obsessed-dave-from-illinois-arrested-for-entering-the-capitol-on-jan-6-he-compared-it-to-a-stroll-in-a-shopping-mall/,https://lawandcrime.com/wp-content/uploads/2021/09/jan6.jpg,
https://www.msn.com/en-us/news/politics/top-republican-calls-on-biden-admin-to-share-pre-withdrawal-intelligence-reports-on-afghanistan/ar-AAOKr5v?ocid=Peregrine,Top Republican calls on Biden administration to share pre-withdrawal intelligence reports on Afghanistan,"Rep. Michael McCaul, ranking Republican on the Foreign Affairs Committee, asked the Biden administration to submit relevant intelligence reports on Afghanistan within 30 days.",,"['Dan De Luce', 'Dan De Luce Is A Reporter For The Nbc News Investigative Unit.']",2021-09-23 16:15:00+00:00,Fri Sep 24 2021 00:23:19 GMT+0000 (UTC),https://www.nbcnews.com/politics/national-security/top-republican-calls-biden-admin-share-pre-withdrawal-intelligence-reports-n1279937,"https://media-cldnry.s-nbcnews.com/image/upload/t_nbcnews-fp-1200-630,f_auto,q_auto:best/newscms/2021_38/3507846/210923-michael-mccaul-jm-1126.jpg",false
https://www.msn.com/en-us/news/politics/tulsi-gabbard-rips-biden-and-harris-over-border-crisis-says-trump-s-policy-worked/ar-AAOKwe5?ocid=Peregrine,"Tulsi Gabbard rips Biden and Harris over border crisis, says Trump's policy 'worked'","Tulsi Gabbard, a former Democratic representative from Hawaii and 2020 presidential candidate, ripped the Biden administration's immigration policy Thursday.",News,[],2021-09-23 16:14:37.227000,2021-09-23T16:14:37.227,https://www.washingtonexaminer.com/news/tulsi-gabbard-rips-biden-harris-border-crisis-haiti-texas-trump-policy-twitter,https://mediadc.brightspotcdn.com/dims4/default/0a21618/2147483647/strip/true/crop/2290x1202+0+60/resize/1200x630!/quality/90/?url=http%3A%2F%2Fmediadc-brightspot.s3.amazonaws.com%2F43%2F3f%2Fe95bffb94e889b360d94ae47f4d5%2Ftulsi-gabbard.jpg,
https://www.msn.com/en-us/news/world/sri-lankan-shaman-dies-of-covid-after-touting-cure/ar-AAOKvPZ?ocid=Peregrine,Eliyantha White: Sri Lankan shaman dies of Covid after touting cure,Eliyantha White said his anti-Covid potion could be poured into rivers to end the pandemic.,Asia,[],,,https://www.bbc.com/news/world-asia-58669914,https://ichef.bbci.co.uk/news/1024/branded_news/5BD3/production/_120670532_gettyimages-98081356.jpg,
https://www.msn.com/en-us/news/politics/schumer-says-democrats-have-framework-to-pay-for-agenda/ar-AAOKlEh?ocid=Peregrine,Are you a robot?,,,[],2021-09-23 00:00:00,,,,
https://www.msn.com/en-us/news/us/live-updates-horse-patrols-temporarily-suspended-at-haitian-migrant-camp-in-del-rio-texas/ar-AAOJMsk,"Live updates: Horse patrols temporarily suspended at Haitian migrant camp in Del Rio, Texas","Amid a probe into the use of agents on horseback, the Department of Homeland Security has temporarily stopped using horse patrols at the Del Rio border.",,[],2021-09-23 00:00:00,,https://www.usatoday.com/story/news/politics/2021/09/23/haitian-migrants-us-diplomat-quits-cites-inhumane-treatment/5825162001/,"https://www.gannett-cdn.com/presto/2021/09/20/NAAS/5afb6849-69e7-4fda-b67b-adf032fb0ba3-Del_Rio_Haitians_1.jpeg?crop=831,467,x0,y275&width=831&height=467&format=pjpg&auto=webp",false
https://www.msn.com/en-us/news/us/texas-death-row-case-supreme-court-grapples-with-prayer-touch-in-execution-chamber/ar-AAOD06e,USA TODAY,,,[],2021-09-20 00:00:00,,,https://www.gannett-cdn.com/sites/usatoday/images/favicon.png,
https://www.msn.com/en-us/news/us/state-department-says-u-s-envoy-to-haiti-mischaracterized-circumstances/ar-AAOKtcw,State Department says U.S. envoy to Haiti 'mischaracterized circumstances',"The State Department on Thursday said the resignation of the U.S. special envoy to Haiti was ""unfortunate"" and defended the Biden administration's policies, saying for the envoy ""to say his proposals were ignored is simply false.""",United States,[],2021-09-23 15:48:38+00:00,2021-09-23T15:53:48.648Z,https://www.reuters.com/world/us/state-department-says-us-envoy-haiti-mischaracterized-circumstances-2021-09-23/,https://www.reuters.com/resizer/rrOmUII6LT7Bb4jwR4l9Ab9fHCE=/1200x628/smart/filters:quality(80)/cloudfront-us-east-2.images.arcpublishing.com/reuters/QNXFBH2YUJM6DK3OB74INGO57U.jpg,
https://www.msn.com/en-us/news/crime/moab-will-investigate-police-s-response-to-gabby-petito-and-her-fianc%C3%A9-s-domestic-dispute/ar-AAOKjOf,"Moab, Utah, will investigate police response to Gabby Petito and her fiancé's domestic dispute","The city of Moab, Utah, said it is launching an investigation into the Moab City Police Department's handling of a dispute between Gabby Petito and Brian Laundrie in August several weeks before she was killed.",us,"['Eric Levenson', 'Ray Sanchez']",2021-09-23 00:00:00,2021-09-27T22:08:41Z,https://www.cnn.com/2021/09/23/us/gabby-petito-moab-police/index.html,https://cdn.cnn.com/cnnnext/dam/assets/210916154912-gabby-petito-bodycam-footage-super-tease.jpg,false
https://www.msn.com/en-us/news/crime/sidney-powell-and-others-want-to-pay-less-than-44-000-in-sanctions-after-trying-to-overturn-the-2020-election/ar-AAOKlVq,"Sidney Powell and Others Want to Pay Less Than $44,000 in Sanctions After Trying to Overturn the 2020 Election",Attorney Sidney Powell and a collection of other litigators who pressed claims against the outcome of the 2020 election in Michigan have asked a federal judge to severely limit the dollar amount of sanctions sought against them by the State of Michigan and the City of Detroit.,,"['Aaron Keller Holds A Juris Doctor Degree The University Of New Hampshire School Of Law', 'A Broadcast Journalism Degree Syracuse University.', 'He Is A Former Anchor', 'Executive Producer For The Law Crime Network', 'Is Now A Senior Editor For The Law Crime Website.', 'Disclaimer', 'This Website Is For General Informational Purposes Only.', 'You Should Not Rely On It For Legal Advice.', 'Reading This Site Or Interacting With The Author Via This Site Does Not Create An Attorney-Client Relationship.', 'This Website Is Not A Substitute For The Advice Of An Attorney.']",2021-09-23 15:30:34+00:00,2021-09-23T15:36:49+00:00,https://lawandcrime.com/2020-election/sidney-powell-and-others-want-to-pay-less-than-44000-in-sanctions-after-trying-to-overturn-the-2020-election/,https://lawandcrime.com/wp-content/uploads/2021/09/Sidney-Powell-via-Australian-Broadcasting-Corporation-1.jpg,
https://www.msn.com/en-us/news/crime/missing-grad-student-jelani-day-s-wallet-found-as-mom-pleads-for-resources-all-i-want-is-my-son/ar-AAOKhMu,Missing grad student Jelani Day’s wallet found as mom pleads for resources: ‘All I want is my son’,"Jelani Day’s car was found on Aug. 26, just two days after he was last seen in Bloomington.","U.S., News",['Jami Ganz'],2021-09-23 00:00:00,,https://www.nydailynews.com/news/national/ny-jelani-day-resources-wallet-found-20210923-gxqarzk7e5e4baurmmnvvzt53u-story.html,https://www.nydailynews.com/resizer/skLcZ8x8Va-nZ974oi7R1GaosCg=/1200x0/top/cloudfront-us-east-1.images.arcpublishing.com/tronc/RPW54LQMFJF47GYSLHWD5OLKGA.jpg,false
https://www.msn.com/en-us/news/world/returning-to-maximum-pressure-won-t-solve-iran-crisis/ar-AAOKpq4,Returning to 'maximum pressure' won't solve Iran crisis,A stream of migrants at the southern border. A creeping debt ceiling that Federal Reserve Chairman Jerome Powell has hinted might collapse the market. A lingering pandemic. Dust-ups with France over a nuclear submarine deal with Australia. President Joe Biden’s to-do list is overflowing. The last thing Biden needs is a new crisis with Iran.,Opinion,[],2021-09-23 16:11:01.245000,2021-09-23T16:11:01.245,https://www.washingtonexaminer.com/opinion/returning-to-maximum-pressure-wont-solve-iran-crisis,https://mediadc.brightspotcdn.com/dims4/default/9032573/2147483647/strip/true/crop/2290x1202+0+2/resize/1200x630!/quality/90/?url=http%3A%2F%2Fmediadc-brightspot.s3.amazonaws.com%2F0b%2Fe1%2F8ac3bbed420592fff9e27c480e59%2Fap21142409295107.jpg,
https://www.msn.com/en-us/news/world/kremlin-critics-to-contest-online-voting-in-duma-election/ar-AAOKqy0,Kremlin critics to contest online voting in Duma election,"MOSCOW (AP) — Politicians and activists who lost to Kremlin-backed candidates in Russia's parliamentary election last weekend have formed a coalition to contest the results from online voting in Moscow, which they believe was rigged and blame for their defeat.",Parliamentary elections,['Daria Litvinova'],2021-09-23 15:58:58+00:00,2021-09-23T16:39:43Z,https://apnews.com/c3f1f8d3927a1a34cc402c8b3af9468c,https://storage.googleapis.com/afs-prod/media/4b736186e6bf415bb063786808134f1a/3000.jpeg,
https://www.msn.com/en-us/news/world/mike-pence-praised-declining-abortions-under-hungary-s-authoritarian-regime-and-said-he-hopes-the-supreme-court-will-restrict-abortion/ar-AAOKm6E,Mike Pence praised declining abortions under Hungary's authoritarian regime and said he hopes the Supreme Court will restrict abortion,"In Hungary, Pence lamented the US's ""declining marriage rates, rising divorce, widespread abortion and plummeting birth rates.""",,['Eliza Relman'],2021-09-23 00:00:00,2021-09-23T15:58:57Z,https://www.businessinsider.com/mike-pence-praised-hungarys-authoritarian-leader-for-drop-in-abortions-2021-9,https://i.insider.com/614c8cc1c2c9630018f5f478?width=1200&format=jpeg,false
https://www.msn.com/en-us/news/technology/android-accessibility-update-lets-you-control-your-phone-communicate-using-facial-gestures/ar-AAOKjSv,"Android accessibility update lets you control your phone, communicate using facial gestures","The new features, called Camera Switches and Project Activate, let users navigate their devices without their hands or voice.",,['Abrar Al-Heeti'],,,https://www.cnet.com/tech/mobile/android-accessibility-update-lets-you-control-your-phone-communicate-using-facial-gestures/,https://www.cnet.com/a/img/N3UVsiAVQS-Jf0qrCBROdozvqVY=/1200x630/2021/09/20/3267bdfd-d6ff-4549-a46d-2ba5dcf6dd43/screen-shot-2021-09-20-at-6-24-38-pm.png,false
https://www.msn.com/en-us/news/technology/lost-or-damaged-covid-19-vaccine-card-don-t-worry-here-s-what-to-do/ar-AAOI7wd,Lost your COVID-19 vaccine card? Other ways to prove that you're vaccinated,There are several free ways to prove that you're vaccinated but getting a fake vaccination card isn't the answer.,,['Dashia Starr'],,,https://www.cnet.com/health/lost-your-covid-19-vaccine-card-other-ways-to-prove-that-youre-vaccinated/,https://www.cnet.com/a/img/juR-rgAhA_9wXA6qJ0Ticods-bU=/1200x630/2021/09/22/26905150-624e-499a-ac09-d8af44787d8e/gettyimages-1306550411.jpg,false
https://www.msn.com/en-us/news/technology/credit-card-annual-fees-what-they-are-and-when-they-re-worth-it/ar-AAOKcel,Credit card annual fees: What they are and when they're worth it,Cards with annual fees unlock better rewards -- just make sure the rewards offset the cost of the card.,,['Jackie Lam'],,,https://www.cnet.com/personal-finance/credit-cards/credit-card-annual-fees-what-they-are-and-when-theyre-worth-it/,https://www.cnet.com/a/img/4TV3-5pUFwXKGhcSNEgeW_9lgus=/1200x630/2021/09/17/97eae79e-a4cd-4916-a28f-67952f9c9e57/gettyimages-1129609340.jpg,false
https://www.msn.com/en-us/news/technology/text-message-scams-are-on-the-rise-here-s-what-you-can-do-about-it/ar-AAOKjRC,Text message scams are on the rise. Here's what you can do about it,"Spam texts often pose as real companies, like AT&T, FedEx or Chase. To stay safe, don't click any links.",,"['Bridget Carey', 'Jason Cipriani']",,,https://www.cnet.com/tech/mobile/text-message-spam-scams-on-the-rise-how-to-stop-spam/,https://www.cnet.com/a/img/LvXXGYNI92sV991o5rEmjvFstfc=/1200x630/2020/03/26/825e1a21-7533-40c9-be16-257bed19a4d6/apple-iphone-9745.jpg,false
https://www.msn.com/en-us/news/technology/arlo-pro-4-review-the-best-outdoor-security-camera-of-2021/ar-AAOK5jd,Arlo Pro 4 review: The best outdoor security camera of 2021,"The Pro 4 beats competitors, like Nest's most recent offering, with great features and reliable performance.",,['David Priest'],,,https://www.cnet.com/home/security/arlo-pro-4-review/,https://www.cnet.com/a/img/r5PYPw5F6Cy81Gi1-3DGYJ8l-Fo=/1200x630/2021/09/22/6a5aab00-5667-472d-9032-392a37a08e35/img-5929.jpg,false
