article_headline,article_url,article_topic,source_name,source_url,article_datetime,article_position,article_isopinion,article_isad
Protests in France continue to grow after Macron enacts new COVID-19 measures,https://www.msn.com/en-us/news/world/protests-in-france-continue-to-grow-after-macron-enacts-new-covid-19-measures/ar-AAMgCZr?ocid=Peregrine,Top Stories,The Hill,Unavailable,,1.0,False,False
Struggling channel GB News hires Nigel Farage to host show,https://www.msn.com/en-us/news/world/struggling-channel-gb-news-hires-nigel-farage-to-host-show/ar-AAMgCVE?ocid=Peregrine,Top Stories,Associated Press,Unavailable,,1.1,False,False
Cheap Buys From IKEA That Will Totally Transform Your Home,https://trace.mediago.io/api/bidder/track?tn=9220dd482c2a49631b4e66cca9f5f0ee&price=ENRHZoNIfBK_p39GGFK_YX3SpF7gwtBPfzPiNj2cfuU&evt=102&rid=b0b4bdd4805a9e98913a046354409ceb&campaignid=1032763&impid=vlp-infopane-3&offerid=2194027&test=0&time=1626545479&cp=CIlpKJa5PrTOYfUpjAG5oc1IFw9PCxy3YzN8xG7sAuY&clickid=21_b0b4bdd4805a9e98913a046354409ceb_vlp-infopane-3&acid=103&trackingid=61fe3112706e90c1a8d873e993064ea8&uid=0B8831A4B7A9607F15A821D3B6BB61FF&jt=2&url=EQw7Vl1Q4_uiaVai5AYkTwKEiPIOUHS9jg-gUXw0MOPxFninhwn-aqyoqWgvY86pS_oupPYYgTgO-COvW11DYPwAApsKRt9uSJahv-oeFvAbtJBJDhO4ReViFS3mRJVZtRV3PbODhcQOSbCPXrl_hC87ReVzaxeyNxiwCqNL237xpcAmeaeYvcSvy_gOzaUDalfuysQqhAkiJsuTqhTTBnjjoRwD2sq6vs_YT5rRN_kfFivMzskELph5Txtb3h4X&bm=0&la=en&cn=us&cid=1068255&info=aS491Te6RC99ZSeJMxj7mAHfZboylBF5Kh0DhTpJwNs,Top Stories,AdZenHerald,Unavailable,,1.2,False,True
"Europe flood death toll tops 160, costly rebuilding ahead",https://www.msn.com/en-us/news/world/europe-flood-death-toll-tops-160-costly-rebuilding-ahead/ar-AAMgJE2?ocid=Peregrine,Top Stories,New York Daily News,Unavailable,,1.3,False,False
"7 rescued, 1 missing after Boston Harbor boating accident",https://www.msn.com/en-us/news/us/1-dead-7-rescued-after-boston-harbor-boating-accident/ar-AAMguPT?ocid=Peregrine,Top Stories,ABC News,Unavailable,,1.4,False,False
"She Was An Icon, This Is How Cote De Pablo Lives Today",https://trace.mediago.io/api/bidder/track?tn=9220dd482c2a49631b4e66cca9f5f0ee&price=hlP9sXN93bJjO2Pz1GaULPymd0nISqrnZY3MHuvghag&evt=102&rid=b0b4bdd4805a9e98913a046354409ceb&campaignid=1031185&impid=vlp-infopane-6&offerid=2134529&test=0&time=1626545479&cp=w02wjVKxfffu1XCb8982P6FOHcB4uK6fCTRskauLO2g&clickid=21_b0b4bdd4805a9e98913a046354409ceb_vlp-infopane-6&acid=594&trackingid=f3bd680575dbfed90aaecded5ac92b84&uid=0B8831A4B7A9607F15A821D3B6BB61FF&jt=2&url=8gORsPx1E6YAXuYxLzpKPMuiqlYLTWXUG1igxYNQ8SKCtddXS5k9GsnJRNutsSjQcyVy2_jWNFJBpHsnvwnQq1nwjbLodOvztrtoUebKPC3buFFUM4bBurxcapQgT3qgu_QSi-jjsS9wjRkvOXKwtPEGlErSTgN6KQiAubnuOtbn2rTklZ2cU65rBUIIlqS1vqK83UEGVYkRIpaBH7zHULh17ncifS3RZo5ouGMLZlbBf7ynTmhURaV-f6_x8a_i5qGeWN9KslCZQANFVV2-dHDVHcdzT0B-oQ86IlLnYgSjvIsQ7tCj-WCH6b4DXU6OWUYfvkdrTe3nW2EhwvW-mXOlqcnaoE9d3ShL3w5zllN5LgGmt0ss1DIZ5BTXWkGeyXU0E8qhEMEi3-oStOzuihGqp9m-dKQ4eDgUN6Qayz4&bm=0&la=en&cn=us&cid=1065500&info=XmDrGKVSRGK11ddeGOjKpuU7CQwLKRonrIYfwmmMkG0,Top Stories,AdAuthors Pick,Unavailable,,1.5,False,True
A third California venue has nixed Matt Gaetz' and Marjorie Taylor Greene's 'America First' tour stop,https://www.msn.com/en-us/news/politics/a-third-california-venue-has-nixed-matt-gaetz-and-marjorie-taylor-greene-s-america-first-tour-stop/ar-AAMgJsw?ocid=Peregrine,Top Stories,Business Insider,Unavailable,,1.6,False,False
Mom thwarts kidnapping attempt by pulling her son out the car window,https://www.msn.com/en-us/news/crime/mom-thwarts-kidnapping-attempt-by-pulling-her-son-out-the-car-window/ar-AAMgHdD?ocid=Peregrine,Top Stories,NBC News,Unavailable,,1.7,False,False
"D.C. shooting: 6-year-old girl killed and 5 adults injured in a shooting in Washington, DC",https://www.msn.com/en-us/news/us/d-c-shooting-6-year-old-girl-killed-and-5-adults-injured-in-a-shooting-in-washington-dc/ar-AAMfDcL?ocid=Peregrine,Top Stories,CNN,Unavailable,,1.8,False,False
"Bolsonaro Prescribed New Diet, Discharge Yet to Be Decided",https://www.msn.com/en-us/news/world/bolsonaro-prescribed-new-diet-discharge-yet-to-be-decided/ar-AAMglgX?ocid=Peregrine,Top Stories,Bloomberg,Unavailable,,1.9,False,False
"Police Sergeant Accused of Making Child Porn, ‘Lustful Touching’ After the FBI Put His Picture on Wanted Poster",https://www.msn.com/en-us/news/crime/police-sergeant-accused-of-making-child-porn-lustful-touching-after-the-fbi-put-his-picture-on-wanted-poster/ar-AAMgyoy?ocid=Peregrine,Top Stories,Law & Crime,Unavailable,,1.10,False,False
Biden's secret weapon in fight against right-wing COVID-19 misinformation? Olivia Rodrigo,https://www.msn.com/en-us/news/politics/biden-s-secret-weapon-in-fight-against-right-wing-covid-19-misinformation-olivia-rodrigo/ar-AAMgJsh?ocid=Peregrine,Top Stories,Salon,Unavailable,,1.11,False,False
"5-Year-Old Ohio Boy Shot by 'Intoxicated' Mother, Currently in Stable Condition, Police Say",https://www.msn.com/en-us/news/crime/5-year-old-ohio-boy-shot-by-intoxicated-mother-currently-in-stable-condition-police-say/ar-AAMgyew?ocid=Peregrine,Top Stories,People,Unavailable,,2.0,False,False
"Hundreds of Cubans are still detained after anti-government protests, human-rights groups say",https://www.msn.com/en-us/news/world/hundreds-of-cubans-are-still-detained-after-anti-government-protests-human-rights-groups-say/ar-AAMgy5y?ocid=Peregrine,Top Stories,Miami Herald,Unavailable,,3.0,False,False
Europeans face travel woes as Covid reaches Olympic Village,https://www.msn.com/en-us/news/world/europeans-face-travel-woes-as-covid-reaches-olympic-village/ar-AAMgqj5?ocid=Peregrine,Top Stories,AFP,Unavailable,,4.0,False,False
Juvenile carjacking incidents quadruple in DC since 2020: Police data,https://www.msn.com/en-us/news/crime/juvenile-carjacking-incidents-quadruple-in-dc-since-2020-police-data/ar-AAMgCoS?ocid=Peregrine,Top Stories,Washington Examiner,Unavailable,,5.0,False,False
"TikTok, Instagram Campaign Launched by Murder Victim's Friends Leads to Suspect's Arrest",https://www.msn.com/en-us/news/crime/tiktok-instagram-campaign-launched-by-murder-victim-s-friends-leads-to-suspect-s-arrest/ar-AAMgy9t?ocid=Peregrine,Top Stories,Newsweek,Unavailable,,6.0,False,False
In pictures: Masks and social distancing at Hajj,https://www.msn.com/en-us/news/world/in-pictures-masks-and-social-distancing-at-hajj/ar-AAMgGss?ocid=Peregrine,Top Stories,BBC News,Unavailable,,7.0,False,False
The next voting rights battleground is Michigan,https://www.msn.com/en-us/news/politics/the-next-voting-rights-battleground-is-michigan/ar-AAMgvKB?ocid=Peregrine,Top Stories,Vox.com,Unavailable,,8.0,False,False
Drug overdose deaths reach an all-time high in US,https://www.msn.com/en-us/health/medical/drug-overdose-deaths-reach-an-all-time-high-in-us-amid-coronavirus-pandemic/ar-AAMgxWh,Coronavirus,CNN,Unavailable,,9.0,False,False
COVID-19 hospitalizations on the rise in Texas as over 50% of the state is fully vaccinated,https://www.msn.com/en-us/news/us/covid-19-hospitalizations-on-the-rise-in-texas-as-less-than-50-percent-of-the-state-is-fully-vaccinated/ar-AAMgzkH,Coronavirus,The Hill,Unavailable,,11.0,False,False
Expert: Covid risk for some unvaccinated people higher than it's ever been,https://www.msn.com/en-us/health/health-news/us-coronavirus-covid-19-risk-for-some-unvaccinated-people-is-higher-than-it-s-ever-been-expert-says/ar-AAMfIlV,Coronavirus,CNN,Unavailable,,12.0,False,False
"Watchdog says AT&T gave over $100K to Abbott, GOP lawmakers after vowing to support voting rights",https://www.msn.com/en-us/news/politics/watchdog-says-at-t-gave-over-100k-to-abbott-gop-lawmakers-after-vowing-to-support-voting-rights/ar-AAMgnE0,Politics,The Hill,Unavailable,,13.0,False,False
DOJ to appeal 'deeply disappointing' DACA ruling: Biden,https://www.msn.com/en-us/news/politics/doj-to-appeal-deeply-disappointing-daca-ruling-biden/ar-AAMfjAc,Politics,ABC News,Unavailable,,14.0,False,False
Biden Administration to Appeal DACA Ruling,https://www.msn.com/en-us/news/politics/biden-administration-to-appeal-daca-ruling/ar-AAMgCFi,Politics,National Review,Unavailable,,15.0,False,False
Lobbyist tapes underscore the importance of meaningful environmental policies,https://www.msn.com/en-us/news/politics/lobbyist-tapes-underscore-the-importance-of-meaningful-environmental-policies/ar-AAMgn7L,Politics,The Hill,Unavailable,,16.0,False,False
Obama calls on Congress to find permanent solution for Dreamers after judge ruling,https://www.msn.com/en-us/news/politics/obama-calls-on-congress-to-find-permanent-solution-for-dreamers-following-federal-judge-ruling/ar-AAMgxPe,Politics,The Hill,Unavailable,,17.0,False,False
What we know about the Surfside collapse victims,https://www.msn.com/en-us/news/us/what-we-know-about-the-dead-and-unaccounted-for-in-the-surfside-condo-collapse/ar-AALpdEu,US,CNN,Unavailable,,18.0,False,False
Tribe claims remains of kids who died at assimilation school,https://www.msn.com/en-us/news/us/tribe-claims-remains-of-kids-who-died-at-assimilation-school/ar-AAMgqpH,US,Associated Press,Unavailable,,19.0,False,False
Condo collapse: Engineer hired by town says he's been denied access to the collapse site to test materials,https://www.msn.com/en-us/news/us/condo-collapse-engineer-hired-by-town-says-he-s-been-denied-access-to-the-collapse-site-to-test-materials/ar-AAMg1vu,US,CNN,Unavailable,,20.0,False,False
Two Baltimore police officers indicted in alleged assault of teen,https://www.msn.com/en-us/news/us/two-baltimore-police-officers-indicted-in-alleged-assault-of-teen/ar-AAMgH0f,US,CNN,Unavailable,,21.0,False,False
Another victim identified in collapse of Florida condominium,https://www.msn.com/en-us/news/us/another-victim-identified-in-collapse-of-florida-condominium/ar-AAMgy03,US,Associated Press,Unavailable,,22.0,False,False
The Biological Fireworks Sparked by Fertilization Are at Least 300 Million Years Old,https://www.msn.com/en-us/news/technology/the-biological-fireworks-sparked-by-fertilization-are-at-least-300-million-years-old/ar-AAMgncG,Science and Technology,ScienceAlert,Unavailable,,23.0,False,False
adyn founder Elizabeth Ruzzo is on a mission to make scientific discovery more inclusive,https://www.msn.com/en-us/health/wellness/adyn-founder-elizabeth-ruzzo-is-on-a-mission-to-make-scientific-discovery-more-inclusive/ar-AAMgvNU,Science and Technology,Geekwire,Unavailable,,24.0,False,False
"The best browser for Linux, Windows and Mac isn't Google Chrome in 2021",https://www.msn.com/en-us/news/technology/the-best-browser-for-linux-windows-and-mac-isn-t-google-chrome-in-2021/ar-AALVHOi,Science and Technology,TechRepublic,Unavailable,,25.0,False,False
California legislature approves ‘historic’ broadband internet bill,https://www.msn.com/en-us/news/technology/california-legislature-approves-historic-broadband-internet-bill/ar-AAMgdm3,Science and Technology,The Verge,Unavailable,,26.0,False,False
"Study: Cannabis first domesticated 12,000 years ago",https://www.msn.com/en-us/news/technology/cannabis-first-domesticated-12-000-years-ago-study/ar-AAMgknj,Science and Technology,AFP,Unavailable,,27.0,False,False
Armenian court upholds June election win for acting PM's party -Ifax,https://www.msn.com/en-us/news/world/armenian-court-upholds-june-election-win-for-acting-pm-s-party-ifax/ar-AAMgLB3,World,Reuters,Unavailable,,28.0,False,False
Two hundred flights cancelled at Lisbon airport at start of strike,https://www.msn.com/en-us/news/world/two-hundred-flights-cancelled-at-lisbon-airport-at-start-of-strike/ar-AAMgnop,World,Reuters,Unavailable,,29.0,False,False
Desperate search for survivors as western Europe reels from a 'catastrophe',https://www.msn.com/en-us/news/world/europe-floods-desperate-search-for-survivors-after-catastrophe-of-historic-proportion/ar-AAMfZQN,World,CNN,Unavailable,,30.0,False,False
South African authorities probe coastal chemical spill in Durban,https://www.msn.com/en-us/news/world/south-african-authorities-probe-coastal-chemical-spill-in-durban/ar-AAMgvR1,World,Reuters,Unavailable,,31.0,False,False
Bride Gets Ticket For Not Wearing COVID Face Mask In Wedding Photoshoot,https://www.msn.com/en-us/news/world/bride-gets-ticket-for-not-wearing-covid-face-mask-in-wedding-photoshoot/ar-AAMgBZb,World,Newsweek,Unavailable,,32.0,False,False
